date,username,to,replies,retweets,favorites,text,geo,mentions,hashtags,id,permalink
2014-09-04 11:13:07,BJP4India,,5,44,62,"जम्मू कश्मीर के बाढ़ और भूस्खलन प्रभावित क्षेत्रों में राहत व बचाव कार्य में जुट जाएं कार्यकर्ता- http://bit.ly/1qzDsmB @AmitShahOffice",,@AmitShahOffice,,507486510262673408,https://twitter.com/BJP4India/status/507486510262673408
2014-09-04 10:34:12,AmitShah,,30,111,163,"During arrival in Mumbaipic.twitter.com/vVf2uha5Dz",,,,507476718064386048,https://twitter.com/AmitShah/status/507476718064386048
2014-09-04 09:09:18,INCIndia,,16,46,44,"Rahul Gandhi interacting with people at a meeting in Bahadurpur village in Amethi todaypic.twitter.com/0cxCctJwyD",,,,507455353227706368,https://twitter.com/INCIndia/status/507455353227706368
2014-09-04 08:56:17,INCIndia,,14,49,50,"Congress Vice President #RahulGandhi meeting with people in Bahadurpur village, Amethi todaypic.twitter.com/x6yKpyZQ1N",,,#RahulGandhi,507452077220433920,https://twitter.com/INCIndia/status/507452077220433920
2014-09-04 08:01:19,mkstalin,,6,7,27,"Interacted with members of DMK Literary Wing, Karnataka at Anna Arivalayam.pic.twitter.com/Ii308MMPqT",,,,507438240782376960,https://twitter.com/mkstalin/status/507438240782376960
2014-09-04 07:48:00,PMOIndia,,46,157,355,"Nagaland CM T.R. Zeliang called on PM @narendramodipic.twitter.com/yNaJnp2RHg",,@narendramodipic,,507434889520496642,https://twitter.com/PMOIndia/status/507434889520496642
2014-09-04 07:46:51,PMOIndia,,32,149,337,"Karnataka Governor Shri Vajubhai Vala met the PMpic.twitter.com/FZPPLtaqz5",,,,507434602550407168,https://twitter.com/PMOIndia/status/507434602550407168
2014-09-04 07:38:18,PMOIndia,,46,173,369,"MP CM @ChouhanShivraj met the PMpic.twitter.com/5cLjLjjVkh",,@ChouhanShivraj,,507432448972447745,https://twitter.com/PMOIndia/status/507432448972447745
2014-09-04 07:17:37,INCIndia,,14,57,35,"#RahulGandhi interacting with people in Amethi todaypic.twitter.com/VNHyfXaZ4z",,,#RahulGandhi,507427245695041537,https://twitter.com/INCIndia/status/507427245695041537
2014-09-04 07:06:12,INCIndia,,14,45,39,"Rahul Gandhi interacting with people in Bhikipur Village, Amethipic.twitter.com/ioFyVtMYBT",,,,507424373402132480,https://twitter.com/INCIndia/status/507424373402132480
2014-09-04 06:58:31,PMOIndia,,90,267,441,"PM @narendramodi and HRD Minister @smritiirani at the informal interaction with teacherspic.twitter.com/EfLtjWdIfa",,@narendramodi @smritiirani,,507422436648706048,https://twitter.com/PMOIndia/status/507422436648706048
2014-09-04 06:57:40,PMOIndia,,103,250,456,"The PM held an informal interaction with teachers todaypic.twitter.com/S10aSccb6C",,,,507422224437895169,https://twitter.com/PMOIndia/status/507422224437895169
2014-09-04 06:50:59,PMOIndia,,14,119,195,"The PM recalled Shri Mohammed Fazal's contribution to public life & prays that his soul rests in peace.",,,,507420541351759872,https://twitter.com/PMOIndia/status/507420541351759872
2014-09-04 06:49:12,PMOIndia,,49,146,254,"The Prime Minister has condoled the passing away of former Goa and Maharashtra Governor Shri Mohammed Fazal.",,,,507420093697884161,https://twitter.com/PMOIndia/status/507420093697884161
2014-09-04 06:49:11,INCIndia,,18,39,33,"Congress Vice President #RahulGandhi meeting people on his way to Amethi todaypic.twitter.com/HG6Krn4xy8",,,#RahulGandhi,507420090199846912,https://twitter.com/INCIndia/status/507420090199846912
2014-09-04 06:32:57,ncbn,,145,401,233,"Andhra Pradesh #capital to be centrally located around Vijayawada. Will do justice to every city through decentralised development.",,,#capital,507416002569572352,https://twitter.com/ncbn/status/507416002569572352
2014-09-04 05:42:41,BJP4India,,96,383,583,"Journey of Action & Hope:https://www.youtube.com/watch?v=qg1L95eyHNI …",,,,507403353878323200,https://twitter.com/BJP4India/status/507403353878323200
2014-09-04 04:55:05,INCIndia,,17,35,37,"Congress VP #RahulGandhi has reached Lucknow, begins his 2 day visit to Amethi",,,#RahulGandhi,507391373972996096,https://twitter.com/INCIndia/status/507391373972996096
2014-09-04 02:48:26,narendramodi,,318,816,1363,"I congratulate the friends & volunteers for their efforts! I invite you all to visit http://actionandhope.narendramodi.in/",,,,507359501960245248,https://twitter.com/narendramodi/status/507359501960245248
2014-09-04 02:47:35,narendramodi,,181,593,962,"A group of friends & volunteers created a compilation that offers a glimpse of the work done by Government, titled 'Action & Hope.'",,,,507359289824903168,https://twitter.com/narendramodi/status/507359289824903168
2014-09-04 01:57:59,INCIndia,,22,79,53,"Whether I am a Hindu, a Muslim, a Christian, a Parsi or of any other creed, I am above all an Indian-Dadabhai Naorojipic.twitter.com/cy8JdMaDmJ",,,,507346805319688192,https://twitter.com/INCIndia/status/507346805319688192
2014-09-03 16:48:27,ncbn,,27,27,60,"In a meeting with #APSRTC officials, sanctioned Rs250 crore for them. This will save Credit Cooperative Society from the burden of loans.",,,#APSRTC,507208510589767680,https://twitter.com/ncbn/status/507208510589767680
2014-09-03 12:26:12,PMOIndia,,144,402,705,"I thank the people of Japan for the affection, warmth & wonderful hospitality during my visit. Thank you Japan: PM @narendramodi Tweets",,@narendramodi,,507142515615494145,https://twitter.com/PMOIndia/status/507142515615494145
2014-09-03 12:25:48,PMOIndia,,51,222,393,"After landing in Delhi, PM @narendramodi has Tweeted in Japanese, thanking the people of Japan. @JapanGov @AbeShinzo",,@narendramodi @JapanGov @AbeShinzo,,507142412339134464,https://twitter.com/PMOIndia/status/507142412339134464
2014-09-03 12:13:35,narendramodi,,517,1544,1369,"デリーに帰着。滞在中に寄せていただいた、日本の皆さんの愛情、温かさ、素晴らしいおもてなしに感謝申し上げたい。日本よ、ありがとう！",,,,507139340690923520,https://twitter.com/narendramodi/status/507139340690923520
2014-09-03 11:47:37,narendramodi,,391,817,1446,"EAM @SushmaSwaraj ji told me that the visit has generated lot of positivity & optimism in India about our ties with Japan. Glad to know.",,@SushmaSwaraj,,507132804967047168,https://twitter.com/narendramodi/status/507132804967047168
2014-09-03 11:45:16,narendramodi,,921,985,2116,"Back in Delhipic.twitter.com/gArXZ3mepn",,,,507132214589399040,https://twitter.com/narendramodi/status/507132214589399040
2014-09-03 07:47:59,mkstalin,,10,15,37,"I am confident that the efforts of TESO will be able to resolve this long standing political issue in the coming dayspic.twitter.com/cMXXNWuJTe",,,,507072501474926592,https://twitter.com/mkstalin/status/507072501474926592
2014-09-03 07:47:04,mkstalin,,5,13,29,"Participated in the mass agitation organized by TESO against the mistreatment of Tamils in Sri Lanka.pic.twitter.com/NKfl6KaM7K",,,,507072268187762688,https://twitter.com/mkstalin/status/507072268187762688
2014-09-03 04:26:20,BJP4India,,39,147,126,"Participate in Online Membership Campaign by inviting your friends to #JoinBJP at http://bjp.org/membership .pic.twitter.com/cBh2QR4SIz",,,#JoinBJP,507021752908533760,https://twitter.com/BJP4India/status/507021752908533760
2014-09-03 03:47:28,INCIndia,Pressbrief,10,37,34,"RT "" @Pressbrief: Smt. #SoniaGandhi in Raebareli, reviews development projects implementation pic.twitter.com/0o6AwxQ7h1”",,@Pressbrief,#SoniaGandhi,507011971628036096,https://twitter.com/INCIndia/status/507011971628036096
2014-09-03 03:46:59,INCIndia,Pressbrief,19,53,47,"RT "" @Pressbrief: Smt. #SoniaGandhi in Raebareli pic.twitter.com/9PfeOd0Gmt”",,@Pressbrief,#SoniaGandhi,507011850123218944,https://twitter.com/INCIndia/status/507011850123218944
2014-09-02 16:04:15,arunjaitley,,73,88,162,"Goolam Vahanvati was a brilliant lawyer and a close friend. His death has shaken me. May his soul rest in peace.",,,,506835001409691649,https://twitter.com/arunjaitley/status/506835001409691649
2014-09-02 15:50:23,ArvindKejriwal,,290,1070,510,"Did Anil Dhirubhai Ambani Group (ADAG) officials try to influence CBI in 2G case? Do read and RThttp://www.dnaindia.com/india/report-did-anil-ambani-officials-try-to-influence-cbi-in-2g-case-2015562 …",,,,506831511241228288,https://twitter.com/ArvindKejriwal/status/506831511241228288
2014-09-02 14:47:21,narendramodi,,295,874,1589,"Greetings to the people of Vietnam on their National Day. Looking forward to making our ties with Vietnam stronger in the years to come.",,,,506815650132541441,https://twitter.com/narendramodi/status/506815650132541441
2014-09-02 14:41:31,narendramodi,,203,1104,1788,"It was great meeting His Majesty Emperor Akihito.pic.twitter.com/XSbiWmZXqi",,,,506814179785707520,https://twitter.com/narendramodi/status/506814179785707520
2014-09-02 14:39:58,narendramodi,,160,744,1700,"Meeting youngsterspic.twitter.com/CyPLv1elr0",,,,506813788847214592,https://twitter.com/narendramodi/status/506813788847214592
2014-09-02 14:35:09,narendramodi,,330,1638,2389,"Met 99 year old Mr. Saichiro Misumi, Subhas Babu's oldest living associate in Japan http://nm4.in/1pDIBMs pic.twitter.com/jxFJ5chlxQ",,,,506812580233359360,https://twitter.com/narendramodi/status/506812580233359360
2014-09-02 14:31:01,narendramodi,,89,589,1271,"Inaugurated the Vivekananda Cultural Centre at the Indian Embassy & visited the exhibits there.pic.twitter.com/DEidLUImvU",,,,506811539320360960,https://twitter.com/narendramodi/status/506811539320360960
2014-09-02 14:30:02,narendramodi,,64,455,960,"Its always wonderful interacting with youngsters! Sharing my interaction at University of the Sacred Heart, Tokyo.http://nm4.in/1lvhQIZ",,,,506811289385988097,https://twitter.com/narendramodi/status/506811289385988097
2014-09-02 14:29:16,narendramodi,,145,836,1200,"Come Make in India. No Red Tape, only Red Carpet! My message to Japanese businesspersons at Nikkei Inc. & JETRO event http://nm4.in/1pla1Rg",,,,506811096288608257,https://twitter.com/narendramodi/status/506811096288608257
2014-09-02 14:28:08,narendramodi,,352,1085,1934,"Tried my hand at the drums today! Enjoyed the experience. http://nm4.in/1lvic2h pic.twitter.com/kHQiTnzHEq",,,,506810811784757250,https://twitter.com/narendramodi/status/506810811784757250
2014-09-02 14:23:03,narendramodi,,168,526,1057,"Had a delightful day in Tokyo! Met political leaders, businesspersons, students & attended a reception with the Indian community.",,,,506809533306392576,https://twitter.com/narendramodi/status/506809533306392576
2014-09-02 13:31:50,INCIndia,,37,41,31,"100 days of this Govt has proved to be disappointing,characterized by non-fulfillment of promises http://inc.in/resources/press-releases/576-Press-Release … #100DaysIndiaPays",,,#100DaysIndiaPays,506796644801576960,https://twitter.com/INCIndia/status/506796644801576960
2014-09-02 10:56:55,PMOIndia,,65,212,274,"Here is the link to MyGov that the PM mentioned in his speech a very short while ago http://mygov.nic.in @mygovindia @narendramodi",,@mygovindia @narendramodi,,506757658657845248,https://twitter.com/PMOIndia/status/506757658657845248
2014-09-02 10:55:13,PMOIndia,,18,57,160,"PM's speech has concluded.",,,,506757229853147136,https://twitter.com/PMOIndia/status/506757229853147136
2014-09-02 10:54:52,PMOIndia,,20,119,201,"PM calls upon members of the diaspora to join MyGov and contribute through the various forums there.",,,,506757141164617728,https://twitter.com/PMOIndia/status/506757141164617728
2014-09-02 10:54:12,PMOIndia,,67,228,264,"We have launched a website MyGov. Request you to look at thew website & give constrictive suggestions: PM @narendramodi",,@narendramodi,,506756973996412928,https://twitter.com/PMOIndia/status/506756973996412928
2014-09-02 10:52:07,PMOIndia,,29,176,241,"Through your efforts, you should inspire 5 Japanese families to visit India: PM @narendramodi to Indian community in Japan",,@narendramodi,,506756450589241344,https://twitter.com/PMOIndia/status/506756450589241344
2014-09-02 10:40:21,PMOIndia,,53,217,300,"Small things have the power to change the world: PM @narendramodi",,@narendramodi,,506753489880358912,https://twitter.com/PMOIndia/status/506753489880358912
2014-09-02 10:30:12,PMOIndia,,20,169,258,"Infact we hear the Indians are simple, they contribute to the growing economy too. Credit for this goes to you all: PM @narendramodi",,@narendramodi,,506750936471969792,https://twitter.com/PMOIndia/status/506750936471969792
2014-09-02 10:29:25,PMOIndia,,30,272,278,"Wherever the Indian community went there has been no complaint from society there. This is not a small thing: PM @narendramodi",,@narendramodi,,506750738962198528,https://twitter.com/PMOIndia/status/506750738962198528
2014-09-02 10:25:16,PMOIndia,,18,134,202,"The Prime Minister is addressing the Indian Community in Japan. Watch his speech.https://www.youtube.com/watch?v=NUMzt7NzOdY …",,,,506749695247405056,https://twitter.com/PMOIndia/status/506749695247405056
2014-09-02 09:34:46,INCIndia,ndtvfeed,9,24,16,"RT "" @ndtvfeed एनएसयूआई ने किया राजनाथ के घर के बाहर प्रदर्शन http://goo.gl/fb/pTv1hf (video)"" #100DaysIndiaPays",,@ndtvfeed,#100DaysIndiaPays,506736985390587904,https://twitter.com/INCIndia/status/506736985390587904
2014-09-02 08:46:12,mkstalin,,14,8,35,"Interacting with party cadres in Trichy!pic.twitter.com/blqysybtwh",,,,506724760878088192,https://twitter.com/mkstalin/status/506724760878088192
2014-09-02 08:34:28,PMOIndia,,45,138,232,"PM is speaking at a programme organised by Japan-India Association.",,,,506721811275317248,https://twitter.com/PMOIndia/status/506721811275317248
2014-09-02 08:19:28,INCIndia,,9,50,19,"भाग -१ https://twitter.com/INCIndia/status/506687314152538112 … भाग -२ क्या यह हैं अच्छे दिन? #100DaysIndiapayspic.twitter.com/6OQVDriags",,,#100DaysIndiapayspic,506718033830608896,https://twitter.com/INCIndia/status/506718033830608896
2014-09-02 08:03:18,INCIndia,,16,56,17,"#100DaysIndiaPays The 100 days story of this Government has proved to be disappointing Read- http://inc.in/100days pic.twitter.com/y6X5G0OfOx",,,#100DaysIndiaPays,506713965238312960,https://twitter.com/INCIndia/status/506713965238312960
2014-09-02 07:50:39,INCIndia,,10,41,17,"Are we now entering a system where judiciary is expected to be loyal togovt for political patronage post retirement:Sharma #100DaysIndiaPays",,,#100DaysIndiaPays,506710783703543810,https://twitter.com/INCIndia/status/506710783703543810
2014-09-02 07:47:36,INCIndia,,4,30,13,"#100DaysIndiaPays Former CJI becomes a Vice President, but should not be made a governor: Shri Sharma",,,#100DaysIndiaPays,506710016120737792,https://twitter.com/INCIndia/status/506710016120737792
2014-09-02 07:46:41,INCIndia,,7,23,10,"#100DaysIndiaPays They have reduced the position of Chief Justice of India by appointing him as a Gov, acc to warrant of precedance",,,#100DaysIndiaPays,506709783701766145,https://twitter.com/INCIndia/status/506709783701766145
2014-09-02 07:45:00,INCIndia,,14,63,11,"#100DaysIndiaPays: Teachers Day has an integrity and sanctity. Speeches of anybody cannot be imposed on students whether its of PM or CM",,,#100DaysIndiaPays,506709361251450881,https://twitter.com/INCIndia/status/506709361251450881
2014-09-02 07:43:33,INCIndia,,6,45,7,"#100DaysIndiaPays While we have a part time Defence Minister and the Home Minister of this country plays deputy to his own MoS",,,#100DaysIndiaPays,506708994442792960,https://twitter.com/INCIndia/status/506708994442792960
2014-09-02 07:40:04,INCIndia,,13,49,13,"We have raised important issues in Parliament, we have played a role of a constructive opposition too in these 100 days : Shri Sharma",,,,506708119209013249,https://twitter.com/INCIndia/status/506708119209013249
2014-09-02 07:35:50,INCIndia,,6,37,10,"AICC Press Conference by Shri Anand Sharma on #100DaysIndiaPays LIVE athttps://www.youtube.com/watch?v=ng600blEEps …",,,#100DaysIndiaPays,506707053855780864,https://twitter.com/INCIndia/status/506707053855780864
2014-09-02 07:32:46,INCIndia,,11,50,14,"Under the Currency Swap Agreement with Japan - $50 Billion had already committed by Japan for investment: Shri Sharma #100DaysIndiaPays",,,#100DaysIndiaPays,506706282305179648,https://twitter.com/INCIndia/status/506706282305179648
2014-09-02 07:31:52,INCIndia,,6,47,14,"It was in 2010, that India and Japan entered into a Comprehensive Eco Agreement: Shri Sharma #100DaysIndiaPays",,,#100DaysIndiaPays,506706056668405760,https://twitter.com/INCIndia/status/506706056668405760
2014-09-02 07:31:03,INCIndia,,13,87,16,"India and Japan already upgraded the Strategic Partership in 2008 itself at their Annual Summit in Tokyo: Shri Sharma #100DaysIndiaPays",,,#100DaysIndiaPays,506705848228261888,https://twitter.com/INCIndia/status/506705848228261888
2014-09-02 07:30:07,INCIndia,,5,48,10,"Those officers who were working in NirmalBharatAbhiyan,would have felt good that present govt is recogizing their efforts #100DaysIndiaPays",,,#100DaysIndiaPays,506705614051893248,https://twitter.com/INCIndia/status/506705614051893248
2014-09-02 07:28:35,INCIndia,,6,51,10,"We do not have any objection to PM's JanDhanYojana, but we want qn their pol honesty,that things already happening:Sharma #100DaysIndiaPays",,,#100DaysIndiaPays,506705227467075584,https://twitter.com/INCIndia/status/506705227467075584
2014-09-02 07:27:21,INCIndia,,5,26,11,"UPA started the ""Swabhiman"" Abhiyan for every village above a population of 2000, launched in 2012: Shri Sharma #100DaysIndiaPays",,,#100DaysIndiaPays,506704918812434432,https://twitter.com/INCIndia/status/506704918812434432
2014-09-02 07:26:05,INCIndia,,6,41,15,"Who gave in writing it to the PM that ""Fin Untouchability"" was prevalent in India?770 Million A/c holders present:Sharma #100DaysIndiapays",,,#100DaysIndiapays,506704598677979136,https://twitter.com/INCIndia/status/506704598677979136
2014-09-02 07:23:06,INCIndia,,10,31,14,"Nirmal Bharat Abhiyan's budgetory allocation has not been increased by a single Rupee, Now they rename it to Swatchh Bharat Abhiyan: Sharma",,,,506703851009761280,https://twitter.com/INCIndia/status/506703851009761280
2014-09-02 07:21:56,INCIndia,,4,23,9,"They were opposed to Direct Benefit Transfer too, now they have accepted it : Shri Sharma #100DaysIndiaPays",,,#100DaysIndiaPays,506703554262736896,https://twitter.com/INCIndia/status/506703554262736896
2014-09-02 07:21:05,INCIndia,,12,36,14,"We thank the PM and the Govt for repackaging and renaming our schemes, now they support AADHAAR: Shri Sharma #100DaysIndiaPays",,,#100DaysIndiaPays,506703340726546432,https://twitter.com/INCIndia/status/506703340726546432
2014-09-02 07:20:05,INCIndia,,20,61,25,"A quarter is of 90 days, 55 days were under UPA , and BJP was ruling in 35 days. So they raised GDP to 5.7% in 35 days? #100DaysIndiaPays",,,#100DaysIndiaPays,506703090204958721,https://twitter.com/INCIndia/status/506703090204958721
2014-09-02 07:19:02,INCIndia,,11,29,12,"The former FM Shri Chidambaram already predicted a 5.5% GDP Growth, RBI also did the same: Shri Sharma #100DaysIndiapays",,,#100DaysIndiapays,506702824923623424,https://twitter.com/INCIndia/status/506702824923623424
2014-09-02 07:16:25,INCIndia,,6,30,11,"Constitutional right of civil servants have been assaulted by saying that those in service since 10 years cannot be part of admin:Sharma",,,,506702166124269571,https://twitter.com/INCIndia/status/506702166124269571
2014-09-02 07:14:47,INCIndia,,3,28,11,"They talk of minimum government but their time is being used to appoint officers and pvt secretaries: Shri Sharma #100DaysIndiaPays",,,#100DaysIndiaPays,506701758261768192,https://twitter.com/INCIndia/status/506701758261768192
2014-09-02 07:14:00,INCIndia,,8,52,10,"Secretaries of Ministries reporting directly to PMO, instead of respective Ministers: Shri Sharma #100DaysIndiaPays",,,#100DaysIndiaPays,506701559896743936,https://twitter.com/INCIndia/status/506701559896743936
2014-09-02 07:13:08,INCIndia,,6,22,9,"The Home Minister was not allowed to appoint his own private sec : Shri Sharma #100DaysIndiaPayshttps://www.youtube.com/watch?v=ng600blEEps …",,,#100DaysIndiaPayshttps,506701339426975744,https://twitter.com/INCIndia/status/506701339426975744
2014-09-02 07:12:14,INCIndia,,5,16,6,"Have the sancitity of a cabinet form of a govt has been upheld or a silent shift is made to a prez form where one voice counts: Shri Sharma",,,,506701114104750080,https://twitter.com/INCIndia/status/506701114104750080
2014-09-02 07:10:34,INCIndia,,5,39,12,"Why is Education being Politicized? Institutions and Research & Science must remain out of politics : Shri Sharma #100DaysIndiaPays",,,#100DaysIndiaPays,506700693768372224,https://twitter.com/INCIndia/status/506700693768372224
2014-09-02 07:09:53,INCIndia,,3,23,8,"We are being taught a different kind of History, This is already taught in History books of Gujarat, Shri Sharma #100DaysIndiaPays",,,#100DaysIndiaPays,506700524314324992,https://twitter.com/INCIndia/status/506700524314324992
2014-09-02 07:08:03,INCIndia,,17,33,11,"The PM did not ask the states before taking the decision of dissolving Planning Com declared it from Red Fort: Shri Sharma #100DaysIndiaPays",,,#100DaysIndiaPays,506700063997845504,https://twitter.com/INCIndia/status/506700063997845504
2014-09-02 07:06:29,INCIndia,,11,17,7,"The arbitrarily decision of dismantling of the Planning Com strikes at the base of our federal structure: Shri Sharma #100DaysIndiaPays",,,#100DaysIndiaPays,506699665970962432,https://twitter.com/INCIndia/status/506699665970962432
2014-09-02 07:05:52,INCIndia,,6,30,6,"There is no urgency shown to appoint the Lokpal, perhaps that is why LoP is being kept out : Shri Sharma #100DaysIndiaPays",,,#100DaysIndiaPays,506699511981293569,https://twitter.com/INCIndia/status/506699511981293569
2014-09-02 07:04:37,INCIndia,,6,19,7,"#AchheDin Sirf BJP Ke Aye Hai : Shri Anand Sharma LIVE: https://www.youtube.com/watch?v=ng600blEEps … #100DaysIndiaPays",,,#AchheDin #100DaysIndiaPays,506699198264131585,https://twitter.com/INCIndia/status/506699198264131585
2014-09-02 07:03:54,INCIndia,,5,20,9,"13 Ministers in the present govt have serious criminal charges against them : Shri Sharma #100DaysIndiaPays https://www.youtube.com/watch?v=ng600blEEps …",,,#100DaysIndiaPays,506699018865352704,https://twitter.com/INCIndia/status/506699018865352704
2014-09-02 07:02:47,INCIndia,,11,59,11,"They cried ""Scams, Scams"" when in opposition. We ask the PM to take action and tell us what are those scams: Shri Sharma #100DaysIndiaPays",,,#100DaysIndiaPays,506698736534175744,https://twitter.com/INCIndia/status/506698736534175744
2014-09-02 07:01:50,INCIndia,,6,23,6,"Even the Finance Minister @ArunJaitley said he has no information on Black Money: Shri Sharma #100DaysIndiaPays",,@ArunJaitley,#100DaysIndiaPays,506698497341394944,https://twitter.com/INCIndia/status/506698497341394944
2014-09-02 07:00:37,INCIndia,,5,38,14,"The then BJP President Shri Rajnath Singh gave a deadline of 100 days to bring black money back, after coming to power #100DaysIndiaPays",,,#100DaysIndiaPays,506698191387889666,https://twitter.com/INCIndia/status/506698191387889666
2014-09-02 06:59:52,INCIndia,,9,25,10,"The UPA Government had signed treaties with more than 80 countries to facilitate the return of black money to India #100DaysIndiaPays",,,#100DaysIndiaPays,506698004091269120,https://twitter.com/INCIndia/status/506698004091269120
2014-09-02 06:59:20,INCIndia,,12,47,25,"They promised to get Rs 85 Lakh Crore of Black Money !100 Days over, not even Rs 85 has been brought : Shri Sharma #100DaysIndiaPays",,,#100DaysIndiaPays,506697869886107649,https://twitter.com/INCIndia/status/506697869886107649
2014-09-02 06:58:13,INCIndia,,0,21,9,"India was conspicuous by its absence at the annual ministerial of ASEAN + 6 meet in Myanmar: Shri Sharma #100DaysIndiaPays",,,#100DaysIndiaPays,506697586141446145,https://twitter.com/INCIndia/status/506697586141446145
2014-09-02 06:57:30,BJP4India,,15,61,54,"Commitment to peace is ingrained in the DNA of Indian society. This is above international treaties or processes: PM http://www.narendramodi.in/pms-special-lecture-at-the-university-of-the-sacred-heart-tokyo/ …",,,,506697406692347904,https://twitter.com/BJP4India/status/506697406692347904
2014-09-02 06:55:13,INCIndia,,3,26,6,"Watch AICC Press Conference by Shri Anand Sharma LIVE : https://www.youtube.com/watch?v=ng600blEEps … #100DaysIndiaPays",,,#100DaysIndiaPays,506696832160763904,https://twitter.com/INCIndia/status/506696832160763904
2014-09-02 06:54:37,INCIndia,,11,18,8,"This government does not have consistent foreign policy, its policy is opaque and directionless : Shri Sharma #100DaysIndiaPays",,,#100DaysIndiaPays,506696681954369536,https://twitter.com/INCIndia/status/506696681954369536
2014-09-02 06:52:57,INCIndia,,5,21,11,"From UP to Maharashtra, there are incidents of violence in different states,a feeling of fear is being created:Shri Sharma #100DaysIndiaPays",,,#100DaysIndiaPays,506696262419099648,https://twitter.com/INCIndia/status/506696262419099648
2014-09-02 06:51:46,INCIndia,,4,48,12,"Government data itself shows that Food Inflation rose to 9.36% in July from the previous 7.90% in June #100DaysIndiaPays",,,#100DaysIndiaPays,506695963541397504,https://twitter.com/INCIndia/status/506695963541397504
2014-09-02 06:51:21,INCIndia,,4,26,11,"In 100 days, there has been no respite in Price Rise : Shri Anand Sharma #100DaysIndiaPays",,,#100DaysIndiaPays,506695857366790144,https://twitter.com/INCIndia/status/506695857366790144
2014-09-02 06:50:02,INCIndia,,12,25,12,"The BJP captured power by making lofty promises and selling unrealistic dreams : Shri Anand Sharma #100DaysIndiaPays",,,#100DaysIndiaPays,506695529686777856,https://twitter.com/INCIndia/status/506695529686777856
