date,username,to,replies,retweets,favorites,text,geo,mentions,hashtags,id,permalink
2015-06-09 06:38:13,INCIndia,INCIndia,18,289,216,"Now, BJP has become the greatest champion of GST but I am not sure that the law we are presently considering is best route forward: Dr Singh",,,,608161155731746817,https://twitter.com/INCIndia/status/608161155731746817
2015-06-09 06:36:42,INCIndia,,8,186,75,"We made every effort to make GST a reality but we were up against an obstructionist BJP: Dr Manmohan Singh #CongressCMsMeet",,,#CongressCMsMeet,608160774628835328,https://twitter.com/INCIndia/status/608160774628835328
2015-06-09 06:35:55,INCIndia,INCIndia,23,320,213,"I am concerned that the Planning Commission that helped weaker states and poorer regions has been abolished hastily: Dr Manmohan Singh",,,,608160576783548416,https://twitter.com/INCIndia/status/608160576783548416
2015-06-09 06:35:33,INCIndia,,5,155,52,"I am all for greater untied funds being made available to state governments: Dr Manmohan Singh #CongressCMsMeet",,,#CongressCMsMeet,608160486924779520,https://twitter.com/INCIndia/status/608160486924779520
2015-06-09 06:35:06,INCIndia,,3,144,55,"And I certainly hope that they respect the autonomy of institutions that have stood us in good stead like the RBI : Dr Manmohan Singh",,,,608160371438804993,https://twitter.com/INCIndia/status/608160371438804993
2015-06-09 06:34:14,INCIndia,INCIndia,11,303,202,"But doubts have been expressed both within and outside Government about the validity of new GDP numbers: Dr Singh #CongressCMsMeet",,,#CongressCMsMeet,608160155511824384,https://twitter.com/INCIndia/status/608160155511824384
2015-06-09 06:33:47,INCIndia,,5,288,181,"There is somewhat of an euphoria that our GDP growth since 2014-15 has started accelerating once again: Dr Manmohan Singh #CongressCMsMeet",,,#CongressCMsMeet,608160042261450752,https://twitter.com/INCIndia/status/608160042261450752
2015-06-09 06:33:09,INCIndia,,2,114,46,"We also need to look at the progress of our manifestos and cooperation needed from centre for our states : Smt. Sonia Gandhi",,,,608159883418992640,https://twitter.com/INCIndia/status/608159883418992640
2015-06-09 06:32:42,INCIndia,,5,115,57,"Today we need to discuss the dilution of UPA schemes by the centre and how we respond to the policies of the NDA: Smt.Sonia Gandhi",,,,608159768843198464,https://twitter.com/INCIndia/status/608159768843198464
2015-06-09 06:32:22,INCIndia,,7,111,65,"Best tribute we can pay to Ambedkarji is by ensuring INC-ruled states give statutory status to implement SC plan &Tribal sub-plan:Smt.Gandhi",,,,608159682755072001,https://twitter.com/INCIndia/status/608159682755072001
2015-06-09 06:30:30,INCIndia,,3,102,49,"As CM's you ought to counter this assault on Panditji by arranging appropriate programmes commemorating his birth anniversary: Smt. Gandhi",,,,608159216319143937,https://twitter.com/INCIndia/status/608159216319143937
2015-06-09 06:30:02,INCIndia,,15,133,49,"Pandit Nehru is now under sustained assault by forces that guide the ruling establishment.His contributions are being belittled: Smt.Gandhi",,,,608159096357810176,https://twitter.com/INCIndia/status/608159096357810176
2015-06-09 06:29:08,INCIndia,,0,159,60,"As Chief Ministers you have a special responsibility to ensure that Party workers are motivated & enthused:Smt.Sonia Gandhi #CongressCMsMeet",,,#CongressCMsMeet,608158872067403777,https://twitter.com/INCIndia/status/608158872067403777
2015-06-09 06:28:32,INCIndia,,4,139,47,"Your administration and the Party organisation have to work cohesively with each other: Smt.Sonia Gandhi #CongressCMsMeet",,,#CongressCMsMeet,608158721533804544,https://twitter.com/INCIndia/status/608158721533804544
2015-06-09 06:27:49,INCIndia,,2,118,51,"It is the responsibility of the Central Govtto create and maintain an atmosphere conducive for cooperation and consensus: Smt.Sonia Gandhi",,,,608158538930601984,https://twitter.com/INCIndia/status/608158538930601984
2015-06-09 06:27:05,INCIndia,,13,138,56,"On one hand,PM wants to project himself as champion of good governance,on other he allows his colleagues to make communal remarks:Smt.Gandhi",,,,608158356503527424,https://twitter.com/INCIndia/status/608158356503527424
2015-06-09 06:24:06,INCIndia,,15,155,84,"There is a dangerous duplicitous game that is being played out: Smt.Sonia Gandhi #CongressCMsMeetpic.twitter.com/ErlT71ZHh9",,,#CongressCMsMeetpic,608157604414504960,https://twitter.com/INCIndia/status/608157604414504960
2015-06-09 06:22:19,INCIndia,,8,149,44,"The deliberate by-passing of Parliament, threats to civil society and warnings to the judiciary: Smt.Sonia Gandhi #CongressCMsMeet",,,#CongressCMsMeet,608157157108760576,https://twitter.com/INCIndia/status/608157157108760576
2015-06-09 06:21:02,INCIndia,,58,344,252,"There is unprecedented centralisation of power and authority: Smt. Sonia Gandhi #CongressCMsMeetpic.twitter.com/MLRLxPcFbe",,,#CongressCMsMeetpic,608156832696115200,https://twitter.com/INCIndia/status/608156832696115200
2015-06-09 06:18:52,INCIndia,,7,133,46,"Seven out of the eleven states under special category Cong ruled: Smt. Sonia Gandhi #CongressCMsMeet",,,#CongressCMsMeet,608156287482798080,https://twitter.com/INCIndia/status/608156287482798080
2015-06-09 06:17:44,INCIndia,,2,121,36,"This is a new philosophy which abdicates the essential role of the central govt: Smt. Sonia Gandhi #CongressCMsMeet",,,#CongressCMsMeet,608156001519288320,https://twitter.com/INCIndia/status/608156001519288320
2015-06-09 06:16:54,RahulGandhi,,86,527,506,"The #CongressCMsMeet begins with a one minute silence in honour of the Jawans martyred in Manipurpic.twitter.com/T1mQfcRubp",,,#CongressCMsMeet,608155792269701120,https://twitter.com/RahulGandhi/status/608155792269701120
2015-06-09 06:16:49,INCIndia,,33,284,186,"There are systematic attempts being made to dismantle the edifice of welfare state built up over the decades by successive Cong: Smt.Gandhi",,,,608155770295689216,https://twitter.com/INCIndia/status/608155770295689216
2015-06-09 06:16:11,INCIndia,,4,122,43,"I recall now how at a similar session at Guwahati way back in April 2002 the idea of RTI and MNREGA first took shape : Smt. Sonia Gandhi",,,,608155610987634688,https://twitter.com/INCIndia/status/608155610987634688
2015-06-09 06:11:31,INCIndia,,4,121,54,"Shri A K Antony welcomes the delegates #CongressCMsMeet Happy that all 9 CM's are there, hope meeting is fruitful",,,#CongressCMsMeet,608154436653826048,https://twitter.com/INCIndia/status/608154436653826048
2015-06-09 06:09:58,RahulGandhi,,71,362,307,"Meeting of Chief Ministers of Congress ruled states to begin shortly #CongressCMsMeet",,,#CongressCMsMeet,608154045853745152,https://twitter.com/RahulGandhi/status/608154045853745152
2015-06-09 06:08:47,INCIndia,,4,138,68,"Congress President Smt. Sonia Gandhi & Vice President Rahul Gandhi arrive at AICC HQ, for the #CongressCMsMeetpic.twitter.com/0WOk4WZdFB",,,#CongressCMsMeetpic,608153747512958977,https://twitter.com/INCIndia/status/608153747512958977
2015-06-09 06:04:08,INCIndia,,5,111,53,"Starting Shortly: CMs from Congress Ruled States are meeting at AICC Headquarters. #CongressCMsMeet",,,#CongressCMsMeet,608152580892393472,https://twitter.com/INCIndia/status/608152580892393472
2015-06-09 05:28:39,INCIndia,,13,59,52,"Chief Ministers Meeting of Congress Ruled States to be held today at AICC Headquarterspic.twitter.com/egWae0I3K6",,,,608143648278994946,https://twitter.com/INCIndia/status/608143648278994946
2015-06-09 04:29:09,OmarAbdullah,bombaywallah,2,2,4,"@bombaywallah I had to Google Malthus :) #honestconfession",,@bombaywallah,#honestconfession,608128677927198723,https://twitter.com/OmarAbdullah/status/608128677927198723
2015-06-09 04:19:28,OmarAbdullah,,94,83,86,"The solution to overcrowding in India since so many of us will have to pack our bags. Ek teer do shikar :-) https://twitter.com/timesnow/status/608122424823934977 …",,,,608126238633259009,https://twitter.com/OmarAbdullah/status/608126238633259009
2015-06-09 03:43:36,MamataOfficial,,11,70,57,"My homage to Birsa Munda on his 115th death anniversary. We are committed to the welfare of Santhal brothers and sisters",,,,608117213229248512,https://twitter.com/MamataOfficial/status/608117213229248512
2015-06-09 03:26:02,RajaBrar_INC,htTweets,6,133,116,"""हम परों से नहीं , हौसलों से उड़ान भरते हैं"" - इस नन्ही परी के जज़्बे को सलाम !https://twitter.com/httweets/status/607832908498239489 …",,,,608112790574759936,https://twitter.com/RajaBrar_INC/status/608112790574759936
2015-06-09 02:43:30,narendramodi,,388,1500,2258,"Know more about Ardha Ushtrasana. #YogaDayhttps://amp.twimg.com/v/3162eabf-5713-45fe-bb23-6328d657b4f2 …",,,#YogaDayhttps,608102086476099586,https://twitter.com/narendramodi/status/608102086476099586
2015-06-08 16:56:52,OmarAbdullah,BBCAfrica,22,45,53,"This is getting much worse for @Nestlehttps://twitter.com/bbcafrica/status/607949247942651905 …",,@Nestlehttps,,607954458417307648,https://twitter.com/OmarAbdullah/status/607954458417307648
2015-06-08 16:51:32,narendramodi,Rumi_Ahmed,20,102,167,"@Rumi_Ahmed Totally. This visit was historic for India-Bangladesh ties & people of both nations will benefit.",,@Rumi_Ahmed,,607953115405377536,https://twitter.com/narendramodi/status/607953115405377536
2015-06-08 16:50:36,narendramodi,SagarShinde8,12,122,181,"@SagarShinde8 Good effort. Congratulations to the team. Keep working towards a Swachh Bharat. #MyCleanIndia",,@SagarShinde8,#MyCleanIndia,607952880734072833,https://twitter.com/narendramodi/status/607952880734072833
2015-06-08 16:47:52,narendramodi,,169,593,1075,"Today's meeting focused on aspects relating to irrigation sector & delivering quicker results for farmers. http://nm4.in/1Jykw3e",,,,607952194248187904,https://twitter.com/narendramodi/status/607952194248187904
2015-06-08 16:46:00,narendramodi,,160,672,1080,"Reviewed preparations for Krishi Sinchai Yojana & emphasised on need to include young university researchers in irrigation-policy planning.",,,,607951723391352832,https://twitter.com/narendramodi/status/607951723391352832
2015-06-08 13:56:37,OmarAbdullah,,52,60,84,"The resounding silence from Mufti Syed & his allies upon completing 100 days in office today speaks volumes for their achievements.",,,,607909096797278209,https://twitter.com/OmarAbdullah/status/607909096797278209
2015-06-08 13:54:56,OmarAbdullah,,24,19,66,"Thank you to all the media people who came for my press conference today. It was good to see all of you again.",,,,607908671180308481,https://twitter.com/OmarAbdullah/status/607908671180308481
2015-06-08 13:19:00,laluprasadrjd,,170,192,195,"भाजपा के छक्के छुड़ाने के लिए पूरी तरह तैयार...pic.twitter.com/S89GweqvfH",,,,607899629078740992,https://twitter.com/laluprasadrjd/status/607899629078740992
2015-06-08 12:39:47,BJP4India,,16,139,169,"E-Visa implementation boosts tourist count by more than 1000%. #SaalEkShuruaatAnekpic.twitter.com/1SQWeaMyje",,,#SaalEkShuruaatAnekpic,607889761408159745,https://twitter.com/BJP4India/status/607889761408159745
2015-06-08 12:39:03,BJP4India,,14,110,128,"ई-वीजा के इंप्लीमेंटेशन के द्वारा १०००% से अधिक बढ़ी पर्यटकों की संख्या #SaalEkShuruaatAnekpic.twitter.com/U3ercHXqDK",,,#SaalEkShuruaatAnekpic,607889573767544834,https://twitter.com/BJP4India/status/607889573767544834
2015-06-08 11:58:21,INCIndia,,100,329,234,"Dear Prime Minister, #DespiteBeingAWoman they are all achieverspic.twitter.com/GjqVd5pT9N",,,#DespiteBeingAWoman,607879331503742976,https://twitter.com/INCIndia/status/607879331503742976
2015-06-08 11:32:15,INCIndia,,47,123,87,"Was PM Modi trying to say that woman are cowards&their courage needs to be validated by an Indian PM?: Anand Sharmapic.twitter.com/PQUFSmRG2f",,,,607872766423867392,https://twitter.com/INCIndia/status/607872766423867392
2015-06-08 11:31:56,INCIndia,,8,79,56,"More than once PM said “I want to congratulate Sheikh Hasina that she's fighting a war against terrorism "" #DespiteBeingawomen”:Anand Sharma",,,#DespiteBeingawomen,607872683200507904,https://twitter.com/INCIndia/status/607872683200507904
2015-06-08 11:31:15,INCIndia,,31,109,67,"PM Narendra Modi certainly doesn’t have qualities, gravitas, or grace that statesman have: Shri Anand Sharma",,,,607872511796117504,https://twitter.com/INCIndia/status/607872511796117504
2015-06-08 11:30:54,INCIndia,,6,72,57,"Indira Gandhi supported Bangabandhu Mujibur Rahman who was in prison.India supported liberation movement:Anand Sharmapic.twitter.com/1QHygzWx5U",,,,607872424411930624,https://twitter.com/INCIndia/status/607872424411930624
2015-06-08 11:19:46,INCIndia,INCIndia,7,64,43,"We demand a judicial inquiry in this Cash for Vote Scam, and CM Naidu should resign pending inquiry: @shobha_oza",,@shobha_oza,,607869625037025282,https://twitter.com/INCIndia/status/607869625037025282
2015-06-08 11:18:45,INCIndia,INCIndia,6,66,49,"BJP cried hoarse and demanded resignations, when their own MP's wielded cash in Parl in 2008, but is now is silent: @shobha_oza",,@shobha_oza,,607869367389265922,https://twitter.com/INCIndia/status/607869367389265922
2015-06-08 11:17:44,INCIndia,INCIndia,7,45,22,"Why the BJP, an allay of TDP is silent on this Cash for Vote Scam: @shobha_oza",,@shobha_oza,,607869112035844096,https://twitter.com/INCIndia/status/607869112035844096
2015-06-08 11:17:10,INCIndia,INCIndia,2,42,26,"The way CM Chandrababu Naidu is involved in this scam, questions should be raised why he should still be CM: @shobha_oza",,@shobha_oza,,607868970507452416,https://twitter.com/INCIndia/status/607868970507452416
2015-06-08 11:15:46,INCIndia,,14,64,56,"We have all heard about Shri Chandrababu Naidu's involvement in the Cash for Vote Scam: @shobha_oza",,@shobha_oza,,607868618211090432,https://twitter.com/INCIndia/status/607868618211090432
2015-06-08 11:13:04,INCIndia,INCIndia,14,80,67,"Vajpayee ji supported Smt. Indira Gandhi and hailed her as 'Maa Durga'- PM could have remembered this: Shri Anand Sharma",,,,607867937899216896,https://twitter.com/INCIndia/status/607867937899216896
2015-06-08 11:12:03,INCIndia,INCIndia,3,57,48,"Shri Modi said #DespiteBeingAWoman Sheikh Hasina fought terror, he said not once but many times: Shri Anand Sharma",,,#DespiteBeingAWoman,607867682810032128,https://twitter.com/INCIndia/status/607867682810032128
2015-06-08 11:10:41,INCIndia,INCIndia,4,58,60,"Smt. Indira Gandhi has been awarded by the highest civilian award of Bangladesh in 2011: Shri Anand Sharma",,,,607867339028070401,https://twitter.com/INCIndia/status/607867339028070401
2015-06-08 11:08:42,INCIndia,INCIndia,2,61,51,"We are surprised that the PM makes such statements on foreign soil or gets carried away: Shri Anand Sharma",,,,607866839780106240,https://twitter.com/INCIndia/status/607866839780106240
2015-06-08 11:07:55,INCIndia,INCIndia,9,65,51,"Shri Narendra Modi embarrassed India by saying that ""I took the decision"", Shri Modi might be only 20 years old then: Shri Anand Sharma",,,,607866639816589313,https://twitter.com/INCIndia/status/607866639816589313
2015-06-08 11:05:38,INCIndia,INCIndia,8,55,29,"PM has tried to rewrite pages of history, by not acknowledging the contribution of Smt.Indira Gandhi in liberation of B'Desh: Shri Sharma",,,,607866065712848897,https://twitter.com/INCIndia/status/607866065712848897
2015-06-08 11:04:19,INCIndia,INCIndia,3,47,26,"PM wanted to sign a truncated agreement by excluding Assam, it was because of constant pressure by INC, Govt had to include it: Shri Sharma",,,,607865733498826752,https://twitter.com/INCIndia/status/607865733498826752
2015-06-08 11:02:51,INCIndia,INCIndia,2,58,28,"The protocol agreement was signed on Sept 7, 2011 between Dr Manmohan Singh & Sheikh Hasina: Shri Anand Sharma",,,,607865364651712512,https://twitter.com/INCIndia/status/607865364651712512
2015-06-08 11:01:43,INCIndia,INCIndia,3,55,26,"The PM played partisan politics by not honouring the CM's of Meghalaya, Tripura & Assam: Shri Anand Sharma LIVE: https://www.youtube.com/watch?v=i17TG6xrxHY …",,,,607865082257620992,https://twitter.com/INCIndia/status/607865082257620992
2015-06-08 11:00:54,INCIndia,INCIndia,1,44,28,"It was the Congress which supported the Land Boundary Bill, without which the agreement couldn't have been signed: Shri Anand Sharma",,,,607864874031443968,https://twitter.com/INCIndia/status/607864874031443968
2015-06-08 10:59:40,INCIndia,INCIndia,5,46,23,"The PM was playing politics, when the Govt wanted to exclude Assam: Shri Anand Sharma LIVE: https://www.youtube.com/watch?v=i17TG6xrxHY …",,,,607864565146066944,https://twitter.com/INCIndia/status/607864565146066944
2015-06-08 10:58:45,INCIndia,INCIndia,3,58,27,"It would have been better if the PM would have showcased LAB as an achievement of India rather than of his Govt: Shri Anand Sharma",,,,607864333498875905,https://twitter.com/INCIndia/status/607864333498875905
2015-06-08 10:57:40,INCIndia,,10,86,59,"The PM ratified the protocol agreement of the Land Boundary Agreement which was signed on Sept 7, 2011: Shri Anand Sharma",,,,607864059715682304,https://twitter.com/INCIndia/status/607864059715682304
2015-06-08 10:56:23,INCIndia,,2,37,35,"AICC Press Conference being addressed by Shri Anand Sharma and Smt. @shobha_oza today LIVE: https://www.youtube.com/watch?v=i17TG6xrxHY …",,@shobha_oza,,607863739572887552,https://twitter.com/INCIndia/status/607863739572887552
2015-06-08 10:19:21,OmarAbdullah,,62,217,231,"#DespiteBeingAMan I can't think of a single wise crack to use the #DespiteBeingAWoman hashtag.",,,#DespiteBeingAMan #DespiteBeingAWoman,607854420211023872,https://twitter.com/OmarAbdullah/status/607854420211023872
2015-06-08 07:58:29,ncbn,,118,87,177,"We have crossed many milestones by converting crisis into opportunity. This is the beginning of our long journey towards a prosperous AP.",,,,607818968292679680,https://twitter.com/ncbn/status/607818968292679680
2015-06-08 07:58:13,ncbn,,59,80,131,"Taking Maha Sankalpam today as I complete 1 year in govt. Last 12 months have given me an opportunity to make #EveryDreamCount in AP.",,,#EveryDreamCount,607818901494202368,https://twitter.com/ncbn/status/607818901494202368
2015-06-08 07:26:46,RahulGandhi,,389,1047,1047,"Ban friendly Modi Sarkar on back foot. IIT Study Circle ban lifted. Big win for students: Rahul Gandhi",,,,607810986121302016,https://twitter.com/RahulGandhi/status/607810986121302016
2015-06-08 03:02:59,narendramodi,,417,1772,2714,"Bhadrasana, also known as the firm/auspicious posture keeps the body firm & stabilises the mind. #YogaDayhttps://amp.twimg.com/v/111380e9-ddfc-4241-ad68-4524d2a32563 …",,,#YogaDayhttps,607744604234850304,https://twitter.com/narendramodi/status/607744604234850304
2015-06-08 03:02:41,narendramodi,,189,741,1416,"Over the last few days I shared aspects about standing postures. Today onwards we will shift to sitting postures, 1st of which is Bhadrasana",,,,607744526900326400,https://twitter.com/narendramodi/status/607744526900326400
2015-06-08 02:56:55,BJP4India,,15,110,178,"भारत और बांग्लादेश पास-पास भी हैं और अब साथ-साथ भी: श्री नरेन्द्र मोदी http://nm4.in/1FCrAWu #ModiInBangladeshpic.twitter.com/O4Ncgsl9zz",,,#ModiInBangladeshpic,607743077172670464,https://twitter.com/BJP4India/status/607743077172670464
2015-06-08 02:50:04,narendramodi,RappyShakawat,32,199,294,"@RappyShakawat Absolutely. As I said, ""भारत और बांग्लादेश पास-पास भी हैं और अब साथ-साथ भी""",,@RappyShakawat,,607741353116581891,https://twitter.com/narendramodi/status/607741353116581891
2015-06-08 02:49:35,narendramodi,kashiflion,9,159,266,"@kashiflion Very kind of you. The visit was historic and the warmth of the people of Bangladesh was overwhelming.",,@kashiflion,,607741232106700800,https://twitter.com/narendramodi/status/607741232106700800
2015-06-07 14:14:53,narendramodi,,479,1113,2316,"Most importantly, we successfully overcame long pending issues of the past & this will enable us to create a better future for our ties.",,,,607551303972057088,https://twitter.com/narendramodi/status/607551303972057088
2015-06-07 14:14:17,narendramodi,,148,566,1488,"সবচেয়ে গুরুত্বপূর্ণ হচ্ছে, আমরা অতীতের অমীমাংসিত বিষয় সাফল্যের সঙ্গে কাটিয়ে উঠেছি। এটি আমাদের সম্পর্কের ক্ষেত্রে নতুন দিগন্ত সৃষ্টি করবে।",,,,607551155011354624,https://twitter.com/narendramodi/status/607551155011354624
2015-06-07 14:13:58,narendramodi,,226,1161,2353,"Thank you Bangladesh. The visit will remain forever etched in my memory. Outcomes of the visit will lead to a stronger partnership.",,,,607551073918656512,https://twitter.com/narendramodi/status/607551073918656512
2015-06-07 14:13:14,narendramodi,,124,572,1424,"ধন্যবাদ বাংলাদেশ। এই সফর আমার স্মৃতিতে ভাস্বর হয়ে থাকবে। এই সফর ভারত-বাংলাদেশ অংশীদারিত্ব সুদৃঢ় করবে।",,,,607550888480280576,https://twitter.com/narendramodi/status/607550888480280576
2015-06-07 14:12:35,narendramodi,,240,898,1772,"भारत और बांग्लादेश पास-पास भी हैं और अब साथ-साथ भी…great atmosphere at Dhaka University. Sharing my speech. http://nm4.in/1FCrAWu",,,,607550724214358016,https://twitter.com/narendramodi/status/607550724214358016
2015-06-07 14:00:21,PMOIndia,,33,225,523,"Yesterday @MamataOfficial told me you can never forget Bangladesh's hospitality. I agree with that: PM @narendramodi",,@MamataOfficial @narendramodi,,607547648032174081,https://twitter.com/PMOIndia/status/607547648032174081
2015-06-07 13:58:12,PMOIndia,,60,208,466,"The thought process of your PM and my thought process perfectly matches. All we think of is development, development and development: PM",,,,607547105326985216,https://twitter.com/PMOIndia/status/607547105326985216
2015-06-07 13:45:24,PMOIndia,,67,241,472,"Terrorism has no boundaries. India has been troubled by it for years. What did people associated with terrorism gain: PM @narendramodi",,@narendramodi,,607543883191349248,https://twitter.com/PMOIndia/status/607543883191349248
2015-06-07 13:38:59,PMOIndia,,28,174,373,"The trust must remain. Efforts must continue: PM @narendramodi on India-Bangladesh ties",,@narendramodi,,607542269759995906,https://twitter.com/PMOIndia/status/607542269759995906
2015-06-07 13:25:09,PMOIndia,,25,249,466,"Bangladesh, Bhutan, India and Nepal have placed their priority on easy connectivity. This was a proposal even raised in SAARC Summit: PM",,,,607538787187453952,https://twitter.com/PMOIndia/status/607538787187453952
2015-06-07 13:19:08,PMOIndia,,38,217,387,"If you think Land Boundary Agreement is about land going this side & that side then think again. It is a meeting of hearts: PM @narendramodi",,@narendramodi,,607537274859880448,https://twitter.com/PMOIndia/status/607537274859880448
2015-06-07 13:17:10,PMOIndia,,38,193,405,"Bangladesh, like India is a youthful Nation. Am sure the development journey of Bangladesh cannot stop now: PM @narendramodi",,@narendramodi,,607536781601341440,https://twitter.com/PMOIndia/status/607536781601341440
2015-06-07 13:15:17,PMOIndia,,27,183,367,"PM Sheikh Hasina has made development her only goal: PM @narendramodi in Dhaka #ModiInBangladeshhttps://www.youtube.com/watch?v=M7cJYytoHyQ …",,@narendramodi,#ModiInBangladeshhttps,607536304230785025,https://twitter.com/PMOIndia/status/607536304230785025
2015-06-07 13:14:37,PMOIndia,,19,238,432,"When we think of Bangladesh we feel very proud of the fact that even our Jawans have given their blood for this Nation: PM @narendramodi",,@narendramodi,,607536138757103616,https://twitter.com/PMOIndia/status/607536138757103616
2015-06-07 13:11:22,PMOIndia,,14,125,311,"Despite several obstacles Bangladesh has done very well: PM @narendramodi https://www.youtube.com/watch?v=M7cJYytoHyQ … #ModiInBangladesh",,@narendramodi,#ModiInBangladesh,607535321006272513,https://twitter.com/PMOIndia/status/607535321006272513
2015-06-07 13:07:04,PMOIndia,,33,200,375,"The person who taught us a lot, Bharat Ratna Atal Bihari Vajpayee has been honoured by Bangladesh today: PM @narendramodi #ModiInBangladesh",,@narendramodi,#ModiInBangladesh,607534236178878465,https://twitter.com/PMOIndia/status/607534236178878465
2015-06-07 13:05:37,PMOIndia,,31,160,360,"People thought we are near but now people have accept we are near as well as together: PM @narendramodi #ModiInBangladesh",,@narendramodi,#ModiInBangladesh,607533872276865025,https://twitter.com/PMOIndia/status/607533872276865025
2015-06-07 13:03:33,PMOIndia,,38,191,392,"My two day visit ends today. This is the last programme of this visit: PM at Dhaka University. https://www.youtube.com/watch?v=M7cJYytoHyQ … #ModiInBangladesh",,,#ModiInBangladesh,607533355177934848,https://twitter.com/PMOIndia/status/607533355177934848
2015-06-07 12:07:19,narendramodi,,177,773,1844,"Comprehensive meeting on India-Bangladesh economic ties with Presidents of leading commerce & industry chambers.pic.twitter.com/CvhM0AI8Ts",,,,607519203537485825,https://twitter.com/narendramodi/status/607519203537485825
2015-06-07 12:06:00,narendramodi,,106,640,1733,"Met former PM Begum Khaleda Zia.pic.twitter.com/7OzMdXrr6V",,,,607518871126294528,https://twitter.com/narendramodi/status/607518871126294528
