date,username,to,replies,retweets,favorites,text,geo,mentions,hashtags,id,permalink
2015-06-18 15:21:18,OmarAbdullah,,80,125,257,"Ramzan Mubarak to all of you. May the holy month of fasting be a blessed one all around.",,,,611554284904169473,https://twitter.com/OmarAbdullah/status/611554284904169473
2015-06-18 14:56:03,INCIndia,,7,48,51,"AICC Press Conference addressed by @drcpjoshi today on #ModiGate Watch: https://www.youtube.com/watch?=YieGCgDdP1E&feature=youtu.be …",,@drcpjoshi,#ModiGate,611547932240654336,https://twitter.com/INCIndia/status/611547932240654336
2015-06-18 14:09:02,MamataOfficial,,7,25,70,"I am in #Darjeeling with the message of peace and development. This is my 60th visit to Queen of Hillspic.twitter.com/sU24g77c7d",,,#Darjeeling,611536099635101696,https://twitter.com/MamataOfficial/status/611536099635101696
2015-06-18 14:07:58,MamataOfficial,,7,80,88,"I wish all the best to my brothers and sisters of Darjeeling. We want the Hills to keep smilingpic.twitter.com/MdA5KrDj4j",,,,611535831765880832,https://twitter.com/MamataOfficial/status/611535831765880832
2015-06-18 14:06:51,MamataOfficial,,3,68,56,"I have attended several administrative meetings and met representatives of Himalayan Mountaineering Institutepic.twitter.com/ktmIq6LRGY",,,,611535551590633473,https://twitter.com/MamataOfficial/status/611535551590633473
2015-06-18 14:04:57,ncbn,,33,70,166,"My warmest greetings to Muslims celebrating the beginning of Ramadan in India & around the world. Wishing you all prosperity & happiness.",,,,611535072248725504,https://twitter.com/ncbn/status/611535072248725504
2015-06-18 14:04:44,MamataOfficial,,2,67,48,"During my stay in Darjeeling, I met with representatives of various communities and political partiespic.twitter.com/nYk5l4cTUr",,,,611535015432728576,https://twitter.com/MamataOfficial/status/611535015432728576
2015-06-18 13:36:43,narendramodi,,187,776,1272,"Got an overview of the current status of Aadhaar enrolment & direct transfer of benefits in various sectors. http://pmindia.gov.in/en/news_updates/review-of-uid-and-dbt-pm-calls-for-accelerating-the-delivery-of-benefits-through-aadhaar-and-dbt/?comment=disable …",,,,611527967399743488,https://twitter.com/narendramodi/status/611527967399743488
2015-06-18 13:36:03,narendramodi,,131,676,1134,"During today's meeting on UID & DBT, we discussed ways to accelerate delivery of benefits & more aspects relating to UID & DBT.",,,,611527797182328832,https://twitter.com/narendramodi/status/611527797182328832
2015-06-18 12:18:52,INCIndia,,36,123,96,"Prime Minister Shri Modi continues to maintain conspiratorial silence on the #ModiGate scandalpic.twitter.com/qRAHBr2tYF",,,#ModiGate,611508374870495232,https://twitter.com/INCIndia/status/611508374870495232
2015-06-18 11:40:53,laluprasadrjd,,44,85,78,"Already there is undeclared emergency as authoritarian & Hitlerian tendencies prevailing in country since May14. We hv exp. to win over it",,,,611498817431560192,https://twitter.com/laluprasadrjd/status/611498817431560192
2015-06-18 11:35:39,laluprasadrjd,,39,94,92,"Advani Ji proved that our concerns regarding anti-democratic elements & activities being sponsored & promoted by union govt are correct.",,,,611497497253425153,https://twitter.com/laluprasadrjd/status/611497497253425153
2015-06-18 11:35:05,INCIndia,,13,67,53,"After the decision of High Court,why is the Govt misusing CBI to raid Virbadhra Singh, when it's feeling the heat in #ModiGate: @drcpjoshi",,@drcpjoshi,#ModiGate,611497358275153921,https://twitter.com/INCIndia/status/611497358275153921
2015-06-18 11:31:46,INCIndia,,11,61,57,"For Sushma ji, RSS has spoken; but in the case of Vasundhara Raje RSS is silent : @drcpjoshi #ModiGate",,@drcpjoshi,#ModiGate,611496521209479168,https://twitter.com/INCIndia/status/611496521209479168
2015-06-18 11:30:25,INCIndia,,13,60,67,"The silence of the PM is deafening, PM must tell the people of India about his views on #ModiGate: @drcpjoshipic.twitter.com/pBpY8j9MaJ",,@drcpjoshipic,#ModiGate,611496181596684288,https://twitter.com/INCIndia/status/611496181596684288
2015-06-18 11:27:41,INCIndia,,13,72,70,"We demand the resignation of Vasundhara Raje, requesting BJP President Amit Shah to sack her immediately : @drcpjoshi",,@drcpjoshi,,611495495358263297,https://twitter.com/INCIndia/status/611495495358263297
2015-06-18 11:25:33,INCIndia,,6,81,64,"We want to know the transaction between Dushyant Singh and Lalit Modi is a Black Money transaction or not? : @drcpjoshi",,@drcpjoshi,,611494958491500545,https://twitter.com/INCIndia/status/611494958491500545
2015-06-18 11:24:27,INCIndia,,2,67,59,"Lalit Modi's statements released by his counsel corroborates his proximity with Vasundhara Raje : @drcpjoshipic.twitter.com/DdezQcjNoM",,@drcpjoshipic,,611494678840504320,https://twitter.com/INCIndia/status/611494678840504320
2015-06-18 11:22:00,INCIndia,,12,80,70,"After Election, there is a new slogan for PM ""Na Khaunga, Na Khane Doonga, Aur Jo Kha Raha Hai Usse Bachaunga"" : @drcpjoshi",,@drcpjoshi,,611494062504304640,https://twitter.com/INCIndia/status/611494062504304640
2015-06-18 11:21:19,INCIndia,,15,80,58,"There is no such thing as ""Humanitarian Ground"" in Law : @drcpjoshipic.twitter.com/CF09W7SAd4",,@drcpjoshipic,,611493892509143042,https://twitter.com/INCIndia/status/611493892509143042
2015-06-18 11:18:47,INCIndia,,1,44,36,"AICC Press Conference being addressed by @drcpjoshi",,@drcpjoshi,,611493252642967552,https://twitter.com/INCIndia/status/611493252642967552
2015-06-18 10:03:22,INCIndia,,56,159,128,"आपका इशारा किस तरफ है अडवाणी जी ?pic.twitter.com/RhHrB659RP",,,,611474276139405312,https://twitter.com/INCIndia/status/611474276139405312
2015-06-18 09:40:47,narendramodi,,210,1620,2309,"Maryam donated Rs. 11,000/- each to PMNRF & Swachhta Abhiyan. Maryam's interest in various religions is an inspiration to all Indians.",,,,611468590894596096,https://twitter.com/narendramodi/status/611468590894596096
2015-06-18 09:39:22,narendramodi,,450,3138,5078,"Met my young friend, Maryam Asif Siddiqui, winner of Bhagavad Gita Champion League organised by ISKCON.pic.twitter.com/tqDSHHmPUn",,,,611468233858617345,https://twitter.com/narendramodi/status/611468233858617345
2015-06-18 09:30:46,narendramodi,,156,1059,1755,"Talked about technology & investment opportunities in India with Mr. John Chambers, Chairman, CISCO.pic.twitter.com/Tug8oItuou",,,,611466069098692608,https://twitter.com/narendramodi/status/611466069098692608
2015-06-18 08:27:39,JM_Scindia,,20,103,147,"#RamadanMubarak to all as the holy month begins, may the month be blessed with Peace, Prosperity & Happiness to all.",,,#RamadanMubarak,611450187836362752,https://twitter.com/JM_Scindia/status/611450187836362752
2015-06-18 08:23:08,laluprasadrjd,,76,64,106,"हमारा नारा:- गांव-गांव,पांव-पांव ; बीजेपी करे चांव-चांव",,,,611449050202808320,https://twitter.com/laluprasadrjd/status/611449050202808320
2015-06-18 07:51:08,BJP4India,,22,127,153,"Stay connected with Shri @narendramodi using 'Narendra Modi Mobile App'. Download from - http://nm4.in/nmandroidapp pic.twitter.com/G8bk9xsePr",,@narendramodi,,611440997784907776,https://twitter.com/BJP4India/status/611440997784907776
2015-06-18 07:31:03,MamataOfficial,MamataOfficial,8,60,46,"A special event has been planned at Paris Plage and at UNESCO Headquarters on 28th July 2015. My best wishes to all of them.",,,,611435941400576000,https://twitter.com/MamataOfficial/status/611435941400576000
2015-06-18 07:30:42,MamataOfficial,MamataOfficial,2,60,37,"Our artisans, along with baul and chau team,will be visiting France to represent India at prestigious Gannat festival during July 7-26, 2015",,,,611435855085993984,https://twitter.com/MamataOfficial/status/611435855085993984
2015-06-18 07:29:04,MamataOfficial,MamataOfficial,4,57,17,"Our efforts to spread rural crafts of Bengal across boundaries continue to get yet another international acclaim",,,,611435443670904832,https://twitter.com/MamataOfficial/status/611435443670904832
2015-06-18 07:28:48,MamataOfficial,,9,64,41,"Rural Craft Hub of Bengal, run by MSME Dept, has been selected by UNESCO Headquarters to showcase their artistes in Paris on 28th July, 2015",,,,611435376343912448,https://twitter.com/MamataOfficial/status/611435376343912448
2015-06-18 07:13:20,OmarAbdullah,ImranNDar,2,2,8,"@ImranNDar Ramzaan Mubarak to you too.",,@ImranNDar,,611431484348461058,https://twitter.com/OmarAbdullah/status/611431484348461058
2015-06-18 07:12:39,OmarAbdullah,BBCtrending,7,19,58,"Nice ones :-)https://twitter.com/bbctrending/status/611383614077415425 …",,,,611431311794765824,https://twitter.com/OmarAbdullah/status/611431311794765824
2015-06-18 07:09:30,ArvindKejriwal,,1419,2324,1971,"Advani ji is correct in saying that emergency can't be ruled out. Is Delhi their first experiment?",,,,611430520715489280,https://twitter.com/ArvindKejriwal/status/611430520715489280
2015-06-18 05:40:00,PMOIndia,,190,573,1045,"योग - जीवन को जीभर के जीने की जड़ी- बूटी #YogaDaypic.twitter.com/PSS7NHr960",,,#YogaDaypic,611407997722427392,https://twitter.com/PMOIndia/status/611407997722427392
2015-06-18 05:31:24,RahulGandhi,,226,748,897,"#RamadanMubarak. May this month be filled with blessings and bring peace and prosperity for everyone: Rahul Gandhi",,,#RamadanMubarak,611405831523807232,https://twitter.com/RahulGandhi/status/611405831523807232
2015-06-18 04:42:21,INCIndia,,26,133,112,"The people of Rajasthan don't want a CM who is involved in corruption: Sachin Pilot pic.twitter.com/HQPfC0jY63 #ModiGate",,,#ModiGate,611393488651837440,https://twitter.com/INCIndia/status/611393488651837440
2015-06-18 04:42:00,INCIndia,,28,94,90,"Modi said, 'Na khaoonga, na khane doonga'. Today, his ministers are supporting criminals: Sachin Pilot on #ModiGate",,,#ModiGate,611393399648751616,https://twitter.com/INCIndia/status/611393399648751616
2015-06-18 04:41:38,INCIndia,,8,81,66,"CBI should probe this issue, but only after the ministers resign from their post: Congress' Sachin Pilot on #ModiGate",,,#ModiGate,611393310175825921,https://twitter.com/INCIndia/status/611393310175825921
2015-06-18 04:38:36,INCIndia,,8,89,62,"Why not use the same scale that you use for other people?PM needs to break his silence. Rajasthan CM needs to resign: Sachin Pilot #ModiGate",,,#ModiGate,611392543478026240,https://twitter.com/INCIndia/status/611392543478026240
2015-06-18 04:19:41,RahulGandhi,,117,628,716,"Meeting Sardar Surjit Singh's family in Fatehgarh Sahibpic.twitter.com/iwFuJXyTNx",,,,611387782741667840,https://twitter.com/RahulGandhi/status/611387782741667840
2015-06-18 03:56:44,OmarAbdullah,nazir_masoodi,1,4,5,"@nazir_masoodi thanks a lot, just did that. Also had a call from Ajay in Jammu so all sorted now. Will use the app going ahead.",,@nazir_masoodi,,611382009294786560,https://twitter.com/OmarAbdullah/status/611382009294786560
2015-06-18 03:35:12,RahulGandhi,,80,421,461,"Rahul Gandhi will be in Dadu Majra, Fatehgarh Sahib to meet the family of Sardar Surjit Singh and pay his respects",,,,611376589318815744,https://twitter.com/RahulGandhi/status/611376589318815744
2015-06-18 02:59:15,narendramodi,,186,887,1984,"Greetings to the people of Seychelles on their National Day.pic.twitter.com/jAAYrwyTVw",,,,611367542775418880,https://twitter.com/narendramodi/status/611367542775418880
2015-06-18 02:55:47,narendramodi,,196,1205,1723,"Anuloma Viloma Pranayama is very beneficial for the body, adding a sense of tranquility, improving concentration & reducing stress. #YogaDay",,,#YogaDay,611366670221733888,https://twitter.com/narendramodi/status/611366670221733888
2015-06-18 02:54:32,narendramodi,,217,1498,2101,"We now move to Pranayama, which is a very important aspect of Yoga. Discover more about Anuloma Viloma Pranayama.https://amp.twimg.com/v/1f7aa280-5f29-4bc6-867b-c2196a83da42 …",,,,611366353908269056,https://twitter.com/narendramodi/status/611366353908269056
2015-06-18 02:53:27,narendramodi,,509,2095,3484,"My greetings on Ramzan.pic.twitter.com/bqWtwtaiaK",,,,611366085179224064,https://twitter.com/narendramodi/status/611366085179224064
2015-06-18 02:51:05,narendramodi,,189,752,1317,"مقدس ماہ رمضان شروع ہونے پر میری مبارک باد۔pic.twitter.com/Lm4fuGgkgG",,,,611365489181233152,https://twitter.com/narendramodi/status/611365489181233152
2015-06-18 02:48:37,OmarAbdullah,,19,2,41,"Seems I sent the earlier tweet to their Nigerian customer care :-)) I'll have to figure out a better way to do this. Have deleted it now.",,,,611364866847215618,https://twitter.com/OmarAbdullah/status/611364866847215618
2015-06-17 17:58:16,RajaBrar_INC,ANI,15,135,111,"हमारा सवाल मौन #PM से है क्या उनका चुनाव सटोरिये मोदी का प्रायोजित है?क्यों नहीं सुषमा-वसुन्धरा का इस्तीफ़ा माँगते ?https://twitter.com/ani_news/status/611127380321501184 …",,,#PM,611231399647940608,https://twitter.com/RajaBrar_INC/status/611231399647940608
2015-06-17 16:31:25,INCIndia,,10,76,74,"AICC Press Conference today on #ModiGate Watch:https://www.youtube.com/watch?v=J6wl7rMvLlw&feature=youtu.be …",,,#ModiGate,611209543637446656,https://twitter.com/INCIndia/status/611209543637446656
2015-06-17 15:37:28,AmitShah,,91,473,572,"I thank PM @narendramodi ji for your decision of “Housing for all by 2022”,shows your commitment towards Antyodaya & Sabka Saath-Sabka Vikas",,@narendramodi,,611195967052709889,https://twitter.com/AmitShah/status/611195967052709889
2015-06-17 15:09:46,OmarAbdullah,,16,44,54,"Excellent piece by @CChristineFair. Well worth a read. False Equivalency in the “Indo-Pakistan” Disputehttp://warontherocks.com/2015/06/false-equivalency-in-the-indo-pakistan-dispute/ …",,@CChristineFair,,611188996916408322,https://twitter.com/OmarAbdullah/status/611188996916408322
2015-06-17 14:36:58,narendramodi,,550,2678,3632,"From the Siachen Base Camp…the Indian Army Personnel practising Yoga, all geared up for #YogaDay!pic.twitter.com/gDX0VLqjSU",,,#YogaDay,611180738923225088,https://twitter.com/narendramodi/status/611180738923225088
2015-06-17 14:30:00,narendramodi,,114,565,1059,"Ziara ya Rais Kikwete itaimarisha zaidi mahusiano ya karibu na ya kirafiki baina ya India na Tanzania. @jmkikwete",,@jmkikwete,,611178986673037313,https://twitter.com/narendramodi/status/611178986673037313
2015-06-17 14:29:32,narendramodi,,55,512,1054,"The visit of President @jmkikwete will further cement the close & friendly ties between India & Tanzania.",,@jmkikwete,,611178870042030081,https://twitter.com/narendramodi/status/611178870042030081
2015-06-17 14:28:48,narendramodi,,41,463,898,"Nawakaribisha nchini India Rais @jmkikwete wa Tanzania na Mama Salma Kikwete. Nawatakia makazi yenye furaha nchini India.",,@jmkikwete,,611178684922245121,https://twitter.com/narendramodi/status/611178684922245121
2015-06-17 14:28:02,narendramodi,,97,671,1366,"I welcome President @jmkikwete of Tanzania and Mama Salma Kikwete to India. I wish both of them a wonderful stay in India.",,@jmkikwete,,611178493410344961,https://twitter.com/narendramodi/status/611178493410344961
2015-06-17 14:17:04,OmarAbdullah,Junaid_Mattu,17,20,32,"But the 3rd MP (the one that really matters) has lost her voice & those crocodile tears that she shed for six years.https://twitter.com/junaid_mattu/status/611154242674425856 …",,,,611175731834454016,https://twitter.com/OmarAbdullah/status/611175731834454016
2015-06-17 14:14:39,OmarAbdullah,,0,1,5,"@naseerganai good ones :-))))",,@naseerganai,,611175123685498880,https://twitter.com/OmarAbdullah/status/611175123685498880
2015-06-17 14:07:57,RahulGandhi,,63,466,549,"Tripura Congress leaders met RG to discuss StateGovt's inaction in securing justice for ppl affected by ChitFund scampic.twitter.com/9nQnxms6eJ",,,,611173438145720320,https://twitter.com/RahulGandhi/status/611173438145720320
2015-06-17 13:55:30,MamataOfficial,,16,70,70,"যে নিয়তে রোজা রেখেছেন, আল্লাহ তা কবুল করুন। তাকওয়া এবং প্রশান্তির সঙ্গে রোজা রাখার শক্তি আল্লাহ আপনাদের দিন।",,,,611170305600458752,https://twitter.com/MamataOfficial/status/611170305600458752
2015-06-17 13:53:25,MamataOfficial,,11,65,51,"শুরু হল রমজান। আপনাদের সব রোজা আল্লাহ কবুল করুন, এই দোয়া করি। পবিত্র রমজান আপনাদের শুভ হোক।",,,,611169780570062849,https://twitter.com/MamataOfficial/status/611169780570062849
2015-06-17 13:51:08,MamataOfficial,,5,73,56,"For the auspicious month of Ramzan, greetings to all Muslim brothers & sisters. I share their piety. Hope their Roza is accepted by Almighty",,,,611169206730493952,https://twitter.com/MamataOfficial/status/611169206730493952
2015-06-17 13:49:06,MamataOfficial,,7,72,64,"Holy month of Ramzan is a special time for introspection & spiritual renewal. This month of fasting is rewarded at the end with Eid-Ul-Fitre",,,,611168695600091136,https://twitter.com/MamataOfficial/status/611168695600091136
2015-06-17 13:30:14,OmarAbdullah,naseerganai,39,41,44,"Would someone in Govt of India care to confirm this 10 LAKH CRORE package Mufti Syed has promised his members?https://twitter.com/naseerganai/status/611160218244788226 …",,,,611163949094928384,https://twitter.com/OmarAbdullah/status/611163949094928384
2015-06-17 13:28:44,OmarAbdullah,naseerganai,26,42,42,"This is a joke right? His finance minister was on stage when the package was announced so what is Mufti protesting?https://twitter.com/naseerganai/status/611152318084415488 …",,,,611163569053249536,https://twitter.com/OmarAbdullah/status/611163569053249536
2015-06-17 13:19:35,INCIndia,,30,165,108,"यह है असली ' Modi Development Model' #ModiGatepic.twitter.com/yXTTrW0vKS",,,#ModiGatepic,611161268657852416,https://twitter.com/INCIndia/status/611161268657852416
2015-06-17 13:11:53,narendramodi,,188,934,1921,"It was great meeting Swami Prakashananda, Head of Sivagiri Mutt, Kerala.pic.twitter.com/Y2uufbb5A1",,,,611159328997806080,https://twitter.com/narendramodi/status/611159328997806080
2015-06-17 12:41:20,INCIndia,,11,63,55,"Every political party should consider the facts which are now in public domain: Randeep Surjewala",,,,611151640637222912,https://twitter.com/INCIndia/status/611151640637222912
2015-06-17 12:32:52,INCIndia,,26,96,79,"PM has a conspiratorial silence, which can only come from a person who is guilty himself : Surjewala #ModiGatepic.twitter.com/gOIRwErDEh",,,#ModiGatepic,611149509070950400,https://twitter.com/INCIndia/status/611149509070950400
2015-06-17 12:30:21,INCIndia,,13,74,73,"Is this the Nationalism of the BJP ? : Randeep Surjewala",,,,611148876515401728,https://twitter.com/INCIndia/status/611148876515401728
2015-06-17 12:29:37,INCIndia,,35,87,72,"Smt. Sushma Swaraj & Smt. Vasundhara Raje are guilty of various penal codes of CrPc : Surjewalapic.twitter.com/cCsKGJ8nB1",,,,611148692704243712,https://twitter.com/INCIndia/status/611148692704243712
2015-06-17 12:26:43,INCIndia,,12,72,64,"Why is the Prime Minister silent on this #ModiGate : Sachin Pilotpic.twitter.com/IyM0VDP5Xz",,,#ModiGate,611147962106843136,https://twitter.com/INCIndia/status/611147962106843136
2015-06-17 12:25:08,INCIndia,,9,98,68,"Sushma ji had an excuse of ""Humanitarian Grounds"", but Vasundhara Raje ji does not have that excuse too: Sachin Pilotpic.twitter.com/eFV6HXvzHs",,,,611147562666491904,https://twitter.com/INCIndia/status/611147562666491904
2015-06-17 12:23:08,INCIndia,,8,63,56,"Acc to latest figures released Lalit Modi is an accused of a ₹1700Cr Scam & as many as 16 cases are slapped by ED on him: Surjewala",,,,611147062655057922,https://twitter.com/INCIndia/status/611147062655057922
2015-06-17 12:21:04,INCIndia,,4,79,45,"Co incidentally Rajasthan Govt entered into an MoU with the Cancer institute 58 days after Lalit Modi's wife treatment: Shri Kamat",,,,611146538803277824,https://twitter.com/INCIndia/status/611146538803277824
2015-06-17 12:18:40,INCIndia,,3,68,46,"Smt Vasundhara Raje does not deny the document released by Lalit Modi's counsel : Shri Kamat #ModiGate",,,#ModiGate,611145938707460097,https://twitter.com/INCIndia/status/611145938707460097
2015-06-17 12:17:41,INCIndia,,2,61,50,"She confirmed the content of the statements signed by her and wanted to avoid a video conference: Shri Kamatpic.twitter.com/6vbHqYFdLf",,,,611145687971926016,https://twitter.com/INCIndia/status/611145687971926016
2015-06-17 12:15:45,INCIndia,,4,67,51,"Doc signed by Vasundhara Raje and the confidential note attached indicates she knew very well that she was violating laws: Shri Kamat",,,,611145202875535361,https://twitter.com/INCIndia/status/611145202875535361
2015-06-17 12:13:42,INCIndia,,6,58,50,"Vasundhara Raje yesterday confirmed her proximity with Mr. Lalit Modi and family for last 20-30 years: Gurudas Kamat",,,,611144686162477056,https://twitter.com/INCIndia/status/611144686162477056
2015-06-17 12:10:43,INCIndia,INCIndia,2,59,46,"Although Shri Jaitley, yesterday said that the decision to appeal for revoking Lalit Modi's passport rests with the EAM: Surjewala #ModiGate",,,#ModiGate,611143935444910081,https://twitter.com/INCIndia/status/611143935444910081
2015-06-17 12:09:30,INCIndia,,4,63,50,"It is also clear that the external affairs ministry did not even consult their counsel Shri Rajiv Mehra : Surjewala",,,,611143627926978560,https://twitter.com/INCIndia/status/611143627926978560
2015-06-17 12:08:41,INCIndia,,2,49,46,"It also clear that she also spoke to Chairman of Parl Home Affairs of UK Mr. Keith Vazz: Surjewala",,,,611143424469643264,https://twitter.com/INCIndia/status/611143424469643264
2015-06-17 12:07:41,INCIndia,,5,59,44,"This is also clear that Smt. Sushma Swaraj called on the UK envoy to India that travel docs be handed over to Lalit Modi:Surjewala #ModiGate",,,#ModiGate,611143172660465664,https://twitter.com/INCIndia/status/611143172660465664
2015-06-17 12:05:29,INCIndia,,6,77,59,"Sushma Swaraj never disclosed this relationship either to the Parl ethics or to the GOI, which is compulsory under Code of Conduct:Surjewala",,,,611142618186055680,https://twitter.com/INCIndia/status/611142618186055680
2015-06-17 12:04:01,INCIndia,,5,52,49,"Smt Sushma Swaraj was maintaining a family relationship with a fugitive of law since 20 years-both as LoP & EAM: Surjewala",,,,611142249166929920,https://twitter.com/INCIndia/status/611142249166929920
2015-06-17 12:01:01,INCIndia,,10,65,47,"Doublespeak of BJP in defending the indefensible stands exposed now #ModiGate : Surjewala",,,#ModiGate,611141494825619457,https://twitter.com/INCIndia/status/611141494825619457
2015-06-17 12:00:01,INCIndia,,4,70,48,"#ModiGate scandal has exposed murky deals,wilful lies,non disclosure of personal & conflict of interest by senior BJP Leadership: Surjewala",,,#ModiGate,611141242668257280,https://twitter.com/INCIndia/status/611141242668257280
2015-06-17 11:57:57,INCIndia,,5,59,41,"The ED, Directorate of Revenue Intelligence was used by the BJP to help money launderer: Surjewala",,,,611140724604534784,https://twitter.com/INCIndia/status/611140724604534784
2015-06-17 11:57:11,INCIndia,,16,93,71,"In the last 72 hours, after #ModiGate scandal surfaced- the BJP top leadership has been totally exposed: Surjewalapic.twitter.com/uBFsXmHnYg",,,#ModiGate,611140531637194753,https://twitter.com/INCIndia/status/611140531637194753
2015-06-17 11:51:39,INCIndia,,5,53,47,"AICC Press Conference by Sachin Pilot, Gurudas Kamath and Randeep Singh Surjewala to start in a short while. LIVE :http://www.inc.in",,,,611139137719013376,https://twitter.com/INCIndia/status/611139137719013376
2015-06-17 11:47:29,INCIndia,,7,83,50,"Mr Jaitley suggested that the Government takes collective responsibility, if we go by him; Mr Modi should be responsible: @PChidambaram_IN",,@PChidambaram_IN,,611138090506129409,https://twitter.com/INCIndia/status/611138090506129409
2015-06-17 11:39:51,INCIndia,,9,73,52,"Mr. Lalit Modi is an Indian citizen, what steps is the government are taking to prosecute him under Indian laws: @PChidambaram_IN",,@PChidambaram_IN,,611136166113312769,https://twitter.com/INCIndia/status/611136166113312769
2015-06-17 11:38:13,INCIndia,,8,75,46,"When the division bench of HC set aside the cancellation of Mr Lalit Modi, who took the decision not to appeal against it: @PChidambaram_IN",,@PChidambaram_IN,,611135757265170432,https://twitter.com/INCIndia/status/611135757265170432
2015-06-17 11:37:17,INCIndia,,3,71,52,"Why the GOI not releasing the letters between the Finance Min of India and UK Chancellor of Exchequer: @PChidambaram_IN",,@PChidambaram_IN,,611135521834676224,https://twitter.com/INCIndia/status/611135521834676224
2015-06-17 11:36:17,INCIndia,,2,58,42,"The conduct of Smt. Sushma Swaraj raises a number of important questions : @PChidambaram_IN",,@PChidambaram_IN,,611135270369431552,https://twitter.com/INCIndia/status/611135270369431552
2015-06-17 11:35:39,INCIndia,,4,79,53,"The letters between me and my UK counterpart, I request that those letters exchanged should be made public : @PChidambaram_IN",,@PChidambaram_IN,,611135110486687744,https://twitter.com/INCIndia/status/611135110486687744
2015-06-17 11:34:28,INCIndia,,4,64,40,"ED requested my counterpart the UK chancellor, we discussed the matter as a bilateral meeting : @PChidambaram_IN",,@PChidambaram_IN,,611134813618110466,https://twitter.com/INCIndia/status/611134813618110466
