date,username,to,replies,retweets,favorites,text,geo,mentions,hashtags,id,permalink
2015-07-10 12:28:35,INCIndia,,6,59,60,"If you are not following the People's Shadow Handle of Ministry of Road. Please do follow @MORTHInd_Shadow Thankspic.twitter.com/iybkHvRaXT",,@MORTHInd_Shadow,,619483351569707008,https://twitter.com/INCIndia/status/619483351569707008
2015-07-10 12:19:57,narendramodi,,187,1189,2113,"A special thanks to President Putin for being an exceptional host during the stay in Russia. @KremlinRussia_Epic.twitter.com/DiZ4q9umiF",,@KremlinRussia_Epic,,619481182091112448,https://twitter.com/narendramodi/status/619481182091112448
2015-07-10 12:16:21,narendramodi,,150,963,1709,"I leave Russia, fully satisfied with the ground covered during the @BRICS2015 & SCO Summits. The meetings & talks have been productive.",,@BRICS2015,,619480274070470656,https://twitter.com/narendramodi/status/619480274070470656
2015-07-10 12:15:26,narendramodi,,55,657,1116,"Be it culture, environment, energy, IT, health, banking, agriculture, scope of cooperation among SCO nations is greathttp://nm4.in/1ScOBVQ",,,,619480042997833730,https://twitter.com/narendramodi/status/619480042997833730
2015-07-10 12:14:42,narendramodi,,54,667,1043,"At SCO Plenary Session, expressed gratitude to SCO members for accepting India as a full member & assured India's full cooperation to SCO.",,,,619479860751118336,https://twitter.com/narendramodi/status/619479860751118336
2015-07-10 12:12:53,narendramodi,,154,865,1591,"Here are some pictures from the various meetings & programmes today in Ufa.pic.twitter.com/zetDQvwlFw",,,,619479402603110400,https://twitter.com/narendramodi/status/619479402603110400
2015-07-10 12:09:09,BJP4India,,24,140,127,"बिहार विधान परिषद के चुनाव में 'महा-गठबंधन' की 'महा-हार' हुई है : श्री शाहनवाज़ हुसैन https://www.youtube.com/watch?v=gEDAz-m9JFE … @ShahnawazBJP",,@ShahnawazBJP,,619478461585854465,https://twitter.com/BJP4India/status/619478461585854465
2015-07-10 11:33:59,INCIndia,,14,96,59,"India cannot make such departures, the PM's stand has jeopardised our relationship with Palestine & other Middle East countries: A Sharma",,,,619469611298258944,https://twitter.com/INCIndia/status/619469611298258944
2015-07-10 11:32:29,INCIndia,INCIndia,13,77,56,"(Contd) This has not gone down well not only with Palestinian leaders but with other leaders of Middle East : Shri Anand Sharma",,,,619469235564122112,https://twitter.com/INCIndia/status/619469235564122112
2015-07-10 11:31:12,INCIndia,,6,81,60,"The development which is of concerned to us is on the issue of Palestine. This time there has been a deviation & dilution (contd): A Sharma",,,,619468914234257408,https://twitter.com/INCIndia/status/619468914234257408
2015-07-10 11:29:40,INCIndia,,12,106,63,"China opposed our position in the UN & justified it.PM raised it,but did the one way publicity of Govt tell us what China replied: A Sharma",,,,619468525246111744,https://twitter.com/INCIndia/status/619468525246111744
2015-07-10 11:27:14,INCIndia,,20,103,62,"In the last few days our Jawans have died and there are threats of Nuclear attack by Pak, still Our PM Is talking with them: Anand Sharma",,,,619467912248606720,https://twitter.com/INCIndia/status/619467912248606720
2015-07-10 11:24:57,INCIndia,,5,117,63,"Now Pak is asking for more evidence for Mumbai case,on what basis Shri Modi agreed to it, when every dossier has been provided: Shri Sharma",,,,619467340678197248,https://twitter.com/INCIndia/status/619467340678197248
2015-07-10 11:22:40,INCIndia,,5,79,47,"..(contd) All the other statements are same with regards to ""terrorism in all forms & manifestations"" : Shri Anand Sharma",,,,619466762862526464,https://twitter.com/INCIndia/status/619466762862526464
2015-07-10 11:21:37,INCIndia,,5,79,52,"Claim of BJP of a Major ""Breakthrough"" is laughable, if you look at earlier statements in 2006,2012 with reg to fight terror (contd): Sharma",,,,619466502312366080,https://twitter.com/INCIndia/status/619466502312366080
2015-07-10 11:19:37,INCIndia,,12,96,60,"On June 1, The External Affairs Minister said India will not talk to Pak, unless Lakhvi is brought to book, now why this U Turn: A Sharma",,,,619465997997641728,https://twitter.com/INCIndia/status/619465997997641728
2015-07-10 11:18:20,INCIndia,,5,69,50,"The country has been dark for justification of foreign sec talks and subsequent cancelling of sec talks : Shri Anand Sharma",,,,619465675589881856,https://twitter.com/INCIndia/status/619465675589881856
2015-07-10 11:17:10,INCIndia,,6,78,55,"Modi Govt's Pakistan policy lacks coherence: Shri Anand Sharma",,,,619465378880622592,https://twitter.com/INCIndia/status/619465378880622592
2015-07-10 11:16:36,INCIndia,,12,92,67,"The Indian National Congress supports dialogue with Pakistan provided there is action against perpetuators of Mumbai attack: Anand Sharma",,,,619465237301821440,https://twitter.com/INCIndia/status/619465237301821440
2015-07-10 11:15:11,INCIndia,,3,67,58,"AICC Press Conference being addressed by Shri Anand Sharma nowpic.twitter.com/EKdPKIrlsb",,,,619464882736369664,https://twitter.com/INCIndia/status/619464882736369664
2015-07-10 10:49:02,ncbn,,13,49,160,"Conveyed birthday wishes personally to @BJPRajnathSingh ji. Also discussed about issues related to the state with himpic.twitter.com/hO8UeJHyFZ",,@BJPRajnathSingh,,619458301445586944,https://twitter.com/ncbn/status/619458301445586944
2015-07-10 10:42:58,ncbn,,18,52,140,"Discussed about solar power projects in Andhra Pradesh with Union Minister @PiyushGoyal ji in Delhi.pic.twitter.com/d5aqLQ9dlO",,@PiyushGoyal,,619456775717150720,https://twitter.com/ncbn/status/619456775717150720
2015-07-10 10:22:43,INCIndia,,22,161,113,"बहुत हुई महंगाई की मार?pic.twitter.com/Q4lJrQaL3U",,,,619451679247732737,https://twitter.com/INCIndia/status/619451679247732737
2015-07-10 10:16:46,mkstalin,,6,21,55,"Natl. Comm for SC- TN in top 5 states for atrocities against Dalits. 6074 SC/ST Act cases and 213 murders since 2011http://bit.ly/1CtV6Sj",,,,619450179494608897,https://twitter.com/mkstalin/status/619450179494608897
2015-07-10 10:09:30,PMOIndia,,45,166,368,"I also take this opportunity to congratulate Pakistan on joining the SCO: PM @narendramodi at the SCO Summit",,@narendramodi,,619448352007065601,https://twitter.com/PMOIndia/status/619448352007065601
2015-07-10 10:09:11,PMOIndia,,13,145,297,"I assure you of India's full cooperation to SCO: PM @narendramodihttps://www.youtube.com/watch?v=oNhO10gCWiw …",,@narendramodihttps,,619448270822076416,https://twitter.com/PMOIndia/status/619448270822076416
2015-07-10 10:08:28,PMOIndia,,17,153,287,"We will work with SCO to combat terrorism and extremism: PM @narendramodi",,@narendramodi,,619448089619755008,https://twitter.com/PMOIndia/status/619448089619755008
2015-07-10 10:08:10,PMOIndia,,15,162,303,"The future of prosperity rests on the foundation of peace. India will contribute to advancing peace and friendship in the region: PM",,,,619448014889877504,https://twitter.com/PMOIndia/status/619448014889877504
2015-07-10 10:07:56,PMOIndia,,13,133,295,"Promoting deeper understanding and exchanges, especially among our youth, will promote greater unity in the region and beyond: PM",,,,619447958707134464,https://twitter.com/PMOIndia/status/619447958707134464
2015-07-10 10:07:33,PMOIndia,,8,117,258,"The SCO region is characterised by rich diversity of cultures: PM @narendramodi",,@narendramodi,,619447861663535105,https://twitter.com/PMOIndia/status/619447861663535105
2015-07-10 10:07:11,PMOIndia,,8,126,262,"We will support efforts to create an environment that eases barriers and facilitates trade and investments in the region: PM @narendramodi",,@narendramodi,,619447767174262785,https://twitter.com/PMOIndia/status/619447767174262785
2015-07-10 10:06:47,PMOIndia,,8,131,251,"India will be pleased to contribute to the development of infrastructure in the region: PM @narendramodi https://www.youtube.com/watch?v=oNhO10gCWiw …",,@narendramodi,,619447668046073856,https://twitter.com/PMOIndia/status/619447668046073856
2015-07-10 10:05:27,PMOIndia,,7,136,242,"Our membership of SCO is a natural extension of these relationships and mirrors the region’s place in India’s future: PM @narendramodi",,@narendramodi,,619447334246576129,https://twitter.com/PMOIndia/status/619447334246576129
2015-07-10 10:04:50,PMOIndia,,15,126,253,"Our strategic ties with Russia and China are deep: PM @narendramodi at the SCO Summit",,@narendramodi,,619447177048264704,https://twitter.com/PMOIndia/status/619447177048264704
2015-07-10 10:04:26,PMOIndia,,16,211,354,"Our ties with Central Asia are very old: PM @narendramodi begins his speech at SCO https://www.youtube.com/watch?v=oNhO10gCWiw …pic.twitter.com/5nUxgVwyAq",,@narendramodi,,619447078104633344,https://twitter.com/PMOIndia/status/619447078104633344
2015-07-10 10:01:56,RajaBrar_INC,ravishndtv,13,134,106,"सिलसिला समझौता एक्सप्रेस और कारगिल से शुरू हुआ,जो अब मसर्रतआलम,पाकिस्तान ज़िन्दाबाद और #ISIS के झंडों तक पंहुच गया!https://twitter.com/ravishndtv/status/619407599721582592 …",,,#ISIS,619446446413090816,https://twitter.com/RajaBrar_INC/status/619446446413090816
2015-07-10 09:00:17,BJP4India,,25,81,84,"First time Pakistan has accepted that terrorism in 'all its forms' is unacceptable - Shri @mjakbarhttps://www.youtube.com/watch?v=AQIJgfthqvw …",,@mjakbarhttps,,619430933230260226,https://twitter.com/BJP4India/status/619430933230260226
2015-07-10 08:21:30,OmarAbdullah,,13,27,43,"And a little less chest thumping from spokespersons claiming victory because that's a sure shot way to derail the entire process 4/4",,,,619421170949984256,https://twitter.com/OmarAbdullah/status/619421170949984256
2015-07-10 08:21:21,OmarAbdullah,,13,29,37,"We expect that in spite of Pakistan not mentioning Kashmir at all that the issue of Kashmir will receive its due attention going ahead 3/n",,,,619421135118012416,https://twitter.com/OmarAbdullah/status/619421135118012416
2015-07-10 08:21:06,OmarAbdullah,,1,24,31,"We've seen too many breaks in this process to allow today's announcements to excite us much here in the valley but it's a good 1st step 2/n",,,,619421072320958464,https://twitter.com/OmarAbdullah/status/619421072320958464
2015-07-10 08:20:55,OmarAbdullah,,22,32,41,"Resumption of the Indo-Pak dialogue is a welcome development. I only hope that this time it is sustained over the long term for results 1/n",,,,619421024652623872,https://twitter.com/OmarAbdullah/status/619421024652623872
2015-07-10 06:46:26,PMOIndia,,54,320,496,"More meetings through the day...India-Afghanistan ties being discussed by President @ashrafghani & PM @narendramodi.pic.twitter.com/0aoKJvSF7R",,@ashrafghani @narendramodi,,619397248573550592,https://twitter.com/PMOIndia/status/619397248573550592
2015-07-10 06:25:45,BJP4India,,4,47,61,"Stay updated about BJP's latest events, pictures, videos, press releases & more. Download BJP App from iTunes now http://apple.co/1IL8cfc .",,,,619392043538722816,https://twitter.com/BJP4India/status/619392043538722816
2015-07-10 06:17:18,laluprasadrjd,,33,46,52,"जिस कागज में गरीबों की तरक्की लिखी है उसी को मोदी ने छुपा लिया। हम उसे उजागर करवाकर रहेंगेpic.twitter.com/oRmVkeSKyG",,,,619389914983956480,https://twitter.com/laluprasadrjd/status/619389914983956480
2015-07-10 05:29:32,BJP4India,,7,72,90,"Indian Chamber of Commerce Hong Kong organised luncheon reception in honour of Shri LK Advani http://bit.ly/1KTbRt5 pic.twitter.com/0jIB8thYIj",,,,619377897174757376,https://twitter.com/BJP4India/status/619377897174757376
2015-07-10 04:42:23,PMOIndia,,173,399,769,"Two PMs of South Asian nations meet in Ufa. A picture of PM Nawaz Sharif meeting PM @narendramodi.pic.twitter.com/6IoYjh07Gc",,@narendramodi,,619366028598882305,https://twitter.com/PMOIndia/status/619366028598882305
2015-07-10 04:16:34,OmarAbdullah,IndiaToday,25,26,36,"What will Mufti Syed & his allies do about this I wonder!!!https://twitter.com/indiatoday/status/619355931948625920 …",,,,619359532762836992,https://twitter.com/OmarAbdullah/status/619359532762836992
2015-07-10 03:24:16,INCIndia,,38,230,176,"Every drop of my blood will contribute to the growth of this nation and make it strong and dynamic-Smt. Indira Gandhipic.twitter.com/Ukbq6pBoof",,,,619346370621669377,https://twitter.com/INCIndia/status/619346370621669377
2015-07-10 02:38:20,RajaBrar_INC,,11,119,93,"मोदीजी माना कि आप व्यापारी है,पर देश का सौदा तो मत करो ""चीन जाते हो तो हमारी जमीन का सियाचिन में और नवाज़शरीफ़ से मिलने पर जवानों की जान का""",,,,619334810901725185,https://twitter.com/RajaBrar_INC/status/619334810901725185
2015-07-10 02:19:18,PMOIndia,,44,197,423,"We cherish our warm relations with The Bahamas & see a great scope for expanding our ties which can benefit our people: PM @narendramodi",,@narendramodi,,619330020444471296,https://twitter.com/PMOIndia/status/619330020444471296
2015-07-10 02:18:23,PMOIndia,,24,175,440,"On the Independence Day of The Bahamas, my greetings & good wishes to the people of The Bahamas: PM @narendramodi",,@narendramodi,,619329791049641984,https://twitter.com/PMOIndia/status/619329791049641984
2015-07-10 02:14:20,narendramodi,,628,1986,3757,"Warm birthday wishes to @BJPRajnathSingh ji. A valued colleague, grassroots leader & a dear friend, I pray for his long life & good health.",,@BJPRajnathSingh,,619328773440167936,https://twitter.com/narendramodi/status/619328773440167936
2015-07-09 17:44:35,RajaBrar_INC,RahulGandhi,8,136,100,"हर तरफ़ झूठ का कारोबार है ! खुद को खुदा मानने वाले ""ख़ून से सरोबार है""! झूठ शब्दों के साथ आत्मा को हल्का कर देता हैhttps://twitter.com/officeofrg/status/619113024092123136 …",,,,619200489788411904,https://twitter.com/RajaBrar_INC/status/619200489788411904
2015-07-09 17:31:47,laluprasadrjd,,60,132,136,"TOI Cartoon worth thousands of words...""बड़बोले भाषण,जुमले और झूठ की भरमार, भाजपा घोटालों की सरदार""pic.twitter.com/eVjRb2ZXsr",,,,619197266436485120,https://twitter.com/laluprasadrjd/status/619197266436485120
2015-07-09 16:40:53,OmarAbdullah,sajjadshaheen,7,1,6,"@sajjadshaheen @rohit2decho nice answer Sajjad :-)",,@sajjadshaheen @rohit2decho,,619184459926011904,https://twitter.com/OmarAbdullah/status/619184459926011904
2015-07-09 16:36:54,OmarAbdullah,,101,376,254,"The BJP spokespersons need to realise that the answer to the #VyapamScam questions isn't ""Dr Manmohan Singh was involved in the coal scam""!!",,,#VyapamScam,619183456484900864,https://twitter.com/OmarAbdullah/status/619183456484900864
2015-07-09 16:34:52,PMOIndia,,103,439,794,"Leaders of BRICS and Eurasian nations at Ufa.pic.twitter.com/oXf3AZrs0M",,,,619182943156617216,https://twitter.com/PMOIndia/status/619182943156617216
2015-07-09 16:31:13,narendramodi,,288,1270,2591,"Had a great meeting with President @dilmabr. We are very optimistic about the potential of strong India-Brazil ties.pic.twitter.com/mJTf5C4CTT",,@dilmabr,,619182027753926656,https://twitter.com/narendramodi/status/619182027753926656
2015-07-09 16:28:37,narendramodi,,156,952,1846,"President Zuma & I had a wonderful meeting. Discussions were centred around strengthening India-South Africa ties.pic.twitter.com/nb9bb8XUIa",,,,619181372016472064,https://twitter.com/narendramodi/status/619181372016472064
2015-07-09 16:23:24,BJP4India,,29,135,213,"भाजपा कार्यकर्ता सिद्धांत और विचारधारा के लिये अनवरत कार्य करते हैं : श्री @AmitShahOffice http://bit.ly/1eJt0HK pic.twitter.com/RFY9EfKL8k",,@AmitShahOffice,,619180058788261888,https://twitter.com/BJP4India/status/619180058788261888
2015-07-09 16:19:24,OmarAbdullah,vineetkaul,0,0,2,"@vineetkaul thanks very much for sharing :)",,@vineetkaul,,619179051597434880,https://twitter.com/OmarAbdullah/status/619179051597434880
2015-07-09 16:06:42,OmarAbdullah,KashPhotoClub,26,64,101,"What a stunning photograph of one of my all time favourite destinations in Kashmir!https://twitter.com/kashphotoclub/status/619171420652728320 …",,,,619175857773350912,https://twitter.com/OmarAbdullah/status/619175857773350912
2015-07-09 14:47:50,OmarAbdullah,,29,49,59,"Tragic to hear about Const. Dubey of the BSF killed on the LOC by firing from across. RIP",,,,619156008997224449,https://twitter.com/OmarAbdullah/status/619156008997224449
2015-07-09 14:37:42,INCIndia,,19,161,148,"Congress VP Rahul Gandhi interacted with Mahila Congress leaders at their National Council Meet at AICC HQ todaypic.twitter.com/p13bEHPTLc",,,,619153458810097665,https://twitter.com/INCIndia/status/619153458810097665
2015-07-09 14:26:16,INCIndia,,6,72,55,"#VyapamScam :Supreme Court transfers probe to CBI Watch: https://www.youtube.com/watch?v=Gm57yFjfO8s …",,,#VyapamScam,619150580527673344,https://twitter.com/INCIndia/status/619150580527673344
2015-07-09 14:19:02,INCIndia,,36,247,156,"Riot accused Sangeet Som provided Z category security while Whistleblower of Vyapam A. Chaturvedi receiving threatspic.twitter.com/mVJEdrQf5R",,,,619148760422088704,https://twitter.com/INCIndia/status/619148760422088704
2015-07-09 14:15:34,RahulGandhi,,111,504,558,"Interacting with Mahila Congress leaders at the National Council Meet earlier todaypic.twitter.com/2BgE0GPwgc",,,,619147888942186496,https://twitter.com/RahulGandhi/status/619147888942186496
2015-07-09 12:56:26,narendramodi,,217,761,1432,"Given our strengths, we can create excellent synergies in many sectors, the results of which will be far-reaching.http://nm4.in/1ILC4Ij",,,,619127974479069184,https://twitter.com/narendramodi/status/619127974479069184
2015-07-09 12:54:17,narendramodi,,87,713,1281,"At #BRICS Business Council, emphasised on merits of close economic relations & business engagement with key developing regions of the world.",,,#BRICS,619127433678028800,https://twitter.com/narendramodi/status/619127433678028800
2015-07-09 12:51:51,narendramodi,,97,733,1340,"Discussed the immense opportunities of economic cooperation among BRICS Nations with Indian CEOs during our meeting.pic.twitter.com/p2aFzaLkp5",,,,619126820424712192,https://twitter.com/narendramodi/status/619126820424712192
2015-07-09 12:48:37,narendramodi,,94,839,1478,"Was delighted to meet President @HassanRouhani & talk to him about stronger India-Iran ties.pic.twitter.com/7AjJdADjSn",,@HassanRouhani,,619126006910029824,https://twitter.com/narendramodi/status/619126006910029824
2015-07-09 12:46:42,narendramodi,,80,639,998,"Here is the video of my speech at the #BRICS Plenary Session. @BRICS2015 http://nm4.in/1KX8mQP",,@BRICS2015,#BRICS,619125522715447296,https://twitter.com/narendramodi/status/619125522715447296
2015-07-09 12:40:29,RahulGandhi,,165,518,447,"“प्रधानमंत्रीजी आपके शब्दों का वज़न होना चाहिये” Watch:https://www.youtube.com/watch?v=b4Dwxp_FXMM&feature=youtu.be …",,,,619123962119716864,https://twitter.com/RahulGandhi/status/619123962119716864
2015-07-09 12:36:37,narendramodi,,100,772,1189,"Proposed the setting up of a #BRICS Agriculture Research Centre. This will help our efforts to make agriculture more productive. @BRICS2015",,@BRICS2015,#BRICS,619122988886003712,https://twitter.com/narendramodi/status/619122988886003712
2015-07-09 12:35:46,narendramodi,,64,710,1209,"In my speech I spoke on why strong cooperation between #BRICS Nations matters, for us & the entire world @BRICS2015pic.twitter.com/u1XYbwma4Q",,@BRICS2015pic,#BRICS,619122774678704128,https://twitter.com/narendramodi/status/619122774678704128
2015-07-09 12:31:23,narendramodi,,48,563,954,"Heard the insightful views of President Putin, President Xi Jinping, President Zuma & President Dilma Rousseff at #BRICS Plenary Session.",,,#BRICS,619121671107014656,https://twitter.com/narendramodi/status/619121671107014656
2015-07-09 12:28:25,narendramodi,,176,962,1630,"The #BRICS family. Our discussions have been wide-ranging & very comprehensive. @BRICS2015 #BRICS2015pic.twitter.com/MByQwGqu9r",,@BRICS2015,#BRICS #BRICS2015pic,619120922868367360,https://twitter.com/narendramodi/status/619120922868367360
2015-07-09 12:07:02,mkstalin,,18,29,69,"Visit our revamped website http://www.dmk.in . You can now join us, share feedback and stay tuned to our work online!",,,,619115542419369984,https://twitter.com/mkstalin/status/619115542419369984
2015-07-09 11:57:44,RahulGandhi,RahulGandhi,119,547,437,"आप चौहान जी को क्यों खाने देने रहे है?",,,,619113202312294401,https://twitter.com/RahulGandhi/status/619113202312294401
2015-07-09 11:57:02,RahulGandhi,RahulGandhi,159,634,465,"प्रधानमंत्रीजी आपके शब्दों का वज़न होना चाहिये। आप राजस्थान में क्यों खाने दे रहें है, आप ललित मोदी को वापस क्यों नहीं ला रहें है?",,,,619113024092123136,https://twitter.com/RahulGandhi/status/619113024092123136
2015-07-09 11:51:40,RahulGandhi,,253,830,644,"प्रधानमंत्री जी ने कहा था ""न खाऊंगा, न खाने दूँगा"", तो फिर आप खाने क्यों दे रहे हैं : राहुल गांधी",,,,619111676374204416,https://twitter.com/RahulGandhi/status/619111676374204416
2015-07-09 11:51:11,PMOIndia,,42,200,428,"Signing of the agreements... Laying the foundations of strong and vibrant partnerships. @BRICS2015pic.twitter.com/Kvjn7lhNKS",,@BRICS2015pic,,619111552793210880,https://twitter.com/PMOIndia/status/619111552793210880
2015-07-09 11:29:07,OmarAbdullah,,13,12,40,"Here's wishing my colleague & @JKNC_ spokesperson @Junaid_Mattu a very happy 30th birthday. Have a great year ahead Junaid, big year for you",,@JKNC_ @Junaid_Mattu,,619105998184120320,https://twitter.com/OmarAbdullah/status/619105998184120320
2015-07-09 10:48:56,PMOIndia,,30,207,418,"PM @narendramodi expresses confidence that BRICS nations can play a major role in mitigating global challenges.pic.twitter.com/D2VKXdRtuw",,@narendramodi,,619095887076143104,https://twitter.com/PMOIndia/status/619095887076143104
2015-07-09 10:46:56,PMOIndia,,35,235,420,"Will have the honour of welcoming you to India next year: PM at the @BRICS2015 Plenary Sessionpic.twitter.com/Q9n32GZFQG",,@BRICS2015,,619095384883728384,https://twitter.com/PMOIndia/status/619095384883728384
2015-07-09 10:45:29,PMOIndia,,15,142,269,"Let us have conversation and cooperation between our cities. There is a lot to learn from each other in this field: PM @narendramodi",,@narendramodi,,619095018687442944,https://twitter.com/PMOIndia/status/619095018687442944
2015-07-09 10:44:43,PMOIndia,,48,470,821,"Let us use our expertise to enable better access to water, efficient water use and potable water supply: PM @narendramodi at @BRICS2015",,@narendramodi @BRICS2015,,619094826579947520,https://twitter.com/PMOIndia/status/619094826579947520
2015-07-09 10:44:32,BJP4India,,11,111,105,"बिहार विधान सभा चुनाव में भारतीय जनता पार्टी के कार्यकर्ता बनने के लिए 8000780007 पर मिस्ड कॉल या व्हाट्स ऐप करें।pic.twitter.com/oHOIkPrdBU",,,,619094779998044161,https://twitter.com/BJP4India/status/619094779998044161
2015-07-09 10:43:40,PMOIndia,,24,190,315,"I propose a BRICS Agriculture Research Centre, which would be a big gift to the world: PM @narendramodi",,@narendramodi,,619094560199741440,https://twitter.com/PMOIndia/status/619094560199741440
2015-07-09 10:41:46,PMOIndia,,37,523,921,"I would like to see the first major project funded by the New Development Bank to be in the area of clean energy: PM @narendramodi",,@narendramodi,,619094084033101824,https://twitter.com/PMOIndia/status/619094084033101824
2015-07-09 10:41:21,PMOIndia,,67,502,848,"Climate change is one of our foremost global challenges. Need to focus on renewable energy & energy efficiency: PM @narendramodi @BRICS2015",,@narendramodi @BRICS2015,,619093981025079296,https://twitter.com/PMOIndia/status/619093981025079296
2015-07-09 10:39:42,PMOIndia,,7,116,238,"PM stresses on combatting the menace of terror during his remarks at the @BRICS2015 Plenary Session.",,@BRICS2015,,619093563985555456,https://twitter.com/PMOIndia/status/619093563985555456
2015-07-09 10:38:52,PMOIndia,,17,128,244,"We can mitigate any challenge better if we focus on reforms of the UN and the UN Security Council. This must be done soon: PM",,,,619093355377483776,https://twitter.com/PMOIndia/status/619093355377483776
2015-07-09 10:38:22,PMOIndia,,9,113,213,"We have discussed several issues in our meetings: PM @narendramodihttps://www.youtube.com/watch?v=M5yAN01vUIA …",,@narendramodihttps,,619093227669450752,https://twitter.com/PMOIndia/status/619093227669450752
