date,username,to,replies,retweets,favorites,text,geo,mentions,hashtags,id,permalink
2015-07-20 12:38:31,narendramodi,,128,751,1281,"Talked about importance of 'dignity of labour' at Indian Labour Conference and launched National Career Service Portal & ESIC 2.0.",,,,623109730135748609,https://twitter.com/narendramodi/status/623109730135748609
2015-07-20 12:26:56,INCIndia,,9,62,44,"क्या हुआ तेरा वादा? #MSPForFarmers वीडियो देखें और शेयर करें:https://www.youtube.com/watch?v=0W0MhHiaJM0 …",,,#MSPForFarmers,623106816298201088,https://twitter.com/INCIndia/status/623106816298201088
2015-07-20 12:15:38,ncbn,,51,127,308,"I laud the efforts of the Singapore Government and every person who has worked hard on our Capital Master Plans.pic.twitter.com/lPIW0UZqa6",,,,623103972287483904,https://twitter.com/ncbn/status/623103972287483904
2015-07-20 11:28:13,INCIndia,,11,78,82,"Mahila Congress will gherao the Parliament tomorrow : @shobha_ozapic.twitter.com/AsPgFLlGcO",,@shobha_ozapic,,623092038825684993,https://twitter.com/INCIndia/status/623092038825684993
2015-07-20 11:23:48,INCIndia,,17,72,57,"Any literate or thinking person according to them is ""Anti - Hindu"" : @KapilSibal",,@KapilSibal,,623090929981788160,https://twitter.com/INCIndia/status/623090929981788160
2015-07-20 11:22:32,INCIndia,,14,73,56,"No matter how much proof you show,they ( BJP) will not give resignations. They are the ones who have fixed the milestones: @KapilSibal",,@KapilSibal,,623090607968260096,https://twitter.com/INCIndia/status/623090607968260096
2015-07-20 11:20:39,INCIndia,,15,109,75,"BJP top leader used to say ""obstruction is part of Parliamentary Strategy"". We will decide our strategy: @KapilSibalpic.twitter.com/n9dMNb4ppK",,@KapilSibalpic,,623090137673568256,https://twitter.com/INCIndia/status/623090137673568256
2015-07-20 11:18:39,INCIndia,,8,96,55,"Modi's cabinet has twice as many ministers facing criminal cases as compared to the previous govt: @KapilSibal",,@KapilSibal,,623089630473138176,https://twitter.com/INCIndia/status/623089630473138176
2015-07-20 11:17:32,INCIndia,,7,78,53,"In Maha, Modi said before elections that he will not discriminate between BJP and others on Corruption,reality is different: @KapilSibal",,@KapilSibal,,623089351568678913,https://twitter.com/INCIndia/status/623089351568678913
2015-07-20 11:16:21,INCIndia,,16,69,46,"They have announced there will be a composite cap on FDI, they should also have a cap on corruption: @KapilSibalpic.twitter.com/DBkA7PV0aA",,@KapilSibalpic,,623089052791627776,https://twitter.com/INCIndia/status/623089052791627776
2015-07-20 11:15:17,OmarAbdullah,chintskap,17,15,79,"Loved you guys in Prem Rog & Zamaane ko Dikhana Hai. Some of the lines from ZKDH are still family favourites :)https://twitter.com/chintskap/status/623087424487317504 …",,,,623088784024797184,https://twitter.com/OmarAbdullah/status/623088784024797184
2015-07-20 11:14:24,INCIndia,,9,70,38,"Modi went to all countries except African Countries, cancelled summit in Indonesia, postponed Indo-African summit: @KapilSibal",,@KapilSibal,,623088564172034052,https://twitter.com/INCIndia/status/623088564172034052
2015-07-20 11:12:28,INCIndia,,3,69,44,"While the Chinese are docking submarines in Pak, Modi is giving them e-visas : @KapilSibal",,@KapilSibal,,623088076609290240,https://twitter.com/INCIndia/status/623088076609290240
2015-07-20 11:11:29,INCIndia,,3,56,32,"Today China has agreements with several countries in the Indian Ocean to lose their ports,but What has Modi said? : @KapilSibal",,@KapilSibal,,623087828197453825,https://twitter.com/INCIndia/status/623087828197453825
2015-07-20 11:10:03,INCIndia,,6,60,35,"On Aug 11, 2013, Modi said ""Our country's protector are being killed by Pak Army- what is Govt doing"" Now we ask same question: @KapilSibal",,@KapilSibal,,623087468460376065,https://twitter.com/INCIndia/status/623087468460376065
2015-07-20 11:08:33,INCIndia,,6,46,31,"In July itself there have been 5 ceasefire violations in 5 days : @KapilSibal",,@KapilSibal,,623087090792673280,https://twitter.com/INCIndia/status/623087090792673280
2015-07-20 11:07:46,INCIndia,,13,54,34,"We don't understand the Pakistan policy of this Modi Govt, there is no strategic thinking: @KapilSibal",,@KapilSibal,,623086894838996993,https://twitter.com/INCIndia/status/623086894838996993
2015-07-20 11:06:50,INCIndia,,12,64,39,"This Govt is Modi centric,not citizen centric. There is a sound and light show going on since 15 months: @KapilSibal",,@KapilSibal,,623086658234118144,https://twitter.com/INCIndia/status/623086658234118144
2015-07-20 11:05:47,INCIndia,,20,91,52,"We are surprised to hear for the first time in Modern India that someone said that IIT's are Anti Hindu : @KapilSibal",,@KapilSibal,,623086395662299136,https://twitter.com/INCIndia/status/623086395662299136
2015-07-20 11:04:59,INCIndia,,4,42,33,"AICC Press Conference being addressed by Shri @KapilSibal nowpic.twitter.com/xM20oOjj1a",,@KapilSibal,,623086192087531520,https://twitter.com/INCIndia/status/623086192087531520
2015-07-20 10:50:00,ncbn,,56,85,177,"#APSeedCapital will be developed in an area of 16 sq.kms. It is planned for 3 lakh residents & expected to generate about 7 lakh jobs. (2/2)",,,#APSeedCapital,623082422180024321,https://twitter.com/ncbn/status/623082422180024321
2015-07-20 10:49:38,ncbn,,7,56,150,"Singapore Minister S. Iswaran presented #APSeedCapital Master Plan to us. My heartfelt thanks to Singapore team. (1/2)",,,#APSeedCapital,623082332174422017,https://twitter.com/ncbn/status/623082332174422017
2015-07-20 10:49:19,ncbn,,59,166,245,"Amaravati will be Smart, Green & Sustainable Capital. It will be symbol of pride for the people of AP. Have a look:http://bit.ly/1TJ8GFR",,,,623082250918195200,https://twitter.com/ncbn/status/623082250918195200
2015-07-20 09:28:25,OmarAbdullah,derekobrienmp,3,0,9,"@quizderek sounds like a plan though wazwan is best consumed in slightly cooler temperatures so may be better then :)",,@quizderek,,623061892701908992,https://twitter.com/OmarAbdullah/status/623061892701908992
2015-07-20 09:21:50,INCIndia,,18,174,88,"BJP should sack its MLA & Muzaffarnagar riot accused, Shri Sangeet Som for lying about his education in affidavitspic.twitter.com/Mg4idPWAxe",,,,623060232978087936,https://twitter.com/INCIndia/status/623060232978087936
2015-07-20 08:43:28,MamataOfficial,,35,156,245,"Tomorrow is Maa Mati Manush Dibas. We will remember our martyrs on the 22nd anniversary of #21JulySahidDibas. সবাই আসুন #শহীদদিবস",,,#21JulySahidDibas #শহ,623050581364445184,https://twitter.com/MamataOfficial/status/623050581364445184
2015-07-20 07:14:57,PMOIndia,,97,156,408,"PM Shri @narendramodi ends his speech at the 46th Indian Labour Conference",,@narendramodi,,623028302945476608,https://twitter.com/PMOIndia/status/623028302945476608
2015-07-20 07:12:09,PMOIndia,,74,217,422,"We have come up with 3 important schemes to ensure social security for even the unorganised labour: PM Shri @narendramodi",,@narendramodi,,623027599925600256,https://twitter.com/PMOIndia/status/623027599925600256
2015-07-20 07:10:14,PMOIndia,,50,213,428,"We are concerned about the health of our labour. All their medical records will now be available online : PM Shri @narendramodi",,@narendramodi,,623027117882675200,https://twitter.com/PMOIndia/status/623027117882675200
2015-07-20 07:07:17,PMOIndia,,122,488,701,"I have seen and experienced poverty, I do not need to go somewhere with a camera-man to know about poverty: PM Shri @narendramodi",,@narendramodi,,623026374857506816,https://twitter.com/PMOIndia/status/623026374857506816
2015-07-20 07:06:20,OmarAbdullah,Equateall,7,0,9,"@Equateall never assumed otherwise. Unlike some I'm not looking for disciples.",,@Equateall,,623026135278858240,https://twitter.com/OmarAbdullah/status/623026135278858240
2015-07-20 07:06:11,PMOIndia,,23,165,343,"When we formed the Govt, people used to get paltry sums as pensions. We have come up with a minimum pension of Rs 1000: PM @narendramodi",,@narendramodi,,623026097987260416,https://twitter.com/PMOIndia/status/623026097987260416
2015-07-20 07:05:32,OmarAbdullah,KiranManral,2,0,3,"@kiranmanral :)",,@kiranmanral,,623025935193739265,https://twitter.com/OmarAbdullah/status/623025935193739265
2015-07-20 07:05:07,OmarAbdullah,punjabkhwa,1,0,6,"@punjabkhwa never said they did so don't worry, won't need to trouble him.",,@punjabkhwa,,623025829656723457,https://twitter.com/OmarAbdullah/status/623025829656723457
2015-07-20 07:04:20,PMOIndia,,48,201,365,"If we want to move ahead, we need to give opportunities to our youth. Giving opportunities to apprentices is the need for the hour: PM Modi",,,,623025633631731712,https://twitter.com/PMOIndia/status/623025633631731712
2015-07-20 07:01:19,PMOIndia,,37,183,364,"We are concerned for the labour who is employed, but we are also concerned for the people who are unemployed: PM Shri @narendramodi",,@narendramodi,,623024870448758784,https://twitter.com/PMOIndia/status/623024870448758784
2015-07-20 06:56:51,OmarAbdullah,,121,62,233,"ONE MILLION!!! Never thought I'd ever reach this milestone. Thank you very much every one of the 1,000,000 of you. It's been a great journey",,,,623023748040404993,https://twitter.com/OmarAbdullah/status/623023748040404993
2015-07-20 06:55:54,INCIndia,,31,165,145,"Congress will never allow Shri Modi's Anti-Farmer and Pro-Crony Capitalist #LandBill to be passed in Parliament.pic.twitter.com/m9ILcun8ER",,,#LandBill,623023508163989504,https://twitter.com/INCIndia/status/623023508163989504
2015-07-20 06:53:51,PMOIndia,,21,155,325,"I was pleasantly surprised on seeing the various practical innovations done by our Armed forces: PM Shri @narendramodi",,@narendramodi,,623022993598316544,https://twitter.com/PMOIndia/status/623022993598316544
2015-07-20 06:52:43,PMOIndia,,16,150,297,"Government, Industrialists & Labour Organisations; all of us need to think how much stress we have given on innovation: PM @narendramodi",,@narendramodi,,623022709765599233,https://twitter.com/PMOIndia/status/623022709765599233
2015-07-20 06:48:36,PMOIndia,,78,205,428,"It is my effort to simplify the laws so that even the poorest are able to understand their rights and avail them: PM Shri @narendramodi",,@narendramodi,,623021670345748482,https://twitter.com/PMOIndia/status/623021670345748482
2015-07-20 06:46:50,PMOIndia,,28,162,321,"I am confident that we will be able to address the challenges ahead & proceed with reforms with everyone's consensus: PM Shri @narendramodi",,@narendramodi,,623021228484247555,https://twitter.com/PMOIndia/status/623021228484247555
2015-07-20 06:44:46,PMOIndia,,39,166,300,"As a society, we need to respect the Dignity of Labour: PM Shri @narendramodihttps://www.youtube.com/watch?v=Eq4gE6i7GGI …",,@narendramodihttps,,623020708969361408,https://twitter.com/PMOIndia/status/623020708969361408
2015-07-20 06:43:49,PMOIndia,,43,160,312,"There is a wrong habit which has crept in, we do not respect our labour enough: PM @narendramodi",,@narendramodi,,623020466890911744,https://twitter.com/PMOIndia/status/623020466890911744
2015-07-20 06:32:49,INCIndia,,5,44,36,"Do follow @CimGOIShadow -Shadow Ministry of Comm & Industry to keep Govt accountable based on constructive criticismpic.twitter.com/9zWgOfVmQ2",,@CimGOIShadow,,623017700088918016,https://twitter.com/INCIndia/status/623017700088918016
2015-07-20 06:31:52,PMOIndia,,13,111,235,"PM Shri @narendramodi will now speak at the 46th Indian Labour Conference. Watch Live https://www.youtube.com/watch?v=Eq4gE6i7GGI …",,@narendramodi,,623017462561288193,https://twitter.com/PMOIndia/status/623017462561288193
2015-07-20 06:23:22,OmarAbdullah,FirstpostSports,29,41,50,"Amazing misreporting FirstPost @PTI_News: Farooq Abdullah, who was President JKCA since 1980, decided not to contesthttps://twitter.com/firstpostsports/status/623011533795143680 …",,@PTI_News,,623015323810160641,https://twitter.com/OmarAbdullah/status/623015323810160641
2015-07-20 06:22:46,PMOIndia,,13,125,244,"Finance Minister Shri @arunjaitley is speaking now at the 46th Indian Labour Conferece. Watch Livehttps://www.youtube.com/watch?v=Eq4gE6i7GGI …",,@arunjaitley,,623015172253167618,https://twitter.com/PMOIndia/status/623015172253167618
2015-07-20 05:50:12,BJP4India,,10,102,124,"PM Shri @narendramodi at the inauguration of 46th Session of Indian labour Conference. LIVE at http://yuva4india.tv pic.twitter.com/zT4xxEzJUC",,@narendramodi,,623006975949803520,https://twitter.com/BJP4India/status/623006975949803520
2015-07-20 05:45:00,PMOIndia,,57,184,314,"PM Shri @narendramodi dedicates the National Career Service Portal to the Nation https://www.youtube.com/watch?v=Eq4gE6i7GGI …",,@narendramodi,,623005666135805952,https://twitter.com/PMOIndia/status/623005666135805952
2015-07-20 05:37:33,PMOIndia,,37,138,278,"Shri Bandaru Dattatreya is speaking at the inauguration of the 46th Indian Labour Conference. https://www.youtube.com/watch?v=Eq4gE6i7GGI …",,,,623003791286099969,https://twitter.com/PMOIndia/status/623003791286099969
2015-07-20 05:33:15,RahulGandhi,,140,483,496,"Coming up this week- 23rd July: Visit to Tiruchi,Tamil Nadu 24th July: Padyatra in Anantpur District, Andhra Pradesh Stay tuned for updates",,,,623002710476898304,https://twitter.com/RahulGandhi/status/623002710476898304
2015-07-20 05:31:26,narendramodi,,227,743,1473,"Will inaugurate Indian Labour Conference shortly. Join Live http://www.narendramodi.in/watch-live",,,,623002253255929857,https://twitter.com/narendramodi/status/623002253255929857
2015-07-20 05:13:48,arunjaitley,,51,61,165,"Watch me live addressing the 46th Session of the Indian Labour Conference, today at 11 am https://www.youtube.com/watch?v=Eq4gE6i7GGI …""",,,,622997813861810176,https://twitter.com/arunjaitley/status/622997813861810176
2015-07-20 04:42:38,PMOIndia,,95,262,522,"PM will address the Indian Labour Conference.pic.twitter.com/WypozyWY7P",,,,622989970865790977,https://twitter.com/PMOIndia/status/622989970865790977
2015-07-20 04:15:59,ArvindKejriwal,,208,863,921,"I greet all students of Delhi University on their first day in college. Reminds of my student days some 30 years ago!",,,,622983265129922560,https://twitter.com/ArvindKejriwal/status/622983265129922560
2015-07-20 03:56:26,ncbn,,37,65,150,"#APSeedCapital Area Master Plan will be presented today. Will be in a day-long meetings with the Singapore delegation in Rajahmundry.",,,#APSeedCapital,622978343932030976,https://twitter.com/ncbn/status/622978343932030976
2015-07-20 03:13:03,INCIndia,,26,224,140,"BJP has praised""tremendous success of AADHAAR"" in the Supreme Court,BJP used to call it a ""scam"" before electionspic.twitter.com/jb5WlFR6qF",,,,622967429354754048,https://twitter.com/INCIndia/status/622967429354754048
2015-07-19 15:22:12,INCIndia,,9,64,50,"AICC Press Conference addressed by @ghulamnazad today Watch:https://www.youtube.com/watch?v=4KnV8yfuBeE …",,@ghulamnazad,,622788536693948417,https://twitter.com/INCIndia/status/622788536693948417
2015-07-19 14:53:18,PMOIndia,,183,365,833,"PM @narendramodi met trade union leaders todaypic.twitter.com/4JQk2YlKkn",,@narendramodi,,622781261199753216,https://twitter.com/PMOIndia/status/622781261199753216
2015-07-19 14:30:26,OmarAbdullah,,96,111,286,"Who says there is no place for civility in J&K's politics?pic.twitter.com/E9FjIvu5rY",,,,622775508380487681,https://twitter.com/OmarAbdullah/status/622775508380487681
2015-07-19 10:45:44,INCIndia,,8,74,70,"Congress leader Ajay Maken at the site of Vishnu Garden building collapse.pic.twitter.com/ZSUL2k87Ij",,,,622718958978752512,https://twitter.com/INCIndia/status/622718958978752512
2015-07-19 09:14:51,OmarAbdullah,acorn,5,12,39,"Now if only I'd had this when I dropped out of the Philosophy Honours course at St. Stephens in 1989 https://twitter.com/acorn/status/622694828661288960 …",,,,622696090324766720,https://twitter.com/OmarAbdullah/status/622696090324766720
2015-07-19 09:07:41,OmarAbdullah,thewire_in,26,26,63,"Some of my all time favourite Hindi songs. Somehow I just can't identify with most of the new stuff these days.https://twitter.com/thewire_in/status/622692368970555392 …",,,,622694283754090496,https://twitter.com/OmarAbdullah/status/622694283754090496
2015-07-19 09:01:40,OmarAbdullah,,19,8,38,"Almost there.",,,,622692770063343616,https://twitter.com/OmarAbdullah/status/622692770063343616
2015-07-19 06:34:18,INCIndia,,5,80,66,"Do follow @ShadowAgriGoI - Shadow Ministry of Agriculture to keep Govt accountable based on constructive criticismpic.twitter.com/bRt4SuftSh",,@ShadowAgriGoI,,622655684107067392,https://twitter.com/INCIndia/status/622655684107067392
2015-07-19 05:46:47,MamataOfficial,,11,69,74,"Tributes to freedom fighter Mangal Pandey on his birth anniversary. His martyrdom will always be remembered",,,,622643729640230912,https://twitter.com/MamataOfficial/status/622643729640230912
2015-07-19 05:46:02,MamataOfficial,,5,70,62,"""Sokol desher Rani se je amar jonmobhoomi"" My homage to Dwijendralal Roy on his 152nd birth anniversary",,,,622643539709554688,https://twitter.com/MamataOfficial/status/622643539709554688
2015-07-19 05:32:01,INCIndia,,14,115,93,"#ViolenceAgainstWomen on the rise! Make Delhi Safe For Women!pic.twitter.com/My06eGkagU",,,#ViolenceAgainstWomen,622640012408918016,https://twitter.com/INCIndia/status/622640012408918016
2015-07-19 05:26:54,INCIndia,,22,195,135,"Charges in chikki row 'partly true', admits Pankja Munde http://timesofindia.indiatimes.com/india/Charges-in-chikki-row-partly-true-admits-Pankaja-Munde/articleshow/48120667.cms … Maharashtra CM should now Sack Her!pic.twitter.com/aMNBPFckVI",,,,622638725030281216,https://twitter.com/INCIndia/status/622638725030281216
2015-07-19 04:19:24,INCIndia,,16,145,83,"क्या हुआ तेरा वादा? #BlackMoney वीडियो देखें और शेयर करें:https://www.youtube.com/watch?v=bw6rxGZhUCU …",,,#BlackMoney,622621737344077824,https://twitter.com/INCIndia/status/622621737344077824
2015-07-19 04:17:32,INCIndia,,57,219,147,"Owing to Pak betrayals,Dr Manmohan Singh never visited Pak in 10 years,but PM Modi has promptly accepted Pak's invitepic.twitter.com/1Y621rmUM3",,,,622621266147590144,https://twitter.com/INCIndia/status/622621266147590144
2015-07-19 04:15:41,INCIndia,,21,135,129,"सन 1857 के प्रथम भारतीय स्वतन्त्रता संग्राम के अग्रदूत मंगल पाण्डेय की जयंती पर हम उन्हें शत शत नमन करते हैं। जय हिंदpic.twitter.com/7quaTU629K",,,,622620801393491969,https://twitter.com/INCIndia/status/622620801393491969
2015-07-19 03:23:44,OmarAbdullah,dna,30,49,91,"And Shikari Shamboo, Kalia the crow, Supandhi et all. I'd get an annual Tinkle subscription on my birthday :)https://twitter.com/dna/status/622605385505968128 …",,,,622607728859451392,https://twitter.com/OmarAbdullah/status/622607728859451392
2015-07-19 03:11:43,OmarAbdullah,dna,5,19,50,"I remember looking for PCOs in all sorts of obscure places while traveling for work.https://twitter.com/dna/status/622601204728606720 …",,,,622604705399574528,https://twitter.com/OmarAbdullah/status/622604705399574528
2015-07-18 16:56:45,mkstalin,,70,94,250,"Thanks Cuddalore for the overwhelming turnout at Needhi Ketkum Perani today!pic.twitter.com/mz4GOEnqcN",,,,622449943370858496,https://twitter.com/mkstalin/status/622449943370858496
2015-07-18 13:22:40,OmarAbdullah,OmarAbdullah,36,18,57,"I've not changed the name of Anantnag. The words after the - are the link from the Greater Kashmir website. Tweet the link & see.",,,,622396064541179904,https://twitter.com/OmarAbdullah/status/622396064541179904
2015-07-18 13:20:43,OmarAbdullah,OmarAbdullah,15,21,45,"My only words in this tweet are ""Mufti's gift to his voters"" the rest are the link from Greater Kashmirhttps://twitter.com/abdullah_omar/status/622314809241923584 …",,,,622395577750302724,https://twitter.com/OmarAbdullah/status/622395577750302724
2015-07-18 13:15:57,ArvindKejriwal,,520,757,749,"I have called the police commissioner on monday to discuss this case and law n order situation.",,,,622394377306910720,https://twitter.com/ArvindKejriwal/status/622394377306910720
2015-07-18 12:33:39,ArvindKejriwal,,849,1295,959,"दिल्ली पुलिस सीधे प्रधानमंत्री जी के अंडर है। या तो प्रधानमंत्री जी कुछ करें और या फिर दिल्ली पुलिस को दिल्ली सरकार को सौंपे(2/2)",,,,622383732389838848,https://twitter.com/ArvindKejriwal/status/622383732389838848
2015-07-18 12:33:14,ArvindKejriwal,,367,903,645,"मिनाक्षी का क़त्ल दिल दहलाने वाला है। दिल्ली में कानून व्यवस्था हर दिन बिगड़ती जा रही है(1/2)",,,,622383627653898240,https://twitter.com/ArvindKejriwal/status/622383627653898240
2015-07-18 12:03:44,INCIndia,,2,46,43,"AICC Press Conference by @SinghRPN today Watch:https://www.youtube.com/watch?v=3wUXmNO479k …",,@SinghRPN,,622376203479941121,https://twitter.com/INCIndia/status/622376203479941121
2015-07-18 11:50:06,INCIndia,,5,50,42,"If you are not following the People's Shadow Handle of Ministry of HRD, Do follow @HRDMinShadow Thankspic.twitter.com/XydeC6zpTL",,@HRDMinShadow,,622372770605731840,https://twitter.com/INCIndia/status/622372770605731840
2015-07-18 11:13:16,MamataOfficial,MamataOfficial,8,90,88,"I inaugurated the Rathjatra Festival of ISKCON todaypic.twitter.com/pyQ3m5ethx",,,,622363503706415104,https://twitter.com/MamataOfficial/status/622363503706415104
2015-07-18 11:12:37,MamataOfficial,,7,77,92,"Today I attended Eid prayer at Red Road in the morningpic.twitter.com/jTHo9V81pm",,,,622363339646238720,https://twitter.com/MamataOfficial/status/622363339646238720
2015-07-18 11:04:40,INCIndia,,16,104,68,"The Modi Govt has adopted a completely directionless and embarrassing policy towards dealing with Pakistan: @SinghRPN",,@SinghRPN,,622361339487387648,https://twitter.com/INCIndia/status/622361339487387648
2015-07-18 11:03:28,INCIndia,,22,94,64,"More than 800 Ceasefire Violations have taken place since last 15 months, where is BJP's so called talks of Nationalism?: @SinghRPN",,@SinghRPN,,622361035706466305,https://twitter.com/INCIndia/status/622361035706466305
2015-07-18 11:02:17,INCIndia,,28,106,75,"The entire country is watching Pak flags & ISIS flags being raised in Jammu & Kashmir, why the BJP is so silent on this?: @SinghRPN",,@SinghRPN,,622360736971403265,https://twitter.com/INCIndia/status/622360736971403265
2015-07-18 11:00:41,INCIndia,,12,112,82,"Whats App etc are now used in Villages now and the Govt wants to charge its calls. We strongly oppose it: @SinghRPN #NetNeutrality",,@SinghRPN,#NetNeutrality,622360334737616896,https://twitter.com/INCIndia/status/622360334737616896
2015-07-18 10:59:40,INCIndia,,5,66,44,"The DoT report on #NetNeutrality is clearly disappointing, Whats App, Viber etc will be regulated: @SinghRPN",,@SinghRPN,#NetNeutrality,622360081342971905,https://twitter.com/INCIndia/status/622360081342971905
2015-07-18 10:57:17,INCIndia,,11,61,46,"The BJP with all its rhetoric on Nationalism is failing to handle Jammu and Kasmir day by day: @SinghRPN",,@SinghRPN,,622359481125466112,https://twitter.com/INCIndia/status/622359481125466112
2015-07-18 10:56:27,INCIndia,,8,63,55,"Pakistani and ISIS flags were raised by protestors in Srinagar and Anantnag today. We strongly condemn these incidents: @SinghRPN",,@SinghRPN,,622359271712231424,https://twitter.com/INCIndia/status/622359271712231424
2015-07-18 10:55:38,INCIndia,,5,56,51,"The Indian National Congress strongly condemns any attempts to disturb the peace in Jammu and Kashmir: @SinghRPN",,@SinghRPN,,622359064991789057,https://twitter.com/INCIndia/status/622359064991789057
2015-07-18 10:53:14,INCIndia,,1,56,52,"AICC Press Conference being addressed by @SinghRPN & @rojimjohn right now LIVE: https://www.youtube.com/watch?v=GlQYbIPQVQs …",,@SinghRPN @rojimjohn,,622358459242033152,https://twitter.com/INCIndia/status/622358459242033152
2015-07-18 09:58:21,INCIndia,,17,160,95,"The Modi Government has provided Rs 6.31 Cr for advertising Kisaan Channel, while Zero Relief to distressed Kisaanspic.twitter.com/bk5HzyYN04",,,,622344648111976448,https://twitter.com/INCIndia/status/622344648111976448
2015-07-18 09:55:15,OmarAbdullah,,40,64,89,"No exchange of sweets instead exchange of heavy fire along the LoC. I never expected much from #Ufa but am disappointed at swift unraveling.",,,#Ufa,622343869833699328,https://twitter.com/OmarAbdullah/status/622343869833699328
2015-07-18 09:11:43,ncbn,,201,521,594,"Have a peek into an artist's impression of the - #APSeedCapital The Masterplan will be presented to us on Monday.pic.twitter.com/jYDhXRvEsg",,,#APSeedCapital,622332911941857280,https://twitter.com/ncbn/status/622332911941857280
2015-07-18 08:40:08,OmarAbdullah,peerashiq,2,2,9,"@peerashiq khair Mubarak, Eid Mubarak to you too. Enjoy your day of excess :)",,@peerashiq,,622324964696309761,https://twitter.com/OmarAbdullah/status/622324964696309761
2015-07-18 07:59:47,OmarAbdullah,,169,77,101,"Mufti's Eid gift to his voters - Tear smoke shells lobbed inside Jamia Ahlihadith in Islamabad https://shar.es/1sv072",,,,622314809241923584,https://twitter.com/OmarAbdullah/status/622314809241923584
2015-07-18 07:12:23,BJP4India,,16,83,133,"May the auspicious occasion of Eid-UL-Fitr bless you with peace and bring joy & happiness in your family.pic.twitter.com/lQWMUivkn1",,,,622302879798288384,https://twitter.com/BJP4India/status/622302879798288384
