date,username,to,replies,retweets,favorites,text,geo,mentions,hashtags,id,permalink
2016-04-29 18:39:42,mkstalin,,20,84,284,"Kovai ppl want to know where is promised monorail,6 apparel parks,ITpark in every district, jobs for 20lakh people?pic.twitter.com/SClmhdv2G9",,,,726118778342268931,https://twitter.com/mkstalin/status/726118778342268931
2016-04-29 18:39:28,mkstalin,,6,56,166,"Unlike the ADMK, DMK will only promise what it can deliver. We will cut red tapes for companies, power for weavers&promote farmers. #DMK2016",,,#DMK2016,726118720691535876,https://twitter.com/mkstalin/status/726118720691535876
2016-04-29 17:20:56,narendramodi,,461,2908,10003,"Great meeting you @sudarsansand. Keep up the wonderful work & accomplishments and best wishes for the future.pic.twitter.com/dGV37IaW95",,@sudarsansand,,726098956900438016,https://twitter.com/narendramodi/status/726098956900438016
2016-04-29 17:01:15,ncbn,,47,165,639,"Laid foundation stone for ITC Fortune of @ITCHotels in Guntur. The upscale hotel will commence operations from 2019.pic.twitter.com/59djshEfaR",,@ITCHotels,,726094005205929984,https://twitter.com/ncbn/status/726094005205929984
2016-04-29 16:30:18,INCIndia,,30,318,209,"Why did PM Modi not take any action on James Christian Michael offer to be questioned by CBI & ED?pic.twitter.com/7rspXXiWBT",,,,726086214688755713,https://twitter.com/INCIndia/status/726086214688755713
2016-04-29 16:23:52,ArvindKejriwal,ITNlive,1009,2045,2990,"I congratulate Hon'ble Railway Minister Sh @sureshpprabhu ji. He is doing a commendable job.https://twitter.com/itnlive/status/726082966691012608 …",,@sureshpprabhu,,726084598422188032,https://twitter.com/ArvindKejriwal/status/726084598422188032
2016-04-29 15:30:14,INCIndia,,46,250,240,"हमारी संस्कृतिpic.twitter.com/CejvpnZRq6",,,,726071097418874880,https://twitter.com/INCIndia/status/726071097418874880
2016-04-29 14:30:19,INCIndia,,39,339,235,"Why did Modi government permit AgustaWestland to bid for 100 Naval Utility Helicopters in April, 2015?pic.twitter.com/Yloih3gNiR",,,,726056022272401408,https://twitter.com/INCIndia/status/726056022272401408
2016-04-29 14:22:58,ArvindKejriwal,,810,746,698,"CIC order directing disclosure of Hon'ble PM's educational degrees https://drive.google.com/file/d/0B-mT82UpmEy2ODF5MjlxVVp3enM/view?usp=drivesdk …",,,,726054171481399296,https://twitter.com/ArvindKejriwal/status/726054171481399296
2016-04-29 13:44:03,BJP4India,,38,247,444,"कांग्रेस पार्टी अगस्तावेस्टलैंड घोटाले में 'उल्टा चोर कोतवाल को डाटें' का खेल खेल रही है: श्री अमित शाहhttps://www.youtube.com/watch?v=spxSNofNltY …",,,,726044378482003968,https://twitter.com/BJP4India/status/726044378482003968
2016-04-29 13:43:13,ArvindKejriwal,PTI_News,497,993,925,"We welcome CIC decision. All speculations wud be put to rest nowhttps://twitter.com/pti_news/status/726032029360381952 …",,,,726044167558799360,https://twitter.com/ArvindKejriwal/status/726044167558799360
2016-04-29 13:38:27,PMOIndia,,241,789,1900,"#Transforming India - Less Government, More Governance http://www.narendramodi.in/category/infographics … via NMApppic.twitter.com/cxtRbcDt1Z",,,#Transforming,726042966419079168,https://twitter.com/PMOIndia/status/726042966419079168
2016-04-29 13:35:37,JM_Scindia,,36,167,224,"Raised a supplementary question in Lok Sabha on self sufficiency in Defence.https://youtu.be/_6l-TDNqmAI",,,,726042255333548032,https://twitter.com/JM_Scindia/status/726042255333548032
2016-04-29 13:30:36,ArvindKejriwal,,294,893,668,"Do watch this on Agustawestland scam n share widely: http://youtu.be/DWgyXn6cAJQ",,,,726040992688824321,https://twitter.com/ArvindKejriwal/status/726040992688824321
2016-04-29 13:30:28,INCIndia,,39,297,215,"कांग्रेस पार्टी सरकार को 2 महीने में अगस्ता वेस्टलैंड मामले की सच्चाई जनता के सामने लाने की चुनौती देती हैpic.twitter.com/2adoB4e09V",,,,726040959763382272,https://twitter.com/INCIndia/status/726040959763382272
2016-04-29 12:30:20,INCIndia,,68,303,243,"जिस सख्श को सुप्रीम कोर्ट ने तड़ीपार किया वो आज लोगों को कानून सिखा रहे हैंpic.twitter.com/cCXYL0D8uT",,,,726025827012341761,https://twitter.com/INCIndia/status/726025827012341761
2016-04-29 12:24:50,mkstalin,,22,88,308,"Met with senior journalists from various news organisations & exchanged views on several topics!pic.twitter.com/IDUZEprL3V",,,,726024442027995136,https://twitter.com/mkstalin/status/726024442027995136
2016-04-29 12:17:39,INCIndia,INCIndia,45,185,230,"Govt is doing all this because they have failed to fulfil their promises: @ghulamnazad",,@ghulamnazad,,726022636258488320,https://twitter.com/INCIndia/status/726022636258488320
2016-04-29 12:15:58,INCIndia,INCIndia,17,134,107,"National security compromised when Govt gave MoD documents selectively to certain news channels: AICC Press Briefing",,,,726022208812765185,https://twitter.com/INCIndia/status/726022208812765185
2016-04-29 12:13:29,INCIndia,INCIndia,17,110,74,"It was the UPA which started the process of blacklisting AgustaWestland: @SinghRPN",,@SinghRPN,,726021586197700608,https://twitter.com/INCIndia/status/726021586197700608
2016-04-29 12:11:55,INCIndia,INCIndia,3,95,77,"The BJP is telling half truths & engaging in rumour-mongering: @SinghRPN",,@SinghRPN,,726021189945069569,https://twitter.com/INCIndia/status/726021189945069569
2016-04-29 12:09:46,INCIndia,INCIndia,8,148,175,"If they are competent, let them bring out names of the accused in the Monsoon Session: @ghulamnazad",,@ghulamnazad,,726020649584447490,https://twitter.com/INCIndia/status/726020649584447490
2016-04-29 12:08:33,INCIndia,INCIndia,14,130,152,"We oppose these baseless allegations & want to know took the money: @ghulamnazad",,@ghulamnazad,,726020344083939328,https://twitter.com/INCIndia/status/726020344083939328
2016-04-29 12:07:55,INCIndia,INCIndia,7,127,148,"We request you (BJP) to stop this tamasha and conclude investigations: @ghulamnazad",,@ghulamnazad,,726020183219802112,https://twitter.com/INCIndia/status/726020183219802112
2016-04-29 12:05:58,INCIndia,INCIndia,8,116,136,"...they would have used the CBI/ED/RAW to find the truth. Why haven't they been able to do anything?: @ghulamnazad",,@ghulamnazad,,726019694944083968,https://twitter.com/INCIndia/status/726019694944083968
2016-04-29 12:04:03,INCIndia,INCIndia,6,132,137,"If the Govt has some integrity & commitment to the truth, instead of giving bytes & selectively leaking MoD files to certain news channels..",,,,726019210900475904,https://twitter.com/INCIndia/status/726019210900475904
2016-04-29 12:01:32,INCIndia,INCIndia,7,135,137,"If the UPA leaders took bribes, would we have initiated CBI/ED probe, cancelled the helicopters or blacklisted the company: @ghulamnazad",,@ghulamnazad,,726018578944659457,https://twitter.com/INCIndia/status/726018578944659457
2016-04-29 11:59:28,INCIndia,,28,171,158,"They (BJP) find it difficult to shake off the habit of making accusations & proving nothing: @ghulamnazad AICC Press Briefing in Parliament",,@ghulamnazad,,726018059169734657,https://twitter.com/INCIndia/status/726018059169734657
2016-04-29 11:30:40,INCIndia,,56,352,367,"""I hope when history is written, it will be kinder to me than contemporary media"" - Dr. Manmohan Singhpic.twitter.com/Y5Cmh2F3HI",,,,726010809554358272,https://twitter.com/INCIndia/status/726010809554358272
2016-04-29 11:30:35,ArvindKejriwal,ANI,1107,1220,1110,"Amit Shah playing politics by asking Qs? Amit ji, pl arrest Sonia ji n others, take police remand n let CBI ask Qshttps://twitter.com/ani_news/status/726002295121559552 …",,,,726010789178540032,https://twitter.com/ArvindKejriwal/status/726010789178540032
2016-04-29 11:00:10,JM_Scindia,,29,181,240,"My heartfelt condolences to Digvijaya Singh ji & his family at the sad demise of his daughter Smt Karnika Singh.",,,,726003136167563264,https://twitter.com/JM_Scindia/status/726003136167563264
2016-04-29 10:24:10,SachinPilot,,8,164,170,"11 mentally&physically challenged kids died in a govt run centre in Jaipur.4 in ICU.govt shifts blame,no inquiry yetpic.twitter.com/LpHnI08HcK",,,,725994073715253248,https://twitter.com/SachinPilot/status/725994073715253248
2016-04-29 10:22:24,INCIndia,,43,250,191,"Why did Modi Govt permit a blacklisted company's entry as partner or sub-contractor to various Indian corporates?pic.twitter.com/E2SkxltTd1",,,,725993630381400065,https://twitter.com/INCIndia/status/725993630381400065
2016-04-29 09:26:15,BJP4India,,18,164,275,"Be a part in the journey of #TransformingIndia... Share your views now!http://nm-4.com/rzhn",,,#TransformingIndia,725979501784498176,https://twitter.com/BJP4India/status/725979501784498176
2016-04-29 09:00:53,INCIndia,,109,280,269,"If there is development in India, why aren't people getting jobs?pic.twitter.com/MkMmrg7Bk4",,,,725973116703240192,https://twitter.com/INCIndia/status/725973116703240192
2016-04-29 08:27:20,ArvindKejriwal,ITNlive,2031,1555,1320,". @ITNlive शीला जी के सारे काग़ज़ मोदी जी की ACB में हैं। मोदी जी ने ACB पर क़ब्ज़ा कर रखा है। ACB हमें वापस कर दो, देखो हम ऐक्शन दिखाते हैं।",,@ITNlive,,725964674114703360,https://twitter.com/ArvindKejriwal/status/725964674114703360
2016-04-29 07:56:06,narendramodi,,521,1938,5003,"Am sure this data will be used by researchers & analysts & lead to enhanced insights for policy making on taxation. http://www.incometaxindia.gov.in/Pages/Direct-Taxes-Data.aspx …",,,,725956811774291969,https://twitter.com/narendramodi/status/725956811774291969
2016-04-29 07:53:36,narendramodi,,1444,4694,10844,"Our Govt. has taken the landmark decision of publishing the income tax data. It is a big step towards transparency & informed policy making",,,,725956183375257602,https://twitter.com/narendramodi/status/725956183375257602
2016-04-29 07:41:47,INCIndia,,17,178,143,"Congress Party offers its condolences to @digvijaya_28 & his family at the passing away of his daughter Smt Karnika Singh",,@digvijaya_28,,725953212033814528,https://twitter.com/INCIndia/status/725953212033814528
2016-04-29 07:24:23,INCIndia,,75,296,211,"BJP has no intention of cleaning Ganga, otherwise why the delays? We wonder what excuse they'll give in 2018.pic.twitter.com/O6P8wgQceK",,,,725948832052174848,https://twitter.com/INCIndia/status/725948832052174848
2016-04-29 05:30:08,INCIndia,,24,208,150,"Indian Railways revenue shortfall grows, yet the Govt want to go forward with financially questionable Bullet Trainpic.twitter.com/OjpeJtBT9n",,,,725920079670448130,https://twitter.com/INCIndia/status/725920079670448130
2016-04-29 05:20:47,ncbn,,35,88,428,"Best wishes to all the students of AP who are taking the EAMCET today. Do your best.",,,,725917725780926464,https://twitter.com/ncbn/status/725917725780926464
2016-04-29 04:39:14,ArvindKejriwal,,1533,1777,1738,"अमित शाह जी हाथ जोड़कर सोनिया जी से पूछ रहे हैं - ""प्लीज़ बता दो किसने रिश्वत ली है।"" ऐसे जाँच होती है? फिर CBI और ACB बंद कर दो।",,,,725907271067136007,https://twitter.com/ArvindKejriwal/status/725907271067136007
2016-04-29 04:34:34,ArvindKejriwal,,1720,1611,1584,"इटली अदालत के आदेश में यदि मेरा नाम होता, मोदी जी अभी तक मुझे गिरफ़्तार कर चुके होते। पर सोनिया जी से पूछताछ तक नहीं कर रहे। क्यों?",,,,725906094258671617,https://twitter.com/ArvindKejriwal/status/725906094258671617
2016-04-29 04:30:08,INCIndia,,46,201,166,"We stand with every Indianpic.twitter.com/ogatszivAW",,,,725904978326343681,https://twitter.com/INCIndia/status/725904978326343681
2016-04-29 04:27:38,ArvindKejriwal,,1297,1585,1437,"मोदी जी ने मुझ पर CBI रेड कराई, सोनिया जी और वाड्रा जी पर नहीं कर रहे। मोदी जी को गांधी परिवार ईमानदार लगता है।",,,,725904351269539842,https://twitter.com/ArvindKejriwal/status/725904351269539842
2016-04-29 04:22:24,INCIndia,INCIndia,19,147,118,"Why is Lalit Modi being given favourable treatment if they are seeking deportation of Vijay Mallya?: @rssurjewala",,@rssurjewala,,725903035256307712,https://twitter.com/INCIndia/status/725903035256307712
2016-04-29 04:21:37,INCIndia,INCIndia,20,186,134,"Indian Rotorcraft Company is a partnership between Tatas & AgustaWestland. Will Defence Min answer?: @rssurjewalapic.twitter.com/hUGEexCuFb",,@rssurjewalapic,,725902837247410176,https://twitter.com/INCIndia/status/725902837247410176
2016-04-29 04:20:47,INCIndia,INCIndia,4,105,70,"Modi Govt sanctioned Foreign Investment Promotion Board permission on 8th Oct 2015 to Indian Rotorcraft Company: @rssurjewala",,@rssurjewala,,725902625338597376,https://twitter.com/INCIndia/status/725902625338597376
2016-04-29 04:19:41,INCIndia,INCIndia,10,114,69,"Actually the only person who is protecting AgustaWestland, is Narendra Modi Govt for the last two years: @rssurjewala",,@rssurjewala,,725902348359331842,https://twitter.com/INCIndia/status/725902348359331842
2016-04-29 04:17:54,INCIndia,INCIndia,12,127,77,"Why is Modi Govt protecting bribe-giving co. AgustaWestland? Why wasn't anything done for two years when CBI conducted inquiry: @rssurjewala",,@rssurjewala,,725901901103927298,https://twitter.com/INCIndia/status/725901901103927298
2016-04-29 04:16:39,INCIndia,INCIndia,12,138,81,"Is he (Shri Amit Shah) not the same person who was expelled from entering Gujarat by the SC's order?: @rssurjewala",,@rssurjewala,,725901585637761024,https://twitter.com/INCIndia/status/725901585637761024
2016-04-29 04:15:35,INCIndia,,49,250,227,"Amit Shah ji should show more maturity. He shouldn't teach us the law of the land: @rssurjewalapic.twitter.com/sfSVvGBoRi",,@rssurjewalapic,,725901317089021952,https://twitter.com/INCIndia/status/725901317089021952
2016-04-29 03:30:04,INCIndia,,29,250,246,"जब भी इबादत में नज़र झुकती है, हर हिंदुस्तानी अपने मुल्क की तरक्की की दुआ मांगता है।pic.twitter.com/VoJqXr4st1",,,,725889864093192193,https://twitter.com/INCIndia/status/725889864093192193
2016-04-29 02:30:06,INCIndia,,13,140,103,"INC session held in Amritsar expressed solidarity with victims of Jallianwala Bagh massacre http://inc.in/INC-Time-Line pic.twitter.com/6bXUtC8GaN",,,,725874772077215746,https://twitter.com/INCIndia/status/725874772077215746
2016-04-29 01:39:16,mkstalin,,17,67,301,"Promised de-silting of water bodies and Flood Control & Mgt.Committee for Chennai to minimise flood damage #DMK2016pic.twitter.com/dBFIeTohzH",,,#DMK2016pic,725861978250465280,https://twitter.com/mkstalin/status/725861978250465280
2016-04-29 01:37:57,mkstalin,,18,40,156,"Visited 10 constituencies in Chennai. Promised to turn Chennai into Singara Chennai once again #DMK2016pic.twitter.com/Ie2mijrYam",,,#DMK2016pic,725861649458982912,https://twitter.com/mkstalin/status/725861649458982912
2016-04-28 17:14:27,ncbn,,34,89,421,"Flagged off Udyogaratham, a mobile employment-cum-skill development centre, which will give info on MSME jobs in AP.pic.twitter.com/I8M3eJ1ZfW",,,,725734937593319424,https://twitter.com/ncbn/status/725734937593319424
2016-04-28 17:13:21,ncbn,,28,93,483,"At Progressive Recognised Teachers Union meet, encouraged teachers to use tech to learn innovative teaching methods.pic.twitter.com/ySnD5XoQfV",,,,725734663055093761,https://twitter.com/ncbn/status/725734663055093761
2016-04-28 16:30:12,INCIndia,,71,201,143,"Like his other promises, Swachh Bharat Mission has also turned out to be a Jumla http://inc.in/In-Focus/745/Like-his-other-promises-Swachh-Bharat-Mission-has-also-turned-out-to-be-a-Jumla …pic.twitter.com/PkmvDFuWoZ",,,,725723803809013761,https://twitter.com/INCIndia/status/725723803809013761
2016-04-28 15:30:15,INCIndia,,40,187,211,"सादगीpic.twitter.com/todvvw50e5",,,,725708714955542528,https://twitter.com/INCIndia/status/725708714955542528
2016-04-28 14:44:01,SachinPilot,,3,114,137,"In West Bengal today. Campaigned for the Cong candidate in Calcutta Port constituency. addressed the local mediapic.twitter.com/G0BBghWLZ2",,,,725697078899408896,https://twitter.com/SachinPilot/status/725697078899408896
2016-04-28 14:30:35,INCIndia,,23,277,132,"BJP had earlier compromised the national security because of corruption, are they doing the same with Agusta deal?https://www.youtube.com/watch?v=NF5qHV1FE4Q&feature=youtu.be …",,,,725693700030918656,https://twitter.com/INCIndia/status/725693700030918656
2016-04-28 14:28:56,INCIndia,,7,202,164,"Highlights of the Press Briefing by Dr Abhishek Manu Singhvi in Parliament earlier todaypic.twitter.com/2wiL23XHUp",,,,725693285772075011,https://twitter.com/INCIndia/status/725693285772075011
2016-04-28 14:24:24,INCIndia,,3,165,146,"Highlights of the Press Briefing by AICC in Parliament today HJC's merger with Congress.pic.twitter.com/5wMvYV7WhQ",,,,725692142065045505,https://twitter.com/INCIndia/status/725692142065045505
2016-04-28 14:23:15,BJP4India,,29,290,542,"#TransformingIndia : Moving fast towards a brighter tomorrow and 'power for all'.pic.twitter.com/BSanlpS1wX",,,#TransformingIndia,725691854847631360,https://twitter.com/BJP4India/status/725691854847631360
2016-04-28 14:11:37,narendramodi,,927,5334,13273,"Congrats to all our scientists who worked tirelessly for launch of IRNSS-1G Mission. India salutes your persistence & dedication.",,,,725688926493663233,https://twitter.com/narendramodi/status/725688926493663233
2016-04-28 14:10:11,narendramodi,,772,3093,7111,"A historic day for India's space programme. 125 crore Indians got a Navic. http://n-m4.in/1SS1V83",,,,725688565762510848,https://twitter.com/narendramodi/status/725688565762510848
2016-04-28 13:52:32,ArvindKejriwal,SatyendarJain,304,1035,1336,"Great newshttps://twitter.com/satyendarjain/status/725683101574283264 …",,,,725684122979557376,https://twitter.com/ArvindKejriwal/status/725684122979557376
2016-04-28 13:30:19,INCIndia,,33,363,213,"Speed up the inquiry and punish the guiltypic.twitter.com/JxUmTOOqxC",,,,725678532962082816,https://twitter.com/INCIndia/status/725678532962082816
2016-04-28 12:48:53,JM_Scindia,JM_Scindia,38,154,186,"We must negotiate from a position of strength. This Government is negotiating from a position of weakness.",,,,725668106916532224,https://twitter.com/JM_Scindia/status/725668106916532224
2016-04-28 12:48:08,JM_Scindia,JM_Scindia,17,143,162,"India’s foreign policy with regards to Pakistan can’t be based on emotions.",,,,725667919246577664,https://twitter.com/JM_Scindia/status/725667919246577664
2016-04-28 12:47:38,JM_Scindia,,22,174,210,"Raised the issue in Lok Sabha, regarding govt’s decision to allow Pakistan’s probe team in India.https://youtu.be/fmWiysFjbuk",,,,725667792859594753,https://twitter.com/JM_Scindia/status/725667792859594753
2016-04-28 12:30:27,INCIndia,,5,202,154,"This is the third such incident during this election. Is this the change she promised?pic.twitter.com/JxwrHM8KvA",,,,725663467315699712,https://twitter.com/INCIndia/status/725663467315699712
2016-04-28 12:14:34,INCIndia,INCIndia,14,122,103,"Today we have come together & strengthened the voice against the BJP: @AshokTanwar_INC",,@AshokTanwar_INC,,725659468944416768,https://twitter.com/INCIndia/status/725659468944416768
2016-04-28 12:10:38,INCIndia,INCIndia,7,128,109,"The BJP have taken no steps to fulfil their electoral promises in Haryana: AICC Press Briefing in Parliament",,,,725658479025770497,https://twitter.com/INCIndia/status/725658479025770497
2016-04-28 12:09:47,INCIndia,INCIndia,7,122,89,"We welcome today's decision. The Congress is growing stronger: Bhupinder Singh Hooda",,,,725658266471043072,https://twitter.com/INCIndia/status/725658266471043072
2016-04-28 12:07:36,INCIndia,INCIndia,4,114,81,"We want to eradicate the communal forces in the country. If we come together, we can wholly defeat the BJP: Kuldeep Bishnoi",,,,725657716765560832,https://twitter.com/INCIndia/status/725657716765560832
2016-04-28 12:05:32,INCIndia,INCIndia,2,107,76,"Today senior leaders & members of the HJC met with Congress President Smt. Gandhi & Congress VP Rahul Gandhi: @Ahmad_Shakeel",,@Ahmad_Shakeel,,725657197439373312,https://twitter.com/INCIndia/status/725657197439373312
2016-04-28 12:04:24,BJP4India,,5,82,184,"BJP CEC announces a list of BJP candidates for Uttar Pradesh bye-elections to the legislative assembly 2016- http://bit.ly/21gQLK6",,,,725656910691618816,https://twitter.com/BJP4India/status/725656910691618816
2016-04-28 12:02:01,INCIndia,,10,157,139,"Haryana Janhit Congress, started by Bhajan Lal, has merged with the Congress Party: @Ahmad_Shakeel at AICC Press Briefing in Parliament",,@Ahmad_Shakeel,,725656312487378944,https://twitter.com/INCIndia/status/725656312487378944
2016-04-28 11:30:42,INCIndia,,43,287,179,"We ensured that AgustaWestland paid heavily for breaching Integrity Pact. They were made to pay 27% more!pic.twitter.com/U8pEyteOSd",,,,725648430849097730,https://twitter.com/INCIndia/status/725648430849097730
2016-04-28 11:16:37,MamataOfficial,,14,23,96,"#RealBengal বাংলায় পরিবেশরক্ষার ক্ষেত্রে যে উদ্যোগ নেওয়া হয়েছে তাতে পরিবেশবিদ সঞ্চিতা সরকার খুবই খুশিhttps://goo.gl/qt4C0K",,,#RealBengal,725644884711895040,https://twitter.com/MamataOfficial/status/725644884711895040
2016-04-28 11:15:33,MamataOfficial,,4,24,79,"#RealBengal Environmentalist Sanchita Sarkar is happy with progress made in the field of environment conservation https://goo.gl/qt4C0K",,,#RealBengal,725644616813289474,https://twitter.com/MamataOfficial/status/725644616813289474
2016-04-28 11:10:05,ArvindKejriwal,,1998,1304,1124,"BJP'll never do it. BJP की नीयत ख़राब है। देखना, 5 साल भाजपा केवल बयानबाज़ी करेगी। Cong/BJP में बहुत गहरा रिश्ता है(2/2",,,,725643241152995328,https://twitter.com/ArvindKejriwal/status/725643241152995328
2016-04-28 11:09:44,ArvindKejriwal,timesofindia,2037,1288,1017,"I dare BJP 2 arrest Sonia ji n those cong leaders named in Italy court order n interrogate them(1/2)https://twitter.com/timesofindia/status/725634775503900673 …",,,,725643156566491136,https://twitter.com/ArvindKejriwal/status/725643156566491136
2016-04-28 11:06:15,MamataOfficial,,2,16,81,"#RealBengal আনন্দধারা প্রকল্পের মাধ্যমে গ্রাম বাংলায় কাঞ্চন রঙের মত বহু মহিলা আজ স্বনির্ভরhttps://goo.gl/5ipCB7",,,#RealBengal,725642275871563777,https://twitter.com/MamataOfficial/status/725642275871563777
2016-04-28 11:02:34,MamataOfficial,,6,22,83,"#RealBengal Anandadhara scheme has helped in making women from rural areas self-reliant. Kanchan Rang is an example https://goo.gl/5ipCB7",,,#RealBengal,725641349026865152,https://twitter.com/MamataOfficial/status/725641349026865152
2016-04-28 10:22:03,INCIndia,,115,336,260,"यह आदमी (सुब्रमण्यम स्वामी ) संसद में और गली में बोले जाने वाले शब्दों में अंतर नहीं जानता: श्री गुलाम नबी आजादpic.twitter.com/V6cYYPMMyS",,,,725631154871631872,https://twitter.com/INCIndia/status/725631154871631872
2016-04-28 10:19:14,ArvindKejriwal,,877,1668,1558,"CIC ने मुझसे पूछा कि क्या मुझसे सम्बन्धित जानकारी जनता को दे दी जाए? मेरा जवाब -pic.twitter.com/HZdPZpVsm0",,,,725630447506587648,https://twitter.com/ArvindKejriwal/status/725630447506587648
2016-04-28 10:10:42,RahulGandhi,,306,1022,1258,"Congratulations to the @isro team on successful launch of IRNSS-1G, the final satellite that completes our own regional navigational system!",,@isro,,725628299104374784,https://twitter.com/RahulGandhi/status/725628299104374784
2016-04-28 09:43:25,BJP4India,,56,677,1363,"Congratulations to @isro for the successful launch of its 7th and final navigation satellite - IRNSS-1G.pic.twitter.com/4BTNqpdhfN",,@isro,,725621430872854528,https://twitter.com/BJP4India/status/725621430872854528
2016-04-28 09:28:28,OmarAbdullah,OmarAbdullah,10,14,67,"Also to @sagarsalman64 for the loss of a much loved family member. #prayers",,@sagarsalman64,#prayers,725617669760765952,https://twitter.com/OmarAbdullah/status/725617669760765952
2016-04-28 09:28:04,INCIndia,,32,233,200,"PM Modi is hell bent on pocketing the people's hard earned money.pic.twitter.com/UFHZHYHKht",,,,725617567390294016,https://twitter.com/INCIndia/status/725617567390294016
