date,username,to,replies,retweets,favorites,text,geo,mentions,hashtags,id,permalink
2016-10-22 05:20:59,AmitShah,VanathiBJP,12,35,161,"Thank you for your wishes @VanathiBJPhttps://twitter.com/VanathiBJP/status/789676047469903873 …",,@VanathiBJPhttps,,789698040097443840,https://twitter.com/AmitShah/status/789698040097443840
2016-10-22 05:20:09,AmitShah,mlkhattar,21,42,192,"धन्यवाद मनोहर लाल जी |https://twitter.com/mlkhattar/status/789677359012024320 …",,,,789697831128801281,https://twitter.com/AmitShah/status/789697831128801281
2016-10-22 05:19:46,AmitShah,jayantsinha,7,45,211,"आपकी शुभकामनाओं के लिए बहुत बहुत धन्यवाद जयंत जी |https://twitter.com/jayantsinha/status/789677899905327104 …",,,,789697734450089984,https://twitter.com/AmitShah/status/789697734450089984
2016-10-22 05:19:34,BJP4India,,9,216,482,"एकात्म मानववाद, एकात्म मानव दर्शन एवं अंत्योदय की विचारधारा हमारा आदर्श और गरीब-कल्याण हमारा एकमात्र लक्ष्य होना चाहिए। #HBDayAmitShahpic.twitter.com/jB8f5LPNZE",,,#HBDayAmitShahpic,789697684403740673,https://twitter.com/BJP4India/status/789697684403740673
2016-10-22 05:19:03,AmitShah,amitmalviya,9,31,130,"Thank you @malviyamithttps://twitter.com/malviyamit/status/789678773100646400 …",,@malviyamithttps,,789697553927249920,https://twitter.com/AmitShah/status/789697553927249920
2016-10-22 05:18:50,AmitShah,Gen_VKSingh,6,31,157,"Thank you @Gen_VKSingh ji.https://twitter.com/Gen_VKSingh/status/789680075679596544 …",,@Gen_VKSingh,,789697500475043840,https://twitter.com/AmitShah/status/789697500475043840
2016-10-22 05:18:07,AmitShah,BoxerManojkr,9,46,187,"मंगलकामनाओं के लिए बहुत बहुत धन्यवाद @BoxerManojkrhttps://twitter.com/BoxerManojkr/status/789648841658273792 …",,@BoxerManojkrhttps,,789697320359034880,https://twitter.com/AmitShah/status/789697320359034880
2016-10-22 05:17:03,AmitShah,aniljaindr,4,31,168,"बहुत बहुत धन्यवाद डॉ. अनिल जैन जी |https://twitter.com/aniljaindr/status/789681118744158208 …",,,,789697050153668608,https://twitter.com/AmitShah/status/789697050153668608
2016-10-22 05:16:23,AmitShah,DarshanaJardosh,11,27,146,"Thank you @DarshanaJardosh ji.https://twitter.com/DarshanaJardosh/status/789682897632448512 …",,@DarshanaJardosh,,789696884084346882,https://twitter.com/AmitShah/status/789696884084346882
2016-10-22 05:16:07,AmitShah,,4,27,136,"Thank you. https://twitter.com/AshwiniBJP/status/789683818764521473 …",,,,789696817004810240,https://twitter.com/AmitShah/status/789696817004810240
2016-10-22 05:15:00,AmitShah,RajivPratapRudy,8,48,229,"शुभकामनाओं के लिए धन्यवाद रूडी जी |https://twitter.com/RajivPratapRudy/status/789685251345833984 …",,,,789696536837894144,https://twitter.com/AmitShah/status/789696536837894144
2016-10-22 05:14:09,AmitShah,ramkripalmp,13,50,236,"आपकी शुभकामनाओं के लिए बहुत बहुत आभार रामकृपाल जी |https://twitter.com/ramkripalmp/status/789685981662150657 …",,,,789696322139893760,https://twitter.com/AmitShah/status/789696322139893760
2016-10-22 05:13:30,AmitShah,SuPriyoBabul,10,40,192,"Thank you for your wishes.https://twitter.com/SuPriyoBabul/status/789687419838861312 …",,,,789696156200611840,https://twitter.com/AmitShah/status/789696156200611840
2016-10-22 05:12:48,AmitShah,VinodChavdaBJP,12,27,130,"बहुत बहुत धन्यवाद @vinodchavda31",,@vinodchavda31,,789695982065766400,https://twitter.com/AmitShah/status/789695982065766400
2016-10-22 05:12:00,AmitShah,Kailashkher,9,103,326,"Thank you so much for the wishes @Kailashkherhttps://twitter.com/Kailashkher/status/789688464279089152 …",,@Kailashkherhttps,,789695782064562176,https://twitter.com/AmitShah/status/789695782064562176
2016-10-22 05:11:22,AmitShah,girirajsinghbjp,18,87,345,"शुभकामनाओं के लिए बहुत बहुत धन्यवाद गिरिराज जी |https://twitter.com/girirajsinghbjp/status/789689501174140928 …",,,,789695620252438528,https://twitter.com/AmitShah/status/789695620252438528
2016-10-22 05:10:42,AmitShah,tarunchughbjp,5,41,183,"शुभकामनाओं के लिए धन्यवाद तरुण जी |https://twitter.com/bjptarunchugh/status/789690075374297088 …",,,,789695454954950656,https://twitter.com/AmitShah/status/789695454954950656
2016-10-22 05:09:34,AmitShah,Dev_Fadnavis,18,48,295,"Thank you @Dev_Fadnavis for your wishes.https://twitter.com/Dev_Fadnavis/status/789690543852834816 …",,@Dev_Fadnavis,,789695169561899008,https://twitter.com/AmitShah/status/789695169561899008
2016-10-22 05:08:08,AmitShah,jitu_vaghani,21,51,230,"Thank you Jitu Bhai.https://twitter.com/jitu_vaghani/status/789692090116665344 …",,,,789694808306487297,https://twitter.com/AmitShah/status/789694808306487297
2016-10-22 05:07:33,AmitShah,Ra_THORe,10,58,244,"शुभकामनाओं के लिए हार्दिक आभार @Ra_THORe जी |https://twitter.com/Ra_THORe/status/789694325269594116 …",,@Ra_THORe,,789694662059495424,https://twitter.com/AmitShah/status/789694662059495424
2016-10-22 05:06:24,AmitShah,vijayrupanibjp,15,35,182,"Thank you @vijayrupanibjp ji for kind birthday wishes.",,@vijayrupanibjp,,789694370442207232,https://twitter.com/AmitShah/status/789694370442207232
2016-10-22 05:04:40,BJP4India,,31,230,433,"मेरा अध्यक्ष बनना कार्यकर्ता नाम की संस्था का सम्मान है। यह भाजपा में ही संभव है: श्री अमित शाह http://bjp.org/amitshahquotes #HBDayAmitShahpic.twitter.com/Hje1FBYQ6S",,,#HBDayAmitShahpic,789693933009764353,https://twitter.com/BJP4India/status/789693933009764353
2016-10-22 04:59:36,AmitShah,VasundharaBJP,24,44,221,"Thank you @VasundharaBJP ji",,@VasundharaBJP,,789692661661700096,https://twitter.com/AmitShah/status/789692661661700096
2016-10-22 04:58:41,BJP4India,,16,280,655,"आज यदि जम्मू-कश्मीर भारत का अभिन्न अंग है बंगाल भारत का हिस्सा है तो उसकी नींव में डॉ. श्यामा प्रसाद मुखर्जी जी का बलिदान है। #HBDayAmitShahpic.twitter.com/TWMeqTcuPl",,,#HBDayAmitShahpic,789692430001975296,https://twitter.com/BJP4India/status/789692430001975296
2016-10-22 04:56:13,AmitShah,narendramodi,71,225,728,"Thank you Honourable PM @narendramodi ji for your kind wishes.https://twitter.com/narendramodi/status/789635693639106560 …",,@narendramodi,,789691807126818816,https://twitter.com/AmitShah/status/789691807126818816
2016-10-22 04:51:21,BJP4India,,27,210,473,"लोकतांत्रिक व्यवस्था में जनता के जनादेश को सिर पर रखना चाहिए, जनता के जनादेश के खिलाफ संघर्ष नहीं करना चाहिए: श्री अमित शाह #HBDayAmitShahpic.twitter.com/iNdjsfRNUT",,,#HBDayAmitShahpic,789690585103773696,https://twitter.com/BJP4India/status/789690585103773696
2016-10-22 04:40:40,RajaBrar_INC,,5,226,241,"A young man with a body of Iron & will of steel who dedicated his life to the service of India & challenged the British Empire. शत् शत् नमन!pic.twitter.com/3X8jSA8TUv",,,,789687894445215744,https://twitter.com/RajaBrar_INC/status/789687894445215744
2016-10-22 04:40:32,BJP4India,,37,246,409,"राष्ट्रवाद हमारी प्रेरणा है ओर अंत्योदय ही हमारा लक्ष्य है : श्री अमित शाह http://bjp.org/amitshahquotes #HBDayAmitShahpic.twitter.com/cP5bRrzWw0",,,#HBDayAmitShahpic,789687861985501184,https://twitter.com/BJP4India/status/789687861985501184
2016-10-22 04:32:58,BJP4India,,65,435,821,"किसी भी देश का विभाजन धर्म के आधार पर नहीं होना चाहिए, लेकिन कांग्रेस ने धर्म के आधार पर भारत का बंटवारा स्वीकार किया। #HBDayAmitShahpic.twitter.com/w1YLQpxJic",,,#HBDayAmitShahpic,789685956936818688,https://twitter.com/BJP4India/status/789685956936818688
2016-10-22 04:30:00,INCIndia,,27,243,302,"All citizens have equal rights irrespective of religion or caste. I consider this proof of the wisdom & farsightedness of our country.pic.twitter.com/3emBV3LU1e",,,,789685212401643521,https://twitter.com/INCIndia/status/789685212401643521
2016-10-22 04:21:29,RajaBrar_INC,,2,75,54,"En Route Bangalore, Karnataka.",,,,789683065446543360,https://twitter.com/RajaBrar_INC/status/789683065446543360
2016-10-22 02:41:40,AmitShah,,172,850,2229,"माँ भारती की स्वाधीनता के लिए हँसते हँसते फंसी पर चढ़ने वाले अमर शहीद अशफाक उल्ला ख़ाँ की जयंती पर शत् शत् नमन |pic.twitter.com/zEy4O5atVk",,,,789657948330926080,https://twitter.com/AmitShah/status/789657948330926080
2016-10-22 02:30:00,INCIndia,,13,363,425,"We pay tribute to freedom fighter Ashfaqulla Khan on his birth anniversary.pic.twitter.com/WODt9H2xN4",,,,789655011760283648,https://twitter.com/INCIndia/status/789655011760283648
2016-10-22 01:53:10,arunjaitley,,48,313,1641,"My best wishes & b'day greetings to Shri @AmitShah ji, National President, BJP. May God bless him with success, good health & a long life",,@AmitShah,,789645741757116416,https://twitter.com/arunjaitley/status/789645741757116416
2016-10-22 01:30:04,BJP4India,,76,639,1153,"#HBDayAmitShahpic.twitter.com/ll7fK66L0W",,,#HBDayAmitShahpic,789639930821566465,https://twitter.com/BJP4India/status/789639930821566465
2016-10-22 01:13:14,narendramodi,,868,3474,11933,"Wishing BJP President @AmitShah a very happy birthday. May God bless him with a long life filled with good health.",,@AmitShah,,789635693639106560,https://twitter.com/narendramodi/status/789635693639106560
2016-10-21 16:25:24,arunjaitley,,33,199,1370,"Delivering Keynote Address at Global Conference on National Initiative towards Strengthening Arbitration & Enforcement in India, Oct. 21pic.twitter.com/UzPGbXILjf",,,,789502857280053248,https://twitter.com/arunjaitley/status/789502857280053248
2016-10-21 16:18:48,BJP4India,,23,264,766,"भारतीय जनता पार्टी के राष्ट्रीय अध्यक्ष श्री अमित शाह 21 अक्टूबर 2016 को कुरुक्षेत्र, हरियाणा में आर्य युवा महासम्मेलन को संबोधित करेंगे।pic.twitter.com/9v8z4SGbgP",,,,789501197057036289,https://twitter.com/BJP4India/status/789501197057036289
2016-10-21 16:13:48,ArvindKejriwal,,599,1477,2117,"pic.twitter.com/UqWO3BlLEF",,,,789499939608862721,https://twitter.com/ArvindKejriwal/status/789499939608862721
2016-10-21 15:30:02,INCIndia,,20,245,175,"PM Modi’s sugary talk & the bitter truth of India’s faltering sugarcane industry Read More: http://inc.in/In-Focus/845/PM-Modi-sugary-talk-the-bitter-truth-of-India-faltering-sugarcane-industry …pic.twitter.com/hQF5hu251r",,,,789488923693031425,https://twitter.com/INCIndia/status/789488923693031425
2016-10-21 15:18:48,ArvindKejriwal,,282,767,657,"http://www.dailyo.in/variety/arnab-goswami-y-security-cover-end-vip-racism-newshour-times-now-establishment-journalism/story/1/13542.html …",,,,789486099227828224,https://twitter.com/ArvindKejriwal/status/789486099227828224
2016-10-21 14:32:45,PMOIndia,,257,1312,5232,"Tomorrow, PM @narendramodi will inaugurate the new integrated terminal building of Vadodara Airport. Here are some pictures.pic.twitter.com/dRCn3dpXuY",,@narendramodi,,789474509686394884,https://twitter.com/PMOIndia/status/789474509686394884
2016-10-21 14:30:02,INCIndia,,22,249,258,"BJP के UP प्रभारी श्री ओम माथुर ने सेना के जवानों की शहादत पर वोट की खेती शुरु करने के गुरुमंत्र भाजपा नेताओं को देने शुरू कर दिए हैंpic.twitter.com/u9O1z6H94f",,,,789473827071913984,https://twitter.com/INCIndia/status/789473827071913984
2016-10-21 14:23:07,ArvindKejriwal,,478,1211,1176,"This is Amit Shah style of politics...pic.twitter.com/Y0O77D78u8",,,,789472083575054336,https://twitter.com/ArvindKejriwal/status/789472083575054336
2016-10-21 14:16:48,ArvindKejriwal,,118,713,650,"http://www.jantakareporter.com/entertainment/renuka-shahane-exposes-right-wing-politiciansral/70216/ …",,,,789470496739831809,https://twitter.com/ArvindKejriwal/status/789470496739831809
2016-10-21 14:09:34,SachinPilot,,30,191,399,"Met with some super bright class8 students in Jaipur.Discussed their school project on traffic management.Heartening to see their confidencepic.twitter.com/2X3trbPc2e",,,,789468677062008832,https://twitter.com/SachinPilot/status/789468677062008832
2016-10-21 14:05:12,PMOIndia,,77,656,2906,"Shri Sanjay Gupta, Editor-in-Chief & CEO, Dainik Jagran, met PM & presented two demand drafts worth Rs 2.71 crore towards PMNRF. @JagranNewspic.twitter.com/gkrmQ7VOQY",,@JagranNewspic,,789467577315569664,https://twitter.com/PMOIndia/status/789467577315569664
2016-10-21 13:53:41,arunjaitley,,26,172,937,"Addressing media at the disbursement of first tranche of loan from Long Term Irrigation Fund (LTIF) set-up by NABARD, Oct 21, 2016pic.twitter.com/ItROCOX6ej",,,,789464678464225280,https://twitter.com/arunjaitley/status/789464678464225280
2016-10-21 13:39:27,MamataOfficial,,37,100,642,"Salutes to all members of the police force. Love to their families on Police Commemoration Day today. Their contribution is unforgettable",,,,789461097552093185,https://twitter.com/MamataOfficial/status/789461097552093185
2016-10-21 13:30:02,INCIndia,,20,260,244,"104 farmers have committed suicide every month for the last 2 years in Telengana, yet CM Rao has done nothing!pic.twitter.com/3IigtGJCdg",,,,789458726134702080,https://twitter.com/INCIndia/status/789458726134702080
2016-10-21 13:19:22,ncbn,,15,62,488,"On Police Commemoration Day, my tributes to the policemen who laid down their lives while discharging their duties.pic.twitter.com/8ShJCyTnty",,,,789456042232909824,https://twitter.com/ncbn/status/789456042232909824
2016-10-21 12:48:56,arunjaitley,,15,141,716,"Addressing the 28th Accountants General Conference in New Delhi, October 21, 2016.pic.twitter.com/VRcBZZJS5d",,,,789448381697372161,https://twitter.com/arunjaitley/status/789448381697372161
2016-10-21 12:34:34,OmarAbdullah,OmarAbdullah,2,2,18,"@MamataOfficial I join him in wishing your nephew a speedy & complete recovery.",,@MamataOfficial,,789444769277673474,https://twitter.com/OmarAbdullah/status/789444769277673474
2016-10-21 12:31:19,OmarAbdullah,MamataOfficial,16,25,102,"Thank you very much ma'am. I'll be sure to pass your greetings on to dad.https://twitter.com/mamataofficial/status/789297628076965890 …",,,,789443949777780736,https://twitter.com/OmarAbdullah/status/789443949777780736
2016-10-21 12:30:32,OmarAbdullah,derekobrienmp,17,23,99,"Thanks a lot Derek. I'll be sure to pass on your message to dad :)https://twitter.com/quizderek/status/789316181450690560 …",,,,789443754260369408,https://twitter.com/OmarAbdullah/status/789443754260369408
2016-10-21 12:30:01,INCIndia,,13,265,231,"Crops worth lakhs. Insurance worth Rs 500/. Farmer gets Rs 100/-. The loot of farmers by Modi Govt continues unabated.pic.twitter.com/ScHsCUXFfy",,,,789443622085066753,https://twitter.com/INCIndia/status/789443622085066753
2016-10-21 12:09:03,INCIndia,INCIndia,1,186,96,"Watch recording of AICC Press Briefing by @drajoykumarhttps://www.youtube.com/watch?v=oVqJS8Kf7ig …",,@drajoykumarhttps,,789438344744665088,https://twitter.com/INCIndia/status/789438344744665088
2016-10-21 11:51:46,RahulGandhi,,216,1247,1817,"Glad to see our efforts in Amethi bearing fruit. Congratulations to the RGIPT family on the inauguration of the permanent campus!pic.twitter.com/Uw6XoIpiSL",,,,789433996644003840,https://twitter.com/RahulGandhi/status/789433996644003840
2016-10-21 11:34:06,INCIndia,INCIndia,10,157,125,"This is primarily due to Modi Govt cuts in social welfare schemes, which were targeted at the marginalised sections of India: @drajoykumar",,@drajoykumar,,789429550522310656,https://twitter.com/INCIndia/status/789429550522310656
2016-10-21 11:33:07,INCIndia,INCIndia,6,132,98,"UPA I & II took steps to reduce hunger through schemes like ICDS, MGNREGA etc. But, now India performed poorly in the Global Hunger Index.",,,,789429301879775232,https://twitter.com/INCIndia/status/789429301879775232
2016-10-21 11:30:48,narendramodi,,733,2220,9593,"On Police Commemoration Day, proudly recalling the valour of all courageous police personnel who sacrificed their lives in the line of duty.",,,,789428719752314880,https://twitter.com/narendramodi/status/789428719752314880
2016-10-21 11:30:18,INCIndia,INCIndia,13,120,82,"Under Modi ji, every day 550 jobs are lost in India. Everyday 52 farmers commit suicide: @drajoykumar",,@drajoykumar,,789428594883768322,https://twitter.com/INCIndia/status/789428594883768322
2016-10-21 11:30:02,INCIndia,,4,210,197,"After destroying Punjab's economy, SAD-BJP Govt are now spending money on self-promotion.pic.twitter.com/Z36dBid1H2",,,,789428526533402624,https://twitter.com/INCIndia/status/789428526533402624
2016-10-21 11:29:04,narendramodi,,338,2115,6441,"Did you know the Government of India helps you in building toilets? Lets work together for a Swachh Bharat.https://m.youtube.com/watch?feature=youtu.be&v=LFKrZxL0F3w …",,,,789428284148678656,https://twitter.com/narendramodi/status/789428284148678656
2016-10-21 11:27:55,INCIndia,INCIndia,3,83,52,"The amount of Rs 800 cr was due in 2013-14: @drajoykumar",,@drajoykumar,,789427995173728256,https://twitter.com/INCIndia/status/789427995173728256
2016-10-21 11:27:12,INCIndia,INCIndia,1,102,58,"As per a response to a question in the RS in Feb, the amount due to sugarcane farmers is Rs 13,000cr for 2015-16: @drajoykumar",,@drajoykumar,,789427814000766978,https://twitter.com/INCIndia/status/789427814000766978
2016-10-21 11:24:41,INCIndia,INCIndia,2,101,57,"This will not reduce the price of Sugar before Diwali, but those importing the sugar & then selling it will be profiting: @drajoykumar",,@drajoykumar,,789427181671690240,https://twitter.com/INCIndia/status/789427181671690240
2016-10-21 11:23:45,INCIndia,INCIndia,3,108,64,"With this, price of sugar will not go down. But, sugar will be imported from Brazil at Rs 26/kg & sold at Rs 45/kg here: @drajoykumar",,@drajoykumar,,789426946467729408,https://twitter.com/INCIndia/status/789426946467729408
2016-10-21 11:21:06,INCIndia,INCIndia,1,108,57,"Now there is a Sugar scam brewing in India. Govt is planning to reduce Customs Duty on Sugar: @drajoykumar",,@drajoykumar,,789426279036497921,https://twitter.com/INCIndia/status/789426279036497921
2016-10-21 11:13:38,INCIndia,INCIndia,9,117,80,"Instead of giving everyone Rs 15 lakh, it appears that in Modi ji's India, money is getting taken out of the people's accounts: @drajoykumar",,@drajoykumar,,789424400617476096,https://twitter.com/INCIndia/status/789424400617476096
2016-10-21 11:11:36,INCIndia,INCIndia,6,99,62,"The Govt must ensure that the banks compensate all card holders for their loss: @drajoykumar",,@drajoykumar,,789423887964438528,https://twitter.com/INCIndia/status/789423887964438528
2016-10-21 11:11:09,INCIndia,INCIndia,4,95,52,"The common man, whose hard earned money has been taken out of their accounts should have their money returned: @drajoykumar",,@drajoykumar,,789423774265319424,https://twitter.com/INCIndia/status/789423774265319424
2016-10-21 11:09:39,INCIndia,INCIndia,2,100,58,"We demand that the Modi Govt makes a full disclosure on the extent of this theft. They must inform all those affected by this: @drajoykumar",,@drajoykumar,,789423396895326208,https://twitter.com/INCIndia/status/789423396895326208
2016-10-21 11:06:35,INCIndia,INCIndia,3,100,57,"There are very few occurrences of this magnitude in the world. And these lists were stolen on Modi ji's watch: @drajoykumar",,@drajoykumar,,789422627198689280,https://twitter.com/INCIndia/status/789422627198689280
2016-10-21 11:04:45,INCIndia,INCIndia,7,121,65,"This Govt has a habit of saying that it is the 1st govt to do anything. Well it is the 1st Govt to let lists of cardholders get stolen",,,,789422165284102146,https://twitter.com/INCIndia/status/789422165284102146
2016-10-21 11:02:30,INCIndia,INCIndia,3,103,58,"While these lists were being stolen, the nations ""Chowkidar"", Shri Modi was sleeping: @drajoykumar",,@drajoykumar,,789421597446725632,https://twitter.com/INCIndia/status/789421597446725632
2016-10-21 11:01:34,INCIndia,INCIndia,3,98,49,"In China, Russa, Indonesia, US, there are sitting hackers who have stolen lists of 65 lakh card holders: @drajoykumar",,@drajoykumar,,789421364121702400,https://twitter.com/INCIndia/status/789421364121702400
2016-10-21 10:59:28,BJP4India,,44,335,799,"Together we are building ""Ek Bharat, Shreshtha Bharat."" Come, let's join hands. #JoinBJP at http://bit.ly/1QgOLtN pic.twitter.com/LfRuNcb56q",,,#JoinBJP,789420833793990656,https://twitter.com/BJP4India/status/789420833793990656
2016-10-21 10:54:26,INCIndia,,10,108,121,"Watch Now: AICC press briefing by Dr Ajoy Kumar, LIVE at: https://www.facebook.com/IndianNationalCongress/ … orhttp://www.inc.in/",,,,789419570612228096,https://twitter.com/INCIndia/status/789419570612228096
2016-10-21 09:32:52,INCIndia,,27,234,222,"Union Minister admits that manufacturing sector is in trouble. Is the NDA Govt slowly admitting that managing the economy is beyond them?pic.twitter.com/jWRg9ej70K",,,,789399039565438977,https://twitter.com/INCIndia/status/789399039565438977
2016-10-21 08:10:53,ArvindKejriwal,singharti411,188,704,1362,"God bless u betahttps://twitter.com/singharti411/status/789349797735993344 …",,,,789378408681607173,https://twitter.com/ArvindKejriwal/status/789378408681607173
2016-10-21 07:57:57,INCIndia,,28,278,261,"देश में नए रोजगार का विकास लगातार घट रहा है क्योंकि ज्यादा रोजगार देने वाली बड़ी कंपनियां बुरे दौर से गुजर रही है।pic.twitter.com/YArMiP1SEW",,,,789375156514795520,https://twitter.com/INCIndia/status/789375156514795520
2016-10-21 06:32:59,INCIndia,,33,266,264,"मोदी जी के सरकार में मंत्री बाबुल सुप्रियो की गुंडागर्दीpic.twitter.com/Rzx2d996Hn",,,,789353772442984448,https://twitter.com/INCIndia/status/789353772442984448
2016-10-21 06:31:48,AmitShah,AmitShah,101,421,1075,"आज भारतीय जनता पार्टी के प्रत्येक कार्यकर्ता को इस परम्परा को आगे ले जाने के लिए गर्व है |",,,,789353474441949184,https://twitter.com/AmitShah/status/789353474441949184
2016-10-21 06:30:45,AmitShah,AmitShah,29,380,991,"जनसंघ के रूप में शुरू हुई यह यात्रा आज असंख्य कार्यकर्ताओं के कठीन परिश्रम एवं बलिदान के बाद भाजपा जैसे वट वृक्ष के रूप में चरितार्थ हुई है|",,,,789353208674037760,https://twitter.com/AmitShah/status/789353208674037760
2016-10-21 06:30:28,AmitShah,AmitShah,18,417,901,"जनसंघ के साथ भारत में एक नई राजनैतिक परम्परा की शुरुवात हुई जिसमे भारत वर्ष की सांस्कृतिक आत्मा और स्वदेशी अर्थ नीति को केंद्र में रखा गया |",,,,789353137626722306,https://twitter.com/AmitShah/status/789353137626722306
2016-10-21 06:30:14,AmitShah,,100,855,2316,"जनसंघ के स्थापना दिवस पर डॉ.श्यामा प्रसाद मुख़र्जी,पं. दीन दयाल जी एवं इस विचारधारा को आगे बढ़ाने वाले समस्त राष्ट्रभक्तों को नमन् करता हूँ|pic.twitter.com/z5NRspV6gk",,,,789353079971819520,https://twitter.com/AmitShah/status/789353079971819520
2016-10-21 06:28:37,BJP4India,,47,403,891,"MGNREGA sees highest ever improvement in performance in 2016-17. Modi government is set to spend a record Rs. 60,000 crore in 2016-17.pic.twitter.com/LOfy0LU2Xj",,,,789352673761898496,https://twitter.com/BJP4India/status/789352673761898496
