date,username,to,replies,retweets,favorites,text,geo,mentions,hashtags,id,permalink
2016-04-02 15:40:15,PMOIndia,,120,427,1194,"Your happiness is my happiness and when you are not happy, I also feel the pain: PM @narendramodi",,@narendramodi,,716289149251104768,https://twitter.com/PMOIndia/status/716289149251104768
2016-04-02 15:38:21,PMOIndia,,39,339,966,"When in the times to come, people will see the work you've done, you will realise the importance of your efforts: PM @narendramodi",,@narendramodi,,716288667732447237,https://twitter.com/PMOIndia/status/716288667732447237
2016-04-02 15:35:26,PMOIndia,,36,477,1913,"Your hardwork draws me here: PM speaks at the L&T workers complex in Riyadhpic.twitter.com/MuPOJpyS1n",,,,716287935826436096,https://twitter.com/PMOIndia/status/716287935826436096
2016-04-02 15:30:24,INCIndia,,17,159,126,"The nation is above everything else: Pt. Nehru's speech from the ramparts of the Red Forthttps://www.youtube.com/watch?v=UMW3ZPpUSgA …",,,,716286668387397633,https://twitter.com/INCIndia/status/716286668387397633
2016-04-02 14:44:06,ArvindKejriwal,,678,1435,2250,"Anna not well. I pray to God for his fast recovery",,,,716275016577318912,https://twitter.com/ArvindKejriwal/status/716275016577318912
2016-04-02 14:39:23,PMOIndia,,57,416,1636,"India is making strides in agriculture, industry and services sector: PM @narendramodipic.twitter.com/zeayJuLM95",,@narendramodipic,,716273830986002433,https://twitter.com/PMOIndia/status/716273830986002433
2016-04-02 14:37:50,PMOIndia,,50,351,809,"India's youth is India's strength. World needs a workforce that is talented & well versed with technology: PM @narendramodi",,@narendramodi,,716273439363870720,https://twitter.com/PMOIndia/status/716273439363870720
2016-04-02 14:36:57,PMOIndia,,51,421,1342,"Reason for India's growth is the political stability in India: PM @narendramodipic.twitter.com/fMxVNZwpcS",,@narendramodipic,,716273219641020416,https://twitter.com/PMOIndia/status/716273219641020416
2016-04-02 14:35:57,PMOIndia,,33,272,767,"In a very short span of time India has once again given rise to new expectations at the world stage: PM @narendramodi",,@narendramodi,,716272964916744192,https://twitter.com/PMOIndia/status/716272964916744192
2016-04-02 14:35:12,PMOIndia,,32,374,1040,"World's attention is towards India due to the economic progress in India. India can contribute a lot to the world: PM at community programme",,,,716272777863364608,https://twitter.com/PMOIndia/status/716272777863364608
2016-04-02 14:30:20,INCIndia,,7,175,180,"Parliament House illuminated on Republic Day, 1952pic.twitter.com/Ez1bolTYUC",,,,716271551868350464,https://twitter.com/INCIndia/status/716271551868350464
2016-04-02 14:20:34,ArvindKejriwal,INarendra7,401,1100,1274,"Zero tolerance against corruptionhttps://twitter.com/inarendra7/status/716268081379549184 …",,,,716269093888757761,https://twitter.com/ArvindKejriwal/status/716269093888757761
2016-04-02 14:17:58,PMOIndia,,36,314,1019,"More glimpses from the Masmak Fortress.pic.twitter.com/12gUiByF1A",,,,716268440911097858,https://twitter.com/PMOIndia/status/716268440911097858
2016-04-02 14:05:00,PMOIndia,,35,382,1387,"An evening with history...PM @narendramodi visits the Masmak Fortress.pic.twitter.com/yrBFSwPTqL",,@narendramodi,,716265178363404288,https://twitter.com/PMOIndia/status/716265178363404288
2016-04-02 14:00:42,INCIndia,,50,261,209,"Founder of NaMo Brigade, and RSS man, Naresh Shenoy is a key suspect in the murder of an RTI activist in Mangalorepic.twitter.com/wTgDvh7hPq",,,,716264093414350848,https://twitter.com/INCIndia/status/716264093414350848
2016-04-02 13:50:57,PMOIndia,,36,222,621,"Happening now: PM @narendramodi at the Masmak Fortress.http://www.narendramodi.in/watch-live",,@narendramodi,,716261643244535808,https://twitter.com/PMOIndia/status/716261643244535808
2016-04-02 13:30:23,INCIndia,,66,420,286,"What else can you expect from an org which distributed sweets when Mahatma Gandhi was killed! #RSSinsultsTricolorpic.twitter.com/cDnHwSkbaJ",,,#RSSinsultsTricolorpic,716256464042524675,https://twitter.com/INCIndia/status/716256464042524675
2016-04-02 13:20:05,INCIndia,,47,165,141,"मोदी जी देश में लोकतंत्र को खत्म करने की कोशिश कर रहे हैं : राहुल गांधीhttps://www.youtube.com/watch?v=2dpJridT3xA …",,,,716253873434808320,https://twitter.com/INCIndia/status/716253873434808320
2016-04-02 13:01:31,INCIndia,,36,156,116,"What Modi ji is doing in the country, Mamata ji is doing in Bengal. She wants only one-persons rule: Rahul Gandhihttps://www.youtube.com/watch?v=QlUwgupHrY0 …",,,,716249201449897984,https://twitter.com/INCIndia/status/716249201449897984
2016-04-02 12:54:07,ncbn,,31,131,625,"Pleasure meeting Micheal Wang, Technology Advisor to Taiwan PM. He gave insights on using tech to improve services.pic.twitter.com/5N4jeoS4P6",,,,716247338524614656,https://twitter.com/ncbn/status/716247338524614656
2016-04-02 12:41:35,INCIndia,,75,557,398,"They didn't hoist Tricolor for 52 yrs & now @RSSorg is speaking shamelessly against our Tricolor #RSSinsultsTricolorpic.twitter.com/hyEL0jayNY",,@RSSorg,#RSSinsultsTricolorpic,716244184932331523,https://twitter.com/INCIndia/status/716244184932331523
2016-04-02 11:31:48,AmitShah,,51,588,1049,"Launched website of Dhirubhai Ambani Memorial House,Chorwad along with Rajya Sabha MP Shri @mpparimal today in Delhipic.twitter.com/A74GGkrrBZ",,@mpparimal,,716226622249013248,https://twitter.com/AmitShah/status/716226622249013248
2016-04-02 11:30:18,INCIndia,,18,270,209,"Under INC Govt led by @tarun_gogoi Assam has registered phenomenal progress. Per capita income has increased 4 timespic.twitter.com/Oa1QvzkGFA",,@tarun_gogoi,,716226244421902338,https://twitter.com/INCIndia/status/716226244421902338
2016-04-02 10:41:10,BJP4India,,22,322,811,"Key announcements by PM @narendramodi on India's national actions at Nuclear Security Summit 2016. #NSS2016 (2/2)pic.twitter.com/yNi9ZoepPz",,@narendramodi,#NSS2016,716213882486849536,https://twitter.com/BJP4India/status/716213882486849536
2016-04-02 10:38:27,BJP4India,,17,356,905,"Key announcements by PM @narendramodi on India's national actions at Nuclear Security Summit 2016. #NSS2016 (1/2)pic.twitter.com/VGEjnGW5nL",,@narendramodi,#NSS2016,716213196156108800,https://twitter.com/BJP4India/status/716213196156108800
2016-04-02 10:37:05,narendramodi,,793,2762,11064,"Reached Saudi Arabia. I look forward to a productive visit that will strengthen our bilateral relations.pic.twitter.com/lgdWHpVwHw",,,,716212855150813184,https://twitter.com/narendramodi/status/716212855150813184
2016-04-02 10:30:39,INCIndia,,25,269,223,"RG was right about BJP stoking violence. BJP MP has now confessed BJP members were involved in Haryana Jat violencepic.twitter.com/iiRWpDPHx7",,,,716211232328409088,https://twitter.com/INCIndia/status/716211232328409088
2016-04-02 10:27:51,narendramodi,,328,1444,3586,"وصلت إلى المملكة العربية السعودية، و إنني أتطلع إلى زيارة مثمرة التي ستعززعلاقاتنا الثنائية.pic.twitter.com/INIcLPdOSB",,,,716210529908359168,https://twitter.com/narendramodi/status/716210529908359168
2016-04-02 10:20:22,INCIndia,,16,160,132,"Watch the recording of Rahul Gandhi's speech, today in Bardhaman, West Bengalhttps://www.youtube.com/watch?v=0pdUr0c_lv0&feature=youtu.be …",,,,716208647282397184,https://twitter.com/INCIndia/status/716208647282397184
2016-04-02 10:09:21,RahulGandhi,,146,658,680,"In Durgapur, West Bengal #INC4Bengalpic.twitter.com/Dfl16xQFph",,,#INC4Bengalpic,716205872049852416,https://twitter.com/RahulGandhi/status/716205872049852416
2016-04-02 09:51:23,MamataOfficial,MamataOfficial,5,20,95,"#RealBengal জঙ্গলমহলের সঞ্জয় প্রামাণিকের কাহিনী। বিভ্রান্ত হয়ে অস্ত্র উঠিয়ে নিয়েছিল সে। এখন ফিরে এসেছে মূলস্রোতেhttps://goo.gl/qYTj0E",,,#RealBengal,716201354612449281,https://twitter.com/MamataOfficial/status/716201354612449281
2016-04-02 09:48:42,MamataOfficial,,10,49,93,"#RealBengal This is the story of Sanjay Pramanik, a former extremist, who has now returned to the mainstream >> https://goo.gl/qYTj0E",,,#RealBengal,716200679153373184,https://twitter.com/MamataOfficial/status/716200679153373184
2016-04-02 09:40:24,RahulGandhi,RahulGandhi,147,599,555,"बंगाल आपका क्यों भरोसा करे? अब आप कह रहे हो पुल गिर गया तो कार्यवाही होगी, 5 साल जब वो पुल नहीं बना, तब कार्यवाही क्यों नहीं हुई?",,,,716198586640248833,https://twitter.com/RahulGandhi/status/716198586640248833
2016-04-02 09:39:37,RahulGandhi,RahulGandhi,76,529,481,"आपके जो मंत्री, MP, MLAs television पर पैसा ले रहे हैं उनपर कार्यवाही क्यों नहीं हुई?",,,,716198389453496320,https://twitter.com/RahulGandhi/status/716198389453496320
2016-04-02 09:39:10,RahulGandhi,,169,567,560,"मैं ममता जी से पूछना चाहता हूँ, 5 साल शारदा पर कार्यवाही क्यों नहीं हुई?",,,,716198278937772032,https://twitter.com/RahulGandhi/status/716198278937772032
2016-04-02 09:37:49,RahulGandhi,,32,516,491,"In Bankura, West Bengal #INC4Bengalpic.twitter.com/wotbrHfx0R",,,#INC4Bengalpic,716197940004433920,https://twitter.com/RahulGandhi/status/716197940004433920
2016-04-02 09:20:33,RahulGandhi,RahulGandhi,189,497,467,"और जिन लोगों ने भ्रष्टाचार किया है, उनपर सख्त से सख्त कार्यवाही होनी चाहिए",,,,716193591232626688,https://twitter.com/RahulGandhi/status/716193591232626688
2016-04-02 09:19:49,RahulGandhi,,168,547,546,"जब सरकार बनेगी - जनता की सरकार बननी चाहिए, रोजगार पर पूरा focus होना चाहिए, industrialization पर focus होना चाहिए",,,,716193407966646272,https://twitter.com/RahulGandhi/status/716193407966646272
2016-04-02 09:14:29,RahulGandhi,,168,631,620,"जबसे कांग्रेस पार्टी और लेफ्ट मिले हैं, तबसे पूरे Bengal को पता लग गया है कि यहाँ अब ममता जी की सरकार नहीं आने वाली!",,,,716192065965522944,https://twitter.com/RahulGandhi/status/716192065965522944
2016-04-02 08:55:05,RahulGandhi,,68,555,489,"चुनाव जीतने के बाद, जो वायदे कांग्रेस पार्टी और तृणमूल कांग्रेस ने बंगाल को किये उन सब वायदों को ममता जी ने तोड़ना शुरू कर दिया",,,,716187184198328321,https://twitter.com/RahulGandhi/status/716187184198328321
2016-04-02 08:50:57,RahulGandhi,RahulGandhi,158,521,444,"वही काम फिर उत्तराखंड में उन्होंने किया, क्योंकि वो चाहते हैं हिन्दुस्तान में एक ही नेता रहे और वो हो नरेंद्र मोदी",,,,716186142991785984,https://twitter.com/RahulGandhi/status/716186142991785984
2016-04-02 08:50:36,RahulGandhi,,214,582,540,"मोदीजी देश में लोकतंत्र को खत्म करने की कोशिश कर रहे हैं, अरुणाचल में उन्होंने पैसे देकर हमारी सरकार को तोड़ा",,,,716186054378717184,https://twitter.com/RahulGandhi/status/716186054378717184
2016-04-02 08:24:09,ArvindKejriwal,,869,1403,2047,"Last month Delhi govt gave highest compensation ever given for land acquisition in the country to the farmers - Rs 3 crores per acre",,,,716179399377178624,https://twitter.com/ArvindKejriwal/status/716179399377178624
2016-04-02 08:18:19,RahulGandhi,,120,558,524,"पिछले चुनाव में कांग्रेस पार्टी और तृणमूल का coalition था, और अगर TMC चुनाव जीती है तो उसमें बहुत बड़ा हाथ कांग्रेस कार्यकर्ताओं का था",,,,716177932314497024,https://twitter.com/RahulGandhi/status/716177932314497024
2016-04-02 08:16:06,RahulGandhi,,191,575,544,"जो काम देश में नरेंद्र मोदी जी कर रहे हैं, बंगाल में वो ममता जी कर रही हैं। वो भी चाहती हैं सिर्फ एक ही व्यक्ति का राज हो",,,,716177372559478784,https://twitter.com/RahulGandhi/status/716177372559478784
2016-04-02 08:04:40,RahulGandhi,,38,471,471,"At Kulti, Bardhamanpic.twitter.com/ufrsvP7ZdH",,,,716174497200484352,https://twitter.com/RahulGandhi/status/716174497200484352
2016-04-02 07:36:18,BJP4India,,13,102,232,"Special song by @bjpassampradesh - BJP will ensure development of each and every section of society - https://www.youtube.com/watch?v=_Xp3BRerJ5k&list=PL8Z1OKiWzyBExk7yBIww96DhjOqpQh9_K … #BJP4Assam",,@bjpassampradesh,#BJP4Assam,716167356695752705,https://twitter.com/BJP4India/status/716167356695752705
2016-04-02 06:30:08,INCIndia,,43,211,211,"Modi ji said that inflation would leave the country, but all that's leaving the country are wilful defaulters.pic.twitter.com/ujidMFMsIv",,,,716150705778663424,https://twitter.com/INCIndia/status/716150705778663424
2016-04-02 06:26:24,OmarAbdullah,,128,164,731,"Very gracious of Mehbooba Mufti Sahiba to phone & invite me to her oath taking ceremony. I look forward to being there on the 4th.",,,,716149765310795776,https://twitter.com/OmarAbdullah/status/716149765310795776
2016-04-02 06:03:44,INCIndia,,37,399,430,"Congress VP Rahul Gandhi in Kolkata to meet the people injured in the flyover collapse tragedypic.twitter.com/voCHEtgiXd",,,,716144060835045376,https://twitter.com/INCIndia/status/716144060835045376
2016-04-02 06:01:58,RahulGandhi,,65,512,531,"Enroute to Kulti, Bardhaman for the first rally of the day. Will also address rallies in Bankura & Durgapur later today",,,,716143619590074368,https://twitter.com/RahulGandhi/status/716143619590074368
2016-04-02 05:46:13,RahulGandhi,RahulGandhi,253,729,690,"मैं यहाँ दुःख में आया हूँ, जो hospital में injured हैं उनसे मिलने आया हूँ, तो मैं इस समय राजनीति की बात नहीं करना चाहता",,,,716139654743916544,https://twitter.com/RahulGandhi/status/716139654743916544
2016-04-02 05:44:40,RahulGandhi,,359,894,1078,"I am here in Kolkata to support those who have been injured in this tragedy. I have come here to give whatever little support I can",,,,716139262719070209,https://twitter.com/RahulGandhi/status/716139262719070209
2016-04-02 05:30:09,INCIndia,,5,134,109,"Emphasis was laid on recognising the fraternity of all the communities in the country http://inc.in/INC-Time-Line pic.twitter.com/29bDuWcUOS",,,,716135612860923904,https://twitter.com/INCIndia/status/716135612860923904
2016-04-02 05:16:19,BJP4India,,41,447,1106,"#MakeInIndia impact : Unprecedented increase in FDI inflow in employment intensive sectors.pic.twitter.com/eATHdMEr0b",,,#MakeInIndia,716132129428475904,https://twitter.com/BJP4India/status/716132129428475904
2016-04-02 03:51:02,ArvindKejriwal,,168,739,835,"pic.twitter.com/YURBC1qRw8",,,,716110669100126208,https://twitter.com/ArvindKejriwal/status/716110669100126208
2016-04-02 03:49:52,ArvindKejriwal,rohini_sgh,374,857,737,"Valid question. Gives credence to rumours that they were set up by BJP themselveshttps://twitter.com/rohinisgh/status/716097372133007363 …",,,,716110372248223748,https://twitter.com/ArvindKejriwal/status/716110372248223748
2016-04-02 03:30:07,INCIndia,,7,208,169,"A school going child in Punjab receives BCG vaccination in the first nationwide campaign, 1953pic.twitter.com/fiEHgUIGbi",,,,716105402635554816,https://twitter.com/INCIndia/status/716105402635554816
2016-04-02 03:05:17,ArvindKejriwal,AAPInNews,212,652,564,"Sharp contrast in governance of BJP and AAPhttps://twitter.com/aapinnews/status/716079855251533824 …",,,,716099154020175874,https://twitter.com/ArvindKejriwal/status/716099154020175874
2016-04-02 02:50:17,ArvindKejriwal,AAPInNews,66,450,418,"A big relief in power sector to Delhiiteshttps://twitter.com/aapinnews/status/716088953498042369 …",,,,716095380455165952,https://twitter.com/ArvindKejriwal/status/716095380455165952
2016-04-02 02:41:25,ArvindKejriwal,,205,769,886,"pic.twitter.com/7GngEzusOO",,,,716093148527591424,https://twitter.com/ArvindKejriwal/status/716093148527591424
2016-04-02 02:30:05,INCIndia,,41,231,238,"एक राष्ट्र नागरिकों के बीच आपसी संबंध और बातचीत ही है।pic.twitter.com/i4WjZMW0uT",,,,716090296774164480,https://twitter.com/INCIndia/status/716090296774164480
2016-04-01 22:05:26,PMOIndia,,143,636,3153,"A summit, deliberations & bilateral meetings...PM had a packed schedule in USA. He now leaves for Saudi Arabia.pic.twitter.com/plmR76frxk",,,,716023695685234688,https://twitter.com/PMOIndia/status/716023695685234688
2016-04-01 22:00:45,narendramodi,,588,1876,6398,"My Washington DC visit was full of fruitful meetings & interactions. We have discussed an issue of great global importance at #NSS2016.",,,#NSS2016,716022515173167104,https://twitter.com/narendramodi/status/716022515173167104
2016-04-01 21:45:06,narendramodi,,190,2323,7219,"Continuing the dialogue with my friend @AbeShinzo…we are very optimistic about what India-Japan ties can achieve.pic.twitter.com/qTarqDskky",,@AbeShinzo,,716018577552203776,https://twitter.com/narendramodi/status/716018577552203776
2016-04-01 20:43:21,PMOIndia,,59,516,1612,"Prime Ministers @narendramodi & @AbeShinzo meet in Washington DC & deliberate on further deepening India-Japan ties.pic.twitter.com/2AbCOMtaF5",,@narendramodi @AbeShinzo,,716003035667939330,https://twitter.com/PMOIndia/status/716003035667939330
2016-04-01 19:50:44,narendramodi,,199,1521,4859,"My meeting with PM @David_Cameron focused on defence cooperation, @makeinindia & other key issues.pic.twitter.com/zFENJehD4U",,@David_Cameron @makeinindia,,715989796653543425,https://twitter.com/narendramodi/status/715989796653543425
2016-04-01 19:44:36,narendramodi,MEAIndia,84,1089,2893,"Was indeed wonderful to meet you again @JustinTrudeau. The new energy & dynamism in India-Canada ties is gladdening.https://twitter.com/meaindia/status/715909611467870210 …",,@JustinTrudeau,,715988251232833538,https://twitter.com/narendramodi/status/715988251232833538
2016-04-01 19:43:35,narendramodi,,121,1565,4576,"There have been enriching interactions and discussions on Nuclear Security during #NSS2016.pic.twitter.com/7ZXmwojfBn",,,#NSS2016,715987996932235264,https://twitter.com/narendramodi/status/715987996932235264
2016-04-01 19:40:22,narendramodi,,130,865,2382,"NSS is about a commitment to making our world safer & creating a better tomorrow for future… https://www.instagram.com/p/BDq21i9M_09/",,,,715987186215157761,https://twitter.com/narendramodi/status/715987186215157761
2016-04-01 18:12:34,PMOIndia,,100,685,2195,"A Summit that has brought together several nations to discuss a subject of great importance.pic.twitter.com/I4jPxvOZFc",,,,715965091342983168,https://twitter.com/PMOIndia/status/715965091342983168
2016-04-01 16:30:17,INCIndia,,33,174,126,"मोदी जी के मंत्री ने किसान को आत्महत्या करने को कहाhttps://www.youtube.com/watch?v=Ryh0ZmQUxMI&feature=youtu.be …",,,,715939350312124417,https://twitter.com/INCIndia/status/715939350312124417
2016-04-01 16:24:44,PMOIndia,,54,421,1405,"Enhancing a vibrant partnership...PM @narendramodi & PM @David_Cameron talk India-UK ties. @Number10govpic.twitter.com/P4a1BWAftt",,@narendramodi @David_Cameron @Number10govpic,,715937954435346432,https://twitter.com/PMOIndia/status/715937954435346432
2016-04-01 16:19:27,ArvindKejriwal,madversity,359,819,1003,". @madversity Sir, waste disposal is wid MCD. Next year, after winning MCD elections, we will work on waste disposal on war footing",,@madversity,,715936625738391552,https://twitter.com/ArvindKejriwal/status/715936625738391552
2016-04-01 16:15:14,ArvindKejriwal,,932,1612,1675,"Some IDBI officials met me today abt their demands. They were later grilled by an IB officer named Tyagi abt what was discussed wid me.",,,,715935565439340544,https://twitter.com/ArvindKejriwal/status/715935565439340544
2016-04-01 15:30:18,INCIndia,,21,179,175,"Sardar Patel and Lord Mountbatten, 1948pic.twitter.com/1Xrlk2BqnZ",,,,715924256811397120,https://twitter.com/INCIndia/status/715924256811397120
2016-04-01 14:35:56,PMOIndia,,43,298,1110,"Canadian connect...today's meetings commence with an interaction with Canada's PM @JustinTrudeau. Both PMs discuss India-Canada relations.",,@JustinTrudeau,,715910573339193346,https://twitter.com/PMOIndia/status/715910573339193346
2016-04-01 14:30:24,INCIndia,,17,148,125,"हमारे सभी मतभेद एक राष्ट्र और एक देश की पृष्ठभूमि में हल होने चाहिए: Lal Bahadur Shastrihttps://www.youtube.com/watch?v=46iXuKvEXhY …",,,,715909180662484993,https://twitter.com/INCIndia/status/715909180662484993
2016-04-01 13:38:17,RajaBrar_INC,,13,292,251,"Visited the devastated part of the collapsed flyover in Kolkata and met those who were injured in the collapse.pic.twitter.com/ZwVnbrJPfv",,,,715896067607298048,https://twitter.com/RajaBrar_INC/status/715896067607298048
2016-04-01 13:30:30,INCIndia,,67,248,209,"मोदी जी का झूला झुलाना भी काम नहीं आया,UN में मसूद अजहर पर प्रतिबंध लगाने की भारत की कोशिश का चीन ने विरोध किया है।pic.twitter.com/PPzWfW6MuC",,,,715894107634139139,https://twitter.com/INCIndia/status/715894107634139139
2016-04-01 12:53:10,INCIndia,INCIndia,1,114,86,"Watch the recording of AICC Press Briefing by Dr Abhishek Manu Singhvi recorded earlier today.https://www.youtube.com/watch?v=65AbdZP_Avc …",,,,715884713483743233,https://twitter.com/INCIndia/status/715884713483743233
2016-04-01 12:26:48,BJP4India,,4,172,272,". @BJP4Bengal releases charge sheet: Growing 'fear, hunger & corruption' in West Bengal under @MamataOfficial govt -https://www.youtube.com/watch?v=qbYLuX8jbxM …",,@BJP4Bengal @MamataOfficial,,715878077792825344,https://twitter.com/BJP4India/status/715878077792825344
2016-04-01 12:22:41,MamataOfficial,MamataOfficial,10,19,96,"#RealBengal এটি পুরুলিয়ার ছৌ-শিল্পী রমানাথ সিং মুরার কাহিনী। বর্তমানে তিনি তাঁর প্রাপ্য স্বীকৃতি পেয়েছেন >>https://goo.gl/sq0B4V",,,#RealBengal,715877040100999168,https://twitter.com/MamataOfficial/status/715877040100999168
2016-04-01 12:22:29,MamataOfficial,,5,50,97,"#RealBengal The story of Ramanath Singh Mura from Purulia, a Chhau artiste from Purulia who got due recognition >> https://goo.gl/sq0B4V",,,#RealBengal,715876991111532544,https://twitter.com/MamataOfficial/status/715876991111532544
2016-04-01 12:14:32,INCIndia,,23,224,167,"BJP forgets all promises after it gets power. After abandoning farmers, Maha CM goes back on promise on Toll plazaspic.twitter.com/FmewDP4ll5",,,,715874988285243392,https://twitter.com/INCIndia/status/715874988285243392
2016-04-01 11:29:47,INCIndia,INCIndia,6,122,103,"The accuser has become the accused. Accused has become the investigator. This reversal of roles achieved by a blundering Govt: Dr.Singhvi",,,,715863728986587136,https://twitter.com/INCIndia/status/715863728986587136
2016-04-01 11:29:14,INCIndia,INCIndia,5,103,79,"...On the other hand ISI parading a K.Jadhav as an Indian terrorist. When did we achieve this strange reversal of roles?: Dr.Singhvi",,,,715863589916049408,https://twitter.com/INCIndia/status/715863589916049408
2016-04-01 11:24:08,INCIndia,INCIndia,1,90,50,"Its ironical that one the one hand we have a JIT invited to India, which then gives a clean chit to JeM...",,,,715862305603366912,https://twitter.com/INCIndia/status/715862305603366912
2016-04-01 11:20:40,INCIndia,INCIndia,2,81,43,"Did we need certificate from Pak to tell us they are from Pak? Asking for this certificate, does it not amount to legitimation?: Dr. Singhvi",,,,715861435243372544,https://twitter.com/INCIndia/status/715861435243372544
2016-04-01 11:17:28,INCIndia,INCIndia,5,85,58,"Sad spectacle of senior ministers like Shri Rajnath Singh & Shri Amit Shah exhorting Indians to have faith in Pak: Dr. Singhvi",,,,715860629291044864,https://twitter.com/INCIndia/status/715860629291044864
2016-04-01 11:16:09,INCIndia,INCIndia,3,80,48,"Credible reports suggest that the Pak team has done its task well. They have said that they find no link of JeM/Azhar with Pathankot attack.",,,,715860295864877057,https://twitter.com/INCIndia/status/715860295864877057
