date,username,to,replies,retweets,favorites,text,geo,mentions,hashtags,id,permalink
2016-04-11 08:10:58,INCIndia,,31,256,246,"Voters of Assam will reward INC for the good work done in the last 15 years: Dr. Manmohan Singhpic.twitter.com/hBITXDzTqm",,,,719437572556992512,https://twitter.com/INCIndia/status/719437572556992512
2016-04-11 08:08:46,INCIndia,,3,313,251,"Former PM Dr. Manmohan Singh casts his vote in Dispur for final phase of Assam Assembly pollspic.twitter.com/Zg9nv0qRKt",,,,719437020158820352,https://twitter.com/INCIndia/status/719437020158820352
2016-04-11 07:47:59,PMOIndia,,56,525,1778,"President Abdulla Yameen Abdul Gayoom of Maldives and PM @narendramodi meet in New Delhi, discuss bilateral ties.pic.twitter.com/xn3zMWuuQL",,@narendramodi,,719431788351791104,https://twitter.com/PMOIndia/status/719431788351791104
2016-04-11 06:54:33,ncbn,,10,44,188,"Tributes to social reformer Jyotiba Phule on his birth anniversary. His efforts in breaking the caste hegemony will always be remembered.",,,,719418342998605824,https://twitter.com/ncbn/status/719418342998605824
2016-04-11 06:29:32,INCIndia,,13,206,148,"In Punjab: We're with you on SYL Issue In Haryana: We're with you on SYL issue Result: Flip-flop Kejriwal jipic.twitter.com/qMsgUBMQxu",,,,719412045670559744,https://twitter.com/INCIndia/status/719412045670559744
2016-04-11 06:13:18,RajaBrar_INC,,8,212,198,"Just reached Nagpur for Babasaheb Ambedkar's 125th birth anniversary programme.pic.twitter.com/KuxQ3uX6N6",,,,719407962364588032,https://twitter.com/RajaBrar_INC/status/719407962364588032
2016-04-11 05:48:06,narendramodi,,310,1562,4279,"Inspired by Mahatma Phule's ideals, let us collectively work to create an equal & harmonious society where the role of education is pivotal.",,,,719401618286874624,https://twitter.com/narendramodi/status/719401618286874624
2016-04-11 05:47:41,narendramodi,,140,1280,3497,"Mahatma Phule was a stalwart ahead of his time, who gave voice to the marginalised & sought to end their suffering. Tributes on his Jayanti.",,,,719401512271618048,https://twitter.com/narendramodi/status/719401512271618048
2016-04-11 05:30:07,INCIndia,,3,117,95,"Poem by Sahitya Akademi Award winner, Bhagwati Charan Vermapic.twitter.com/CmgnkZifBY",,,,719397093824049152,https://twitter.com/INCIndia/status/719397093824049152
2016-04-11 05:04:40,ArvindKejriwal,,522,1082,940,"pic.twitter.com/mdNMq9U816",,,,719390687678976001,https://twitter.com/ArvindKejriwal/status/719390687678976001
2016-04-11 04:30:04,INCIndia,,1,130,92,"At its Bombay Session, the Congress protested the violation of rules by Lord Curzon http://inc.in/INC-Time-Line pic.twitter.com/AO1tYOLdps",,,,719381980136153088,https://twitter.com/INCIndia/status/719381980136153088
2016-04-11 04:21:42,arunjaitley,,65,248,1091,"I convey my best wishes & birthday greetings to Smt. Sumitra Mahajan ji, hon’ble Speaker/LS, May God bless her with good health & long life.",,,,719379876604567552,https://twitter.com/arunjaitley/status/719379876604567552
2016-04-11 04:21:04,MamataOfficial,,6,53,135,"Remembering the legendary painter, Padma Bhushan Jamini Roy on his birth anniversary. He started a new art form with his legendary paintings",,,,719379716235354117,https://twitter.com/MamataOfficial/status/719379716235354117
2016-04-11 04:18:32,BJP4India,,31,463,832,"As voting begins for Assam & West Bengal, we urge voters to turn out in large numbers & cast their votes. #Vote4BJPpic.twitter.com/jOf732CdLD",,,#Vote4BJPpic,719379079976255488,https://twitter.com/BJP4India/status/719379079976255488
2016-04-11 03:30:05,INCIndia,,8,188,164,"Workers manufacturing National Flags of cotton Khadi conforming to the ISI specification, 1955pic.twitter.com/vPO7meVeNR",,,,719366886287237120,https://twitter.com/INCIndia/status/719366886287237120
2016-04-11 03:22:13,RahulGandhi,,58,673,694,"Remembering the great social reformer Mahatma Jyotiba Phule on his birth anniversary today",,,,719364906768736256,https://twitter.com/RahulGandhi/status/719364906768736256
2016-04-11 03:20:18,RahulGandhi,,93,648,718,"Will be in Nagpur today for Babasaheb Ambedkar's 125th birth anniversary programme",,,,719364425740722176,https://twitter.com/RahulGandhi/status/719364425740722176
2016-04-11 02:30:05,INCIndia,,4,190,176,"We pay tribute to Mahatma Jyotirao Govindrao Phule on his birth anniversary.pic.twitter.com/tiuc9Ko138",,,,719351785937248256,https://twitter.com/INCIndia/status/719351785937248256
2016-04-11 01:39:24,narendramodi,,786,2642,6944,"Requesting all those voting in Assam & West Bengal today to cast their vote in large numbers.",,,,719339032728047616,https://twitter.com/narendramodi/status/719339032728047616
2016-04-10 18:54:27,BJP4India,,29,446,648,"'Maha-Arti & prayers' to be organised in all districts to pay homage to the departed souls in #Kollamfire tragedy.pic.twitter.com/vJf2vu1yQy",,,#Kollamfire,719237121370796032,https://twitter.com/BJP4India/status/719237121370796032
2016-04-10 18:39:21,RajaBrar_INC,,3,136,111,"Was in Mumbai today for Baisakhi Di Raat organised by Punjabi Cultural Heritage Board.pic.twitter.com/IaAudd0beD",,,,719233322438635520,https://twitter.com/RajaBrar_INC/status/719233322438635520
2016-04-10 18:05:24,RajaBrar_INC,,2,191,174,"Joined and supported protesting jewellers in my constituency Gidderbaha, Punjab.pic.twitter.com/mgsvyoaXaO",,,,719224779425775617,https://twitter.com/RajaBrar_INC/status/719224779425775617
2016-04-10 18:02:33,RajaBrar_INC,,3,169,145,"Some more pictures from Gidderbaha, Punjab. With people from my constituency.pic.twitter.com/lyAKci0IPA",,,,719224061792944129,https://twitter.com/RajaBrar_INC/status/719224061792944129
2016-04-10 18:01:32,RajaBrar_INC,,0,114,71,"In Gidderbaha, Punjab.pic.twitter.com/N8IciQbwN9",,,,719223806032646144,https://twitter.com/RajaBrar_INC/status/719223806032646144
2016-04-10 17:49:35,mkstalin,,58,142,252,"Click here to read our manifesto in Tamil - http://bit.ly/1WlNAAc & in English - http://bit.ly/1WlNybM",,,,719220798116929537,https://twitter.com/mkstalin/status/719220798116929537
2016-04-10 17:48:26,mkstalin,,68,180,494,"Join us to fight for a new dawn, a new manifesto & governance model for making Tamil Nadu No.1 again #DMK2016pic.twitter.com/uWHXfZpwBa",,,#DMK2016pic,719220507342557184,https://twitter.com/mkstalin/status/719220507342557184
2016-04-10 15:21:11,ArvindKejriwal,msisodia,449,1016,1232,"Zero tolerance against corruptionhttps://twitter.com/msisodia/status/719165623754883072 …",,,,719183450360520704,https://twitter.com/ArvindKejriwal/status/719183450360520704
2016-04-10 15:18:17,INCIndia,,5,158,140,"Babasaheb Dr BR Ambedkar's 125th birth anniversary celebrations, tomorrow, 4 pm onwards at Kasturchand park, Nagpur https://www.facebook.com/125th-Birth-Anniversary-Celebration-of-Dr-Babasaheb-Ambedkar-1711905475754357/ …",,,,719182723386978304,https://twitter.com/INCIndia/status/719182723386978304
2016-04-10 14:52:09,BJP4India,,18,240,395,"Government of India stands with people of Kerala & the state govt in this tragic hour of Kollam fire incident: PMhttps://www.youtube.com/watch?v=j0b071epVQshttps://www.youtube.com/watch?v=j0b071epVQs …",,,,719176145204154368,https://twitter.com/BJP4India/status/719176145204154368
2016-04-10 14:30:11,INCIndia,,18,207,200,"Pt. Nehru receiving an honorary doctorate from Dwight D. Eisenhower in Columbia University, 1949pic.twitter.com/bBRXSerfKS",,,,719170619120623617,https://twitter.com/INCIndia/status/719170619120623617
2016-04-10 14:27:45,INCIndia,INCIndia,13,141,122,"Kerala Govt will do whatever is possible. If there's something that needs to be raised in Parliament at Central level, we'll do that: RG",,,,719170005108072450,https://twitter.com/INCIndia/status/719170005108072450
2016-04-10 14:09:06,INCIndia,INCIndia,35,397,376,"I have spoken to our Chief Minister & our leaders. Our Govt is acting decisively and swiftly: Rahul Gandhi on Kollam temple fire tragedy",,,,719165310612348928,https://twitter.com/INCIndia/status/719165310612348928
2016-04-10 14:05:43,INCIndia,,50,554,614,"This is a tragedy for Kerala and the whole country: Rahul Gandhi on Kollam temple fire tragedypic.twitter.com/9D3OKMwR6v",,,,719164458602405888,https://twitter.com/INCIndia/status/719164458602405888
2016-04-10 14:02:03,INCIndia,,16,389,388,"My prayers are with families of those who've lost loved ones in this terrible tragedy: Rahul Gandhi onKollam tragedypic.twitter.com/ywpeoHHMU5",,,,719163536912441346,https://twitter.com/INCIndia/status/719163536912441346
2016-04-10 13:59:57,PMOIndia,,125,685,2117,"The Prime Minister at Trivandrum Medical College.pic.twitter.com/5vDgyEBtpr",,,,719163008933453824,https://twitter.com/PMOIndia/status/719163008933453824
2016-04-10 13:50:28,INCIndia,,8,230,205,"Rahul Gandhi meeting the injured at the AA Rahim Memorial Hospital, Kollampic.twitter.com/LtqaqNqq5y",,,,719160623129493504,https://twitter.com/INCIndia/status/719160623129493504
2016-04-10 13:46:13,INCIndia,,11,294,253,"Rahul Gandhi meets those injured in the Kollam temple fire tragedy at the AA Rahim Memorial Hospitalpic.twitter.com/cTTQeRlU2X",,,,719159555121238016,https://twitter.com/INCIndia/status/719159555121238016
2016-04-10 13:43:18,BJP4India,,28,446,718,"FDI inflows have exceeded the current account deficit for the first time since 2004. #TransformingIndiapic.twitter.com/cnZM713GaE",,,#TransformingIndiapic,719158819138314241,https://twitter.com/BJP4India/status/719158819138314241
2016-04-10 13:37:34,INCIndia,,8,250,207,"Rahul Gandhi at the Puttingal fire tragedy site in Kollam, along with other Congress leaderspic.twitter.com/nj3Cf2ZI4V",,,,719157374800384000,https://twitter.com/INCIndia/status/719157374800384000
2016-04-10 13:00:21,INCIndia,,42,220,221,"इस देश की सबसे बड़ी शक्ति है जियो और जीनो दोpic.twitter.com/L53hHe3iwF",,,,719148010710503424,https://twitter.com/INCIndia/status/719148010710503424
2016-04-10 12:46:12,INCIndia,,21,273,231,"Rahul Gandhi at the Puttingal temple fire tragedy site in Kollampic.twitter.com/ZIKfHKvbDh",,,,719144450677551104,https://twitter.com/INCIndia/status/719144450677551104
2016-04-10 12:21:32,mkstalin,,41,144,294,"I am happy to share that @kalaignar89 will be releasing #DMK2016 manifesto today on YouTubehttps://www.youtube.com/watch?v=cet5GvrzstY&feature=youtu.be …",,@kalaignar89,#DMK2016,719138242931466240,https://twitter.com/mkstalin/status/719138242931466240
2016-04-10 12:13:23,PMOIndia,,117,882,2747,"PM @narendramodi meeting CM Oommen Chandy & local administration officials. Health Minister @JPNadda is also presentpic.twitter.com/wmU3Gzny4L",,@narendramodi @JPNadda,,719136191388364800,https://twitter.com/PMOIndia/status/719136191388364800
2016-04-10 12:02:16,PMOIndia,,67,594,1509,"PM @narendramodi at the Kollam district hospital.pic.twitter.com/nRd7sNgsgt",,@narendramodi,,719133391526821888,https://twitter.com/PMOIndia/status/719133391526821888
2016-04-10 11:30:07,INCIndia,,14,150,118,"हम सब एक माँ-बाप के परिजन हैं, इस प्रकार हमे रहना चाहिए: Sardar Patelhttps://www.youtube.com/watch?v=JuOi2g2Urvo&feature=youtu.be …",,,,719125302467629057,https://twitter.com/INCIndia/status/719125302467629057
2016-04-10 11:15:46,OmarAbdullah,,4,10,61,"Who else but a certain @sachin_rt. I'd recognise those @AudemarsPiguet watches anywhere. https://twitter.com/thehindu/status/719120955998507008 …",,@sachin_rt @AudemarsPiguet,,719121692618919937,https://twitter.com/OmarAbdullah/status/719121692618919937
2016-04-10 11:00:56,PMOIndia,,229,1350,3685,"PM @narendramodi at the site of the tragedy in Kollam with CM Oommen Chandy & other officials.pic.twitter.com/mXs8DwI2Xx",,@narendramodi,,719117958245580800,https://twitter.com/PMOIndia/status/719117958245580800
2016-04-10 10:57:25,OmarAbdullah,,48,125,418,"Hope these tremors don't result in any loss of life or serious loss of property. #prayers",,,#prayers,719117072165249024,https://twitter.com/OmarAbdullah/status/719117072165249024
2016-04-10 10:33:29,OmarAbdullah,,53,59,146,"That shook.",,,,719111050948259840,https://twitter.com/OmarAbdullah/status/719111050948259840
2016-04-10 10:30:08,INCIndia,,5,153,108,"Under the leadership of @tarun_gogoi, INC has has estd. a Univ for greater understanding of our ancient culturepic.twitter.com/wh4lMsMwM8",,@tarun_gogoi,,719110209361158144,https://twitter.com/INCIndia/status/719110209361158144
2016-04-10 09:30:09,INCIndia,,12,152,166,"साथ चलें http://inc.in/volunteers @INCVolunteerspic.twitter.com/A5m8W1LpfB",,@INCVolunteerspic,,719095112886714372,https://twitter.com/INCIndia/status/719095112886714372
2016-04-10 09:11:22,BJP4India,,18,234,421,"Crores of BJP karyakartas stand with the families of the victims: Shri @AmitShah on fire incident in Kollamhttps://www.youtube.com/watch?v=8Q4LAoKwaTo …",,@AmitShah,,719090383100116992,https://twitter.com/BJP4India/status/719090383100116992
2016-04-10 08:30:07,INCIndia,,11,162,130,"A new generation of doctors will be trained to help the people of India. @tarun_gogoipic.twitter.com/jGCm7F7zTy",,@tarun_gogoipic,,719080002101227520,https://twitter.com/INCIndia/status/719080002101227520
2016-04-10 08:04:00,ncbn,,26,105,338,"Devastated by the news of Kerala fire mishap in Puttingal temple that claimed more than 100 lives. Our sympathies to the effected families.",,,,719073430704787456,https://twitter.com/ncbn/status/719073430704787456
2016-04-10 08:00:12,INCIndia,,8,129,115,"For innovative solutions for the agri-sector, @tarun_gogoi set up the Agriculture university.pic.twitter.com/jLwACQqmeV",,@tarun_gogoi,,719072476240580610,https://twitter.com/INCIndia/status/719072476240580610
2016-04-10 07:59:11,mkstalin,,26,113,258,"Unfortunate incident has claimed over 90 lives, and has injured 200. My prayers are with the victims' families. #KollamTempleFire",,,#KollamTempleFire,719072220039892992,https://twitter.com/mkstalin/status/719072220039892992
2016-04-10 07:30:06,INCIndia,,10,246,202,"Babasaheb Ambedkar's 125th Birth Anniversary celebrations will be held on 11th April, 2016 at Nagpur by INCpic.twitter.com/82ztrV0GpC",,,,719064900836786177,https://twitter.com/INCIndia/status/719064900836786177
2016-04-10 07:21:25,INCIndia,,3,132,88,"ആദരാഞ്ജലികൾpic.twitter.com/DhqIFBlyH0",,,,719062713696030721,https://twitter.com/INCIndia/status/719062713696030721
2016-04-10 07:18:43,SachinPilot,,8,71,77,"Horrific tragedy in kollam. Over a 100 dead. Heartfelt condolences to families who lost their dear ones and prayers for those injured.",,,,719062035615494144,https://twitter.com/SachinPilot/status/719062035615494144
2016-04-10 07:11:55,laluprasadrjd,,32,81,227,"Gets deeply pained for innocent lives lost in such unfortunate tragedies. Heart goes out for the victims and families of #KollamFire.",,,#KollamFire,719060326377914368,https://twitter.com/laluprasadrjd/status/719060326377914368
2016-04-10 07:08:46,laluprasadrjd,,13,88,215,"Deeply saddened & pained by terrible #KollamTempleFire tragedy.My heartfelt condolences to deceased families& prayers 4 survivors nd injured",,,#KollamTempleFire,719059531162984449,https://twitter.com/laluprasadrjd/status/719059531162984449
2016-04-10 07:03:29,INCIndia,,15,317,235,"The entire Congress family stands with the bereaved families and the people of Kerala. May God be kind.pic.twitter.com/73NYycnzq0",,,,719058200327098368,https://twitter.com/INCIndia/status/719058200327098368
2016-04-10 07:02:16,INCIndia,,27,282,224,"Rahul Gandhi will be travelling to Kollam today to meet families affected by the tragic fire at Puttingal temple.pic.twitter.com/cCShePQliV",,,,719057897359945729,https://twitter.com/INCIndia/status/719057897359945729
2016-04-10 07:00:09,INCIndia,,4,132,87,"INC celebrating & curating the proud & plural culture of the NE. @tarun_gogoipic.twitter.com/5cAfBkjOoT",,@tarun_gogoipic,,719057362045132800,https://twitter.com/INCIndia/status/719057362045132800
2016-04-10 06:58:18,INCIndia,,38,328,294,"Offering her prayers for the deceased, Smt Sonia Gandhi has asked the State Govt to ensure immediate relief measurespic.twitter.com/K7xYXQpKQV",,,,719056896699736064,https://twitter.com/INCIndia/status/719056896699736064
2016-04-10 06:38:34,RajaBrar_INC,,5,196,148,"My prayers with families of those who lost their lives in #KollamTempleFire . May their souls rest in peace! Prayers with those injured.",,,#KollamTempleFire,719051931264548864,https://twitter.com/RajaBrar_INC/status/719051931264548864
2016-04-10 06:32:02,INCIndia,,11,150,102,"Now the children of Assam can learn about the mysteries of the universe. @tarun_gogoipic.twitter.com/jjQSvK8uaa",,@tarun_gogoipic,,719050287860752385,https://twitter.com/INCIndia/status/719050287860752385
2016-04-10 06:15:42,OmarAbdullah,,32,143,342,"Thoughts & prayers with the victims of #KollamTempleFire and their families. God be with them is this hour of darkness & despair.",,,#KollamTempleFire,719046176037703681,https://twitter.com/OmarAbdullah/status/719046176037703681
2016-04-10 06:11:41,RahulGandhi,,167,720,786,"Will be in Kollam this afternoon to meet the families affected by the tragic fire at Puttingal temple",,,,719045166275801088,https://twitter.com/RahulGandhi/status/719045166275801088
2016-04-10 05:41:17,JM_Scindia,,16,207,278,"Saddened to hear of the tragic incident in Kollam. My condolences to the families of the deceased & pray for the recovery of those injured.",,,,719037516225994752,https://twitter.com/JM_Scindia/status/719037516225994752
2016-04-10 05:36:07,arunjaitley,,93,397,1273,"I am saddened by the death of Devotees at Puttingal Devi temple of Paravur in Kollam, Kerala. May God give strength to bereaved families.",,,,719036213894623232,https://twitter.com/arunjaitley/status/719036213894623232
2016-04-10 05:30:05,INCIndia,,9,140,110,"Poem by Ayodhya Prasad Upadhyay 'Hariaudh.'pic.twitter.com/ivXyefFjnT",,,,719034699180445700,https://twitter.com/INCIndia/status/719034699180445700
2016-04-10 05:13:36,PMOIndia,,230,1051,2327,"A team of doctors including burn specialists will accompany PM @narendramodi to Kerala.",,@narendramodi,,719030550300725248,https://twitter.com/PMOIndia/status/719030550300725248
2016-04-10 04:49:08,PMOIndia,,255,1805,3986,"PM has directed that no protocol formalities be observed on his arrival in Kerala & focus remains on relief & rescue operations in Kollam.",,,,719024390885650432,https://twitter.com/PMOIndia/status/719024390885650432
2016-04-10 04:48:27,PMOIndia,,65,659,1562,"Rs. 50,000 will be provided to those injured in the fire at a temple in Kollam.",,,,719024220651413504,https://twitter.com/PMOIndia/status/719024220651413504
2016-04-10 04:48:22,RahulGandhi,,108,798,791,"Spoke to CM @Oommen_Chandy ji to ensure that adequate relief, medical care and assistance is being provided to the injured at the earliest",,@Oommen_Chandy,,719024198765522944,https://twitter.com/RahulGandhi/status/719024198765522944
2016-04-10 04:48:02,PMOIndia,,85,896,1986,"PM announced an ex-gratia relief of Rs. 2 lakhs each from PMNRF for next of kin of those who lost their lives in the fire in Kollam.",,,,719024116691435520,https://twitter.com/PMOIndia/status/719024116691435520
2016-04-10 04:47:22,PMOIndia,,75,716,1848,"PM will travel to Kerala in the wake of the fire in Kollam. He is constantly monitoring the situation & is in touch with officials.",,,,719023948541767680,https://twitter.com/PMOIndia/status/719023948541767680
2016-04-10 04:31:06,INCIndia,,11,129,110,". @tarun_gogoi delivered the Sports complex to tap into the potential of Assam in the world of sportspic.twitter.com/Yjlmqk67aP",,@tarun_gogoi,,719019854536122369,https://twitter.com/INCIndia/status/719019854536122369
2016-04-10 04:17:35,MamataOfficial,,15,89,192,"Very sad news from Kerala.My deepest condolences to the families who lost their loved ones. Prayers for those injured",,,,719016451214958594,https://twitter.com/MamataOfficial/status/719016451214958594
2016-04-10 04:15:22,INCIndia,INCIndia,5,188,131,"Praying for the departed souls & well being of the injured, Smt. Gandhi has asked the Government to ensure ample & immediate relief measures",,,,719015894765019136,https://twitter.com/INCIndia/status/719015894765019136
2016-04-10 04:14:23,INCIndia,,11,277,195,"Smt. Sonia Gandhi has expressed deep shock & grief at the tragic incident of deaths caused by fire at Puttingal temple in Kollam.",,,,719015645363326976,https://twitter.com/INCIndia/status/719015645363326976
2016-04-10 04:00:09,RahulGandhi,RahulGandhi,48,695,588,"My prayers are with the families of those who've lost loved ones in this terrible tragedy",,,,719012065801691136,https://twitter.com/RahulGandhi/status/719012065801691136
2016-04-10 03:59:49,RahulGandhi,,43,736,641,"News of the devastating fire at Puttingal temple in Kollam, Kerala is extremely shocking",,,,719011980900638720,https://twitter.com/RahulGandhi/status/719011980900638720
2016-04-10 03:30:09,INCIndia,,0,134,121,"Grubb Reflector of Kodaikanal Observatory in the erstwhile Madras State, 1951pic.twitter.com/ykREx86O3A",,,,719004514997526528,https://twitter.com/INCIndia/status/719004514997526528
2016-04-10 03:23:53,narendramodi,,1372,4308,10175,"I will be reaching Kerala soon to take stock of the situation arising due to the unfortunate fire tragedy in Kollam.",,,,719002936521527297,https://twitter.com/narendramodi/status/719002936521527297
2016-04-10 03:14:03,narendramodi,,258,2252,5697,"Have also asked my Cabinet colleague & Health Minister @JPNadda to immediately reach the site of the fire tragedy in Kollam.",,@JPNadda,,719000464033849344,https://twitter.com/narendramodi/status/719000464033849344
2016-04-10 03:09:29,narendramodi,,251,2844,6174,"Spoke to CM Oommen Chandy about the fire at a temple in Kollam. Arranging for immediate shifting of those critically injured via helicopter.",,,,718999312311554048,https://twitter.com/narendramodi/status/718999312311554048
2016-04-10 03:05:01,AmitShah,,83,556,1210,"Cancelling all my public programs scheduled in Kerala today.",,,,718998189454393345,https://twitter.com/AmitShah/status/718998189454393345
2016-04-10 03:04:35,AmitShah,,50,751,1293,"Pained beyond words at the loss of lives in fire incident in Puttingal temple,Kerala. My prayers with the family of those affected.",,,,718998082357071872,https://twitter.com/AmitShah/status/718998082357071872
2016-04-10 03:00:32,narendramodi,,711,4406,9449,"Fire at temple in Kollam is heart-rending & shocking beyond words. My thoughts are with families of the deceased & prayers with the injured.",,,,718997061694136320,https://twitter.com/narendramodi/status/718997061694136320
2016-04-10 02:47:28,ArvindKejriwal,timesofindia,314,821,850,"V sad to hear such tragic news. Prayers with all victims.https://twitter.com/timesofindia/status/718982531995934720 …",,,,718993775150759936,https://twitter.com/ArvindKejriwal/status/718993775150759936
2016-04-10 02:30:09,INCIndia,,14,149,140,"1901 Calcutta Session was the first time Mahatma Gandhi appeared on the Congress platform. http://inc.in/INC-Time-Line pic.twitter.com/zn2r7p3Oz8",,,,718989415570255873,https://twitter.com/INCIndia/status/718989415570255873
2016-04-10 02:10:38,ArvindKejriwal,Akshay,320,766,777,"Do watch this appeal for odd-even...https://twitter.com/akshay1malhotra/status/718821016437305348 …",,,,718984506078679040,https://twitter.com/ArvindKejriwal/status/718984506078679040
2016-04-09 18:45:12,INCIndia,,5,133,124,"The candidates selected by the C.E.C for the ensuing elections to the Legislative Assembly of Keralapic.twitter.com/jfKS5I2vfm",,,,718872406664679424,https://twitter.com/INCIndia/status/718872406664679424
2016-04-09 17:30:20,BJP4India,,20,169,377,"Shri @AmitShah will address public programs in Kerala on 10 April 2016. Get updates at @YuvaiTVpic.twitter.com/xd0DKReW0L",,@AmitShah @YuvaiTVpic,,718853566580936705,https://twitter.com/BJP4India/status/718853566580936705
2016-04-09 17:07:55,narendramodi,,478,2862,6729,"Soni Chaurasia, a bright youngster from Kashi has made us very proud. Congratulations to her. http://nbt.in/2xZUbZ",,,,718847925778919425,https://twitter.com/narendramodi/status/718847925778919425
2016-04-09 16:12:05,BJP4India,BJP4India,61,260,356,"आईआईटी छात्रों की फीसवृद्धि पूरी तरह से तर्कसंगत है : 'जरुरतमंदों की पूरी मदद भी की जा रही है'pic.twitter.com/1ll7Ql2HAF",,,,718833873572880384,https://twitter.com/BJP4India/status/718833873572880384
2016-04-09 16:09:38,BJP4India,,65,339,598,"आईआईटी छात्रों की फीसवृद्धि पूरी तरह से तर्कसंगत है : 'जरुरतमंदों की पूरी मदद भी की जा रही है'pic.twitter.com/Xk7gcRwNbS",,,,718833256569774080,https://twitter.com/BJP4India/status/718833256569774080
2016-04-09 16:00:34,INCIndia,,26,159,129,"मोदी राज में देशभक्तों की पिटाईhttps://www.youtube.com/watch?v=_uchU8DFPbQ&feature=youtu.be …",,,,718830976567091200,https://twitter.com/INCIndia/status/718830976567091200
2016-04-09 15:30:20,INCIndia,,48,244,226,"किसान और मजदूर की बात सुनिए उनकी समझ गहरी हैpic.twitter.com/alTq1TvRtG",,,,718823366258327553,https://twitter.com/INCIndia/status/718823366258327553
2016-04-09 15:17:56,OmarAbdullah,dna,53,50,116,"This is a new one. Haven't heard this demand before.https://twitter.com/dna/status/718819719613026304 …",,,,718820247571030018,https://twitter.com/OmarAbdullah/status/718820247571030018
