date,username,to,replies,retweets,favorites,text,geo,mentions,hashtags,id,permalink
2016-10-11 04:50:35,BJP4India,,20,365,868,"1.60 lakh farmers registered across 10 states with #eNAM, within 5 months of launch. #TransformingIndiapic.twitter.com/9toAKr2kQG",,,#eNAM #TransformingIndiapic,785704122104238080,https://twitter.com/BJP4India/status/785704122104238080
2016-10-11 04:44:48,JM_Scindia,,44,184,425,"दशहरा एवं विजयादशमी की हार्दिक शुभकामनाएँ। इस पावन अवसर पर ईश्वर से प्रार्थना है कि अधर्म और असत्य से लड़ने में हमेशा हम सब का साथ दें।",,,,785702667158822912,https://twitter.com/JM_Scindia/status/785702667158822912
2016-10-11 04:39:47,RajaBrar_INC,,7,200,281,"May this Dusshera burn away all your worries with Ravana. I wish you lots of happiness & the fulfilment of your dreams. #HappyDussehrapic.twitter.com/p5GUSmPqOF",,,#HappyDussehrapic,785701406678188033,https://twitter.com/RajaBrar_INC/status/785701406678188033
2016-10-11 03:54:55,ArvindKejriwal,,224,674,699,"http://www.dailyo.in/politics/delhi-government-lg-najeeb-jung-arvind-kejriwal-aam-aadmi-party-union-territories-narendra-modi-bjp-federalism/story/1/13345.html …",,,,785690115037274112,https://twitter.com/ArvindKejriwal/status/785690115037274112
2016-10-11 03:51:05,arunjaitley,,17,127,661,"pic.twitter.com/Wv9tXx7FyQ",,,,785689148963164166,https://twitter.com/arunjaitley/status/785689148963164166
2016-10-11 03:45:18,ncbn,,53,104,510,"With the blessings of Kanaka Durgamma & Krishnamma, I'm confident of giving a definite shape to a #ManaAmaravati by Vijaya Dasami next year.",,,#ManaAmaravati,785687696937062400,https://twitter.com/ncbn/status/785687696937062400
2016-10-11 03:44:37,ncbn,,35,118,660,"I pray to Goddess Durga to bless everyone and give them the strength to overcome all obstacles. Spread the happiness around. #HappyDussehra.",,,#HappyDussehra,785687523439710209,https://twitter.com/ncbn/status/785687523439710209
2016-10-11 03:43:29,ncbn,,20,43,278,"అందరూ ఆ జగదంబ అనుగ్రహంతో కళత్ర, పుత్ర, పౌత్ర, ఆరామాలతో సుఖసౌఖ్యాలను పొందాలని మనసారా కోరుకుంటూ శరన్నవరాత్రి శుభాకాoక్షలు.",,,,785687236255752192,https://twitter.com/ncbn/status/785687236255752192
2016-10-11 03:30:47,arunjaitley,,26,142,712,"pic.twitter.com/Juzdv34f0s",,,,785684041274011648,https://twitter.com/arunjaitley/status/785684041274011648
2016-10-11 03:30:01,INCIndia,,8,195,224,"Subho Bijoya!pic.twitter.com/o70F19pYTp",,,,785683847752978434,https://twitter.com/INCIndia/status/785683847752978434
2016-10-11 03:25:44,arunjaitley,,57,249,1250,"pic.twitter.com/xmRL5LEq9w",,,,785682772341862400,https://twitter.com/arunjaitley/status/785682772341862400
2016-10-11 03:22:28,RahulGandhi,,318,1305,2021,"विजयादशमी के अवसर पर आप सभी को बहुत बहुत शुभकामनाएं #HappyDussehra",,,#HappyDussehra,785681949880754180,https://twitter.com/RahulGandhi/status/785681949880754180
2016-10-11 03:16:38,laluprasadrjd,,62,133,474,"बुराई पर अच्छाई, अधर्म पर धर्म एवं असत्य पर सत्य की जीत के पावन पर्व दशहरा व विजयदशमी की आप सभी को हार्दिक शुभकामनायें। #HappyDussehra",,,#HappyDussehra,785680482059030528,https://twitter.com/laluprasadrjd/status/785680482059030528
2016-10-11 02:30:01,INCIndia,,27,265,341,"दशहरा बुराई पर अच्छाई की विजय का उत्सव है। आप सबको विजयदशमी की हार्दिक शुभकामनायें।pic.twitter.com/Ee8ceUscza",,,,785668748019638272,https://twitter.com/INCIndia/status/785668748019638272
2016-10-11 02:22:35,MamataOfficial,,38,76,507,"On the International Day of the Girl Child, my best wishes to all our Kanyashree girls. Girls are our assets. They are our future",,,,785666879444496384,https://twitter.com/MamataOfficial/status/785666879444496384
2016-10-11 02:21:52,MamataOfficial,,29,54,305,"Greetings to you all on the occasion of Dussehra. Let truth and justice triumph over evil",,,,785666697206206464,https://twitter.com/MamataOfficial/status/785666697206206464
2016-10-11 01:54:48,ArvindKejriwal,,586,1247,2254,"आप सबको विजयदशमी की शुभकामनाएं",,,,785659886268915712,https://twitter.com/ArvindKejriwal/status/785659886268915712
2016-10-11 01:53:37,MamataOfficial,,47,45,327,"Shubho Bijoyapic.twitter.com/vAlAVbDmFw",,,,785659587303120896,https://twitter.com/MamataOfficial/status/785659587303120896
2016-10-11 01:40:05,BJP4India,,29,254,773,"सभी देशवासियों को विजयादशमी की हार्दिक शुभकामनाएं। Happy Dussehra to everyone !pic.twitter.com/P8hHxHRGxE",,,,785656183172444161,https://twitter.com/BJP4India/status/785656183172444161
2016-10-11 01:20:14,narendramodi,,525,4711,13160,"On the Sthapana Diwas of the RSS, my greetings to all Swayamsevaks & best wishes in their endeavours to serve our nation.",,,,785651188653973504,https://twitter.com/narendramodi/status/785651188653973504
2016-10-11 01:18:15,narendramodi,,542,4375,18377,"Dear @SrBachchan, wishing you a very happy birthday. Your versatility & humility has many admirers. Praying for your long & healthy life.",,@SrBachchan,,785650687422058496,https://twitter.com/narendramodi/status/785650687422058496
2016-10-11 01:12:51,narendramodi,,136,1730,6796,"Nanaji Deshmukh was a stalwart blessed with a penchant for selfless service to society. Tributes to him on his birth anniversary.",,,,785649331118321664,https://twitter.com/narendramodi/status/785649331118321664
2016-10-11 01:10:47,narendramodi,,143,1951,7471,"I bow to Loknayak Jayprakash Narayan on his birth anniversary. His contribution towards preserving India’s democratic ideals is invaluable.",,,,785648807530811392,https://twitter.com/narendramodi/status/785648807530811392
2016-10-11 01:08:06,narendramodi,,1377,4421,12972,"Vijaya Dashmi greetings to you all. विजयादशमी के पावन पर्व पर आप सभी को शुभकामनाएं।",,,,785648135905304576,https://twitter.com/narendramodi/status/785648135905304576
2016-10-11 00:45:27,AmitShah,,51,706,2454,"अपने त्याग,समर्पण और संगठन कौशल से असंख्य कार्यकर्ताओं एवं देशवासियों के प्रेरणास्त्रोत बनने वाले राष्ट्र ऋषि नानाजी देशमुख की जयंती पर नमन|pic.twitter.com/LFYUnA0g8m",,,,785642434340335617,https://twitter.com/AmitShah/status/785642434340335617
2016-10-11 00:43:01,AmitShah,,97,975,2422,"विश्व के सबसे बड़े स्वयंसेवी संगठन ""राष्ट्रीय स्वयंसेवक संघ"" के स्थापना दिवस की हार्दिक शुभकामनाएं |pic.twitter.com/QO0suhUuNt",,,,785641821879672832,https://twitter.com/AmitShah/status/785641821879672832
2016-10-11 00:33:01,AmitShah,,129,664,2086,"अधर्म पर धर्म की जीत के महापर्व विजय दशमी की समस्त देशवासियों को हार्दिक शुभकामनाएं |pic.twitter.com/k0j68U1wbs",,,,785639304349437952,https://twitter.com/AmitShah/status/785639304349437952
2016-10-10 18:41:05,MamataOfficial,,24,91,431,"A very Happy Birthday to @SrBachchan Happiness and health . Alwayspic.twitter.com/ApJSXbCUxE",,@SrBachchan,,785550737136910337,https://twitter.com/MamataOfficial/status/785550737136910337
2016-10-10 17:33:13,BJP4India,,46,386,1126,"PM Shri @narendramodi will attend Dussehra Mahotsav on 11 October 2016 at 6PM in Lucknow, UP. Get LIVE updates at @BJPLIVE.pic.twitter.com/KTaOHaiKYC",,@narendramodi @BJPLIVE,,785533660799782912,https://twitter.com/BJP4India/status/785533660799782912
2016-10-10 16:44:54,ncbn,,25,72,478,"Inaugurated the Cyber Security & Analytics Centre as well as Innovation Centre at AU Engineering College.pic.twitter.com/AjpA8cdVdH",,,,785521500623298560,https://twitter.com/ncbn/status/785521500623298560
2016-10-10 16:17:49,ArvindKejriwal,PreetiSMenon,517,1251,1153,"V shocking, if true.https://twitter.com/preetismenon/status/785513959386251264 …",,,,785514682849202176,https://twitter.com/ArvindKejriwal/status/785514682849202176
2016-10-10 15:41:50,RajaBrar_INC,,1,113,104,"At Gurusar, Rukhla, Kothe Surgapuri in Gidderbaha, Punjab yesterday.pic.twitter.com/sNrPARolEq",,,,785505627065815040,https://twitter.com/RajaBrar_INC/status/785505627065815040
2016-10-10 15:40:02,ArvindKejriwal,AamAadmiParty,959,1128,1314,"BJP losing badly in Goahttps://twitter.com/aamaadmiparty/status/785504887392047104 …",,,,785505173640663040,https://twitter.com/ArvindKejriwal/status/785505173640663040
2016-10-10 15:30:01,INCIndia,,75,287,343,"Under the Modi regime, soldiers & farmers are being disrespected and red carpet is being rolled out for 10-15 people.pic.twitter.com/x2ntt20JvM",,,,785502652763439104,https://twitter.com/INCIndia/status/785502652763439104
2016-10-10 15:30:00,JM_Scindia,,23,136,355,"सभी को महानवमी की ढेरों शुभकामनाएँ। आइये हम सब प्रण लें की देवी समान हमारी बेटियों को आगे बढ़ाने के हरसंभव प्रयास करें।",,,,785502652285059072,https://twitter.com/JM_Scindia/status/785502652285059072
2016-10-10 15:06:35,laluprasadrjd,,66,285,420,"Slashing Disability Pension is Modi Govt's way of conveying to our Jawans tht once U lose your utility, you are not even human for us! Shame",,,,785496755630669824,https://twitter.com/laluprasadrjd/status/785496755630669824
2016-10-10 15:02:15,laluprasadrjd,,118,183,450,"विडम्बना ही है कि जिन सैनिकों के दम पर मोदीजी राजनीति कर रहे हैं अब उन्हीं सैनिकों के साथ असंवेदनशील षड्यंत्र रच रहे हैं। शर्म करो...शर्म",,,,785495665770106880,https://twitter.com/laluprasadrjd/status/785495665770106880
2016-10-10 14:57:38,laluprasadrjd,,85,189,447,"Ironic tht same Govt was thumping it's chest ovr Surgical Strikes 4 political gain, nw doing surgery of our own Jawans by slashing pensions",,,,785494503549444096,https://twitter.com/laluprasadrjd/status/785494503549444096
2016-10-10 14:46:41,laluprasadrjd,,43,116,212,"Amid army's achievement & act of courage, Modi stabbed army in back. Gross insult & disrespect to brave soldiers http://googleweblight.com/?lite_url=http://wap.business-standard.com/article/economy-policy/government-slashes-army-s-disability-pensions-116100900688_1.html&ei=SDFz0cIz&lc=en-IN&s=1&m=8&host=www.google.co.in&ts=1476108539&sig=AF9NedkLEbsc5IckQdt9tcSQMKr2JMVB4A …",,,,785491749988950016,https://twitter.com/laluprasadrjd/status/785491749988950016
2016-10-10 13:14:54,INCIndia,,17,284,362,"We will restore Punjab's glory. Join us as we embark on the Kisan Yatra from 12th Octoberpic.twitter.com/tosSvENI80",,,,785468652300611585,https://twitter.com/INCIndia/status/785468652300611585
2016-10-10 12:30:57,ArvindKejriwal,,727,1788,1897,"This is very wrong. Our soldiers deserve better. I urge centre to increase disability pension n not decrease ithttp://wap.business-standard.com/article/economy-policy/government-slashes-army-s-disability-pensions-116100900688_1.html …",,,,785457593045004288,https://twitter.com/ArvindKejriwal/status/785457593045004288
2016-10-10 12:30:00,INCIndia,,51,431,519,"""History will be kinder to me than the media"" - Dr Manmohan Singh, January 2014pic.twitter.com/EdrAaw6oNQ",,,,785457354112368640,https://twitter.com/INCIndia/status/785457354112368640
2016-10-10 12:13:22,INCIndia,INCIndia,3,104,113,"Watch the recording of today's AICC press briefing:https://www.youtube.com/watch?v=vVaH5whI87c …",,,,785453167567790082,https://twitter.com/INCIndia/status/785453167567790082
2016-10-10 12:05:18,INCIndia,INCIndia,14,171,204,"बीएसपी से आये बृजलाल खाबरी और ध्रुवराम लोधी का कांग्रेस पार्टी में स्वागत करते हैं. उनके आने से पार्टी को मजबूती मिलेगी: @ghulamnazad",,@ghulamnazad,,785451135792316416,https://twitter.com/INCIndia/status/785451135792316416
2016-10-10 11:57:28,INCIndia,INCIndia,8,154,178,"आज किसान की 6 महीने की फसल बाजार में हैं और मोदी जी की सरकार न्यूनतम समर्थन मूल्य पर फसल की खरीद नहीं कर रही : @rssurjewala",,@rssurjewala,,785449163186057216,https://twitter.com/INCIndia/status/785449163186057216
2016-10-10 11:55:28,INCIndia,INCIndia,5,100,108,".. तुगलकी फरमान को वापस लेगें: @rssurjewala",,@rssurjewala,,785448660121161728,https://twitter.com/INCIndia/status/785448660121161728
2016-10-10 11:55:18,INCIndia,INCIndia,4,129,160,".. वो ऐसा दोबारा नहीं करेगें और देश की सेना की 7वें वेतन आयोग की विसंगतियों को दूर करेगें और disability pension को कम करने के ..",,,,785448620875067392,https://twitter.com/INCIndia/status/785448620875067392
2016-10-10 11:54:55,INCIndia,INCIndia,11,131,156,"पीएम मोदी जी, भाजपा राष्ट्रीय अध्यक्ष और रक्षा मंत्री देश की सेना का राजनीतिकरण करने के लिए सार्वजानिक माफ़ी मांगें और ये वादा करें कि ..",,,,785448521541365760,https://twitter.com/INCIndia/status/785448521541365760
2016-10-10 11:48:46,INCIndia,INCIndia,5,123,127,".. 45200 रूपये से घटाकर 27200 रूपये कर दी है, ये शर्म की बात है: @rssurjewala",,@rssurjewala,,785446974665338881,https://twitter.com/INCIndia/status/785446974665338881
2016-10-10 11:48:32,INCIndia,INCIndia,6,141,165,".. आधा कर दिया. ये कैसा न्याय है? अगर कोई सैनिक 100% disabale हो जाये तो मोदी सरकार ने उसकी मासिक पेंशन ..",,,,785446917010432001,https://twitter.com/INCIndia/status/785446917010432001
2016-10-10 11:48:17,INCIndia,INCIndia,5,126,136,"सर्जिकल स्ट्राइक करने वाला सैनिक अगर चोटिल हो जाये तो मोदी जी आपने 30 सितम्बर के एक आदेश से उसे मिलने वाली disability pension को आपने ..",,,,785446853571600384,https://twitter.com/INCIndia/status/785446853571600384
2016-10-10 11:42:24,INCIndia,INCIndia,2,123,110,"तीनों सेना प्रमुखों ने 7 वें वेतन आयोग में जो एतराज दर्ज किये हैं आपने उन्हें रद्दी की टोकरी में क्यू डाल दिया? @rssurjewala",,@rssurjewala,,785445373305196544,https://twitter.com/INCIndia/status/785445373305196544
2016-10-10 11:40:26,INCIndia,INCIndia,11,128,121,"हम मोदी जी से पूछना चाहते हैं कि वन रैंक वन पेंशन के सिद्धांत को आपने वन रैंक अनेक पेंशन के सिद्धांत में क्यू बदल डाला? @rssurjewala",,@rssurjewala,,785444878314381312,https://twitter.com/INCIndia/status/785444878314381312
2016-10-10 11:38:46,INCIndia,INCIndia,7,130,119,"एक तरफ सर्जिकल स्ट्राइक का श्रेय लेने की होड़ है और दूसरी तरफ मोदी सरकार सेना वालो के साथ भेदभाव वाला व्यवहार कर रही है: @rssurjewala",,@rssurjewala,,785444460742123528,https://twitter.com/INCIndia/status/785444460742123528
2016-10-10 11:34:04,INCIndia,INCIndia,9,131,133,"सेना की बहादुरी और पराक्रम देश के 125 करोड़ लोगों की है. सैनिक किसी राजनैतिक पार्टी को श्रेय देने के किये कुर्बानी नहीं देता: @rssurjewala",,@rssurjewala,,785443277000417282,https://twitter.com/INCIndia/status/785443277000417282
2016-10-10 11:31:36,INCIndia,INCIndia,12,145,142,"शहीद हेमराज की पत्नी श्रीमती धर्मवती से सीख ले लेते जिन्होंने कल ही कहा कि हमारे पति और शहीदों पर राजनीति बंद कर दीजिये: @rssurjewala",,@rssurjewala,,785442653739491328,https://twitter.com/INCIndia/status/785442653739491328
2016-10-10 11:30:48,INCIndia,INCIndia,6,113,105,".. शहादत पर राजनीति ना करने की सीख दी थी: @rssurjewala",,@rssurjewala,,785442452379348993,https://twitter.com/INCIndia/status/785442452379348993
2016-10-10 11:30:00,INCIndia,INCIndia,11,133,134,"मोदी जी, रक्षा मंत्री और कानून मंत्री शहीद सुबोध की पत्नी श्रीमती सीमा से ही सीख ले लेते, जिसमें उन्होंने सरकार और राजनैतिक पार्टियों को ..",,,,785442254710120448,https://twitter.com/INCIndia/status/785442254710120448
2016-10-10 11:22:32,INCIndia,INCIndia,8,126,124,".., रक्षा मंत्री और कानून मंत्री रवि शंकर प्रसाद जी सेना की 68 साल की वीरगाथा को छोटा बनाने में लगे हैं: @rssurjewala",,@rssurjewala,,785440372541431808,https://twitter.com/INCIndia/status/785440372541431808
2016-10-10 11:22:10,INCIndia,INCIndia,7,143,153,"स्वयं पूर्व सेना प्रमुख जनरल विक्रम सिंह ने जुलाई 2013 और जनवरी 2014 की सार्वजानिक पुष्टि की है. झूठ पर झूठ बोलकर अमित शाह जी, ..",,,,785440283039141888,https://twitter.com/INCIndia/status/785440283039141888
2016-10-10 11:14:35,INCIndia,INCIndia,7,93,89,".. कोशिश नहीं की: @rssurjewala",,@rssurjewala,,785438374744104960,https://twitter.com/INCIndia/status/785438374744104960
2016-10-10 11:14:22,INCIndia,INCIndia,10,135,142,"..जिनको जवाब चाहिए था और जिनको जवाब मिलना चाहिए था उनको जवाब मिल गया था और ये हमारी बहादुर सेना ने किया था, सरकार ने उसका श्रेय लेने की ..",,,,785438319706386432,https://twitter.com/INCIndia/status/785438319706386432
2016-10-10 11:13:43,INCIndia,INCIndia,8,114,128,".. को मारा था. इसका खुलासा स्वयं उस ऑपरेशन के प्रमुख और जाबांज सिपाही मेजर जनरल एस के चक्रवर्ती द्वारा की गयी.हमने इसका ढिंढोरा नहीं पीटा..",,,,785438156254351362,https://twitter.com/INCIndia/status/785438156254351362
2016-10-10 11:13:25,INCIndia,INCIndia,4,119,130,".. जो हमने आपको बताई थी कि 30 अगस्त और 1 सितम्बर 2011 को भारतीय सेना और पैरा कमांडोज ने पाकिस्तान की सीमा में घुसकर दुश्मन के 13 सैनिकों ..",,,,785438078865334276,https://twitter.com/INCIndia/status/785438078865334276
2016-10-10 11:13:07,INCIndia,INCIndia,4,120,135,"कल ही एक समाचार पत्र समूह द्वारा भारतीय सेना की असीम बहादुरी से पूर्ण एक और सर्जिकल स्ट्राइक ऑपरेशन जिंजर का खुलासा हुआ.ये वही तारीख है ..",,,,785438002772258817,https://twitter.com/INCIndia/status/785438002772258817
2016-10-10 11:02:47,INCIndia,INCIndia,7,116,108,".. . 9 अक्टूबर 2016 को प्रधानमन्त्री मोदी जी इस पंक्ति में शामिल हो गये और टिपण्णी करके राजनैतिक फायदा लेने की कोशिश की: @rssurjewala",,@rssurjewala,,785435402312179712,https://twitter.com/INCIndia/status/785435402312179712
2016-10-10 11:02:26,INCIndia,INCIndia,14,119,125,".. कि 68 साल में सेना ने पहली बार LOC पार की है और ये सर्जिकल स्ट्राइक हम पूरे देश में लेकर जायेगें यानि खुलेआम इसकी राजनैतिक रोटी सकेंगे..",,,,785435315771019264,https://twitter.com/INCIndia/status/785435315771019264
2016-10-10 11:02:01,INCIndia,INCIndia,11,116,131,"..अहंकारी स्वर में कहते हैं कि अब मोदी जी का सीना 100 इंच का हो गया है. 7 अक्टूबर को भाजपा के अध्यक्ष अमित शाह घमंड पूर्वक उद्घोष करते हैं..",,,,785435211999817728,https://twitter.com/INCIndia/status/785435211999817728
2016-10-10 11:01:39,INCIndia,INCIndia,1,109,102,"1 अक्टूबर 2016 को रक्षा मंत्री कहते हैं कि मोदी सरकार ने पहली बार भारतीय सेना को अपनी शक्ति का अहसास कराया.इसी दिन मप्र के मुख्यमंत्री ..",,,,785435119414681600,https://twitter.com/INCIndia/status/785435119414681600
2016-10-10 10:54:01,INCIndia,INCIndia,12,122,119,"भाजपा और उनका शीर्ष नेतृत्व 68 साल की सेना की बहादुरी, वीरता और पराक्रम का घोर अपमान में लगी हुई है, और इसके 4 उदहारण हैं: @rssurjewala",,@rssurjewala,,785433196225703939,https://twitter.com/INCIndia/status/785433196225703939
2016-10-10 10:51:53,INCIndia,INCIndia,13,141,156,"..रक्षा मंत्री का सम्मान समारोह,भाजपा की बयानबाजी और पोस्टरबाजी से साफ है कि सैन्य पराक्रम को भाजपा पोलिटिकल टूल की तरह इस्तेमाल कर रही है.",,,,785432661258936321,https://twitter.com/INCIndia/status/785432661258936321
2016-10-10 10:51:05,INCIndia,INCIndia,14,129,146,"शहीदों की कुर्बानी का इस्तेमाल यूपी और पंजाब में वोट बटोरने के लिए किया जा रहा है. देश की सेना बलिदान दे और गोवा से आगरा और लखनऊ तक ..",,,,785432457520701440,https://twitter.com/INCIndia/status/785432457520701440
2016-10-10 10:47:03,JM_Scindia,,25,156,331,"मेरा मक़सद चंदेरी को केवल एक नया अवतार देना नहीं, बल्कि इस शहर के गौरवान इतिहास को पुन: जीवांत करना है | #ChaloChanderipic.twitter.com/kZ30uXucEM",,,#ChaloChanderipic,785431442994016257,https://twitter.com/JM_Scindia/status/785431442994016257
