date,username,to,replies,retweets,favorites,text,geo,mentions,hashtags,id,permalink
2016-04-20 10:51:27,INCIndia,INCIndia,8,73,39,"A grave agrarian & drinking water crisis plagues nearly 40% of India's population today: @rssurjewala",,@rssurjewala,,722739450590007296,https://twitter.com/INCIndia/status/722739450590007296
2016-04-20 10:49:43,INCIndia,,18,102,102,"Watch Now: AICC press briefing by @rssurjewala, LIVE athttp://www.inc.in/",,@rssurjewala,,722739015674306560,https://twitter.com/INCIndia/status/722739015674306560
2016-04-20 10:37:18,INCIndia,,10,274,229,"After the efforts of @OfficeOfRG & Raj PCC, Raje Govt seeks CBI probe into death of young Dalit girl, Delta Meghwalpic.twitter.com/sS2iiBmFrR",,@OfficeOfRG,,722735889827246080,https://twitter.com/INCIndia/status/722735889827246080
2016-04-20 10:22:44,SachinPilot,,8,76,92,"2men die working in an illegal mine in ajmer. Locals allege that police,admn,govt,all involved with the mining mafiapic.twitter.com/KfLQxvkX5C",,,,722732223703695360,https://twitter.com/SachinPilot/status/722732223703695360
2016-04-20 10:00:11,MamataOfficial,,8,67,147,"Birthday greetings @ncbn Chandrababu Naidu ji. We pray for your long life and good health",,@ncbn,,722726548869132289,https://twitter.com/MamataOfficial/status/722726548869132289
2016-04-20 09:33:53,RahulGandhi,RahulGandhi,215,658,563,"We will continue to stand up against injustice wherever it happens and expose BJP's hypocrisy &lack of will to protect the poor &vulnerable",,,,722719929200439296,https://twitter.com/RahulGandhi/status/722719929200439296
2016-04-20 09:33:07,RahulGandhi,RahulGandhi,83,616,511,"Proud that @INCIndia stood alongside Delta's family & fought hard to put pressure on the Rajasthan Govt",,@INCIndia,,722719737650683904,https://twitter.com/RahulGandhi/status/722719737650683904
2016-04-20 09:29:48,RahulGandhi,,141,780,711,"Under pressure, Rajasthan Govt finally gives in to the demand for CBI inquiry into rape &murder of minor Dalit girlhttp://indianexpress.com/article/india/india-news-india/rajasthan-dalit-girl-death-sbi-probe-vasundhara-raje-2761420/ …",,,,722718903860727808,https://twitter.com/RahulGandhi/status/722718903860727808
2016-04-20 08:30:34,INCIndia,,16,201,153,"SAD-BJP ने आज पंजाब को ऐसे मोड़ पर लाकर खड़ा कर दिया है जहां बैंक राज्य सरकार को कर्ज देने में आना-कानी कर रहें हैंpic.twitter.com/YYSnjLzGx8",,,,722703995907608576,https://twitter.com/INCIndia/status/722703995907608576
2016-04-20 08:24:42,ncbn,PonnaarrBJP,11,8,69,"Thank you @PonnaarrBJP ji",,@PonnaarrBJP,,722702518195789824,https://twitter.com/ncbn/status/722702518195789824
2016-04-20 07:30:17,INCIndia,,24,145,91,"Exports hit a 5 year low after 16th straight month of decline.https://www.youtube.com/watch?v=zIujyia05pk …",,,,722688825969881088,https://twitter.com/INCIndia/status/722688825969881088
2016-04-20 07:14:12,ncbn,VasundharaBJP,17,10,93,"Thank you @VasundharaBJP ji",,@VasundharaBJP,,722684776558276608,https://twitter.com/ncbn/status/722684776558276608
2016-04-20 07:13:57,ncbn,AnilShiroleBJP,2,7,65,"Thank you @AnilShiroleBJP",,@AnilShiroleBJP,,722684714709086208,https://twitter.com/ncbn/status/722684714709086208
2016-04-20 07:13:38,ncbn,PiyushGoyal,2,7,76,"Thank you @PiyushGoyal ji",,@PiyushGoyal,,722684636393009154,https://twitter.com/ncbn/status/722684636393009154
2016-04-20 07:13:21,ncbn,yogrishiramdev,14,48,126,"Thank you @yogrishiramdev ji",,@yogrishiramdev,,722684562778824704,https://twitter.com/ncbn/status/722684562778824704
2016-04-20 07:12:52,ncbn,nsitharaman,5,11,71,"Thanks for the wishes @nsitharaman",,@nsitharaman,,722684440972042241,https://twitter.com/ncbn/status/722684440972042241
2016-04-20 07:12:36,ncbn,AmitShah,5,9,79,"Thank you @AmitShah ji",,@AmitShah,,722684375469539328,https://twitter.com/ncbn/status/722684375469539328
2016-04-20 06:58:02,SachinPilot,,8,63,64,"Raj govt finally http://relents.Gives the case of a minor dalit girl's rape and murder to CBI after much agitation and pressure from cong",,,,722680707324190721,https://twitter.com/SachinPilot/status/722680707324190721
2016-04-20 06:30:03,INCIndia,,38,242,162,"The BJP Govt under PM Modi has reduced funds to non-BJP states to stifle all opposition to his policies.pic.twitter.com/VuTX9W3PQE",,,,722673667457421312,https://twitter.com/INCIndia/status/722673667457421312
2016-04-20 05:59:24,PMOIndia,,147,671,1779,"#TransformingIndia - Moving towards Clean Energy http://www.narendramodi.in/category/infographics … via NMApppic.twitter.com/h87MoHop57",,,#TransformingIndia,722665955021754369,https://twitter.com/PMOIndia/status/722665955021754369
2016-04-20 05:57:45,PMOIndia,,60,484,1250,"#TransformingIndia - Reneweable Energy - Clean Energy http://www.narendramodi.in/category/infographics … via NMApppic.twitter.com/AlcWjWb2f6",,,#TransformingIndia,722665536820224000,https://twitter.com/PMOIndia/status/722665536820224000
2016-04-20 05:55:07,AmitShah,,29,429,798,"Warm Birthday greetings to Chief Minister of Andhra Pradesh Shri @ncbn. May God bless you with long & healthy life.",,@ncbn,,722664876989132800,https://twitter.com/AmitShah/status/722664876989132800
2016-04-20 05:51:08,ncbn,KalrajMishra,9,14,69,"Thank you @KalrajMishra ji",,@KalrajMishra,,722663873124413440,https://twitter.com/ncbn/status/722663873124413440
2016-04-20 05:50:49,ncbn,MPNaveenJindal,3,15,63,"Thank you @MPNaveenJindal ji",,@MPNaveenJindal,,722663795185856512,https://twitter.com/ncbn/status/722663795185856512
2016-04-20 05:30:05,INCIndia,,36,275,225,"It is our bonds with each other that makes India strong.pic.twitter.com/WXWGp6Br3R",,,,722658574174806016,https://twitter.com/INCIndia/status/722658574174806016
2016-04-20 05:18:39,ArvindKejriwal,pandeypoonam20,324,647,615,"Yes. We will do ithttps://twitter.com/pandeypoonamnbt/status/722654800224120833 …",,,,722655697494765568,https://twitter.com/ArvindKejriwal/status/722655697494765568
2016-04-20 05:12:18,ArvindKejriwal,,263,740,883,"Overcharging, diesel cars, drivers without license/badges n blackmailing by taxi aggregators won't be allwed(2/2)",,,,722654098525417478,https://twitter.com/ArvindKejriwal/status/722654098525417478
2016-04-20 05:11:59,ArvindKejriwal,,208,767,819,"We are not against taxi aggregators. We fully support them. They provide imp service to people. But they will have to follow law(1/2)",,,,722654021425750016,https://twitter.com/ArvindKejriwal/status/722654021425750016
2016-04-20 05:09:20,ncbn,drramansingh,13,13,84,"Thank you @drramansingh ji",,@drramansingh,,722653355353448450,https://twitter.com/ncbn/status/722653355353448450
2016-04-20 05:08:13,ncbn,mlkhattar,2,9,69,"Thank you @mlkhattar ji",,@mlkhattar,,722653073257152513,https://twitter.com/ncbn/status/722653073257152513
2016-04-20 05:07:50,ncbn,ChBirenderSingh,2,7,57,"Thank you @ChBirenderSingh ji",,@ChBirenderSingh,,722652978029666305,https://twitter.com/ncbn/status/722652978029666305
2016-04-20 05:07:26,ncbn,ShahnawazBJP,6,8,57,"Thank you @ShahnawazBJP",,@ShahnawazBJP,,722652876527505408,https://twitter.com/ncbn/status/722652876527505408
2016-04-20 05:06:58,ncbn,sureshpprabhu,9,12,71,"Thank you @sureshpprabhu ji",,@sureshpprabhu,,722652758852182019,https://twitter.com/ncbn/status/722652758852182019
2016-04-20 05:06:38,ncbn,MVenkaiahNaidu,13,12,83,"Thank you @MVenkaiahNaidu",,@MVenkaiahNaidu,,722652676387946496,https://twitter.com/ncbn/status/722652676387946496
2016-04-20 05:06:13,ncbn,ChouhanShivraj,6,12,77,"Thank you @ChouhanShivraj ji",,@ChouhanShivraj,,722652569928118272,https://twitter.com/ncbn/status/722652569928118272
2016-04-20 05:05:24,ncbn,narendramodi,14,35,221,"Thank you @narendramodi ji.",,@narendramodi,,722652362729517058,https://twitter.com/ncbn/status/722652362729517058
2016-04-20 04:50:29,ArvindKejriwal,,461,1305,1231,"Some media houses supporting surge pricing. One of these media houses has Rs 150 cr investment in one of these taxi aggregators",,,,722648610899406848,https://twitter.com/ArvindKejriwal/status/722648610899406848
2016-04-20 04:48:37,ArvindKejriwal,,376,990,1102,"Some taxis saying they will not provide cab if they are not allowed to loot. This is open blackmailing n govt will not let that happen(2/2)",,,,722648140285943809,https://twitter.com/ArvindKejriwal/status/722648140285943809
2016-04-20 04:48:15,ArvindKejriwal,,268,735,721,"Surge pricing is daylight robbery. No responsible govt can allow that(1/2)",,,,722648049839902720,https://twitter.com/ArvindKejriwal/status/722648049839902720
2016-04-20 04:30:06,INCIndia,,19,181,170,"Pranab Mukherjee, PV Narasimha Rao & Smt Indira Gandhi, 1983pic.twitter.com/0Ddcu3qMKk",,,,722643481819123712,https://twitter.com/INCIndia/status/722643481819123712
2016-04-20 04:27:03,arunjaitley,,65,224,682,"On the auspicious occasion of Mahavir Jayanti, my greetings to everyone. May the teachings of Lord Mahavira always guide our lives.",,,,722642715138269185,https://twitter.com/arunjaitley/status/722642715138269185
2016-04-20 04:23:58,arunjaitley,,72,404,1450,"Addressing the UN General Assembly Special Session on the World Drug problem, New York, April 19, 2016pic.twitter.com/2Txa4ppETe",,,,722641938722222080,https://twitter.com/arunjaitley/status/722641938722222080
2016-04-20 03:30:09,INCIndia,,74,230,180,"Avg income of an Indian has increased 274 times in last 61 yrs as we went from a rural eco to an economic powerhousepic.twitter.com/u9QKrlNCSU",,,,722628395612246016,https://twitter.com/INCIndia/status/722628395612246016
2016-04-20 03:06:33,ArvindKejriwal,,877,1323,1385,"Ha ha ha. ""Independent"" mediapic.twitter.com/73jWEX3s5k",,,,722622454510850049,https://twitter.com/ArvindKejriwal/status/722622454510850049
2016-04-20 02:39:32,BJP4India,,98,747,1079,"मोदी सरकार ने 2 साल के भीतर अंधेरे में डूबे उत्तर प्रदेश के 86% गांवों में बिजली पहुंचाई। #TransformingIndiapic.twitter.com/JDAMXcAmzZ",,,#TransformingIndiapic,722615656265310208,https://twitter.com/BJP4India/status/722615656265310208
2016-04-20 02:30:09,INCIndia,,15,176,115,"Gandhi ji's return to India changed the course of our Freedom Struggle. http://inc.in/INC-Time-Line pic.twitter.com/GjfJR5syAs",,,,722613295090262016,https://twitter.com/INCIndia/status/722613295090262016
2016-04-20 01:57:57,narendramodi,,330,1255,4615,"Wishing the CM of Meghalaya Dr. Mukul Sangma on his birthday. May Almighty bless him with a long life that is full of joy and great health.",,,,722605190059151360,https://twitter.com/narendramodi/status/722605190059151360
2016-04-20 01:56:20,narendramodi,,332,1458,5349,"Birthday wishes to my good friend @ncbn Garu, a leader who is very passionate about Andhra Pradesh's progress. Praying for his long life.",,@ncbn,,722604784922931200,https://twitter.com/narendramodi/status/722604784922931200
2016-04-19 18:00:41,BJP4India,,13,150,439,"Shri @nitin_gadkari will address public meetings in Kolkata on 20 April 2016. Get all live updates at @YuvaiTV.pic.twitter.com/o0on8KUXeF",,@nitin_gadkari @YuvaiTV,,722485084503150592,https://twitter.com/BJP4India/status/722485084503150592
2016-04-19 17:26:11,BJP4India,,107,685,1138,"Rafale deal: 'Strengthening defence capabilities'- Modi government saved $3.2 billion out of $12 billion deal.pic.twitter.com/0wXuSBzb2l",,,,722476400104439809,https://twitter.com/BJP4India/status/722476400104439809
2016-04-19 16:57:07,mkstalin,,39,108,319,"#DMKmanifesto will usher growth & development for #TN. We are here to bring in the change ppl want. #DMK2016pic.twitter.com/u9444LDCfR",,,#DMKmanifesto #TN #DMK2016pic,722469087197003776,https://twitter.com/mkstalin/status/722469087197003776
2016-04-19 16:55:15,mkstalin,,20,82,300,"In Kunnam, reminded ppl of #TN CM's inefficiency. ADMK cadre pasted stickers instead of relief activity.pic.twitter.com/j84W78RRnu",,,#TN,722468614951972864,https://twitter.com/mkstalin/status/722468614951972864
2016-04-19 16:53:07,BJP4India,,43,210,273,"Modi government is making all possible efforts to bring back the Kohinoor Diamond in an amicable manner - http://bit.ly/1pexf2O",,,,722468079754579970,https://twitter.com/BJP4India/status/722468079754579970
2016-04-19 16:33:29,BJP4India,,22,186,496,"Centre & state government are working together for the infrastructure development in J&K: PM http://nm-4.com/yhxm pic.twitter.com/fDBFQdozbF",,,,722463138830921728,https://twitter.com/BJP4India/status/722463138830921728
2016-04-19 16:24:44,BJP4India,,8,187,428,"Dream to do something & not to become someone: PM @narendramodi at 5th Convocation of SMVDU http://nm-4.com/p5wm pic.twitter.com/yDquHVX8Jj",,@narendramodi,,722460935672082435,https://twitter.com/BJP4India/status/722460935672082435
2016-04-19 16:07:56,SachinPilot,,2,50,75,"In Dhundla vill,Alwar.4kids of a family aged 5-8yrs got buried under the sand that fell of a http://truck.tragic.RIP pic.twitter.com/kN9t2gmU1o",,,,722456709776719872,https://twitter.com/SachinPilot/status/722456709776719872
2016-04-19 15:52:33,ncbn,,31,110,408,"Hearty congratulations to Dipa Karmakar for qualifying for the Rio Olympic Games 2016. Make India proud, Dipa.",,,,722452836613795843,https://twitter.com/ncbn/status/722452836613795843
2016-04-19 15:30:18,INCIndia,,12,157,157,"Pranab Mukherjee & Margaret Thatcher, 1995pic.twitter.com/nqPykr1rXN",,,,722447236328591360,https://twitter.com/INCIndia/status/722447236328591360
2016-04-19 15:00:37,INCIndia,,75,235,192,"Is BJP raking up this issue to divert attention from its inability to provide jobs & rural distress?pic.twitter.com/YiebrQPqcB",,,,722439768403943424,https://twitter.com/INCIndia/status/722439768403943424
2016-04-19 14:45:11,INCIndia,,37,230,158,"Is BJP raking up this issue to divert attention from illegal land allocation to associates of Anar Patel, d/o Guj CMpic.twitter.com/ReueP3uaPY",,,,722435882494459904,https://twitter.com/INCIndia/status/722435882494459904
2016-04-19 14:30:20,INCIndia,,38,290,202,"Is BJP raking up this issue to divert attention from the GSPC scam, where Rs 20,000 cr of public money is at stake?pic.twitter.com/Y3aQBYGUP8",,,,722432148167262208,https://twitter.com/INCIndia/status/722432148167262208
2016-04-19 14:15:07,INCIndia,,33,197,136,"Why is BJP attempting to derail the judicial process? What are they trying to hide?pic.twitter.com/ZxYidlyiOY",,,,722428317131911174,https://twitter.com/INCIndia/status/722428317131911174
2016-04-19 14:00:47,INCIndia,,25,199,124,"Does the Modi Govt allege a conspiracy in light of the Two court monitored inquiries?pic.twitter.com/kARk94Awe0",,,,722424711213223937,https://twitter.com/INCIndia/status/722424711213223937
2016-04-19 13:45:08,INCIndia,,20,253,156,"The Gujarat HC monitored CBI enquiry affirmed the finding of 'Fake Encounter' & chargesheets were filed.pic.twitter.com/pSNtq2qY1t",,,,722420769586700291,https://twitter.com/INCIndia/status/722420769586700291
2016-04-19 13:44:28,ArvindKejriwal,,518,1069,1003,"This is tyranny of unelected people like Jaitley ji. They have no idea of pulse of the people. They are disconnected from reality (6/6)",,,,722420602351521792,https://twitter.com/ArvindKejriwal/status/722420602351521792
2016-04-19 13:43:23,ArvindKejriwal,,364,1195,1238,"Startup-India is useless if an employee can't withdraw his money n start his business when government is squatting on his savings(5/6)",,,,722420332422918145,https://twitter.com/ArvindKejriwal/status/722420332422918145
2016-04-19 13:41:43,ArvindKejriwal,,256,1095,1003,"I demand that PM & FM roll-back this rule ASAP. PF is our only savings. We adults have wisdom to manage it. Why govt is interfering?(4/6",,,,722419912178864128,https://twitter.com/ArvindKejriwal/status/722419912178864128
2016-04-19 13:40:35,ArvindKejriwal,,373,1149,1316,"I was an employee myself & I stand with all employees against this draconian rule. Why should my hard earned savings remain with govt?(3/6)",,,,722419626399940608,https://twitter.com/ArvindKejriwal/status/722419626399940608
2016-04-19 13:39:57,ArvindKejriwal,,272,1089,1028,"Modi changed PF Withdrawal rules. Only 50% of PF savings can be now withdrawn; rest of it remains with govt till you become 58 years old(2/6",,,,722419466127216640,https://twitter.com/ArvindKejriwal/status/722419466127216640
2016-04-19 13:39:16,ArvindKejriwal,,317,1048,980,"For most employees, who are aam aadmi, PF is the only saving... apart from that 'Kucch Bachta Nahin Hai Itni Mehangai mein' (1/6)",,,,722419293519024128,https://twitter.com/ArvindKejriwal/status/722419293519024128
2016-04-19 13:30:18,INCIndia,,23,230,119,"The SIT came to its conclusion after investigating all evidence. It then ordered an FIR against all accusedpic.twitter.com/fekVLQZmnA",,,,722417040426860544,https://twitter.com/INCIndia/status/722417040426860544
2016-04-19 13:15:08,INCIndia,,23,254,135,"The SIT constituted by Guj HC concluded that Ishrat Jahan was killed in a 'Fake Encounter'. Is the Judiciary wrong?pic.twitter.com/DTI5SWlMJ4",,,,722413223454973952,https://twitter.com/INCIndia/status/722413223454973952
2016-04-19 12:55:02,INCIndia,,17,234,140,"Modi Govt is economical with the truth & relying upon falsehoods to hide that Judiciary called this a Fake Encounterpic.twitter.com/EzWoDdhZnw",,,,722408164100931584,https://twitter.com/INCIndia/status/722408164100931584
2016-04-19 12:40:05,INCIndia,,32,264,163,"BJP needs to tell the Indian people what is the real motive behind trying to shut down this trial.pic.twitter.com/aLay2Zv9OM",,,,722404400103165953,https://twitter.com/INCIndia/status/722404400103165953
2016-04-19 12:24:17,ncbn,,41,130,398,"I request you all to stay hydrated and ensure that you protect yourselves from the heat wave this Summer. We're also taking relief measures.",,,,722400426654568448,https://twitter.com/ncbn/status/722400426654568448
2016-04-19 12:23:51,ncbn,,51,131,447,"To prevent sunstrokes in these scorching temperatures, our government is distributing buttermilk & ORS packets in every district.",,,,722400317451681792,https://twitter.com/ncbn/status/722400317451681792
2016-04-19 12:22:03,INCIndia,,35,217,146,"BJP is shamelessly misleading the country & obstructing justice by blocking trial of the Fake Encounter casepic.twitter.com/VvVOqfWZ3W",,,,722399860951879680,https://twitter.com/INCIndia/status/722399860951879680
2016-04-19 12:11:51,SachinPilot,,3,54,74,"Today's Amar Ujala Newspaper :http://www.amarujala.com/india-news/congress-will-win-rajasthan-in-2018-says-sachin-pilot-in-amar-ujala-samvad …",,,,722397295002677248,https://twitter.com/SachinPilot/status/722397295002677248
2016-04-19 11:19:29,INCIndia,,3,157,139,"Division bench heard Central Govt & State Govt counsel today, our submissions will be made tomorrow: Dr AM Singhvipic.twitter.com/jo2BSpwonO",,,,722384117698932736,https://twitter.com/INCIndia/status/722384117698932736
2016-04-19 11:15:43,BJP4India,,31,230,300,"If (the then) govt itself compromises with national security, where will citizens go?: Dr. @sambitswaraj https://www.youtube.com/watch?v=V_0_Ru-U2LY … #IshratFile",,@sambitswaraj,#IshratFile,722383169425514496,https://twitter.com/BJP4India/status/722383169425514496
2016-04-19 11:11:14,INCIndia,,251,2285,1513,"Mamata ji said that she would stop corruption. But, instead of taking action, she's protecting those looting Bengalpic.twitter.com/1Osxhnaayb",,,,722382040021078016,https://twitter.com/INCIndia/status/722382040021078016
2016-04-19 10:53:29,narendramodi,,404,1465,4320,"Recalled Atal ji's vision for J&K & highlighted the scope of development in J&K, particularly in areas like tourism.http://nm-4.com/23wm",,,,722377576312893441,https://twitter.com/narendramodi/status/722377576312893441
2016-04-19 10:50:45,narendramodi,,164,1069,3266,"At the large public meeting in Katra, remembered Mufti Sahab & spoke about Centre's unwavering commitment towards development of J&K.",,,,722376887130013697,https://twitter.com/narendramodi/status/722376887130013697
2016-04-19 10:49:46,narendramodi,,104,1034,2855,"Sports complex inaugurated today will most certainly promote sports but at the same time it will enhance sportsman spirit, which is vital.",,,,722376640576282624,https://twitter.com/narendramodi/status/722376640576282624
2016-04-19 10:48:15,narendramodi,,128,1136,3228,"Wished students the very best & urged them to work for the welfare of the poor in any way possible in the future.http://nm-4.com/y0wm",,,,722376258110300160,https://twitter.com/narendramodi/status/722376258110300160
2016-04-19 10:47:20,narendramodi,,158,1309,3718,"Very good interaction with students of Shri Mata Vaishno Devi University. Delighted to see outstanding academic performance by girl students",,,,722376026173661184,https://twitter.com/narendramodi/status/722376026173661184
2016-04-19 10:45:49,narendramodi,,289,1949,7358,"Great facilities at Shri Mata Vaishnodevi Narayana Superspeciality Hospital will immensely benefit local citizens.pic.twitter.com/JQiSYFY3l3",,,,722375644903043072,https://twitter.com/narendramodi/status/722375644903043072
2016-04-19 10:08:27,narendramodi,,606,2117,8167,"There is something very beautiful about J&K that draws me to the state so often. Always happy to be in J&K.pic.twitter.com/ecRthh2x69",,,,722366242749857793,https://twitter.com/narendramodi/status/722366242749857793
2016-04-19 09:57:08,MamataOfficial,MamataOfficial,9,52,80,"#RealBengal এটি নদীয়ার খোকন দেবনাথের কাহিনী। সেচ ব্যবস্থার ব্যাপক উন্নতির জন্য, তার ফসল উত্পাদন বেড়েছে:https://goo.gl/oWKw0D",,,#RealBengal,722363393819021312,https://twitter.com/MamataOfficial/status/722363393819021312
2016-04-19 09:55:39,MamataOfficial,,10,51,75,"#RealBengal Story of Khokon Debnath from Nadia who has benefited due to better irrigation facilities >> https://goo.gl/oWKw0D",,,#RealBengal,722363021855563776,https://twitter.com/MamataOfficial/status/722363021855563776
2016-04-19 09:53:36,PMOIndia,,214,519,1838,"I condemn the attack in Kabul & extend my condolences to bereaved families. Prayers with the injured for a speedy recovery: PM @narendramodi",,@narendramodi,,722362506275090432,https://twitter.com/PMOIndia/status/722362506275090432
2016-04-19 09:44:42,INCIndia,,33,165,126,"Press Statement issued by @rssurjewala today.pic.twitter.com/CPbRlBga4o",,@rssurjewala,,722360262326497280,https://twitter.com/INCIndia/status/722360262326497280
2016-04-19 08:31:36,JM_Scindia,,21,133,237,"Wishing all on the auspicious occasion of Mahavir Jayanti. May the teachings of Bhagwan Mahavir guide us to the path of peace & harmony.",,,,722341869485621248,https://twitter.com/JM_Scindia/status/722341869485621248
2016-04-19 08:00:07,BJP4India,,5,91,185,"BJP CEC announces a list of candidates for Tamil Nadu and Kerala assembly elections 2016 - http://bit.ly/1XG30Oq",,,,722333943928762368,https://twitter.com/BJP4India/status/722333943928762368
2016-04-19 07:22:28,PMOIndia,,123,410,1412,"Centre and State Government are working together for the infrastructure development in J&K. Tourism potential is immense here: PM",,,,722324469839183872,https://twitter.com/PMOIndia/status/722324469839183872
2016-04-19 07:19:24,PMOIndia,,46,364,755,"People of J&K respect Atal ji tremendously. He had a vision for the development of J&K: PM @narendramodihttp://www.narendramodi.in/watch-live",,@narendramodihttp,,722323696698978304,https://twitter.com/PMOIndia/status/722323696698978304
2016-04-19 07:17:47,PMOIndia,,82,335,918,"We all have to work together for the development of India and this development has to be quick paced and all inclusive: PM @narendramodi",,@narendramodi,,722323293022380033,https://twitter.com/PMOIndia/status/722323293022380033
2016-04-19 07:17:02,PMOIndia,,33,289,684,"With this hospital people will not have to go very far for treatment. And the weather here is also very good: PM @narendramodi",,@narendramodi,,722323102412251136,https://twitter.com/PMOIndia/status/722323102412251136
2016-04-19 07:10:31,PMOIndia,,35,244,615,"Cleanliness ensures we remain free from illness: PM @narendramodi #MyCleanIndia http://www.narendramodi.in/watch-live",,@narendramodi,#MyCleanIndia,722321464171630592,https://twitter.com/PMOIndia/status/722321464171630592
2016-04-19 07:08:59,PMOIndia,,17,223,535,"Where there is sports you can stay away from illness. Preventive healthcare is very important: PM @narendramodi http://www.narendramodi.in/watch-live",,@narendramodi,,722321079012847616,https://twitter.com/PMOIndia/status/722321079012847616
2016-04-19 07:07:24,PMOIndia,,66,582,1250,"We are hosting FIFA U-17 World Cup and this has to be an opportunity for us to celebrate sports. The world should see our Yuva Shakti: PM",,,,722320679622852608,https://twitter.com/PMOIndia/status/722320679622852608
2016-04-19 07:06:21,PMOIndia,,13,193,461,"This sports complex will help sports and will help sportsman spirit: PM @narendramodi at the public meeting http://www.narendramodi.in/watch-live",,@narendramodi,,722320414937063424,https://twitter.com/PMOIndia/status/722320414937063424
2016-04-19 07:04:32,PMOIndia,,23,214,513,"Without 'Khel' there cannot be 'Khilna'...the person who plays, shines: PM @narendramodi http://www.narendramodi.in/watch-live",,@narendramodi,,722319958978523136,https://twitter.com/PMOIndia/status/722319958978523136
2016-04-19 07:03:47,PMOIndia,,15,196,479,"This land is drawing students from all over the nation and this gives strength to India: PM @narendramodihttp://www.narendramodi.in/watch-live",,@narendramodihttp,,722319766757720064,https://twitter.com/PMOIndia/status/722319766757720064
