date,username,to,replies,retweets,favorites,text,geo,mentions,hashtags,id,permalink
2017-10-30 17:52:25,BJP4India,,107,454,1827,"राष्ट्रीय एकता दिवस के अवसर पर एकता दौड़ में शामिल होकर सरदार वल्लभ भाई पटेल के स्वप्न को अपना समर्थन दें।pic.twitter.com/XemIx7CErs",,,,925057817173671942,https://twitter.com/BJP4India/status/925057817173671942
2017-10-30 16:58:38,BJP4India,,49,178,426,"#KnowYourGovt : What does GDS stand for?",,,#KnowYourGovt,925044282100146176,https://twitter.com/BJP4India/status/925044282100146176
2017-10-30 16:58:18,BJP4India,BJP4India,13,104,392,"Thanks for your participation. 18 to 50 years is the correct answer. #KnowYourGovthttps://twitter.com/BJP4India/status/924482098572021760 …",,,#KnowYourGovthttps,925044201137434624,https://twitter.com/BJP4India/status/925044201137434624
2017-10-30 16:05:04,BJP4India,,248,846,4091,"सरदार साहब की जयंती (31 अक्टूबर) पर देश भर में रन फॉर यूनिटी का आयोजन किया जाएगा, आप सभी से अनुरोध है कि आप भी इस दौड़ में हिस्सा लें : पीएमpic.twitter.com/XGywG57Zae",,,,925030802462728192,https://twitter.com/BJP4India/status/925030802462728192
2017-10-30 15:34:03,BJP4India,,163,362,1575,"यूपीए सरकार की तुलना में मोदी सरकार ने 14वे वित्त आयोग के अंतर्गत हिमाचल को 71,000 करोड़ रुपये अधिक देने का काम किया है। #ShahInHimachalpic.twitter.com/iPmfEt7XHJ",,,#ShahInHimachalpic,925022997345210368,https://twitter.com/BJP4India/status/925022997345210368
2017-10-30 14:21:59,BJP4India,,228,457,2355,"हिमाचल की पुकार, भाजपा सरकार : हिमाचल प्रदेश को स्वर्णिम हिमाचल बनाने के लिए भाजपा का दृष्टि पत्र - 2017। पूरा पढ़ें http://bit.ly/SwarnimHimachal pic.twitter.com/PkKOyDwQew",,,,925004860914769926,https://twitter.com/BJP4India/status/925004860914769926
2017-10-30 13:34:39,ncbn,,32,68,479,"ప్రస్తుత ప్రపంచ గమనంలో మాతృభాషతో పాటు ఇతర భాషలు కూడా తప్పనిసరిగా నేర్చుకోవాలి. ఇప్పుడు ప్రతి ఒక్కరికీ కమ్యూనికేషన్ స్కిల్స్ చాలా అవసరం.pic.twitter.com/VCTUaXZWNi",,,,924992950999773184,https://twitter.com/ncbn/status/924992950999773184
2017-10-30 13:32:12,ncbn,,31,56,484,"పోలవరం ప్రాజెక్టు పరిధిలోని గిరిజన యువత ఉన్నతి కోసం వారికి నైపుణ్య శిక్షణ ఇప్పించి ఉద్యోగ, ఉపాధి అవకాశాలు కల్పించేలా ప్రభుత్వం కృషిచేస్తోంది",,,,924992334168670208,https://twitter.com/ncbn/status/924992334168670208
2017-10-30 13:30:49,ncbn,,41,88,916,"రాష్ట్రంలో క్రికెట్ అభివృద్ధికి ఎనలేని సేవలందించిన ప్రముఖ వ్యక్తి, భారత జట్టు మాజీ మేనేజర్ ఎంవీ శ్రీధర్ మృతి అత్యంత బాధాకరం ఆయనకు ఘననివాళులు",,,,924991986662227968,https://twitter.com/ncbn/status/924991986662227968
2017-10-30 13:30:01,INCIndia,,85,443,878,"Modi Govt and its abysmal record of completing infrastructure projects on time. Read more: http://inc.in/In-focus/1079/let-talk-about-bjp-work-culture …pic.twitter.com/A4mFuMehym",,,,924991783544635392,https://twitter.com/INCIndia/status/924991783544635392
2017-10-30 13:27:40,MamataOfficial,,75,107,961,"Kolkata achieves a unique position in the U-17 World Cup. My latest FB post >> http://goo.gl/8dZ3ps",,,,924991193808642055,https://twitter.com/MamataOfficial/status/924991193808642055
2017-10-30 13:06:15,INCIndia,,115,753,1530,"Statistics show how much care the Gujarat government really extends towards the health and immunity of its children.pic.twitter.com/vxazWG1mcd",,,,924985804270665728,https://twitter.com/INCIndia/status/924985804270665728
2017-10-30 12:23:19,ArvindKejriwal,SwatiJaiHind,229,1003,3428,"Good work by DCWhttps://twitter.com/swatijaihind/status/924968217956589571 …",,,,924974999617683456,https://twitter.com/ArvindKejriwal/status/924974999617683456
2017-10-30 12:12:12,INCIndia,,126,532,1079,"Gujarat deserves a govt that cares about citizens' wellbeing, not one that decreases the healthcare budget. Read: http://inc.in/In-focus/1080/state-of-public-health-in-gujarat …pic.twitter.com/cNezMaK6Ct",,,,924972201454944256,https://twitter.com/INCIndia/status/924972201454944256
2017-10-30 12:10:17,BJP4India,,112,424,1445,"CAG के अनुसार हिमाचल में वीरभद्र सिंह सरकार ने 20,000 करोड़ रुपये के ऋण को विकास के बजाए घोटालों की भेंट चढ़ा दिया। #ShahInHimachalpic.twitter.com/1FvsfeoGaA",,,#ShahInHimachalpic,924971718992478208,https://twitter.com/BJP4India/status/924971718992478208
2017-10-30 11:58:24,AmitShah,,290,708,2849,"वीरभद्र सिंह को हिमाचल की जनता को जवाब देना चाहिए कि प्रदेश की जनता के विकास के लिए दिए गए पैसे से अगर विकास नही किया तो वो पैसा गया कहाँ?pic.twitter.com/TIUW0ZOz7S",,,,924968728642514945,https://twitter.com/AmitShah/status/924968728642514945
2017-10-30 11:57:28,AmitShah,,124,504,1897,"चल्वारा (कांगड़ा) जनसभा: मोदी जी द्वारा गरीबों के लिए लायी गई योजनाओं को वीरभद्र सरकार ने हिमाचल की जनता तक पहुंचने ही नही दिया।pic.twitter.com/7M7XZZkXfd",,,,924968494432522240,https://twitter.com/AmitShah/status/924968494432522240
2017-10-30 11:45:18,narendramodi,,442,1424,5281,"How many questions can you answer correctly in the #MannKiBaat quiz, on the Narendra Modi App? http://nm4.in/dnldapp pic.twitter.com/6pO9ZCgRBT",,,#MannKiBaat,924965430233407488,https://twitter.com/narendramodi/status/924965430233407488
2017-10-30 11:42:26,narendramodi,,270,1484,6475,"PM @PaoloGentiloni and I met CEOs from both nations. Stronger trade and commerce ties will benefit India and Italy tremendously.pic.twitter.com/Q8iw12Ucnw",,@PaoloGentiloni,,924964711363309568,https://twitter.com/narendramodi/status/924964711363309568
2017-10-30 11:40:22,narendramodi,,552,2321,13299,"We mark 70 years of India-Italy friendship and will continue expanding bilateral relations in the years to come.pic.twitter.com/imELNitySC",,,,924964188220301312,https://twitter.com/narendramodi/status/924964188220301312
2017-10-30 11:38:50,narendramodi,,179,1319,5474,"Held talks with PM @PaoloGentiloni on boosting economic and people-to-people cooperation between India & Italy. http://nm-4.com/dol5 pic.twitter.com/Spa2th6z4u",,@PaoloGentiloni,,924963804244467713,https://twitter.com/narendramodi/status/924963804244467713
2017-10-30 11:09:20,INCIndia,,36,367,666,"Watch: I/c, Communications @rssurjewala briefs the media on AICC's meet regarding demonetisation, GST & #BlackDay.https://www.youtube.com/watch?v=7ktpKnXI9LU&feature=youtu.be …",,@rssurjewala,#BlackDay,924956380053716993,https://twitter.com/INCIndia/status/924956380053716993
2017-10-30 10:18:13,RahulGandhi,INCIndia,3524,7952,18057,"नरेंद्र मोदी जी ने हिन्दुस्तान की अर्थव्यवस्था पर दो torpedoes-नोटबंदी और गलत तरीके से implement की गयी GST मारकर ICU में पहुँचा दिया हैhttps://twitter.com/incindia/status/924931007526006785 …",,,,924943516781854720,https://twitter.com/RahulGandhi/status/924943516781854720
2017-10-30 10:15:26,INCIndia,,89,703,1401,"As #BlackDay of demonetisation approaches, RBI still verifying returned notes.http://www.business-standard.com/article/economy-policy/rbi-says-still-verifying-returned-notes-as-note-ban-anniversary-approaches-117102900289_1.html …",,,#BlackDay,924942817645838336,https://twitter.com/INCIndia/status/924942817645838336
2017-10-30 10:14:22,AmitShah,,970,2679,11186,"वोटबैंक की राजनीति के लिए कश्मीर की आजादी के नारे लगाने वालों का समर्थन करके कांग्रेस ने देश के लाखों शहीदों के बलिदान का अपमान किया है।pic.twitter.com/PdumfMgmrM",,,,924942546849054721,https://twitter.com/AmitShah/status/924942546849054721
2017-10-30 10:10:38,BJP4India,,128,548,1700,"Rahul and Sonia Gandhi must come clean on separatists in Kashmir, in JNU and illegal Rohingya migrants posing threat to national security.pic.twitter.com/xri47QPFcX",,,,924941609325568000,https://twitter.com/BJP4India/status/924941609325568000
2017-10-30 10:00:09,AmitShah,,192,619,2279,"हिमाचल की जनता तय कर चुकी है कि उसे माफियाराज और भ्रष्टाचार वाली कांग्रेस नही बल्कि देवभूमि को एक मॉडल स्टेट बनाने वाली भाजपा सरकार चाहिए।pic.twitter.com/o0JweE2sMg",,,,924938967841062912,https://twitter.com/AmitShah/status/924938967841062912
2017-10-30 09:52:58,AmitShah,,169,569,2025,"हिमाचल में एक ऐसी सरकार है जिसने सिर्फ और सिर्फ भूमि पूजन किये उनके लोकार्पण का दिन ही नहीं आया, प्रदेश में माफियाओं की सरकार चल रही है ।pic.twitter.com/qoKjnXp7CP",,,,924937163262763008,https://twitter.com/AmitShah/status/924937163262763008
2017-10-30 09:52:17,AmitShah,,124,454,1511,"पांच साल में कांग्रेस ने हिमाचल को भ्रष्टाचार और गुंडागर्दी में नंबर-1 बना कर पूरे देश मे देवभूमि को शर्मसार करने का काम किया है ।pic.twitter.com/EE8u3PnN8q",,,,924936988720898048,https://twitter.com/AmitShah/status/924936988720898048
2017-10-30 09:51:36,AmitShah,,147,591,2077,"हिमाचल प्रदेश की जनता में भारतीय जनता पार्टी के लिए यह जोश और उत्साह प्रदेश में भाजपा की प्रचंड बहुमत की सरकार बनाने के संकल्प का प्रतीक है।pic.twitter.com/gLhCJykveU",,,,924936816381194240,https://twitter.com/AmitShah/status/924936816381194240
2017-10-30 09:50:05,AmitShah,,70,388,1418,"देवभूमि हिमाचल के बनीखेत (चम्बा) में आयोजित चुनावी जनसभा को संबोधित किया ।pic.twitter.com/3R5nCGOkAs",,,,924936435555188736,https://twitter.com/AmitShah/status/924936435555188736
2017-10-30 09:28:31,INCIndia,,714,2833,7115,"Congress VP Rahul Gandhi briefs the media on the demonetisation and GST shots fired on the economy. November 8 to be observed as #BlackDay.pic.twitter.com/V7563mv7iZ",,,#BlackDay,924931007526006785,https://twitter.com/INCIndia/status/924931007526006785
2017-10-30 08:29:08,laluprasadrjd,,711,1770,6959,"Amit Shah’s income rises 300& his son Jay Shah’s 16000 times in a year specially when economy reeling undr grt depression of GST & notebandi",,,,924916064160325632,https://twitter.com/laluprasadrjd/status/924916064160325632
2017-10-30 08:24:46,BJP4India,,99,332,1391,"मोदी सरकार द्वारा गरीब कल्याण के लिए लायी जा रही सभी योजनाओं को वीरभद्र सरकार हिमाचल की जनता तक नहीं पहुंचने दे रही है। #ShahInHimachal",,,#ShahInHimachal,924914963684007936,https://twitter.com/BJP4India/status/924914963684007936
2017-10-30 08:20:04,BJP4India,,105,218,764,"वोट बैंक की राजनीति के लिए कांग्रेस पार्टी हमेशा देश की सुरक्षा के साथ खिलवाड़ करती रही है : श्री अमित शाह #ShahInHimachalpic.twitter.com/g9uqX1x9Jn",,,#ShahInHimachalpic,924913783574749184,https://twitter.com/BJP4India/status/924913783574749184
2017-10-30 08:18:52,INCIndia,,210,1061,3208,"All India Congress Committee general secretaries and state in-charges meet with Congress Vice President Rahul Gandhi.pic.twitter.com/YNa5n3LxCZ",,,,924913479395323904,https://twitter.com/INCIndia/status/924913479395323904
2017-10-30 08:15:05,BJP4India,,87,145,590,"भारतीय जनता पार्टी हिमाचल में एक पारदर्शी और लोकप्रिय सरकार बनाने के लिए प्रतिबद्ध है : श्री अमित शाह - लाइव https://www.facebook.com/BJP4India/videos/1876276372412877/ … परpic.twitter.com/1Awteimad3",,,,924912529788174342,https://twitter.com/BJP4India/status/924912529788174342
2017-10-30 08:11:52,BJP4India,,42,211,645,"हिमाचल में एक ऐसी सरकार है जिसने सिर्फ और सिर्फ भूमि पूजन किये, उनके लोकार्पण का दिन आज तक नहीं आया है : श्री अमित शाह #ShahInHimachalpic.twitter.com/eIqpN4vuQK",,,#ShahInHimachalpic,924911718915960832,https://twitter.com/BJP4India/status/924911718915960832
2017-10-30 08:08:33,BJP4India,,80,188,697,"पिछले 3 साल से केंद्र में मोदी सरकार कार्य कर रही है, हमारे विरोधी भी हम पर एक भी भ्रष्टाचार का आरोप नहीं लगा पाए हैं। #ShahInHimachal",,,#ShahInHimachal,924910883150499845,https://twitter.com/BJP4India/status/924910883150499845
2017-10-30 08:07:04,BJP4India,,441,411,1912,"12 लाख करोड़ के घोटाले करने वाले राहुल गाँधी आज भाजपा से सवाल पूछ रहें है : श्री अमित शाह #ShahInHimachalpic.twitter.com/dpuOuRuRuE",,,#ShahInHimachalpic,924910512596332544,https://twitter.com/BJP4India/status/924910512596332544
2017-10-30 08:00:21,BJP4India,,95,252,776,"कांग्रेस की सरकार ने हिमाचल को भ्रष्टाचार और गुंडागर्दी में नंबर-1 बना दिया है, हिमाचल में माफियाओं की सरकार चल रही है। #ShahInHimachalpic.twitter.com/956P7KxuGR",,,#ShahInHimachalpic,924908821524332544,https://twitter.com/BJP4India/status/924908821524332544
2017-10-30 07:57:27,BJP4India,,117,200,694,"देश में कहीं भी भ्रष्टाचार की चर्चा होती है तो वीरभद्र जी का नाम सुर्ख़ियों में होता है : श्री अमित शाह #ShahInHimachalpic.twitter.com/zH26FbAqk9",,,#ShahInHimachalpic,924908092894076928,https://twitter.com/BJP4India/status/924908092894076928
2017-10-30 07:55:28,BJP4India,,36,191,535,"देवभूमि हिमाचल को पूरे देश में शर्मसार करने का काम यहां की कांग्रेस सरकार ने किया है : श्री अमित शाह - लाइव https://www.facebook.com/BJP4India/videos/1876276372412877/ … परpic.twitter.com/K5FMCU6AhP",,,,924907593285300224,https://twitter.com/BJP4India/status/924907593285300224
2017-10-30 07:45:30,mkstalin,,170,326,2328,"வேற்றுமையில் ஒற்றுமை காண போராடிய முத்துராமலிங்க தேவர் பெருமகனாருக்கு பசும்பொன்னில் மலர்வளையம் வைத்து மரியாதை செலுத்தினேன் #ThevarJayanthipic.twitter.com/2CEf0SzUQH",,,#ThevarJayanthipic,924905082902036480,https://twitter.com/mkstalin/status/924905082902036480
2017-10-30 07:44:24,BJP4India,,43,176,624,"Shri @AmitShah will shortly address a public meeting in Banikhet, Himachal Pradesh. LIVE at http://bjplive.org #ShahInHimachalpic.twitter.com/6bfNypD79j",,@AmitShah,#ShahInHimachalpic,924904805549490176,https://twitter.com/BJP4India/status/924904805549490176
2017-10-30 07:41:28,BJP4India,,241,913,4147,"BJP National President Shri @AmitShah is addressing a public meeting in Banikhet, Himachal Pradesh. #ShahInHimachalhttps://www.pscp.tv/w/bMV9qDFZTEVKTlh4RG5ORU58MU9kS3JBa3lucVZ4WGcZPoBl4M-oyiCRY5AzX78MC59Uc8edyfLh_FLJGMA9 …",,@AmitShah,#ShahInHimachalhttps,924904069814091781,https://twitter.com/BJP4India/status/924904069814091781
2017-10-30 06:52:31,mkstalin,,41,214,1209,"பேராசிரியர் ஜெயராமன் மீது தேச துரோக வழக்கு பதிவு செய்திருக்கும் மத்திய பாஜக அரசின் எடுபிடி அதிமுக அரசுக்கு கடும் கண்டனம் #Kathiramangalam",,,#Kathiramangalam,924891752003018755,https://twitter.com/mkstalin/status/924891752003018755
2017-10-30 06:49:12,mkstalin,,137,244,1873,"#HarvardTamilChair-க்கு தமிழக அரசு ரூ.10 கோடி நிதி ஒதுக்குவதாக அறிவித்துள்ள நிலையில், மேலும் தேவைப்படும் நிதியை மத்திய அரசு அளிக்க வேண்டும்",,,#HarvardTamilChair,924890914689925120,https://twitter.com/mkstalin/status/924890914689925120
2017-10-30 06:46:24,INCIndia,,115,554,994,"BJP’s mobs have moved online: Presenting the digi-bhakts of Modi’s undeclared Emergency in new media. Read: https://medium.com/@Congress/new-india-modis-undeclared-emergency-in-new-media-a1e958c6b7da …pic.twitter.com/JFD5KlwDA9",,@Congress,,924890211171016704,https://twitter.com/INCIndia/status/924890211171016704
2017-10-30 06:34:18,BJP4India,,99,543,1958,"12 lakh women adopted digital transaction methods in one day, negating all those who said India is too backward to ‘go cashless' : PM Modipic.twitter.com/E3RZkqH9dB",,,,924887164969558017,https://twitter.com/BJP4India/status/924887164969558017
2017-10-30 06:27:41,BJP4India,,375,1159,4019,"My govt has saved Rs. 57,000 crore of public money from middlemen through DBT. This is one of the reasons corrupt parties hate me : PM Modipic.twitter.com/D54O5eSYWG",,,,924885501953302528,https://twitter.com/BJP4India/status/924885501953302528
2017-10-30 06:07:41,BJP4India,,68,286,1200,"आर्य समाज के संस्थापक और महान समाज सुधारक महर्षि स्वामी दयानन्द सरस्वती की पुण्यतिथि पर शत्-शत् नमन।pic.twitter.com/9rdx29jvNn",,,,924880466703818752,https://twitter.com/BJP4India/status/924880466703818752
2017-10-30 05:48:01,OmarAbdullah,,31,104,586,"Congratulations Sameer & all the very best for the future.http://risingkashmir.com/news/sameer-is-first-rhodes-scholar-from-kashmir …",,,,924875519547469824,https://twitter.com/OmarAbdullah/status/924875519547469824
2017-10-30 05:31:59,PMOIndia,,211,411,1943,"Khadi for nation, fashion and transformation. #MannKiBaatpic.twitter.com/P00hF6SS1J",,,#MannKiBaatpic,924871483913994240,https://twitter.com/PMOIndia/status/924871483913994240
2017-10-30 05:31:19,PMOIndia,,181,385,1803,"India is embracing digital transactions.pic.twitter.com/jS43FURaQ8",,,,924871313830813696,https://twitter.com/PMOIndia/status/924871313830813696
2017-10-30 05:30:45,PMOIndia,,109,349,2023,"The Prime Minister lauds our young sportspersons. #MannKiBaatpic.twitter.com/BQYf2jDePc",,,#MannKiBaatpic,924871172080115712,https://twitter.com/PMOIndia/status/924871172080115712
2017-10-30 05:30:02,PMOIndia,,163,490,2515,"PM @narendramodi salutes the brave @UN peacekeepers during #MannKiBaat.pic.twitter.com/Je0qr9zeSn",,@narendramodi @UN,#MannKiBaat,924870993918672897,https://twitter.com/PMOIndia/status/924870993918672897
2017-10-30 05:29:12,PMOIndia,,263,415,2176,"India has always believed in world peace and harmony. #MannKiBaatpic.twitter.com/rILoIUwV8s",,,#MannKiBaatpic,924870782542536704,https://twitter.com/PMOIndia/status/924870782542536704
2017-10-30 05:23:41,INCIndia,,133,843,1422,"Anil Ambani joins the list of PM Modi's friends with a sweet new defence deal, in the name of the Indian Govt. Read: http://inc.in/In-focus/1077/the-truth-behind-the-indo-france-deal …pic.twitter.com/sTYpfS0BKU",,,,924869392743010309,https://twitter.com/INCIndia/status/924869392743010309
2017-10-30 05:19:54,INCIndia,,250,324,952,"Who gave Gandhiji the title of “Father of the Nation”? #KnowYourLegacy",,,#KnowYourLegacy,924868442544472065,https://twitter.com/INCIndia/status/924868442544472065
2017-10-30 04:58:44,BJP4India,,62,264,957,"भाजपा अध्यक्ष श्री अमित शाह आज हिमाचल प्रदेश में चुनावी जनसभाओं को सम्बोधित करेंगे। लाइव देखें http://facebook.com/BJP4India पर #ShahInHimachalpic.twitter.com/CXhirJ5C11",,,#ShahInHimachalpic,924863115958763521,https://twitter.com/BJP4India/status/924863115958763521
2017-10-30 04:37:00,RajaBrar_INC,ANI,13,293,590,"While BJP and Amit Shah Ji are busy purchasing leaders in Gujarat....https://twitter.com/ani/status/924347809406500864 …",,,,924857645357441029,https://twitter.com/RajaBrar_INC/status/924857645357441029
2017-10-30 03:44:25,arunjaitley,,122,330,2375,"Tributes to #SwamiDayanandSaraswati on his Punya Tithipic.twitter.com/yLvd4ERKyr",,,#SwamiDayanandSaraswati,924844411481079808,https://twitter.com/arunjaitley/status/924844411481079808
2017-10-30 03:30:03,INCIndia,,63,497,1248,"Homi Jehangir Bhabha had been appointed the director of the Indian Nuclear Program by Pt. Nehru in 1948.pic.twitter.com/uPaPuH4ur3",,,,924840797651877889,https://twitter.com/INCIndia/status/924840797651877889
2017-10-30 03:21:10,MamataOfficial,,22,44,505,"pic.twitter.com/mjepT16heU",,,,924838563694264320,https://twitter.com/MamataOfficial/status/924838563694264320
2017-10-30 02:51:49,MamataOfficial,,20,38,404,"Solemnly remembering director V Shantaram on his death anniversary",,,,924831175482384384,https://twitter.com/MamataOfficial/status/924831175482384384
2017-10-30 02:51:39,MamataOfficial,,35,41,558,"Solemnly remembering Begum Akhtar on her death anniversary",,,,924831133878992896,https://twitter.com/MamataOfficial/status/924831133878992896
2017-10-30 02:51:31,MamataOfficial,,40,116,1173,"Remembering legendary nuclear physicist Homi Jehangir Bhabha on his birth anniversary",,,,924831099301138433,https://twitter.com/MamataOfficial/status/924831099301138433
2017-10-30 02:51:18,MamataOfficial,,26,56,610,"Remembering Sukumar Ray, the great humorist and creator of 'nonsense verse' in Bangla, on his birth anniversary",,,,924831047858118656,https://twitter.com/MamataOfficial/status/924831047858118656
2017-10-30 02:30:36,AmitShah,,254,1220,6020,"आर्य समाज के संस्थापक, महान चिंतक व समाज सुधारक महर्षि स्वामी दयानन्द सरस्वती जी की पुण्यतिथि पर भावभीनी श्रद्धांजलि।pic.twitter.com/8ownRh8Hmp",,,,924825834657116160,https://twitter.com/AmitShah/status/924825834657116160
2017-10-30 02:30:04,INCIndia,,24,365,943,"Remembering V. Shantaram, who had an illustrious cinematic career for almost six decades.pic.twitter.com/3Ey65RoqHi",,,,924825700183322624,https://twitter.com/INCIndia/status/924825700183322624
