date,username,to,replies,retweets,favorites,text,geo,mentions,hashtags,id,permalink
2017-10-02 13:43:51,RajaBrar_INC,TV24India,15,308,640,"एक सांसद को अपने ही घर,अपने ही लोगों के बीच जाने से रोका जाना,भाजपा सरकार के अंदर @OfficeOfRG की बड़ती लोकप्रियता को लेकर बड़ते डर की तस्वीरhttps://twitter.com/tv24india/status/914503546032111617 …",,@OfficeOfRG,,914848403946795009,https://twitter.com/RajaBrar_INC/status/914848403946795009
2017-10-02 13:41:01,RajaBrar_INC,,5,139,264,"Some more pictures from Gurdaspur Lok Sabha By-Election today.pic.twitter.com/Y9aJl9wsIk",,,,914847692207083521,https://twitter.com/RajaBrar_INC/status/914847692207083521
2017-10-02 13:38:54,RajaBrar_INC,,8,147,273,"During an election campaign in Gurdaspur todaypic.twitter.com/9MeZja3IP1",,,,914847157714165761,https://twitter.com/RajaBrar_INC/status/914847157714165761
2017-10-02 13:20:48,narendramodi,,274,1192,5233,"Laudable work by @ril_foundation across India towards a Swachh Bharat. Have a look at this timeline. https://twitter.com/ril_foundation/",,@ril_foundation,,914842603497054210,https://twitter.com/narendramodi/status/914842603497054210
2017-10-02 13:00:57,PMOIndia,,206,494,2931,"Realising Mahatma Gandhi's dream of a Swachh Bharat.http://news.trust.org/item/20170929142521-3agwx …",,,,914837610924720129,https://twitter.com/PMOIndia/status/914837610924720129
2017-10-02 12:56:17,PMOIndia,,170,342,1624,"Service For Swachhata http://indianexpress.com/article/opinion/columns/service-for-swachhata/ … via NMApppic.twitter.com/tMwksGXN9r",,,,914836435169026049,https://twitter.com/PMOIndia/status/914836435169026049
2017-10-02 12:53:36,INCIndia,,292,675,1638,"Originals can always be imitated, but no matter how much they try, Gandhiji can never be appropriated. #JanKiBaat #GandhiJayantipic.twitter.com/9fu8c57pzs",,,#JanKiBaat #GandhiJayantipic,914835760490020866,https://twitter.com/INCIndia/status/914835760490020866
2017-10-02 12:47:58,narendramodi,,300,1235,5274,"I laud @DettolIndia & @ndtv for the initiative. This timeline has many inspiring efforts on cleanliness. #Cleanathon https://twitter.com/swachhindia",,@DettolIndia @ndtv,#Cleanathon,914834343285215234,https://twitter.com/narendramodi/status/914834343285215234
2017-10-02 12:47:33,JM_Scindia,,39,225,938,"आज ग्वालियर में क्षत्रिय महासभा के कार्यक्रम में सम्मिलित होकर स्वयं को गौरवान्वित महसूस किया।pic.twitter.com/7wfMHDixRc",,,,914834236963618817,https://twitter.com/JM_Scindia/status/914834236963618817
2017-10-02 12:40:58,narendramodi,rajeev_mp,160,944,4862,"Good effort Rajeev ji.https://twitter.com/rajeev_mp/status/914701237869613056 …",,,,914832579228028928,https://twitter.com/narendramodi/status/914832579228028928
2017-10-02 12:40:31,laluprasadrjd,,1749,2653,13418,"मुँह में राम, दिमाग में नाथूराम तभी तो बना पलटूराम",,,,914832466707234816,https://twitter.com/laluprasadrjd/status/914832466707234816
2017-10-02 12:34:36,ncbn,,12,63,568,"Children essentially watch & learn from us, we should inculcate values in our children from the very start for them to garner good habits.pic.twitter.com/rH4bCYBFvU",,,,914830977809096704,https://twitter.com/ncbn/status/914830977809096704
2017-10-02 12:33:52,ncbn,,39,36,369,"గాంధీ జయంతి సందర్భంగా 'స్వచ్ఛతే సేవ' కార్యక్రమం నిర్వహించి, 'స్వచ్ఛాంధ్ర మిషన్‌'లో విజేతలుగా ఎంపికైన వారికి అవార్డులతో ప్రోత్సహించాముpic.twitter.com/W5ieJHr5h8",,,,914830791800057856,https://twitter.com/ncbn/status/914830791800057856
2017-10-02 12:33:05,ncbn,,13,36,404,"Paid floral tributes to the statues of great leaders, Mahatma Gandhi and Lal Bahadur Shastri on their birth anniversaries.",,,,914830594428747776,https://twitter.com/ncbn/status/914830594428747776
2017-10-02 12:32:26,ncbn,,26,64,714,"Launched the logo for social security scheme, PMJJBY Chandranna Bima at Swachhate Seva event today.pic.twitter.com/VoGrYHr0pe",,,,914830434269196288,https://twitter.com/ncbn/status/914830434269196288
2017-10-02 12:31:21,ncbn,,12,35,319,"Attended the Swachhate Seva event and highlighted that we must join hands in making all the districts of AP Open Defecation Free(ODF).pic.twitter.com/STYv7xNaFC",,,,914830160125247488,https://twitter.com/ncbn/status/914830160125247488
2017-10-02 12:23:34,BJP4India,,52,339,1231,"We worked on cleanliness drive unwaveringly for 3 years because I was convinced that the path shown by Bapu could not be wrong: PM Modipic.twitter.com/KYw0sVCNxB",,,,914828199137177601,https://twitter.com/BJP4India/status/914828199137177601
2017-10-02 12:17:05,BJP4India,,83,535,2321,"स्वराज का शस्त्र था सत्याग्रह और श्रेष्ठ भारत का शस्त्र है स्वच्छता: पीएम श्री @narendramodi, स्वच्छता अभियान के तीन वर्ष पूर्ण होने परpic.twitter.com/YfD3yxfC9V",,@narendramodi,,914826571642421248,https://twitter.com/BJP4India/status/914826571642421248
2017-10-02 12:05:43,AmitShah,,278,830,3372,"जब गुजरात में भारतीय जनता पार्टी की सरकार आई तो राज्य से गुंडागर्दी और कांग्रेस दोनों का सफाया हुआ, दोनों की हार हुई। #ગુજરાતગૌરવયાત્રાpic.twitter.com/0UcFDGD9g4",,,#ગ,914823707507527680,https://twitter.com/AmitShah/status/914823707507527680
2017-10-02 12:05:22,AmitShah,,557,1284,6462,"हम गुजरात की स्थापना से 1995 तक के कांग्रेस शासन और उसके बाद के भाजपा शासन की तुलना करें तो साफ हो जाएगा कि विकास कहाँ से कहाँ पहुंचा है।pic.twitter.com/dlmaRw07DS",,,,914823622409285632,https://twitter.com/AmitShah/status/914823622409285632
2017-10-02 12:03:25,RajaBrar_INC,,8,194,436,"Campaigning in favour of @INCIndia candidate Sunil Jakhar ji for Gurdaspur loksabha bypoll elections.pic.twitter.com/OzwaV5O8Su",,@INCIndia,,914823128747933696,https://twitter.com/RajaBrar_INC/status/914823128747933696
2017-10-02 11:45:14,RajaBrar_INC,,7,129,216,"जय जवान-जय किसान का नारा दे भारत के दो आधार स्तंभ को महान कहने वाले,स्वतंत्र भारत के दूसरे प्रधानमंत्री,लाल बहादुर शास्त्रीजी को शत्-शत् नमनpic.twitter.com/ShcbhwzjBl",,,,914818554658037760,https://twitter.com/RajaBrar_INC/status/914818554658037760
2017-10-02 11:40:14,RajaBrar_INC,IYC,4,160,313,"सत्य और अहिंसा के बल पर अंग्रेजो से भारत को स्वतंत्र करा हम सब को स्वतंत्र भारत का अनमोल उपहार देने वाले राष्ट्रपिता गाँधी जी को शत् शत् नमनhttps://twitter.com/iyc/status/914671279378255878 …",,,,914817297222529024,https://twitter.com/RajaBrar_INC/status/914817297222529024
2017-10-02 11:37:37,RajaBrar_INC,,6,152,305,"गाँधी जी एवं लाल बहादूर शास्त्री जैसी अदभुत प्रतिभाओ का 2 अक्टूबर के अवतरण ने भारत माता को गौरवान्वित किया।pic.twitter.com/p5WaJOft5m",,,,914816636217040896,https://twitter.com/RajaBrar_INC/status/914816636217040896
2017-10-02 11:28:16,narendramodi,BCCI,256,1716,8718,"Appreciable message by the Indian Cricket Team on making India Clean. #SwachhataHiSevahttps://twitter.com/BCCI/status/914405122469281794 …",,,#SwachhataHiSevahttps,914814286530191361,https://twitter.com/narendramodi/status/914814286530191361
2017-10-02 11:27:20,narendramodi,SadhguruJV,340,2821,9676,"I congratulate @SadhguruJV & the team of Isha Foundation for their exemplary effort to generate awareness on keeping our rivers clean.https://twitter.com/SadhguruJV/status/914467512921751552 …",,@SadhguruJV,,914814050474844160,https://twitter.com/narendramodi/status/914814050474844160
2017-10-02 11:26:44,narendramodi,RajatSharmaLive,148,984,4254,"Wonderful initiative by @indiatvnews. This will further spread the message of cleanliness across the nation.https://twitter.com/RajatSharmaLive/status/908677084892905472 …",,@indiatvnews,,914813898414546944,https://twitter.com/narendramodi/status/914813898414546944
2017-10-02 11:25:37,narendramodi,IndiaToday,155,1007,4423,"I laud the @IndiaToday family for the proactive steps to further awareness on Swachhata. Congrats to all #Safaigiri awardees.https://twitter.com/IndiaToday/status/914719000210182144 …",,@IndiaToday,#Safaigiri,914813615877656576,https://twitter.com/narendramodi/status/914813615877656576
2017-10-02 11:25:03,narendramodi,CKforCleanIndia,99,832,3417,"Important message by @CKforCleanIndia, who along with the @ICICIBank family has made vital contributions to Swachh Bharat Mission.https://twitter.com/CKforCleanIndia/status/914682883268161537 …",,@CKforCleanIndia @ICICIBank,,914813475418804224,https://twitter.com/narendramodi/status/914813475418804224
2017-10-02 11:24:16,narendramodi,Mohanlal,144,1050,4452,"Excellent effort by noted actor @Mohanlal. #SwachhataHiSevahttps://twitter.com/Mohanlal/status/914717460305108992 …",,@Mohanlal,#SwachhataHiSevahttps,914813277535965184,https://twitter.com/narendramodi/status/914813277535965184
2017-10-02 11:23:50,narendramodi,AnupamPKher,113,982,4091,"Commendable gesture Anupam ji. #SwachhataHiSevahttps://twitter.com/AnupamPkher/status/914708346455736321 …",,,#SwachhataHiSevahttps,914813169662603264,https://twitter.com/narendramodi/status/914813169662603264
2017-10-02 11:14:33,narendramodi,,392,1209,6584,"Sharing my speech at the programme to mark Swachh Bharat Diwas.http://nm-4.com/4ch5",,,,914810831082328064,https://twitter.com/narendramodi/status/914810831082328064
2017-10-02 11:14:11,narendramodi,,140,992,3913,"Handed over awards to winners of the essay, painting and film competitions held under #SwachhataHiSeva movement.pic.twitter.com/f5VON7CcML",,,#SwachhataHiSeva,914810742204960768,https://twitter.com/narendramodi/status/914810742204960768
2017-10-02 11:12:17,narendramodi,,331,1674,7274,"I salute all those who participated actively in the #SwachhataHiSeva movement. Let us continue this momentum & work towards a clean India.",,,#SwachhataHiSeva,914810260044398592,https://twitter.com/narendramodi/status/914810260044398592
2017-10-02 11:11:43,narendramodi,,233,1300,5527,"An important aspect of Swachh Bharat Abhiyaan is the positive impact it has on women.pic.twitter.com/1ZamFhbrBu",,,,914810121083019264,https://twitter.com/narendramodi/status/914810121083019264
2017-10-02 11:11:18,narendramodi,,163,1183,5110,"Just like the Satyagrahi was at the core of India’s quest for Swarajya, Swachhagrahi is at the core of our dream of a Shreshtha Bharat.pic.twitter.com/9qyphQ8OJG",,,,914810015252230144,https://twitter.com/narendramodi/status/914810015252230144
2017-10-02 11:08:57,narendramodi,,270,1268,5287,"Gandhi ji’s dream of a Swachh Bharat will be fulfilled by the collective strength and efforts of 125 crore Indians.pic.twitter.com/bPrXtstRBW",,,,914809424622923777,https://twitter.com/narendramodi/status/914809424622923777
2017-10-02 11:08:49,narendramodi,,599,2261,12602,"In the last 3 years, Swachh Bharat Abhiyaan has become a people’s movement, based on the strong foundations of Jan Bhagidari.",,,,914809391269818368,https://twitter.com/narendramodi/status/914809391269818368
2017-10-02 11:04:30,narendramodi,,187,1057,3919,"On Swachh Bharat Diwas, joined a programme to mark 3rd anniversary of @swachhbharat Mission & conclusion of #SwachhataHiSeva movement.pic.twitter.com/qlJlvnbdww",,@swachhbharat,#SwachhataHiSeva,914808303137542146,https://twitter.com/narendramodi/status/914808303137542146
2017-10-02 10:50:23,AmitShah,,402,1420,7356,"महात्मा गांधी जी की जन्मभूमि पोरबंदर से ""गुजरात गौरव यात्रा"" के दूसरे चरण का शुभारंभ किया।pic.twitter.com/YxLXuRtDU8",,,,914804752382353409,https://twitter.com/AmitShah/status/914804752382353409
2017-10-02 10:35:55,AmitShah,,182,639,3487,"गांधी जयंती के शुभ अवसर पर आज महात्मा गांधी जी की जन्मभूमि पोरबंदर में ""कीर्ति मंदिर"" जाकर उनको वंदन किया और श्रद्धांजलि अर्पित की।pic.twitter.com/egGzFFP9jA",,,,914801110761787393,https://twitter.com/AmitShah/status/914801110761787393
2017-10-02 10:34:27,SachinPilot,,53,302,968,"Held a prayer meet at cong office in jaipur to mark #GandhiJayanti and #LalBahadurShastri ji anniversary.pic.twitter.com/iNyPp49Jcc",,,#GandhiJayanti #LalBahadurShastri,914800740345851905,https://twitter.com/SachinPilot/status/914800740345851905
2017-10-02 10:20:12,JM_Scindia,,25,168,662,"आज ग्वालियर में उनकी जयंती पर माल्यार्पण कर श्रद्धांजलि अर्पित की।pic.twitter.com/aONLDxYn6m",,,,914797154593656832,https://twitter.com/JM_Scindia/status/914797154593656832
2017-10-02 10:19:40,JM_Scindia,,64,399,1992,"देश को जय जवान-जय किसान का प्रसिद्ध नारा देने वाले पूर्व प्रधानमंत्री श्री लाल बहादुर शास्त्री जी की जयंती पर उन्हें मेरा शत शत नमन।",,,,914797019671048193,https://twitter.com/JM_Scindia/status/914797019671048193
2017-10-02 08:51:50,JM_Scindia,,27,189,850,"राष्ट्रपिता महात्मा गांधी जी की जयंती के अवसर पर आज ग्वालियर में उनकी प्रतिमा पर पुष्प चढ़ा कर श्रद्धांजलि अर्पित की।pic.twitter.com/ESlA3VTWvu",,,,914774917299757056,https://twitter.com/JM_Scindia/status/914774917299757056
2017-10-02 08:50:56,JM_Scindia,,52,333,1230,"""मेरा धर्म सत्य और अहिंसा पर आधारित है। सत्य मेरा भगवान है, अहिंसा उसे पाने का साधन।"" - महात्मा गांधी #GandhiJayantipic.twitter.com/t7pnqQNDdK",,,#GandhiJayantipic,914774691440623616,https://twitter.com/JM_Scindia/status/914774691440623616
2017-10-02 08:41:05,ArvindKejriwal,,85,551,1331,"pic.twitter.com/QEijDN9Bq9",,,,914772210807533568,https://twitter.com/ArvindKejriwal/status/914772210807533568
2017-10-02 08:30:06,BJP4India,,86,410,1690,"जय जवान-जय किसान के उद्घोषक पूर्व प्रधानमंत्री, भारत रत्न लाल बहादुर शास्त्री जी की जयंती पर शत्-शत् नमन।pic.twitter.com/Zz71T5JycP",,,,914769448757637120,https://twitter.com/BJP4India/status/914769448757637120
2017-10-02 07:44:02,BJP4India,,38,158,656,"Watch LIVE: Shri @AmitShah addressing Gujarat Gaurav Yatra in Porbandar. https://www.facebook.com/BJP4India/videos/1838357442871437/ … #ગાંધીસ્મરણ_ગુજરાતગૌરવpic.twitter.com/Tnvqpk8Yj7",,@AmitShah,#ગ,914757856099844096,https://twitter.com/BJP4India/status/914757856099844096
2017-10-02 07:41:19,BJP4India,,114,517,2253,"LIVE: Shri @AmitShah addressing #GujaratGauravYatra in Porbandar, Gujarat. #ગાંધીસ્મરણ_ગુજરાતગૌરવhttps://www.pscp.tv/w/bKCTnzFZTEVKTlh4RG5ORU58MUJSS2p5UG92Z2F4d0RjoEZltC-0N2crxAh9JL8jtFjgG0W2oj0MaYRDfElX …",,@AmitShah,#GujaratGauravYatra #ગ,914757172336013312,https://twitter.com/BJP4India/status/914757172336013312
2017-10-02 07:31:03,BJP4India,,16,118,342,"BJP has decided to protest against this murder politics of CPM by organising #JanarakshaYatra: Shri @PrakashJavdekar @BJP4Keralampic.twitter.com/Jtgw6HkfYJ",,@PrakashJavdekar @BJP4Keralampic,#JanarakshaYatra,914754586124050432,https://twitter.com/BJP4India/status/914754586124050432
2017-10-02 07:28:11,BJP4India,,25,124,342,"CPI(M) has always engaged in murder politics in Kerala - Shri @PrakashJavdekar https://www.youtube.com/watch?v=QzbHtqL8Jzg … #JanarakshaYatra @BJp4Keralam",,@PrakashJavdekar @BJp4Keralam,#JanarakshaYatra,914753864145838080,https://twitter.com/BJP4India/status/914753864145838080
2017-10-02 07:25:31,BJP4India,,54,228,791,"BJP National President Shri @AmitShah will participate in a 'padyatra' in Kerala on October 3. https://www.youtube.com/watch?v=QzbHtqL8Jzg … #JanarakshaYatrapic.twitter.com/0hvr3j4Et8",,@AmitShah,#JanarakshaYatrapic,914753193011113984,https://twitter.com/BJP4India/status/914753193011113984
2017-10-02 07:22:06,INCIndia,,56,303,738,"ગાંધી વિચારધારાને અનુસરીને જ સંપૂર્ણ સ્વરાજની સ્થાપના કરી શકાય. ગુજરાતનું ગૌરવ ગાંધીને પગલે ચાલવામાં જ સમાયેલું છે. https://medium.com/@Congress/%E0%AA%97%E0%AA%BE%E0%AA%82%E0%AA%A7%E0%AB%80%E0%AA%A8%E0%AB%87-%E0%AA%AA%E0%AA%97%E0%AA%B2%E0%AB%87-%E0%AA%AA%E0%AA%97%E0%AA%B2%E0%AB%87-%E0%AA%A4%E0%AB%81%E0%AA%82-%E0%AA%9A%E0%AA%BE%E0%AA%B2%E0%AB%80%E0%AA%B6-%E0%AA%A8%E0%AB%87-%E0%AA%97%E0%AB%81%E0%AA%9C%E0%AA%B0%E0%AA%BE%E0%AA%A4-7ab52d3d69db …pic.twitter.com/ev9uguc7VM",,@Congress,,914752335884062720,https://twitter.com/INCIndia/status/914752335884062720
2017-10-02 07:22:04,mkstalin,,82,192,1403,"Let us commit ourselves to build an economically stronger India w/ secularism& Grama Swaraj as guiding principles at its core #GandhiJayantipic.twitter.com/KOIzFdemN6",,,#GandhiJayantipic,914752326254002176,https://twitter.com/mkstalin/status/914752326254002176
2017-10-02 07:09:28,BJP4India,,90,289,1099,"प्रधानमंत्री श्री नरेन्द्र मोदी के प्रोत्साहन से बीते 3 साल में खादी की बिक्री में 86% की अभूतपूर्व वृद्धि।pic.twitter.com/dcxOWXmbgK",,,,914749156731781120,https://twitter.com/BJP4India/status/914749156731781120
2017-10-02 06:53:32,BJP4India,,62,397,1876,"On birth anniversary of Pujya Bapu and Shastri ji, let us dedicate ourselves to create a clean India : PM Shri @narendramodi",,@narendramodi,,914745146436194304,https://twitter.com/BJP4India/status/914745146436194304
2017-10-02 06:53:22,BJP4India,,7,81,313,"I keep saying- this is the start. We should continue the momentum built by the movement: PM @narendramodi -https://www.facebook.com/BJP4India/videos/1838253589548489/ …",,@narendramodi,,914745105294139392,https://twitter.com/BJP4India/status/914745105294139392
2017-10-02 06:53:02,BJP4India,,22,127,531,"I congratulate all those who supported and took part in the #SwachhataHiSeva movement : PM @narendramodi -http://bjplive.org",,@narendramodi,#SwachhataHiSeva,914745020351156224,https://twitter.com/BJP4India/status/914745020351156224
2017-10-02 06:52:09,PMOIndia,,462,1298,6081,"I congratulate all those who supported and took part in the #SwachhataHiSeva movement. I keep saying- this is the start. We should continue the momentum built by the movement: PM @narendramodi",,@narendramodi,#SwachhataHiSeva,914744795712622592,https://twitter.com/PMOIndia/status/914744795712622592
2017-10-02 06:42:31,BJP4India,,50,155,652,"The #SwachhBharat Mission is about both 'Vyavastha' (systems) and 'Vichar' (thought process and mindset): PM Shri @narendramodipic.twitter.com/cVQyuBrT9l",,@narendramodipic,#SwachhBharat,914742375099936768,https://twitter.com/BJP4India/status/914742375099936768
2017-10-02 06:39:25,PMOIndia,,220,701,3510,"The @swachhbharat Mission is about both 'Vyavastha' (systems) and 'Vichar' (thought process and mindset): PM @narendramodi",,@swachhbharat @narendramodi,,914741594900725760,https://twitter.com/PMOIndia/status/914741594900725760
2017-10-02 06:38:32,BJP4India,,61,260,1160,"बच्चे स्वच्छ भारत के सबसे बड़े ब्रांड एम्बेसडर है: पीएम @narendramodi लाइव देखें http://bjplive.org |https://www.facebook.com/BJP4India/videos/1838253589548489 …",,@narendramodi,,914741371143168000,https://twitter.com/BJP4India/status/914741371143168000
2017-10-02 06:32:53,BJP4India,,67,270,1246,"आज स्वच्छता अभियान देश के सामान्य मानवीय का अपना सपना बन चुका है: पीएम श्री @narendramodi https://www.facebook.com/BJP4India/videos/1838253589548489/ … #SwachhBharat",,@narendramodi,#SwachhBharat,914739948875481088,https://twitter.com/BJP4India/status/914739948875481088
2017-10-02 06:31:57,PMOIndia,,183,656,3047,"A positive spirit of competition has been created due to @swachhbharat Mission. We see this in the cleanliness rankings, how organisations are working on cleanliness: PM @narendramodi",,@swachhbharat @narendramodi,,914739713289809920,https://twitter.com/PMOIndia/status/914739713289809920
2017-10-02 06:30:18,PMOIndia,,317,830,4734,"India has accepted the Swachh Bharat Abhiyaan. The movement has become a people's movement due to the 'Siddhi' of Swachhagrahis: PM @narendramodi",,@narendramodi,,914739300574441472,https://twitter.com/PMOIndia/status/914739300574441472
2017-10-02 06:29:26,BJP4India,,59,171,688,"मुझे विश्वास है अगर समाज की शक्ति को अगर स्वीकार करके चले, जन भागीदारी को स्वीकार करके चले तो ये अभियान सफल होता जायेगा: पीएम #SwachhBharatpic.twitter.com/A8LCRcxoT4",,,#SwachhBharatpic,914739079526469633,https://twitter.com/BJP4India/status/914739079526469633
2017-10-02 06:28:28,BJP4India,,10,112,312,"The dream of a #SwachhBharat will be realised by 125 crore Indians, not a select group of leaders or officials: PM https://www.facebook.com/BJP4India/videos/1838253589548489/ …",,,#SwachhBharat,914738836638392321,https://twitter.com/BJP4India/status/914738836638392321
2017-10-02 06:26:41,PMOIndia,,729,1788,9909,"The dream of a Swachh Bharat will be realised by 125 crore Indians, not a select group of leaders or officials: PM @narendramodi",,@narendramodi,,914738390330859521,https://twitter.com/PMOIndia/status/914738390330859521
2017-10-02 06:24:27,BJP4India,,42,192,863,"When we initiated Swachh Bharat Abhiyan, we faced criticism. But three years later, now we are well aware of its progress: PM @narendramodi",,@narendramodi,,914737827904147457,https://twitter.com/BJP4India/status/914737827904147457
2017-10-02 06:24:20,PMOIndia,,389,957,5416,"India faces challenges but that does not mean we run away from them. We will face them and work to overcome them: PM @narendramodi",,@narendramodi,,914737797633683456,https://twitter.com/PMOIndia/status/914737797633683456
2017-10-02 06:21:20,BJP4India,,12,119,461,"PM @narendramodi addressing on the occasion of 3rd anniversary of #SwachhBharat Mission. http://bjplive.org | https://www.facebook.com/BJP4India/videos/1838253589548489 …pic.twitter.com/fy3jKvLxTu",,@narendramodi,#SwachhBharat,914737040205398016,https://twitter.com/BJP4India/status/914737040205398016
2017-10-02 06:19:12,BJP4India,,22,132,585,"PM Shri @narendramodi distributing prizes to the winners of #SwachhBharat essay & painting competition. https://www.facebook.com/BJP4India/videos/1838253589548489/ …pic.twitter.com/HonpERfC5h",,@narendramodi,#SwachhBharat,914736507306491905,https://twitter.com/BJP4India/status/914736507306491905
2017-10-02 05:59:44,BJP4India,,29,170,561,"PM @narendramodi at the 3rd anniversary of Swachh Bharat Mission & the conclusion of #SwachhataHiSeva fortnight https://www.facebook.com/BJP4India/videos/1838253589548489 …pic.twitter.com/xtoGHmIwgC",,@narendramodi,#SwachhataHiSeva,914731605884682241,https://twitter.com/BJP4India/status/914731605884682241
2017-10-02 05:54:39,ArvindKejriwal,,418,854,3253,"pic.twitter.com/j9UMl5EtIV",,,,914730325594357760,https://twitter.com/ArvindKejriwal/status/914730325594357760
2017-10-02 05:45:21,BJP4India,,260,842,3516,"Live - PM Shri @narendramodi at 3rd anniversary of #SwachhBharat Mission at Vigyan Bhawan, New Delhihttps://www.pscp.tv/w/bKB4cTFZTEVKTlh4RG5ORU58MU95S0FyV2txd3lHYlnmSyOkhV1i2N_pwTGxAl5aoVHEEBJpvUGGE5sFvmec …",,@narendramodi,#SwachhBharat,914727984702951424,https://twitter.com/BJP4India/status/914727984702951424
