date,username,to,replies,retweets,favorites,text,geo,mentions,hashtags,id,permalink
2017-10-11 10:42:26,RahulGandhi,,1046,2809,8899,"Darshan at Kabir Mandir in Saliya, Dahodpic.twitter.com/VHC7YxKQ8J",,,,918064242489618432,https://twitter.com/RahulGandhi/status/918064242489618432
2017-10-11 10:31:51,OmarAbdullah,VORdotcom,1,0,3,"",,,,918061576791326720,https://twitter.com/OmarAbdullah/status/918061576791326720
2017-10-11 10:30:01,INCIndia,,83,435,666,"Read how BJP is using its brute majority in Parliament to convert it into an echo chamber for its ideas of bigotry: https://medium.com/@Congress/misuse-of-the-privileges-committee-of-parliament-suppresses-press-freedom-32f64d666ec7 …pic.twitter.com/UitLGT068R",,@Congress,,918061117062070273,https://twitter.com/INCIndia/status/918061117062070273
2017-10-11 10:28:21,OmarAbdullah,VORdotcom,2,2,12,"One day @twitter will allow us to edit our posts till then we just have to live with the embarrassment of spelling/grammar/drafting errors.",,@twitter,,918060696855748613,https://twitter.com/OmarAbdullah/status/918060696855748613
2017-10-11 10:15:54,OmarAbdullah,,29,8,82,"I just hate it when I read a tweet of mine a few minutes after posting & realise I have a spelling mistake/forgot to delete a word. Arghhh.",,,,918057564998270976,https://twitter.com/OmarAbdullah/status/918057564998270976
2017-10-11 10:15:03,BJP4India,,454,832,3429,"कांग्रेस के शहज़ादे राहुल गाँधी हिसाब दें कि उनकी तीन पीढ़ियों ने अमेठी के लिए क्या किया है: श्री @AmitShah, 10.10.2017pic.twitter.com/MIJhcWlaCE",,@AmitShah,,918057351025803265,https://twitter.com/BJP4India/status/918057351025803265
2017-10-11 10:05:01,OmarAbdullah,,23,39,240,"Gotta love #Punjab. The @BurjAlArab has been transported & is now resides as a hotel near Phagwara. (Photo courtesy a friend)pic.twitter.com/oMeIHzw56E",,@BurjAlArab,#Punjab,918054824075079680,https://twitter.com/OmarAbdullah/status/918054824075079680
2017-10-11 10:03:06,BJP4India,,166,540,2001,"अमेठी की दुर्दशा गांधी-नेहरु मॉडल का परिचायक है और गुजरात का विकास मोदी मॉडल का: श्री @AmitShahpic.twitter.com/5LR9NccoCd",,@AmitShahpic,,918054343164641280,https://twitter.com/BJP4India/status/918054343164641280
2017-10-11 10:00:54,INCIndia,,72,528,1228,"Rahul Gandhi holds a public meeting in Limkheda's Dahod District. #Congress_Aave_Chepic.twitter.com/lYmXcUlwh4",,,#Congress_Aave_Chepic,918053788585402368,https://twitter.com/INCIndia/status/918053788585402368
2017-10-11 09:08:29,ncbn,,95,111,906,"స్వచ్ఛ ఆంధ్రప్రదేశ్ మిషన్ లో భాగంగా విజయవాడ, గుంటూరు నగరపాలక సంస్థలకు చెందిన అత్యాధునిక చెత్త సేకరణ వాహనాలను నేడు జెండా ఊపి ప్రారంభించానుpic.twitter.com/vuDBpaamBe",,,,918040597398564866,https://twitter.com/ncbn/status/918040597398564866
2017-10-11 09:07:49,ncbn,,52,89,989,"బాలికలు స్వేచ్ఛగా తమ ఆశల రెక్కలు విప్పుకుని ఆకాశాన్ని అందుకునేలా చేయూతనిద్దామని నేడు అంతర్జాతీయ బాలికల దినోత్సవం సందర్భంగా ప్రతిజ్ఞ చేద్దాం.",,,,918040431564226560,https://twitter.com/ncbn/status/918040431564226560
2017-10-11 08:56:30,BJP4India,,97,438,1374,"A heartfelt thanks to all party karyakartas and voters of Maharashtra on the stupendous victory of BJP in local body polls.pic.twitter.com/xV1YqsJVEM",,,,918037580167311360,https://twitter.com/BJP4India/status/918037580167311360
2017-10-11 08:48:57,laluprasadrjd,,143,351,3575,"महान स्वतंत्रता सेनानी लोकनायक श्री जयप्रकाश नारायण जी को उनकी जयंती पर कोटि-कोटि प्रणाम व शत-शत नमन। #JayaprakashNarayan",,,#JayaprakashNarayan,918035681162571776,https://twitter.com/laluprasadrjd/status/918035681162571776
2017-10-11 07:37:07,OmarAbdullah,smitaprakash,2,0,3,"",,,,918017605792817152,https://twitter.com/OmarAbdullah/status/918017605792817152
2017-10-11 07:33:39,OmarAbdullah,smitaprakash,15,2,21,"PM’s personal handle or PMO?",,,,918016731301347329,https://twitter.com/OmarAbdullah/status/918016731301347329
2017-10-11 07:33:12,INCIndia,,243,1781,4581,"The people of Baroj Village and Zoz Village in Gujarat warmly welcomed Congress VP Rahul Gandhi. #Congress_Aave_Chepic.twitter.com/HC2gPL9qtV",,,#Congress_Aave_Chepic,918016619191853057,https://twitter.com/INCIndia/status/918016619191853057
2017-10-11 07:32:55,BJP4India,,58,355,902,"You may share your favourite #IncredibleIndia moment with PM @narendramodi by creating a post card. Download NM app http://nm4.in/dnldapp pic.twitter.com/75oSDuvMEE",,@narendramodi,#IncredibleIndia,918016548555579393,https://twitter.com/BJP4India/status/918016548555579393
2017-10-11 07:21:49,BJP4India,,141,307,1302,"ग्रामीण जीवन में बदलाव लाने के संकल्प के साथ हम चलें है : पीएम श्री नरेन्द्र मोदीpic.twitter.com/Gao2ppC9pL",,,,918013753660026880,https://twitter.com/BJP4India/status/918013753660026880
2017-10-11 07:18:47,BJP4India,,56,183,615,"हमारे देश में कृषि क्षेत्र और पशुपालन ग्रामीण जीवन की अर्थव्यवस्था के केंद्र बिंदु हैं : पीएम मोदी - लाइव http://bjplive.org परpic.twitter.com/YfnxGopeY5",,,,918012990552547328,https://twitter.com/BJP4India/status/918012990552547328
2017-10-11 07:14:46,PMOIndia,,383,583,3260,"Lack of sanitation facilities is adversely impacting the development journey of villages. That is why we have been working to overcome this and build toilets in rural areas: PM @narendramodi",,@narendramodi,,918011978395803648,https://twitter.com/PMOIndia/status/918011978395803648
2017-10-11 07:10:22,BJP4India,,44,197,594,"लोकतंत्र की सफलता तब है जब देश जनभागीदारी से चले : पीएम श्री नरेन्द्र मोदी - लाइव देखें https://www.facebook.com/BJP4India/videos/1850596651647516/ … परpic.twitter.com/QJCrGFY3gw",,,,918010874337435648,https://twitter.com/BJP4India/status/918010874337435648
2017-10-11 07:08:30,PMOIndia,,502,1103,6963,"Strength of a democracy cannot be restricted to how many people vote. Yes, that is important but the real essence of a democracy is Jan Bhagidari and integrating people in the development journey of cities, villages. Regular Samvad with governments is required: PM @narendramodi",,@narendramodi,,918010404042711040,https://twitter.com/PMOIndia/status/918010404042711040
2017-10-11 07:07:29,BJP4India,,39,183,574,"The country lacks good governance in some states, development is visible is states where there is good governance : PM @narendramodipic.twitter.com/irEMT1aQhU",,@narendramodipic,,918010148081221632,https://twitter.com/BJP4India/status/918010148081221632
2017-10-11 07:02:24,BJP4India,,363,412,2178,"जो सुविधा शहर के लोगों को उपलब्ध हैं वही सुविधाएं गांव के लोगों के पास भी होनी चाहिए, इस दिशा में हम कार्य कर रहें है : पीएम मोदीpic.twitter.com/usZtFMsdbo",,,,918008868101173248,https://twitter.com/BJP4India/status/918008868101173248
2017-10-11 07:00:53,PMOIndia,,207,419,2364,"Facilties that are associated with cities must also be made available to our villages: PM @narendramodi",,@narendramodi,,918008484888584194,https://twitter.com/PMOIndia/status/918008484888584194
2017-10-11 07:00:00,PMOIndia,,188,660,2755,"Just having the best ideas for development are not enough. Initiatives have to be completed on time and the fruits of development must reach the intended beneficiaries. Efforts have to be comprehensive and 'outcome driven' not 'output driven' : PM @narendramodi",,@narendramodi,,918008265329348610,https://twitter.com/PMOIndia/status/918008265329348610
2017-10-11 06:59:00,INCIndia,,54,432,834,"'Govt’s continued support for demonetisation reflects arrogance far removed from the struggles of everyday people'https://thewire.in/186135/modinomics-behavioural-economics-two-sides-coin/ …",,,,918008012702228480,https://twitter.com/INCIndia/status/918008012702228480
2017-10-11 06:55:50,INCIndia,,71,514,1063,"Glimpses: CVP Rahul Gandhi interacts with children of Adivasis in Chhota Udaipur, about education & lack of opportunities #Congress_Aave_Chepic.twitter.com/uCSPZeQP1G",,,#Congress_Aave_Chepic,918007215276965888,https://twitter.com/INCIndia/status/918007215276965888
2017-10-11 06:55:12,BJP4India,,13,103,365,"He followed JP and preferred to devote himself towards rural development and making our villages self-reliant, free from poverty : PM",,,,918007054953996288,https://twitter.com/BJP4India/status/918007054953996288
2017-10-11 06:54:53,BJP4India,,23,181,658,"When Janata government was formed in 1977, Nanaji Deshmukh was requested to join the Government as a Minister but he did not do so : PM",,,,918006975107031040,https://twitter.com/BJP4India/status/918006975107031040
2017-10-11 06:54:12,PMOIndia,,121,670,3023,"When Janata Government was formed in 1977, Nanaji Deshmukh was requested to join the Government as a Minister but he did not do so. He followed JP and preferred to devote himself towards rural development and making our villages self-reliant, free from poverty: PM @narendramodi",,@narendramodi,,918006805346656256,https://twitter.com/PMOIndia/status/918006805346656256
2017-10-11 06:52:02,PMOIndia,,137,564,2370,"Loknayak JP fought corruption in the nation. His leadership rattled those in power that time and during a march he was even attacked. At that time, standing shoulder to shoulder with him was Nanaji Deshmukh: PM @narendramodi",,@narendramodi,,918006260343095296,https://twitter.com/PMOIndia/status/918006260343095296
2017-10-11 06:51:05,BJP4India,,28,134,418,"PM Shri @narendramodi is speaking at the birth centenary celebration of Nanaji Deshmukh in New Delhi. LIVE at https://www.facebook.com/BJP4India/videos/1850596651647516/ …pic.twitter.com/sBeVQ7O7os",,@narendramodi,,918006020756070400,https://twitter.com/BJP4India/status/918006020756070400
2017-10-11 06:49:41,PMOIndia,,95,556,2126,"Loknayak JP was deeply popular among youngsters. The likes of Loknayak JP and Dr. Lohia were active during the 'Quit India' movement, inspired by the clarion call of Mahatma Gandhi. JP was never interested in power politics: PM @narendramodi",,@narendramodi,,918005666073100288,https://twitter.com/PMOIndia/status/918005666073100288
2017-10-11 06:47:36,PMOIndia,,59,388,1753,"Today, we pay tributes to the great Loknayak JP and Nanaji Deshmukh, who worked closely with JP. Both these individuals distinguished themselves and devoted their lives towards the betterment of our nation: PM @narendramodi",,@narendramodi,,918005141793488898,https://twitter.com/PMOIndia/status/918005141793488898
2017-10-11 06:46:43,BJP4India,,148,680,2995,"LIVE : PM Shri @narendramodi at birth centenary celebration of Nanaji Deshmukh at IARI, New Delhi.https://www.pscp.tv/w/bKxkUzFZTEVKTlh4RG5ORU58MUx5R0JFWFZkTVBLTt60K46xQCEHY1Q7XQUI5nHDJ03sWKIBlBdEBEyFj7NB …",,@narendramodi,,918004919575101440,https://twitter.com/BJP4India/status/918004919575101440
2017-10-11 06:45:43,PMOIndia,,105,241,1074,"Prime Minister @narendramodi is addressing a programme on the birth anniversary of Nanaji Deshmukh.http://narendramodi.in/watch-live",,@narendramodi,,918004668520792066,https://twitter.com/PMOIndia/status/918004668520792066
2017-10-11 06:31:16,INCIndia,,83,746,1518,"Umesh Rathore wants inclusive growth for India, not just for one section of society. Here's his moment with Rahul Gandhi. #Congress_Aave_Chepic.twitter.com/6H4Wan7L7o",,,#Congress_Aave_Chepic,918001033900564481,https://twitter.com/INCIndia/status/918001033900564481
2017-10-11 06:21:05,OmarAbdullah,Memeghnad,13,8,120,"The advantage of never having had #280 https://twitter.com/memeghnad/status/917979484938211334 …",,,#280,917998470367023104,https://twitter.com/OmarAbdullah/status/917998470367023104
2017-10-11 06:19:37,arunjaitley,,127,155,1026,"My speech at Columbia University's Deepak & Neera Raj Center on Indian Economic Policies https://www.facebook.com/firstpostin/videos/1590886164304366/ …",,,,917998101192851456,https://twitter.com/arunjaitley/status/917998101192851456
2017-10-11 06:18:15,arunjaitley,,57,134,584,"Sharing my speech at a joint session of US Chamber of Commerce, USIBC and CII in New Yorkhttps://youtu.be/_vObPqLxoWM",,,,917997759017377792,https://twitter.com/arunjaitley/status/917997759017377792
2017-10-11 06:14:43,BJP4India,,69,443,1889,"PM Shri @narendramodi pays floral tributes to Nanaji Deshmukh on his birth anniversary in New Delhi. LIVE at http://bjplive.org pic.twitter.com/jPfvT7MTWA",,@narendramodi,,917996866393878528,https://twitter.com/BJP4India/status/917996866393878528
2017-10-11 06:11:38,BJP4India,,44,199,807,"PM Shri @narendramodi at birth centenary celebration of Nanaji Deshmukh in New Delhi. Watch LIVE at http://bjplive.org pic.twitter.com/PV0IWyPfrg",,@narendramodi,,917996093891264512,https://twitter.com/BJP4India/status/917996093891264512
2017-10-11 06:02:11,INCIndia,,57,527,1088,"Local media interacted with CVP Rahul Gandhi at Chhota Udaipur's Circuit House, where a variety of issues were discussed. #Congress_Aave_Chepic.twitter.com/G8BoZL9ZiE",,,#Congress_Aave_Chepic,917993711627157504,https://twitter.com/INCIndia/status/917993711627157504
2017-10-11 05:41:24,INCIndia,,18,330,559,"'In stark contrast to Gandhiji’s vision, cultural conformism is today being imposed in the guise of nationalism'http://indianexpress.com/article/india/rights-granted-by-constitution-are-not-favours-by-govt-says-justice-ap-shah-4884491/ …",,,,917988482366177280,https://twitter.com/INCIndia/status/917988482366177280
2017-10-11 05:02:28,INCIndia,,48,392,859,"International Day of Girl Child increases awareness of gender inequality & aspires to empower girls, thus making a better world to live in.pic.twitter.com/TvPYVJoHhN",,,,917978683633172481,https://twitter.com/INCIndia/status/917978683633172481
2017-10-11 04:49:25,JM_Scindia,,69,277,1124,"यहाँ विद्यार्थियों काे परीक्षा देने के समय फर्नीचर उपलब्ध नहीं होता।प्रोफेसराें की भारी अभाव है,सरकारी कांलेज पदस्थापना के बिना खाली पड़े हैpic.twitter.com/lz9Vm0ZbmB",,,,917975401363853312,https://twitter.com/JM_Scindia/status/917975401363853312
2017-10-11 04:19:38,INCIndia,,22,281,657,"Born in Amreli, Gujarat, Dina Pathak was also a woman activist and the President of the 'National Federation of Indian Women'.pic.twitter.com/A4U4FpOZey",,,,917967907816165376,https://twitter.com/INCIndia/status/917967907816165376
2017-10-11 04:16:12,arunjaitley,,51,143,1159,"Remembering #JayPrakashNarayan Ji on his Jayanti #JPpic.twitter.com/ovF6ZtulxH",,,#JayPrakashNarayan #JPpic,917967043298721792,https://twitter.com/arunjaitley/status/917967043298721792
2017-10-11 04:14:49,arunjaitley,,28,126,750,"Respectful tribute to #NanajiDeshmukh on his birth anniversary.pic.twitter.com/LVtt3g4dr8",,,#NanajiDeshmukh,917966692973674498,https://twitter.com/arunjaitley/status/917966692973674498
2017-10-11 04:03:22,INCIndia,,373,529,1026,"Which organization opposed the acceptance of India’s Tricolor flag by saying “The word three is in itself an evil”? #KnowYourLegacy",,,#KnowYourLegacy,917963813277851648,https://twitter.com/INCIndia/status/917963813277851648
2017-10-11 04:02:10,INCIndia,INCIndia,42,240,415,"Narayan Apte was hanged alongside Nathuram Godse for the assassination of Mahatma Gandhi. #KnowYourLegacyhttps://twitter.com/incindia/status/917609942026117120 …",,,#KnowYourLegacyhttps,917963508565925888,https://twitter.com/INCIndia/status/917963508565925888
2017-10-11 04:02:01,INCIndia,,18,160,299,"Narayan Apte was hanged alongside Nathuram Godse for the assassination of Mahatma Gandhi. #KnowYourLegacy",,,#KnowYourLegacy,917963473497264128,https://twitter.com/INCIndia/status/917963473497264128
2017-10-11 04:00:39,ncbn,,34,140,1076,"This International Day of the Girl Child, let us pledge our support to every little girl who wants to spread her wings & reach the sky.",,,,917963130193539073,https://twitter.com/ncbn/status/917963130193539073
2017-10-11 03:48:51,OmarAbdullah,,5,11,61,"Madrid scorns Catalan leader's independence statementhttp://www.bbc.co.uk/news/world-europe-41576870 …",,,,917960158462038018,https://twitter.com/OmarAbdullah/status/917960158462038018
2017-10-11 03:48:32,OmarAbdullah,,33,14,101,"Could Catalonia make a success of independence?http://www.bbc.co.uk/news/world-europe-41474674 …",,,,917960077503541248,https://twitter.com/OmarAbdullah/status/917960077503541248
2017-10-11 03:30:04,INCIndia,,75,527,1112,"Day 3 of Navsarjan with Rahul Gandhi kicks off as he travels from Chhota Udaipur to Kheda and meets people along the way. #Congress_Aave_Chepic.twitter.com/YSVV2lZypx",,,#Congress_Aave_Chepic,917955433322573825,https://twitter.com/INCIndia/status/917955433322573825
2017-10-11 03:08:55,INCIndia,,21,289,612,"Winning numerous medals across the Commonwealth and Asian Games, Krishna Poonia was awarded the Padma Shri in 2011. #ThisDayThatYearpic.twitter.com/iR8ItqKKIs",,,#ThisDayThatYearpic,917950111803572224,https://twitter.com/INCIndia/status/917950111803572224
2017-10-11 03:04:22,narendramodi,,2001,6851,39581,"Happy birthday @SrBachchan! India is proud of his cinematic brilliance & support to many social causes. I pray for his long & healthy life.",,@SrBachchan,,917948962585296896,https://twitter.com/narendramodi/status/917948962585296896
2017-10-11 02:39:53,INCIndia,,150,822,2127,"Nearly 50 years after earning his First in Economics, Cambridge conferred an honorary doctorate upon PM Manmohan Singh. #ThisDayThatYearpic.twitter.com/THg71OdwoC",,,#ThisDayThatYearpic,917942804025786368,https://twitter.com/INCIndia/status/917942804025786368
2017-10-11 02:07:49,narendramodi,,492,1747,7286,"Tell me your #IncredibleIndia experience…share a memorable photo on the NM Mobile App. http://nm4.in/dnldapp pic.twitter.com/2V4AXv3UmY",,,#IncredibleIndia,917934733899702272,https://twitter.com/narendramodi/status/917934733899702272
2017-10-11 02:06:15,narendramodi,,372,2276,9679,"Remembering Nanaji Deshmukh on his birth anniversary. We are constantly motivated by his noble service & emphasis on rural development.pic.twitter.com/IuzBvOaoBV",,,,917934339563720704,https://twitter.com/narendramodi/status/917934339563720704
2017-10-11 02:05:06,narendramodi,,291,1824,7551,"I bow to the venerable Loknayak JP on his Jayanti. His unflinching courage & righteousness continue to inspire every Indian.pic.twitter.com/xNcWULdCp9",,,,917934049049460736,https://twitter.com/narendramodi/status/917934049049460736
2017-10-11 01:59:36,AmitShah,,290,1205,7045,"नानाजी देशमुख जी का ऋषि तुल्य तपस्वी जीवन और उनके विचार हम सभी कार्यकर्ताओं के लिए प्रेरणापुंज है। उनकी जयंती पर उन्हें कोटि-कोटि नमन।",,,,917932663608049665,https://twitter.com/AmitShah/status/917932663608049665
2017-10-11 01:58:08,AmitShah,,142,647,2579,"नानाजी देशमुख एक प्रबुद्ध राष्ट्रसेवक थे जिनका सम्पूर्ण जीवन राष्ट्रसेवा और जनकल्याण को समर्पित रहा।pic.twitter.com/r6H3WNzQHh",,,,917932295188893696,https://twitter.com/AmitShah/status/917932295188893696
2017-10-11 01:56:24,AmitShah,,168,720,3167,"""सम्पूर्ण क्रान्ति आंदोलन"" के जनक, सुप्रसिद्ध स्वतंत्रता सेनानी लोक नायक जय प्रकाश नारायण जी की जयंती पर उनको नमन।pic.twitter.com/jTReb1lhfc",,,,917931860948381696,https://twitter.com/AmitShah/status/917931860948381696
2017-10-10 18:32:26,MamataOfficial,,72,122,1376,"A very Happy Birthday Amit Ji @SrBachchan Health and happiness. Always",,@SrBachchan,,917820132214185984,https://twitter.com/MamataOfficial/status/917820132214185984
2017-10-10 18:32:04,MamataOfficial,,70,138,1166,"On the International Day of the Girl Child, my best wishes to all our #Kanyashree girls. Girls are our assets. They are our future",,,#Kanyashree,917820038341521409,https://twitter.com/MamataOfficial/status/917820038341521409
2017-10-10 17:19:29,ncbn,C_P_Gurnani,29,90,564,"Thank you for your appreciation Sri. @C_P_Gurnani. Technology has played a vital role in the progress as well as governance model of AP.https://twitter.com/c_p_gurnani/status/917724853934841857 …",,@C_P_Gurnani,,917801772588118022,https://twitter.com/ncbn/status/917801772588118022
2017-10-10 16:56:51,OmarAbdullah,rahulverma08,0,0,1,"",,,,917796077016825857,https://twitter.com/OmarAbdullah/status/917796077016825857
2017-10-10 16:54:49,BJP4India,,115,284,929,"#KnowYourGovt : Which scheme aims to make 6 crore persons in rural areas, across States/UTs, digitally literate?",,,#KnowYourGovt,917795564397371393,https://twitter.com/BJP4India/status/917795564397371393
2017-10-10 16:45:02,BJP4India,BJP4India,23,98,398,"Thanks for your participation. Correct answer is Shimla. #KnowYourGovthttps://twitter.com/BJP4India/status/917434968359395329 …",,,#KnowYourGovthttps,917793103238565888,https://twitter.com/BJP4India/status/917793103238565888
2017-10-10 16:28:32,OmarAbdullah,sudarsansand,3,4,80,"Congratulations Dr Pattnaik",,,,917788950080634880,https://twitter.com/OmarAbdullah/status/917788950080634880
2017-10-10 16:13:32,BJP4India,,29,222,725,"Glimpses of #JanaRakshaYatra joined by CM Shri @ChouhanShivraj, Shri @Gen_VKSingh, Shri @rsprasad & Shri @Kummanam against CPM violence.pic.twitter.com/l1VAgKgSQM",,@ChouhanShivraj @Gen_VKSingh @rsprasad @Kummanam,#JanaRakshaYatra,917785178793062400,https://twitter.com/BJP4India/status/917785178793062400
2017-10-10 15:57:35,AmitShah,,205,845,2596,"शाखा से व्यक्तित्व निर्माण, व्यक्तित्व निर्माण से समाज निर्माण और समाज निर्माण से राष्ट्र निर्माण की प्रेरणा यह @RSSorg की कार्यपद्धति है।pic.twitter.com/2Xc2lLyCvI",,@RSSorg,,917781161530875904,https://twitter.com/AmitShah/status/917781161530875904
2017-10-10 15:55:41,AmitShah,,371,1296,5015,"संघ की स्थापना से लेकर आज तक ऐसे हजारों कार्यकर्ता हुए हैं जिनके पास न तो अपना घर है और न ही कोई परिवार है,जो कुछ है, सब संघ और समाज का है।pic.twitter.com/8GGpHnTnkt",,,,917780684260954114,https://twitter.com/AmitShah/status/917780684260954114
2017-10-10 15:54:35,AmitShah,,98,423,1462,"इन पुस्तकों के माध्यम से लोग इन महान मनीषियों से अवगत हो सकेंगें और उनके जीवन संघर्ष से प्रेरणा लेकर अपने जीवन को सार्थक बना सकेंगे।pic.twitter.com/LyxCIMn6Oe",,,,917780408170934272,https://twitter.com/AmitShah/status/917780408170934272
2017-10-10 15:53:17,AmitShah,,109,690,2315,"आज मेरे जैसे कार्यकर्ता के लिए यह सौभाग्य का दिन है कि @RSSorg के पांच परम पूजनीय सरसंघचालकों पर आधारित पुस्तकों के लोकार्पण का हिस्सा बना।pic.twitter.com/AJI9memZH3",,@RSSorg,,917780080172195840,https://twitter.com/AmitShah/status/917780080172195840
2017-10-10 15:12:26,MamataOfficial,,41,58,624,"Some more pictures of today's events are uploaded here for all of you.pic.twitter.com/pEjHixIcQ6",,,,917769802348879874,https://twitter.com/MamataOfficial/status/917769802348879874
2017-10-10 15:11:06,MamataOfficial,,83,88,896,"I was in Jhargram today for an administrative review meeting. My FB post >> http://goo.gl/5Z6dor pic.twitter.com/h9rhzMA9yb",,,,917769466712252416,https://twitter.com/MamataOfficial/status/917769466712252416
2017-10-10 14:57:34,INCIndia,,80,525,1132,"CVP Rahul Gandhi addresses a public meeting in Badoli Village, Chhota Udaipur as day 2 comes to a close. #YuvaKisanAdhikarpic.twitter.com/l5iHyrNOZh",,,#YuvaKisanAdhikarpic,917766060249554944,https://twitter.com/INCIndia/status/917766060249554944
