date,username,to,replies,retweets,favorites,text,geo,mentions,hashtags,id,permalink
2018-01-03 07:03:23,SachinPilot,,125,484,1966,"जीवनपर्यन्त महिला शिक्षा, अधिकारों एवं समाज में समानता कायम करने के लिए प्रयासरत रही प्रथम महिला शिक्षिका सावित्रीबाई फुले जी की जयंती पर शत-शत नमन|pic.twitter.com/vg7FMoOnrO",,,,948449693826138113,https://twitter.com/SachinPilot/status/948449693826138113
2018-01-03 06:30:00,INCIndia,,87,482,953,"Toothless bill criminalising triple talaq is meant only to score political points: @rssurjewala, Incharge Communications, AICChttp://indianexpress.com/article/opinion/columns/this-is-no-reform-triple-talaq-bill-muslim-law-winter-session-5009174/ …",,@rssurjewala,,948441294380191744,https://twitter.com/INCIndia/status/948441294380191744
2018-01-03 06:15:04,INCIndia,,336,739,1931,"Gender equality & justice have always been at the forefront of the Congress Party’s agenda. But the legislation on Instant Triple Talaq as it stands today is incomplete and needs to be strengthened. We will fight hard for a Bill that is reasonable, impartial and empowers women.pic.twitter.com/UQdx6OyHz2",,,,948437537869021184,https://twitter.com/INCIndia/status/948437537869021184
2018-01-03 06:00:00,INCIndia,,42,414,987,"The Govt trumpeted about the return of normalcy in Valley in 2017, but the year will go down in the history of Kashmir as one of the most tumultuous years.https://www.nationalheraldindia.com/national/2017-a-tumultuous-year-for-kashmir …",,,,948433744586657792,https://twitter.com/INCIndia/status/948433744586657792
2018-01-03 05:54:25,narendramodi,,1485,5904,36260,"I bow to the great Savitribai Phule on her Jayanti. Hers was a life devoted to the empowerment of the poor and marginalised. She gave utmost importance to education and social reform. We are deeply guided by her ideals and are working tirelessly towards fulfilling her vision.",,,,948432340727996416,https://twitter.com/narendramodi/status/948432340727996416
2018-01-03 05:51:56,ArvindKejriwal,AamAadmiParty,395,1320,2670,"Middle class suffers double whammy. They pay taxes n then also have to pay for expensive pvt healthcare becoz govt services bad. Now, when govt services improving, why shud middle class be kept out of its benefitshttps://twitter.com/aamaadmiparty/status/948367524097175552 …",,,,948431715952869377,https://twitter.com/ArvindKejriwal/status/948431715952869377
2018-01-03 05:15:00,INCIndia,,81,658,1881,"क्या ये सुशासन, अनुशासन का दावा करने वाली भाजपा का असली चेहरा है?https://www.navjivanindia.com/india/gujarat-bjp-faces-revolt-yet-again-now-koli-leader-purushottam-solanki-demand-favourable-ministry …",,,,948422420775387136,https://twitter.com/INCIndia/status/948422420775387136
2018-01-03 05:08:25,BJP4India,,146,322,1382,"#KnowYourGovt : मोदी सरकार द्वारा वर्ष 2017 में शुरू किया गया 'स्वयं' पोर्टल [https://swayam.gov.in ] किस क्षेत्र से संबंधित है?",,,#KnowYourGovt,948420764574801920,https://twitter.com/BJP4India/status/948420764574801920
2018-01-03 05:01:51,BJP4India,BJP4India,47,240,1269,"प्रधानमंत्री श्री नरेन्द्र मोदी की आधिकारिक वेबसाइट http://www.pmindia.gov.in 13 क्षेत्रीय भाषाओँ में उपलब्ध है। #KnowYourGovthttps://twitter.com/BJP4India/status/947903098017558528 …",,,#KnowYourGovthttps,948419112799150080,https://twitter.com/BJP4India/status/948419112799150080
2018-01-03 04:45:08,AmitShah,,611,1782,11075,"क्रांतिज्योति सावित्रीबाई फुले ने महिलाओं की शिक्षा व उनके सम्मान के लिए जीवन भर कार्य किए। महिला विरोधी कुरीतियों को ध्वस्त कर महिलाओं के सम्मान की जो परिभाषा उन्होंने रची है वह सदियों तक हम सभी को प्रेरित करती रहेगी। ऐसी महान समाजसेविका की जयंती पर उन्हें शत्-शत् नमन।pic.twitter.com/xNWOK7OSIe",,,,948414905723400193,https://twitter.com/AmitShah/status/948414905723400193
2018-01-03 04:30:00,INCIndia,,180,639,1472,"The latest intrusion by China shows that PM Modi is not only failing in foreign policy, but also failing to secure our borders.http://www.hindustantimes.com/india-news/chinese-troops-intruded-into-arunachal-with-road-equipment/story-pgCNQJ7XFDxEIzFGJC7SOK.html …",,,,948411094959235072,https://twitter.com/INCIndia/status/948411094959235072
2018-01-03 04:14:58,ArvindKejriwal,Saurabh_MLAgk,307,1514,3296,"If someone falls ill in ur family, shud u rush to a hospital or shud u rush to SDM office to get an income certificate made?https://twitter.com/saurabh_mlagk/status/948392697986924550 …",,,,948407310615023617,https://twitter.com/ArvindKejriwal/status/948407310615023617
2018-01-03 02:50:42,MamataOfficial,,32,110,1363,"Solemnly remembering Moti Nandi, writer and journalist, on his death anniversary Homage to veteran Rabindra Sangeet legend, Suchitra Mitra, on her death anniversary.",,,,948386104759214081,https://twitter.com/MamataOfficial/status/948386104759214081
2018-01-03 02:00:05,INCIndia,,39,364,997,"We remember Janaki Ballabh Patnaik. He was a leader of the Indian National Congress, and he also served as a Union Minister.pic.twitter.com/9q4aPeM9NB",,,,948373366238461952,https://twitter.com/INCIndia/status/948373366238461952
2018-01-03 01:30:06,INCIndia,,65,529,1623,"We remember Savitribai Jyotirao Phule. She played a significant role in improving women's rights in India and founded the first girls' school in Pune run by Indians in 1848.pic.twitter.com/cZEiHffmuY",,,,948365821193039873,https://twitter.com/INCIndia/status/948365821193039873
2018-01-02 23:33:21,ArvindKejriwal,,188,945,1838,"I urge Hon’ble LG to read this to understand ground reality and the woes of common peoplehttps://timesofindia.indiatimes.com/city/delhi/from-pillar-to-post-what-it-takes-to-get-a-certificate-from-a-govt-office/articleshow/62343713.cms …",,,,948336439648899072,https://twitter.com/ArvindKejriwal/status/948336439648899072
2018-01-02 16:13:48,mkstalin,,41,206,1018,"Imposing new licenseraj & centralization of power will encroach upon the rights of the states - which is against federalism & people's interest. DMK vehemently opposes the establishment of National Medical Commission and enactment of Motor Vehicle Amendment Bill 2017. #NMCBillpic.twitter.com/riDnMCxJ6j",,,#NMCBillpic,948225823953240064,https://twitter.com/mkstalin/status/948225823953240064
2018-01-02 16:01:43,ncbn,,110,133,1354,"'జన్మభూమి-మా ఊరు' కార్యక్రమానికి మీ కోసం దర్శికి వచ్చాను. మీ అందరి సమక్షంలో రూ.245 కోట్ల అభివృద్ధి, సంక్షేమ పనులను ప్రారంభించాను. ప్రతి గ్రామానికి సిమెంట్ రోడ్లు వస్తాయి. క్రీడా ప్రాంగణాలు ఏర్పాటవుతాయి. బోరుబావులు నిర్మిస్తారు. ఇంకా ఎన్నో అభివృద్ధి పనులు జరుగుతాయి.pic.twitter.com/cwR5btMQi8",,,,948222784768901120,https://twitter.com/ncbn/status/948222784768901120
2018-01-02 15:45:00,BJP4India,,75,433,1701,"भारतीय जनता पार्टी इस देश में चुनाव सुधार कार्यक्रमों का भी नेतृत्व करेगी, राजनीतिक जीवन में शुचिता को भी बढ़ावा देने का नेतृत्व करेगी और राजनीति से काले-धन को समाप्त करने के आंदोलन का भी नेतृत्व करेगी : श्री अमित शाह, पूरा पढ़ें - http://bit.ly/2A8TqNW",,,,948218578150371330,https://twitter.com/BJP4India/status/948218578150371330
2018-01-02 15:44:50,BJP4India,,121,800,3978,"प्रधानमंत्री श्री नरेन्द्र मोदी जी राजनैतिक जीवन के अंदर शुचिता लाने और सार्वजनिक जीवन में से काले-धन के दुष्प्रभाव को निरस्त करने के लिए बड़े चुनाव सुधार कार्यक्रमों के प्रति कटिबद्ध हैं : श्री अमित शाह",,,,948218533141295105,https://twitter.com/BJP4India/status/948218533141295105
2018-01-02 15:44:16,BJP4India,,60,518,2179,"इलेक्टोरल बांड्स स्कीम लाकर नरेन्द्र मोदी सरकार चुनाव सुधार के अभियान को गति प्रदान करने के क्रम में एक और बड़ा सुधार करने जा रही है, इससे राजनीति से भ्रष्टाचार और काले-धन के प्रवाह को ख़त्म करने में निश्चित रूप से मदद मिलेगी : श्री अमित शाह",,,,948218390526640129,https://twitter.com/BJP4India/status/948218390526640129
2018-01-02 15:44:02,BJP4India,,135,767,4278,"प्रधानमंत्री श्री नरेन्द्र मोदी के नेतृत्व में केंद्र की भारतीय जनता पार्टी सरकार द्वारा आज संसद में चुनाव सुधार के लिए लाये गए इलेक्टोरल बांड्स स्कीम मोदी सरकार की चुनाव सुधार की प्रतिबद्धता को रेखांकित करते हैं : श्री अमित शाह",,,,948218334163607552,https://twitter.com/BJP4India/status/948218334163607552
2018-01-02 15:09:52,BJP4India,,180,719,4067,"PM Shri @narendramodi met and exchanged new year greetings with the PMO officials and SPG personnel at Lok Kalyan Marg, in New Delhi.pic.twitter.com/Seg9hZX9Al",,@narendramodi,,948209734112256000,https://twitter.com/BJP4India/status/948209734112256000
2018-01-02 14:06:42,INCIndia,,55,629,1241,"Costlier food and cooking gas prices pushed up retail inflation for industrial workers to 3.97%.pic.twitter.com/SXabPRhziT",,,,948193838899740672,https://twitter.com/INCIndia/status/948193838899740672
2018-01-02 14:00:01,INCIndia,,75,634,1332,"A badly implemented #GST is weighing down on the export performance of labour intensive industries. This may result in further job losses in these sectors.https://www.inc.in/en/in-focus/gst-woes-pull-down-export-performance …",,,#GST,948192157231333378,https://twitter.com/INCIndia/status/948192157231333378
2018-01-02 13:40:22,ArvindKejriwal,AnkitLal,270,1230,2302,"Do read this. If income criteria is introduced, it wud practically kill this scheme. It will also kill mohalla clinics and polyclinics. That wud be v sadhttps://twitter.com/ankitlal/status/948184693249208321 …",,,,948187212943781889,https://twitter.com/ArvindKejriwal/status/948187212943781889
2018-01-02 13:29:48,ncbn,Sardar68455818,28,73,628,"Glad to know that you had participated in the Janmabhoomi programme. It is a collective effort for us all to feel responsible towards our motherland, by inducing a sense of belongingness within. #Janmabhoomi2018https://twitter.com/Sardar68455818/status/948130975514443776 …",,,#Janmabhoomi2018https,948184554338004993,https://twitter.com/ncbn/status/948184554338004993
2018-01-02 13:24:07,PMOIndia,,563,1289,9574,"PM @narendramodi meets officials from PMO and SPG. via NMApppic.twitter.com/Um1Jeg2B0m",,@narendramodi,,948183122838876161,https://twitter.com/PMOIndia/status/948183122838876161
2018-01-02 13:15:00,INCIndia,,86,574,1374,"2017 was a disaster in terms of foreign policy, with India isolated in its own backyard. We need to learn from this and turn things around in 2018.https://www.inc.in/en/in-focus/foreign-policy-2018-lessons-from-the-past-year …",,,,948180829066457090,https://twitter.com/INCIndia/status/948180829066457090
2018-01-02 12:45:00,INCIndia,,198,1127,2895,"बढ़ती महंगाई ने बंद किये बचत के सारे दरवाजे, लेकिन भाजपा सरकार इसे भी लोगों का ही जुर्म मानती है और खाते में न्यूनतम धनराशि न रखने के नाम पर छीन लिया 1771 करोड़ रुपया।https://khabar.ndtv.com/news/blogs/sbi-charges-1771-crores-as-penalty-for-not-maintaining-minimum-balance-ravish-kumar-shares-his-views-1794772?pfrom=home-moretop …",,,,948173278690070529,https://twitter.com/INCIndia/status/948173278690070529
2018-01-02 12:41:12,ncbn,,18,71,467,"Initiatives taken in the last three years for the welfare and development of ST community in Andhra Pradesh. #Janmabhoomi2018pic.twitter.com/8ZYt01oNQy",,,#Janmabhoomi2018pic,948172322833285120,https://twitter.com/ncbn/status/948172322833285120
2018-01-02 12:30:01,INCIndia,,144,765,2018,"कहीं गलती से साहेब ने उत्तर कोरिया की मिसाइलों को भी अपना काम बता दिया तो अमेरिका से भी संबंध बिगड़ जायेंगे। #JanKiBaatpic.twitter.com/B0xxsgN7LJ",,,#JanKiBaatpic,948169507234705409,https://twitter.com/INCIndia/status/948169507234705409
2018-01-02 12:15:00,INCIndia,,25,396,753,"Former Union Minister @JM_Scindia seeks an apology from the Govt for BJP MP Nepal Singh's comment: ‘Soldiers die, such things happen’https://www.youtube.com/watch?v=BWwZu-QGBqc&feature=youtu.be …",,@JM_Scindia,,948165728921882624,https://twitter.com/INCIndia/status/948165728921882624
2018-01-02 12:00:00,INCIndia,,31,415,838,"The inability to spend budgets for Family Planning is yet another example of this Govt's inability to execute any project of consequence.https://www.inc.in/en/in-focus/indias-unchecked-family-planning-a-ticking-time-bomb …",,,,948161955151441925,https://twitter.com/INCIndia/status/948161955151441925
2018-01-02 11:59:32,arunjaitley,,132,361,2751,"My response in the Rajya Sabha with respect to discussions on the Insolvency and Bankruptcy Code (Amendment) Bill, 2017, January 2, 2018https://www.youtube.com/watch?v=FzgOJHujV1U …",,,,948161834888052736,https://twitter.com/arunjaitley/status/948161834888052736
2018-01-02 11:53:29,INCIndia,,16,322,677,"Former Union Minister @ShashiTharoor speaks in Lok Sabha on The Ancient Monuments and Archaeological Sites and Remains (Amendment) Bill, 2017https://www.youtube.com/watch?v=PsT0k_ndQKI …",,@ShashiTharoor,,948160312536064000,https://twitter.com/INCIndia/status/948160312536064000
2018-01-02 11:46:37,RahulGandhi,,9599,10019,27780,"A central pillar of the RSS/BJP’s fascist vision for India is that Dalits should remain at the bottom of Indian society. Una, Rohith Vemula and now Bhima-Koregaon are potent symbols of the resistance.",,,,948158586676326400,https://twitter.com/RahulGandhi/status/948158586676326400
2018-01-02 11:45:23,MamataOfficial,,40,72,705,"Some pictures of today’s event are uploaded here for all of you.pic.twitter.com/mYAtcEO3go",,,,948158277371666432,https://twitter.com/MamataOfficial/status/948158277371666432
2018-01-02 11:44:41,MamataOfficial,,74,103,1036,"Today I was present in the inauguration ceremony of ‘Mati Utsav’, 2018 in Mati Tirtha-Krishi Katha, Purba Burdwan. My Facebook post: https://goo.gl/SbgRcp pic.twitter.com/yUMFUre8mz",,,,948158101202509824,https://twitter.com/MamataOfficial/status/948158101202509824
2018-01-02 11:28:30,BJP4India,,261,951,4148,"Modi government's reformist measures put Indian economy on the fast track, India's core sector growth hits 13 month high of 6.8% in November 2017. #NewIndiapic.twitter.com/gwQWeYW0pn",,,#NewIndiapic,948154025249185795,https://twitter.com/BJP4India/status/948154025249185795
2018-01-02 11:03:59,INCIndia,,8,284,618,"Former Union Minister @Jairam_Ramesh speaks in the Rajya Sabha on Insolvency and Bankruptcy Codehttps://www.youtube.com/watch?v=LgwHd_ynIF8&feature=youtu.be …",,@Jairam_Ramesh,,948147857491607553,https://twitter.com/INCIndia/status/948147857491607553
2018-01-02 10:38:48,INCIndia,,20,361,755,"Former Union Minister @PChidambaram_IN speaks in the Rajya Sabha on Insolvency and Bankruptcy Codehttps://www.youtube.com/watch?v=_X569wQvcj0&feature=youtu.be …",,@PChidambaram_IN,,948141520703520769,https://twitter.com/INCIndia/status/948141520703520769
2018-01-02 09:43:58,JM_Scindia,,72,386,1704,"अशोकनगर में पदस्थ ASI सतीश रघुवंशी जी की संदिग्ध मृत्यु का मामला आज लोक सभा में उठाया। केंद्र सरकार से तत्काल CBI जाँच एवं न्याय दिलाने की माँग की।https://www.youtube.com/watch?v=n35pHBaGfMA …",,,,948127719300022272,https://twitter.com/JM_Scindia/status/948127719300022272
2018-01-02 09:11:28,ncbn,,101,164,1880,"Children of MPUPS Naganathanalli in Adoni Mandal, Kurnool District participating in #Janmabhoomi2018 celebrations.pic.twitter.com/Z2X3SF8Ddh",,,#Janmabhoomi2018,948119542152142848,https://twitter.com/ncbn/status/948119542152142848
2018-01-02 09:10:09,ncbn,,16,54,482,"Initiatives taken in the last three years for the welfare and developement of SC community in Andhra Pradesh. #Janmabhoomi2018pic.twitter.com/9unhFgtZJQ",,,#Janmabhoomi2018pic,948119208805597184,https://twitter.com/ncbn/status/948119208805597184
2018-01-02 09:01:41,BJP4India,,860,1813,8933,"मैं चाहता हूँ कि 15 अगस्त के आस-पास दिल्ली में एक Mock Parliament का आयोजन हो जहाँ प्रत्येक ज़िले से चुना गया एक युवा, इस विषय पर चर्चा करे कि कैसे अगले पाँच सालों में एक #NewIndia का निर्माण किया जा सकता है? संकल्प से सिद्धि कैसे प्राप्त की जा सकती है? : पीएम श्री नरेन्द्र मोदीpic.twitter.com/D3yfPLOTPb",,,#NewIndia,948117079571406849,https://twitter.com/BJP4India/status/948117079571406849
2018-01-02 08:53:53,ncbn,,9,32,353,"#Janmabhoomi2018 Day 1 https://twitter.com/andhrapradeshcm/status/948111226541719553 …",,,#Janmabhoomi2018,948115115101995008,https://twitter.com/ncbn/status/948115115101995008
2018-01-02 08:44:19,JM_Scindia,,65,367,1453,"सरकार को स्पष्टीकरण देना होगा - ख़ूफ़िया जानकारी के बावजूद, सुरक्षाबल तैनात क्यों नहीं किए गए? बार-बार सुरक्षातंत्र पर हमले क्यों हो रहे हैं? पाकिस्तान के प्रति सरकार की विदेश नीति आख़िर क्या है? सरकार को देशवासियों को जवाब देना ही पड़ेगा।",,,,948112708083183616,https://twitter.com/JM_Scindia/status/948112708083183616
2018-01-02 08:42:17,JM_Scindia,,188,632,2581,"आज लोक सभा में CRPF सेंटर पर हुए हमले का मुद्दा उठाया। हमारे वीर जवान देश के लिए शहादत दे रहे हैं और भाजपा के सांसद शर्मनाक बयान देने में लगे हुए हैं|https://www.youtube.com/watch?v=BWwZu-QGBqc&feature=youtu.be …",,,,948112198248800256,https://twitter.com/JM_Scindia/status/948112198248800256
2018-01-02 08:15:00,INCIndia,,417,1193,3671,"इलाज के लिए पैसे नहीं, राशन कार्ड बना नहीं मजबूरी ने बना दिया गरीब परिवार को लाचार - इससे ज्यादा शर्मनाक और भाजपा की सरकार की नाकामी का जीता जगता सबूत और कुछ नहीं हो सकता!https://www.bhaskar.com/news/UP-LUCK-LCL-mother-sold-her-child-for-treatment-of-husband-in-bareilly-5782208-PHO.html …",,,,948105330638180353,https://twitter.com/INCIndia/status/948105330638180353
2018-01-02 06:46:43,mkstalin,,69,266,1865,"Centre should step in to save the firecracker manufacturing cluster in Sivakasi, which accounts for 90% of Indian firecracker production and protect the Industry employing lakhs of workers. DMK MPs in Rajya Sabha will raise the issue with concerned Minister. #CrackerBan",,,#CrackerBan,948083115745886209,https://twitter.com/mkstalin/status/948083115745886209
2018-01-02 06:45:00,INCIndia,,146,894,2388,"गुप्त बैठक कौन करता है? प्रधानमंत्री जो कहते हैं, उनकी सरकार खुद उसके उलट ही कुछ करती है।https://www.navjivanindia.com/india/while-india-raps-pak-in-parliament-nsa-ajit-doval-meets-his-counterpart-in-thailand …",,,,948082681375584257,https://twitter.com/INCIndia/status/948082681375584257
2018-01-02 06:00:00,INCIndia,,37,480,1013,"Appointing schoolchildren as 'doctors' is a shameful abdication of responsibility by the Govt of Gujarat.https://timesofindia.indiatimes.com/india/short-of-physicians-gujarat-to-let-schoolkids-act-as-docs/articleshow/62330633.cms …",,,,948071358562308096,https://twitter.com/INCIndia/status/948071358562308096
2018-01-02 05:18:43,PMOIndia,,720,1643,10195,"PM @narendramodi called for furthering a spirit of research and innovation among our youth.pic.twitter.com/ofbRWPiU5m",,@narendramodi,,948060969221025793,https://twitter.com/PMOIndia/status/948060969221025793
2018-01-02 05:17:18,PMOIndia,,354,1155,5969,"Encouraging teaching of science in vernacular languages.pic.twitter.com/lF4Gaj7zEw",,,,948060611405004800,https://twitter.com/PMOIndia/status/948060611405004800
2018-01-02 05:15:00,INCIndia,,257,983,2920,"जम्मू-कश्मीर में मोदी सरकार की गलत नीतियों के कारण हमारे बहादुर जवानों को अपनी जान गंवानी पड़ रही है और ये बात शायद भाजपा सांसदों और नेताओं को पता है।https://aajtak.intoday.in/story/bjp-mp-rampur-nepal-singh-statement-on-pulwama-martyrs-army-1-974826.html …",,,,948060031936811008,https://twitter.com/INCIndia/status/948060031936811008
2018-01-02 05:00:22,BJP4India,,233,986,4265,"4 जनवरी से 10 मार्च 2018 के बीच ‘स्वच्छ सर्वेक्षण 2018’ किया जाएगा। 40 करोड़ से अधिक आबादी में ये सर्वे किया जाएगा। मेरी हर नागरिक से अपील है कि वे, इसमें बढ़-चढ़ करके भाग लें और सुनिश्चित करें कि आपका शहर, आपका मोहल्ला साफ-सफाई में पीछे न रहे : प्रधानमंत्री श्री नरेन्द्र मोदीpic.twitter.com/Oy6bBYGpUW",,,,948056351741165573,https://twitter.com/BJP4India/status/948056351741165573
2018-01-02 04:34:10,MamataOfficial,,49,106,1606,"Solemnly remembering noted playwright and director Safdar Hashmi on his death anniversary",,,,948049755468210176,https://twitter.com/MamataOfficial/status/948049755468210176
2018-01-02 04:30:00,INCIndia,,146,432,1053,"The Instant Triple Talaq Bill was prepared without proper due diligence or regard for its consequences: @SalmanSozhttp://indianexpress.com/article/opinion/the-instant-triple-talaq-bill-is-a-remedy-that-can-worsen-the-disease-5008112/ …",,@SalmanSozhttp,,948048707269804032,https://twitter.com/INCIndia/status/948048707269804032
