date,username,to,replies,retweets,favorites,text,geo,mentions,hashtags,id,permalink
2018-01-14 07:59:44,RajaBrar_INC,,22,133,454,"काट ना सके कभी कोई पतंग आप की, टूटे ना कभी डोर आपके विश्वास की, छु लो आप ज़िन्दगी की सारी कामयाबी, जैसे पतंग छूती है ऊंचाईया आसमान की.... Happy #MakarSankranti !!pic.twitter.com/BaXcxmMsEC",,,#MakarSankranti,952450143109791745,https://twitter.com/RajaBrar_INC/status/952450143109791745
2018-01-14 06:42:52,RahulGandhi,,685,3839,10987,"With the fields swaying in joy at the coming harvest, let us salute the love, hard work and toil of our farmers, our anndatas. Wishing everyone a Happy #MakarSankranti #Pongal, #Bihu #Bhogi and #Uttarayanpic.twitter.com/yme6aHowH1",,,#MakarSankranti #Pongal #Bihu #Bhogi #Uttarayanpic,952430797209853952,https://twitter.com/RahulGandhi/status/952430797209853952
2018-01-14 06:03:40,BJP4India,,261,1365,4288,"देश में क्यों फैलाया जा रहा है इतना झूठ! ज़रा सोचिये!pic.twitter.com/Bv8f9iYKje",,,,952420932739481601,https://twitter.com/BJP4India/status/952420932739481601
2018-01-14 05:43:22,RahulGandhi,,1260,5500,13437,"Treating India's migrant workers like second class citizens is completely unacceptable. This action demonstrates BJP’s discriminatory mindset.https://thewire.in/213323/indian-passport-status-ecr/ …",,,,952415825239175168,https://twitter.com/RahulGandhi/status/952415825239175168
2018-01-14 05:15:51,JM_Scindia,,87,381,1173,"जो हमारे बच्चों का भविष्य उज्ज्वल करते है, आज उन्ही के साथ मध्यप्रदेश में ऐसा खिलवाड़ किया जा रहा है - ये अत्यंत खेदजनक व दुःखद है।pic.twitter.com/vbpxgJG1TE",,,,952408899113533441,https://twitter.com/JM_Scindia/status/952408899113533441
2018-01-14 05:11:50,JM_Scindia,,25,233,678,"MP state government’s apathy to the plight of our teachers is utterly deplorable. There is no greater dishonour than to insult those who build our nation.pic.twitter.com/EcgKgKIq8V",,,,952407890572197889,https://twitter.com/JM_Scindia/status/952407890572197889
2018-01-14 05:08:44,JM_Scindia,,171,417,3049,"मकर संक्रांति,पोंगल, बीहू के पुण्य पर्व की आप सभी को हार्दिक शुभकामनाएं!",,,,952407108594511873,https://twitter.com/JM_Scindia/status/952407108594511873
2018-01-14 04:55:42,INCIndia,,121,580,1902,"We wish you a Happy #MakarSakranti, #Pongal, #Bihu, #Bhogi and #Uttarayanpic.twitter.com/KXD1aHpv8v",,,#MakarSakranti #Pongal #Bihu #Bhogi #Uttarayanpic,952403828367699969,https://twitter.com/INCIndia/status/952403828367699969
2018-01-14 04:18:03,ArvindKejriwal,,530,1136,6633,"Wishing a very happy Makar Sankranti, Pongal and Uttarayni to everyone. May this harvest season bring prosperity and peace.",,,,952394355037253632,https://twitter.com/ArvindKejriwal/status/952394355037253632
2018-01-14 03:22:47,BJP4India,,132,452,2565,"समस्त देशवासियों को मकर संक्रान्ति के पावन पर्व की हार्दिक शुभकामनाएं।pic.twitter.com/E1719T23pB",,,,952380448423972864,https://twitter.com/BJP4India/status/952380448423972864
2018-01-14 03:20:44,BJP4India,,58,290,1361,"Wishing everyone a very Happy Pongal, Bihu and Uttarayan.pic.twitter.com/xjMNBk6vqh",,,,952379929513127936,https://twitter.com/BJP4India/status/952379929513127936
2018-01-14 02:21:43,arunjaitley,,373,640,5945,"#मकरसंक्रांति #पोंगल और #माघबिहु की हार्दिक शुभकामनाएं। #MakarSankranti #Pongal #MaghBihupic.twitter.com/B4WK9ohEAO",,,#मकरस #प #म #MakarSankranti #Pongal #MaghBihupic,952365080313700352,https://twitter.com/arunjaitley/status/952365080313700352
2018-01-14 02:18:49,AmitShah,,292,903,4126,"தமிழ்நாட்டில் உள்ள அனைத்து சகோதர, சகோதரிகளுக்கு எனது மகிழ்ச்சியான பொங்கல் திருநாள் நல்வாழ்த்துகள். இந்த வருட பொங்கல் திருவிழா அனைத்து மக்களுக்கும் மகிழ்ச்சி, செழிப்பு மற்றும் நல்ல ஆரோக்கியத்தை தர இறைவனை வேண்டிக்கொள்கிறேன்.pic.twitter.com/CUsjRqiHTm",,,,952364347153526785,https://twitter.com/AmitShah/status/952364347153526785
2018-01-14 02:17:54,AmitShah,,100,417,1749,"মাঘ বিহু উপলক্ষে সমূহ অসমবাসীলৈ আন্তৰিক শুভেচ্ছা জ্ঞাপন কৰিলোঁ। এই উৎসৱে সকলোৰে জীৱনলৈ কঢ়িয়াই আনক উৎসাহ-উদ্দীপনা আৰু সমৃদ্ধিৰ বতৰা।pic.twitter.com/rsBQOsCDJa",,,,952364117079175168,https://twitter.com/AmitShah/status/952364117079175168
2018-01-14 01:59:34,AmitShah,,175,578,2871,"ઉત્તરાયણના પર્વની હાર્દિક શુભકામનાઓpic.twitter.com/R8eoEwQd2p",,,,952359503105703937,https://twitter.com/AmitShah/status/952359503105703937
2018-01-14 01:57:40,AmitShah,,862,1627,10300,"समस्त देशवासियों को ""मकर संक्रांति"" के पावन पर्व की हार्दिक शुभकामनाएं।pic.twitter.com/as2R2opVHj",,,,952359027781943297,https://twitter.com/AmitShah/status/952359027781943297
2018-01-14 01:55:35,mkstalin,,367,448,3825,"உலகெங்கும் வாழுகின்ற தமிழ் மக்கள் அனைவருக்கும் என்னுடைய இனிய தமிழர் திருநாளான பொங்கல் பெருவிழா மற்றும் தமிழ்ப் புத்தாண்டு நல்வாழ்த்துகள். இல்லங்கள்தோறும் இன்ப பொங்கல் பொங்கட்டும். #Pongal2018pic.twitter.com/xIt3TRd8mY",,,#Pongal2018pic,952358501807869952,https://twitter.com/mkstalin/status/952358501807869952
2018-01-14 01:53:00,ncbn,,52,149,1030,"I congratulate the seven companies that have started operations in Andhra Pradesh yesterday. These firms together will create 2,880 jobs in two years.pic.twitter.com/6EHlsyxGx1",,,,952357851300691968,https://twitter.com/ncbn/status/952357851300691968
2018-01-14 01:50:00,ncbn,,184,270,2744,"భోగి మంటల కాంతులు ప్రతి ఒక్కరి జీవితాల్లో భోగభాగ్యాలు నింపాలని, సంస్కృతి సంప్రదాయాలను మరువక అందరూ కలిసిమెలిసి సంతోషంగా ఈ పండుగ జరుపుకోవాలని కోరుకుంటూ తెలుగు ప్రజలందరికీ భోగి పండుగ శుభాకాంక్షలు.",,,,952357096359714817,https://twitter.com/ncbn/status/952357096359714817
2018-01-14 01:38:07,narendramodi,,791,2918,13644,"Have a happy and blessed Uttarayan.pic.twitter.com/g7coBoai6E",,,,952354104411598848,https://twitter.com/narendramodi/status/952354104411598848
2018-01-14 01:34:57,MamataOfficial,,43,90,803,"Wishing good health, happiness and prosperity to all my Assamese brothers and sisters on the occasion of Magh Bihu সমূহ অসমবাসীলৈ মাঘ বিহুৰ আন্তৰিক শুভকামনা জ্ঞাপন কৰিলো৷",,,,952353308609454081,https://twitter.com/MamataOfficial/status/952353308609454081
2018-01-14 01:34:49,MamataOfficial,,533,1575,6204,"Wishing good health, happiness and prosperity to all my Tamil brothers and sisters on the occasion of Pongal தமிழ் நாட்டு மக்களுக்கு என் இதயம் கனிந்த பொங்கல் நல்வாழ்த்துகள்",,,,952353273813508096,https://twitter.com/MamataOfficial/status/952353273813508096
2018-01-14 01:34:32,MamataOfficial,,69,126,1045,"Wishing everyone the best on the occasion of Makar Sankranti. From this year, we will be celebrating this day as Lok Sanskriti Dibas in #Bengal to promote the folk artistes of our State",,,#Bengal,952353206398406656,https://twitter.com/MamataOfficial/status/952353206398406656
2018-01-14 01:34:03,MamataOfficial,,12,50,457,"Remembering famous singer, composer Shyamal Mitra on his birth anniversary",,,,952353082687373312,https://twitter.com/MamataOfficial/status/952353082687373312
2018-01-14 01:33:44,MamataOfficial,,18,48,511,"Remembering Mahashweta Di on her birth anniversary. We miss her very, very much",,,,952353002370682880,https://twitter.com/MamataOfficial/status/952353002370682880
2018-01-14 01:31:31,narendramodi,,357,2167,9387,"Best wishes on Magh Bihu.pic.twitter.com/feN0XxfksG",,,,952352443987300353,https://twitter.com/narendramodi/status/952352443987300353
2018-01-14 01:23:32,narendramodi,,1067,4246,19645,"Pongal greetings to everyone!pic.twitter.com/701iLPUhaZ",,,,952350436824092672,https://twitter.com/narendramodi/status/952350436824092672
2018-01-14 01:20:11,narendramodi,,3419,6196,31558,"मकर संक्रांति के पावन अवसर पर सभी देशवासियों को ढेरों बधाई।pic.twitter.com/8SLwZat59s",,,,952349595224469504,https://twitter.com/narendramodi/status/952349595224469504
2018-01-13 15:35:02,ncbn,,30,161,963,"Inaugurated office premises of @zoho corporation in Renigunta, today. Zoho will bring in an investment of Rs. 350 crore in Andhra Pradesh and generate many employment opportunities.pic.twitter.com/OgMZNJK1ue",,@zoho,,952202337572986881,https://twitter.com/ncbn/status/952202337572986881
2018-01-13 14:10:51,JM_Scindia,,121,538,1817,"यत्र नार्यस्तु पूज्यन्ते रमन्ते तत्र देवताः शास्त्रो में लिखा है जहां नारियों की पूजा होती है, वहां देवता निवास करते हैं। वहीं दूसरी ओर मध्य प्रदेश के मुख्यमंत्री शिवराज सिंह चौहान का राज है जहां महिला शिक्षकों अपनी मांग के विरोध को लेकर मुंडन कराने पर मजबूर होना पड़ रहा है!pic.twitter.com/61uERqv3E0",,,,952181150989955073,https://twitter.com/JM_Scindia/status/952181150989955073
2018-01-13 14:01:56,JM_Scindia,,59,248,1087,"आज मुंगावली विधानसभा क्षेत्र के ग्राम जनकपुर-खिरिया में आयोजित लोधी समाज के सम्मेलन में उपस्थित होकर समाजजनों से रूबरू हुआ।pic.twitter.com/LPOc7aLYDg",,,,952178905506512899,https://twitter.com/JM_Scindia/status/952178905506512899
2018-01-13 13:58:09,mkstalin,,44,158,898,"#SupremeCourt is the protector of Democracy of our nation,but the voice of dissenting Senior Supreme Court Judges raises concerns over the autonomy & transparency of this great institution. It is imperative,that this issue be resolved amicably,and the people's trust is preserved",,,#SupremeCourt,952177954049503234,https://twitter.com/mkstalin/status/952177954049503234
2018-01-13 13:30:05,INCIndia,,313,1034,2232,"PM Modi, merely renaming policies will not make them yours. #CutAndPasteSarkarpic.twitter.com/2jd1SW0pOg",,,#CutAndPasteSarkarpic,952170892372537344,https://twitter.com/INCIndia/status/952170892372537344
2018-01-13 12:30:01,INCIndia,,92,495,1118,"We are still not off the #GST roller coaster yet. #JanKiBaatpic.twitter.com/VoqpLceBTm",,,#GST #JanKiBaatpic,952155776449052674,https://twitter.com/INCIndia/status/952155776449052674
2018-01-13 12:00:02,INCIndia,,346,1199,2798,"It is not just the judiciary that is under siege. Venerable institutions like the Election Commission (EC) and the Reserve Bank of India (RBI) have been under stress for some time now.https://www.inc.in/en/in-focus/institutions-under-siege …",,,,952148227486236672,https://twitter.com/INCIndia/status/952148227486236672
2018-01-13 11:40:06,BJP4India,,325,1455,5961,"Some people are trying to divide the nation on caste. However, the youth of this country are giving a fitting response to such anti-national elements. Our youth will never be misled : PM Shri @narendramodipic.twitter.com/Xj7ZhU3gFR",,@narendramodipic,,952143213443235845,https://twitter.com/BJP4India/status/952143213443235845
2018-01-13 11:30:00,INCIndia,,73,473,902,"With falling interest rates and retail inflation at a 17 month high, the common Indian is under extra-ordinary financial stress.pic.twitter.com/eMgL7phjsX",,,,952140671804104705,https://twitter.com/INCIndia/status/952140671804104705
2018-01-13 11:20:57,BJP4India,,100,422,1456,"Modi government's crackdown on #BlackMoney continues, Benami property hoarders feel the heat now!pic.twitter.com/UWdm7L4tev",,,#BlackMoney,952138391914561537,https://twitter.com/BJP4India/status/952138391914561537
2018-01-13 10:44:10,narendramodi,,3473,6411,39072,"Happy Lohri!pic.twitter.com/NVLCc5D5NR",,,,952129137551990785,https://twitter.com/narendramodi/status/952129137551990785
2018-01-13 10:12:50,JM_Scindia,,72,307,1128,"एक तरफ़ प्रदेश पर क़र्ज़ा बढ़कर 1.11 लाख करोड़ हो चुका है, दूसरी तरफ़ सरकार ग्रामीण विकास और लोक निर्माण कार्यों में 11222 करोड़ की कटौती कर रही है - आख़िर जनता का पैसा जा कहाँ रहा है?",,,,952121251685789696,https://twitter.com/JM_Scindia/status/952121251685789696
2018-01-13 10:12:33,JM_Scindia,,80,359,1315,"शिवराज सरकार के कुशासन की बदौलत आज मध्यप्रदेश की वित्तीय हालत इतनी ख़राब है कि अब अधोसंरचना विकास के लिए भी पैसे नहीं बचे - बिजली, सड़क, सिंचाई - सभी काम होंगे ठप।pic.twitter.com/yz2TqEdiAO",,,,952121179376009216,https://twitter.com/JM_Scindia/status/952121179376009216
2018-01-13 09:51:49,mkstalin,,331,435,3146,"இந்து மதம் உள்ளிட்ட எந்த மதத்தின் தனிப்பட்ட நம்பிக்கைகளை விமர்சனம் செய்வதில் திமுக விற்கு உடன்பாடு இல்லை. நம் மண்ணின் கவிஞர் கவிப்பேரரசு அவர்கள் வருத்தம் தெரிவித்த பின்னரும், அவர்மீதும் தினமணி நாளிதழ் மீதும் அச்சுறுத்தும் வகையில் வன்முறையைத் தூண்டுவது கடும் கண்டனத்திற்குரியது.",,,,952115963725463552,https://twitter.com/mkstalin/status/952115963725463552
2018-01-13 09:20:07,BJP4India,,129,613,2314,"Indian economy keeps surging, Industrial Production hit 17-month high at 8.4% in November 2017.pic.twitter.com/tW4ZJKdGRf",,,,952107983248310272,https://twitter.com/BJP4India/status/952107983248310272
2018-01-13 08:03:19,INCIndia,,43,436,1103,"Heartbreaking news out of #Dahanu, a boat with 40 students capsizes. Our deepest sympathies with the families of the 4 dead. We hope the everyone else comes home safely.",,,#Dahanu,952088659078950912,https://twitter.com/INCIndia/status/952088659078950912
2018-01-13 08:00:06,BJP4India,,67,436,1928,"देखिये, स्वच्छ भारत अभियान से कैसे आया वातवा, गुजरात की केसरबेन की ज़िंदगी में बदलाव। #TransformingIndia #SwachhBharatpic.twitter.com/o3NNAk038t",,,#TransformingIndia #SwachhBharatpic,952087847263027200,https://twitter.com/BJP4India/status/952087847263027200
2018-01-13 07:45:00,INCIndia,,144,760,2078,"लगता है मध्य प्रदेश में चुनाव होने वाला है, भाजपा ने अपने आजमाए हुए औजारों में तेल-पानी देना शुरू कर दिया है!https://hindi.news18.com/news/madhya-pradesh/guna-curfew-imposed-in-raghogarh-after-bjp-congress-workers-clashes-1231133.html …",,,,952084047165083648,https://twitter.com/INCIndia/status/952084047165083648
2018-01-13 07:00:00,INCIndia,nsui,67,550,1105,"PM Modi refuses to address a press conference. The Haryana BJP CM seems to be emulating him and refuses to answer questions from citizens.https://twitter.com/nsui/status/951869025792995328 …",,,,952072722179379200,https://twitter.com/INCIndia/status/952072722179379200
2018-01-13 06:40:06,PMOIndia,,167,552,2112,"Factory output growth hits 17-month high of 8.4% in November http://www.livemint.com/Industry/QXPdcs09OIl0Ke6vv9wgBJ/Factory-output-growth-hits-17month-high-of-84-in-November.html … via NMApppic.twitter.com/FreSCx154X",,,,952067716365586432,https://twitter.com/PMOIndia/status/952067716365586432
2018-01-13 06:39:27,PMOIndia,,120,639,2231,"Forex reserves scale new high of $411.124 billion https://economictimes.indiatimes.com/markets/forex/forex-reserves-scale-new-high-of-411-124-billion/articleshow/62476479.cms … via NMApppic.twitter.com/PpNgQ0Zmq3",,,,952067553177763840,https://twitter.com/PMOIndia/status/952067553177763840
2018-01-13 06:24:42,PMOIndia,,227,680,3342,"The energy and enthusiasm of our youth will take India to newer heights of progress.pic.twitter.com/OhC6dW42xh",,,,952063838827892736,https://twitter.com/PMOIndia/status/952063838827892736
2018-01-13 06:22:47,PMOIndia,,312,808,3894,"Building a new India powered by the youth.pic.twitter.com/h1PrtaFyi2",,,,952063355451146241,https://twitter.com/PMOIndia/status/952063355451146241
2018-01-13 06:17:35,PMOIndia,,779,1705,7955,"India's youth has given a strong reply to those who are trying to divide our nation.pic.twitter.com/NjcvF44HvV",,,,952062047004446724,https://twitter.com/PMOIndia/status/952062047004446724
2018-01-13 06:16:08,PMOIndia,,204,517,2225,"Government is undertaking skill development initiatives that will make our youth job creators.pic.twitter.com/9n1gh3HNyy",,,,952061685736484864,https://twitter.com/PMOIndia/status/952061685736484864
2018-01-13 06:15:00,INCIndia,,523,1133,3087,"BJP-RSS have had a long history of attacking the Constitution of India. There are now disturbing rumours that the BJP plans to change the Constitution of India. Citizens need to be alert to BJP's nefarious plans.https://www.nationalheraldindia.com/opinion/does-bjp-intend-to-change-indian-constitution …",,,,952061397986287616,https://twitter.com/INCIndia/status/952061397986287616
2018-01-13 06:14:32,BJP4India,,71,276,992,"#KnowYourGovt : How many state leaders from ASEAN countries will be present during India’s 69th Republic Day celebration on 26 January 2018?",,,#KnowYourGovt,952061282672246785,https://twitter.com/BJP4India/status/952061282672246785
2018-01-13 06:13:48,BJP4India,BJP4India,22,99,487,"Thanks for your participation. Correct answer is 1.64 lakh. #KnowYourGovthttps://twitter.com/BJP4India/status/949930438675451905 …",,,#KnowYourGovthttps,952061097472794624,https://twitter.com/BJP4India/status/952061097472794624
2018-01-13 06:02:33,RajaBrar_INC,,23,127,432,"Lohri Diyan Lakh Lakh Vadhaiyan... #HappyLohripic.twitter.com/RNVvmwYWqU",,,#HappyLohripic,952058267018059776,https://twitter.com/RajaBrar_INC/status/952058267018059776
2018-01-13 06:00:00,INCIndia,,77,460,1503,"Congress President Rahul Gandhi congratulates Mr Mukesh Agnihotri, newly elected Leader of the Opposition in the Himachal Pradesh Assembly.pic.twitter.com/7cZTmqYsqa",,,,952057622806503424,https://twitter.com/INCIndia/status/952057622806503424
2018-01-13 05:30:00,INCIndia,,122,498,1122,"Just as all masters, including those that guide the nation’s destiny are made accountable, so must the Master of the Roster (CJI). : @KapilSibal #JudgesPressConference #DemocracyInDangerhttp://indianexpress.com/article/opinion/columns/supreme-court-cji-dipak-misra-justice-chelameswar-ranjan-gogoi-madan-lokur-kurian-joseph-kapil-sibal-a-judicious-warning-5022292/ …",,@KapilSibal,#JudgesPressConference #DemocracyInDangerhttp,952050072904138752,https://twitter.com/INCIndia/status/952050072904138752
2018-01-13 05:29:27,RahulGandhi,,1740,4568,20460,"आप सभी को लोहड़ी की लख लख बधाइयाँ #HappyLohri",,,#HappyLohri,952049936857628672,https://twitter.com/RahulGandhi/status/952049936857628672
2018-01-13 05:00:06,INCIndia,,225,826,1914,"India doesn't have enough jobs. Here's why this problem is not going away soon.pic.twitter.com/6eJAPQx7Ha",,,,952042550549921792,https://twitter.com/INCIndia/status/952042550549921792
2018-01-13 04:48:30,ArvindKejriwal,,560,1000,6367,"Aapko v aapke pariwar ko ""Lohri Parv"" ki hardik shubh kamnaayen.",,,,952039630483763200,https://twitter.com/ArvindKejriwal/status/952039630483763200
2018-01-13 04:30:00,INCIndia,,84,507,1820,"We wish you a #HappyLohri. Let the warmth of #Lohri brighten your life.pic.twitter.com/8gMI6muq4U",,,#HappyLohri #Lohri,952034973787279360,https://twitter.com/INCIndia/status/952034973787279360
2018-01-13 04:14:13,SachinPilot,,63,552,1367,"India Supreme Court judges: Democracy is in danger - BBC Newshttps://www.bbc.co.uk/news/amp/world-asia-india-42660391?__twitter_impression=true …",,,,952031000858542080,https://twitter.com/SachinPilot/status/952031000858542080
2018-01-13 04:10:13,SachinPilot,,62,292,977,"Today's prog:pic.twitter.com/DetzTtuavI",,,,952029994833780736,https://twitter.com/SachinPilot/status/952029994833780736
2018-01-13 04:00:55,OmarAbdullah,,53,64,227,"India Supreme Court judges: Democracy is in dangerhttp://www.bbc.co.uk/news/world-asia-india-42660391 …",,,,952027655502675968,https://twitter.com/OmarAbdullah/status/952027655502675968
2018-01-13 03:46:55,MamataOfficial,,54,112,1099,"Wishing good health, happiness and prosperity to all my Punjabi brothers and sisters on the occasion of Lohri ਲੋਹੜੀ ਦੇ ਸ਼ੁਭ ਦਿਹਾੜੇ ਦੀਆਂ ਸਮੂਹ ਦੇਸ਼ ਵਾਸੀਆਂ ਨੂੰ ਲੱਖ-ਲੱਖ ਵਧਾਈਆਂ। ਰੱਬ ਕਰੇ ਇਹ ਤਿਉਹਾਰ ਤੁਹਾਡੇ ਸਾਰਿਆਂ ਦੀ ਜ਼ਿੰਦਗੀ ਵਿੱਚ ਖੁਸ਼ੀਆਂ-ਖੇੜੇ ਲੈ ਕੇ ਆਵੇ।",,,,952024131108683779,https://twitter.com/MamataOfficial/status/952024131108683779
2018-01-13 03:43:32,MamataOfficial,,6,41,397,"Remembering film director Shakti Samanta on his birth anniversary",,,,952023280608722945,https://twitter.com/MamataOfficial/status/952023280608722945
2018-01-13 03:43:24,MamataOfficial,,6,42,422,"Wishing santoor maestro Shiv Kumar Sharma a very happy birthday",,,,952023247175876609,https://twitter.com/MamataOfficial/status/952023247175876609
2018-01-13 03:43:12,MamataOfficial,,26,108,1076,"Wishing Rakesh Sharma, the first Indian to go into space , a very happy birthday",,,,952023195447525381,https://twitter.com/MamataOfficial/status/952023195447525381
2018-01-13 03:43:01,MamataOfficial,,8,40,429,"Wishing the famous writer Nabaneeta Dev Sen a very happy birthday",,,,952023151340240896,https://twitter.com/MamataOfficial/status/952023151340240896
2018-01-13 03:41:53,OmarAbdullah,,23,34,158,"When four senior most Hon judges of the Supreme Court see a threat to India’s democracy the worst thing we can do is to simply wish it away.",,,,952022865255124992,https://twitter.com/OmarAbdullah/status/952022865255124992
2018-01-13 03:41:28,OmarAbdullah,,33,67,256,"Democracy in India is the bedrock of our nation. We take pride in telling the world we are the largest democracy even if we aren’t the oldest or the greatest.",,,,952022758669471744,https://twitter.com/OmarAbdullah/status/952022758669471744
2018-01-13 03:37:28,OmarAbdullah,,22,85,311,"It is certainly not a BJP v/s Congress or a Rahul v/s Modi issue. It is quite simply an issue that should concern every single Indian.",,,,952021751977844736,https://twitter.com/OmarAbdullah/status/952021751977844736
2018-01-13 03:35:58,OmarAbdullah,,225,427,1488,"“Democracy in India is in danger”. This was the warning that came from the Hon Judges yesterday. So no, it’s not an internal matter for the Hon SC.",,,,952021377502011392,https://twitter.com/OmarAbdullah/status/952021377502011392
2018-01-13 03:31:58,OmarAbdullah,Satwant_Dogra,1,0,16,"Very sorry for you loss Satwant ji, may his soul rest in peace. Please convey my condolences to the rest of the family.",,,,952020371720384514,https://twitter.com/OmarAbdullah/status/952020371720384514
