date,username,to,replies,retweets,favorites,text,geo,mentions,hashtags,id,permalink
2018-01-30 17:01:01,OmarAbdullah,,37,68,259,"Is there no limit to the extent of depravity in some? I can’t get my self to call the alleged rapist a human being. http://www.bbc.co.uk/news/world-asia-india-42869010 …",,,,958384567395610626,https://twitter.com/OmarAbdullah/status/958384567395610626
2018-01-30 16:57:04,MamataOfficial,,10,58,544,"Next #KolkataBookFair will be inaugurated on 19th January, 2019. My best wishes to all.pic.twitter.com/LXNYpViXng",,,#KolkataBookFair,958383574759096320,https://twitter.com/MamataOfficial/status/958383574759096320
2018-01-30 16:57:03,MamataOfficial,,15,63,575,"9 books authored by me, including 2 translated versions in Santali and Hindi of my earlier works, have been published today from the book fair. With these, the number of books authored by me during the spare time I can manage goes up to 79.pic.twitter.com/W8lvJD7Gka",,,,958383570828996608,https://twitter.com/MamataOfficial/status/958383570828996608
2018-01-30 16:57:02,MamataOfficial,,8,38,316,"Soumitra Chatterjee was felicitated for his outstanding contribution to the world of creativity. This year's theme country is France. Mr Alexander Ziegler, HE Ambassador of France was present on the occasion. I also inaugurated stalls of @KolkataPolice, @WBPolice & ""Jago Bangla"".pic.twitter.com/SkBujuJLHj",,@KolkataPolice @WBPolice,,958383566857027584,https://twitter.com/MamataOfficial/status/958383566857027584
2018-01-30 16:57:02,MamataOfficial,,37,110,1027,"Much-awaited festival of books has arrived. Today, I was present in the inauguration ceremony of 42nd International #KolkataBookFair at Central Park, Salt Lake. From 31 Jan to 11 Feb, 2018, it is going to be usual celebration with books.pic.twitter.com/dSd3FYcMPm",,,#KolkataBookFair,958383563669319681,https://twitter.com/MamataOfficial/status/958383563669319681
2018-01-30 15:53:37,INCIndia,,216,1137,3737,"Congress President Rahul Gandhi interacts with the audience at the 'Celebration of Peace' event. #OneMeghalayapic.twitter.com/wUHqly1caV",,,#OneMeghalayapic,958367605450067968,https://twitter.com/INCIndia/status/958367605450067968
2018-01-30 15:30:01,BJP4India,,81,391,1331,"Economic survey 2017-2018 : Consistent fall in fiscal deficit has marked Modi government’s fiscal policies.pic.twitter.com/8bTtaH3oFR",,,,958361665820479488,https://twitter.com/BJP4India/status/958361665820479488
2018-01-30 15:08:09,INCIndia,,149,1025,2349,"Congress President Rahul Gandhi's intervention on the discriminatory 'orange coloured' passports has forced the Govt to backtrack on this ill-advised move.http://www.dnaindia.com/india/report-after-widespread-outrage-mea-reverses-decision-to-issue-orange-passports-to-ecr-holders-2579788 …",,,,958356162105114624,https://twitter.com/INCIndia/status/958356162105114624
2018-01-30 15:00:01,BJP4India,,68,478,1654,"आर्थिक सर्वेक्षण 2017-2018 : 2014-15 से 2017-18 के दौरान सकल घरेलु उत्पाद वृद्धि दर 7.3% की औसत के साथ, दुनिया की प्रमुख अर्थव्यवस्थाओं में सबसे अधिक।pic.twitter.com/9UKWhAqdHB",,,,958354115683340288,https://twitter.com/BJP4India/status/958354115683340288
2018-01-30 14:47:39,narendramodi,,514,1691,10949,"Earlier today, paid homage to Bapu at Rajghat.pic.twitter.com/eJHlAqZSJR",,,,958351004860231680,https://twitter.com/narendramodi/status/958351004860231680
2018-01-30 14:46:52,narendramodi,,656,2045,16444,"Attended a prayer meeting at Gandhi Smriti.pic.twitter.com/yVgjLLRv7q",,,,958350809741144064,https://twitter.com/narendramodi/status/958350809741144064
2018-01-30 14:35:32,INCIndia,,41,439,1122,"LIVE: Congress President Rahul Gandhi takes part in ""Celebration of Peace"", an event celebrating the way of life in Meghalaya #OneMeghalayahttps://www.facebook.com/MeghalayaCongress/videos/220856898460210/ …",,,#OneMeghalayahttps,958347954020143104,https://twitter.com/INCIndia/status/958347954020143104
2018-01-30 14:31:07,PMOIndia,,172,808,4250,"199 gold medals, 199 silver medals and 275 bronze medals are at stake in the Khelo India School Games. The country’s brightest talent in the under-17 age group will compete in the Games.",,,,958346845519978496,https://twitter.com/PMOIndia/status/958346845519978496
2018-01-30 14:30:51,PMOIndia,,210,1092,5994,"The games will highlight India’s young sporting talent and showcase India's sports potential.",,,,958346778784317440,https://twitter.com/PMOIndia/status/958346778784317440
2018-01-30 14:30:38,PMOIndia,,226,1309,6851,"The Khelo India School Games are being held from 31st January to 8th February, 2018 in New Delhi. Under-17 athletes have been invited to participate across 16 disciplines.",,,,958346722287079424,https://twitter.com/PMOIndia/status/958346722287079424
2018-01-30 14:30:14,PMOIndia,,66,452,2002,"Talented players identified in priority sports disciplines at various levels by a High-Powered Committee will be provided annual financial assistance of Rs. 5 lakh per annum for 8 years.",,,,958346620113887233,https://twitter.com/PMOIndia/status/958346620113887233
2018-01-30 14:30:00,BJP4India,,39,260,835,"आर्थिक सर्वेक्षण 2017-2018 : राजकोषीय घाटे में लगातार गिरावट।pic.twitter.com/vuBjB4s0rH",,,,958346564572921856,https://twitter.com/BJP4India/status/958346564572921856
2018-01-30 14:29:58,PMOIndia,,161,445,2371,"In keeping with Prime Minister's vision, Khelo India is expected to help find young talent from the schools in various disciplines and groom them as future sports champions.",,,,958346554452013057,https://twitter.com/PMOIndia/status/958346554452013057
2018-01-30 14:29:34,PMOIndia,,422,1608,8633,"The Khelo India programme has been introduced to revive the sports culture in India at the grass-root level by building a strong framework for all sports played in our country and establishing India as a great sporting nation.",,,,958346454002688001,https://twitter.com/PMOIndia/status/958346454002688001
2018-01-30 14:29:19,PMOIndia,,564,2106,14618,"Prime Minister @narendramodi will launch the first Khelo India School Games at Indira Gandhi Indoor Stadium in New Delhi tomorrow.",,@narendramodi,,958346391268483072,https://twitter.com/PMOIndia/status/958346391268483072
2018-01-30 14:08:41,INCIndia,,59,502,1365,"Congress President Rahul Gandhi addresses the Meghalaya PCC Executive Meeting. #OneMeghalayapic.twitter.com/EC5uFz7p80",,,#OneMeghalayapic,958341198199980033,https://twitter.com/INCIndia/status/958341198199980033
2018-01-30 14:03:15,OmarAbdullah,sameeryasir,1,0,14,"That was a quick tweet :)",,,,958339831637073923,https://twitter.com/OmarAbdullah/status/958339831637073923
2018-01-30 14:00:04,BJP4India,,66,314,1015,"Economic survey 2017-2018 : India's GDP growth averaged 7.3% for the period from 2014-2015 to 2017-18, the highest among the major economies of the words, poised to touch 7.5% next year.pic.twitter.com/9C6pgHTk8G",,,,958339028062912512,https://twitter.com/BJP4India/status/958339028062912512
2018-01-30 13:53:58,RahulGandhi,,1409,4946,16877,"Huge crowds, excitement and energy here in #Meghalaya, where we launched our campaign today for the assembly elections. My family and I have had a special bond with the people of the North East and I enjoy renewing and strengthening that bond with every visit. #OneMeghalayapic.twitter.com/mFrRdgE7MW",,,#Meghalaya #OneMeghalayapic,958337492985327619,https://twitter.com/RahulGandhi/status/958337492985327619
2018-01-30 13:30:28,INCIndia,,178,926,1912,"Latest figures on our economy prove what we've been saying all along, UPA > NDA. #WeToldYouSopic.twitter.com/Vr8b1MvJUV",,,#WeToldYouSopic,958331580304551936,https://twitter.com/INCIndia/status/958331580304551936
2018-01-30 13:14:36,INCIndia,,10,205,445,"In a multiparty democracy, when responsibility of govt & choice of people fall in the hands of a political party, its the responsibility of Opposition to see whether promises are fulfilled. In #SpeakingTruthToPower, @P_Chidambaram has done that: @CitiznMukherjee",,@P_Chidambaram @CitiznMukherjee,#SpeakingTruthToPower,958327587222138880,https://twitter.com/INCIndia/status/958327587222138880
2018-01-30 13:11:43,INCIndia,,23,260,673,"चिदंबरम ने विपक्ष का नेता होने के नाते सत्ता के सामने सच बोलने का सही काम किया है: @CitiznMukherjee #SpeakingTruthToPowerpic.twitter.com/VNbmmTdm1S",,@CitiznMukherjee,#SpeakingTruthToPowerpic,958326861456551936,https://twitter.com/INCIndia/status/958326861456551936
2018-01-30 13:10:05,INCIndia,,10,149,291,"सभी लिख नहीं सकते तो कम से कम लोगों को आगे आकर बोलना चाहिए: @PChidambaram_IN #SpeakingTruthToPower",,@PChidambaram_IN,#SpeakingTruthToPower,958326451970830336,https://twitter.com/INCIndia/status/958326451970830336
2018-01-30 13:08:51,INCIndia,,12,167,239,"There are communal clashes, fear, intolerance of dissent, ideological profiling and a specter of an Orwellian state. And questioning this is one of the reasons I write: @P_Chidambaram #SpeakingTruthToPower",,@P_Chidambaram,#SpeakingTruthToPower,958326142133420033,https://twitter.com/INCIndia/status/958326142133420033
2018-01-30 13:05:42,INCIndia,,36,390,1066,"Former President @CitiznMukherjee launches former Finance Minister @PChidambaram_IN's book #SpeakingTruthToPowerpic.twitter.com/oht1gCOUde",,@CitiznMukherjee @PChidambaram_IN,#SpeakingTruthToPowerpic,958325348642439168,https://twitter.com/INCIndia/status/958325348642439168
2018-01-30 12:33:01,OmarAbdullah,,10,21,101,"We set up one of our high-capacity pumps there & pumped water from Rajbagh in to this enclosure. I'm amazed to see a construction site now!!",,,,958317121565376512,https://twitter.com/OmarAbdullah/status/958317121565376512
2018-01-30 12:30:27,INCIndia,,428,929,3266,"गांधी जी के विचारों को अपना आदर्श बनाने की आवश्यकता है, ना कि दिखावा बनाने की #JanKiBaatpic.twitter.com/2Chsu617rL",,,#JanKiBaatpic,958316476418621441,https://twitter.com/INCIndia/status/958316476418621441
2018-01-30 12:30:02,OmarAbdullah,sameeryasir,8,18,132,"I've been told is Irrigation & Flood Control land.This small patch of land played a vital role in 2014 floods, allowing us to pump water outhttps://twitter.com/sameeryasir/status/958311057465880576 …",,,,958316374467657728,https://twitter.com/OmarAbdullah/status/958316374467657728
2018-01-30 12:05:47,INCIndia,INCNagaland,16,330,594,"The NPF-led Govt in Nagaland has allowed the #LotteryScam to continue for several years, causing a loss to the exchequer. #NagalandForChangehttps://twitter.com/INCNagaland/status/958297529908514816 …",,,#LotteryScam #NagalandForChangehttps,958310271155560449,https://twitter.com/INCIndia/status/958310271155560449
2018-01-30 12:00:40,INCIndia,,61,541,1144,"The Modi Govt has used the latest Economic Survey to present a skewed picture. The reality is far removed.https://www.inc.in/en/in-focus/economic-survey-2017-18-govt-hides-the-truth …",,,,958308982094954496,https://twitter.com/INCIndia/status/958308982094954496
2018-01-30 11:43:31,arunjaitley,,101,233,2322,"Saddened by the demise of dynamic BJP MP from Palghar, Maharashtra, Shri Chintaman Wanaga. My thoughts and prayers are with the bereaved family. May God render peace to the departed soul.",,,,958304664906166273,https://twitter.com/arunjaitley/status/958304664906166273
2018-01-30 11:15:11,INCIndia,,28,307,601,"The Niranthara Jyoti scheme is boon to the rural economy in Karnataka. It helps villages by separating power supply from agricultural loads for other needs. @INCKarnataka #NavaKarnatakaNirmanapic.twitter.com/CFMDaliN44",,@INCKarnataka,#NavaKarnatakaNirmanapic,958297536288251906,https://twitter.com/INCIndia/status/958297536288251906
2018-01-30 10:53:53,INCIndia,,42,506,1269,"Congress President Rahul Gandhi addresses party workers at Jowai. #OneMeghalayapic.twitter.com/XPlZS4fvjF",,,#OneMeghalayapic,958292177213378560,https://twitter.com/INCIndia/status/958292177213378560
2018-01-30 10:48:37,BJP4India,,191,753,3147,"Economic survey 2017-18 : Modi government's structural and fiscal reforms spur the India's growth story.pic.twitter.com/PkPmQ1N3s3",,,,958290851582455810,https://twitter.com/BJP4India/status/958290851582455810
2018-01-30 10:42:19,mkstalin,,128,434,2068,"பேருந்து கட்டண உயர்வை எதிர்த்து வேலூரில் போராடிய மாணவர்கள் மீது காவல்துறை தடியடி நடத்தி இருப்பதை கடுமையாக கண்டிக்கிறேன்.மாணவர்கள் மீதான அடக்குமுறையை கைவிட்டு, கட்டண உயர்வை உடனே திரும்ப பெறுவதோடு,மாணவர்கள் மீதான வழக்குகளை ‘குதிரை பேர’அரசு ரத்து செய்ய வேண்டும். #BusFareHikeProtestpic.twitter.com/SBjgyUulKD",,,#BusFareHikeProtestpic,958289264705327104,https://twitter.com/mkstalin/status/958289264705327104
2018-01-30 10:17:32,ArvindKejriwal,,1628,2346,7323,"Someone told me today - “Thro sealing, BJP wants to ruin Delhi’s retail business to pave way for FDI in retail in Delhi.” I hope this is not true.",,,,958283025669799936,https://twitter.com/ArvindKejriwal/status/958283025669799936
2018-01-30 10:02:05,INCIndia,,233,980,3402,"गाँधी जी के विचारों पर विभाजनकारी तत्वों द्वारा लगातार प्रहार के बावजूद भी वो अडिग है...क्योंकि विचार कभी मरते नहीं। http://bit.ly/2DY9HuV",,,,958279139680800768,https://twitter.com/INCIndia/status/958279139680800768
2018-01-30 09:29:25,BJP4India,,43,433,1947,"देखिये, स्वच्छ भारत अभियान से कैसे आया वातवा, गुजरात की केसरबेन की ज़िंदगी में बदलाव। #SwachhBharatpic.twitter.com/stvMgw4rod",,,#SwachhBharatpic,958270920455471104,https://twitter.com/BJP4India/status/958270920455471104
2018-01-30 09:01:28,SachinPilot,RajendraHira,9,57,114,"@RajendraHira धन्यवाद ! https://twitter.com/rajendrahira/status/958237969567047680 …",,@RajendraHira,,958263883608743937,https://twitter.com/SachinPilot/status/958263883608743937
2018-01-30 09:00:16,narendramodi,,769,2712,15626,"Pained by the unfortunate demise of my colleague and MP from Palghar, Shri Chintaman Wanaga. He played an important role in building the BJP in the Thane region and did commendable work for the welfare of tribals. My thoughts are with his family and supporters in this sad hour.",,,,958263583082729474,https://twitter.com/narendramodi/status/958263583082729474
2018-01-30 08:57:58,narendramodi,,275,1578,8864,"Saddened by the demise of former MP Shri Uttambhai Patel. In his long political career, he rendered invaluable service to the people of Gujarat, particularly the tribal communities. He was committted to Gandhian values and played a key role in the Pardi Satyagraha.",,,,958263003366993920,https://twitter.com/narendramodi/status/958263003366993920
2018-01-30 08:49:37,AmitShah,,220,1018,5558,"Pained to know about the untimely demise of Shri Chintaman Vanga ji, our MP from Palghar, Maharashtra. He devoted his entire life for the welfare of tribals & deprived. His passing away is an irrepairable loss to the BJP. I express my deepest condolences to his family & friends.",,,,958260902356135936,https://twitter.com/AmitShah/status/958260902356135936
2018-01-30 08:09:12,INCIndia,,72,664,1970,"Congress President Rahul Gandhi pays his respects to #MahatmaGandhi at #GandhiSmriti on #MartyrsDaypic.twitter.com/ISMEWcZbiU",,,#MahatmaGandhi #GandhiSmriti #MartyrsDaypic,958250731403804672,https://twitter.com/INCIndia/status/958250731403804672
2018-01-30 07:37:36,BJP4India,,50,215,890,"Inflation Down, Savings up : Lower EMIs and interest rates for automobiles, homes and education loans. #ImprovedEaseOfLivingpic.twitter.com/DAfv9SUII9",,,#ImprovedEaseOfLivingpic,958242777879363585,https://twitter.com/BJP4India/status/958242777879363585
2018-01-30 07:18:20,ncbn,,47,105,1034,"In a video conference with Falcon X delegates and CEOs from Silicon Valley, discussed the various opportunities for encouraging and supporting technology startups in AP.pic.twitter.com/w59mUAyjwn",,,,958237930534813697,https://twitter.com/ncbn/status/958237930534813697
2018-01-30 07:12:39,INCIndia,,76,597,1807,"Congress President Rahul Gandhi arrives in #Guwahati and will be heading to #Meghalaya to kick off the Assembly election campaign. #OneMeghalayapic.twitter.com/CCNs3Sf4vl",,,#Guwahati #Meghalaya #OneMeghalayapic,958236502206623744,https://twitter.com/INCIndia/status/958236502206623744
2018-01-30 06:32:33,AmitShah,,194,867,5018,"Congratulations to Team India for the spectacular win against Pakistan in the #ICCU19WorldCup semi-final. All the very best for the finals.pic.twitter.com/HI6Isbf5Ew",,,#ICCU19WorldCup,958226408202997760,https://twitter.com/AmitShah/status/958226408202997760
2018-01-30 05:42:24,BJP4India,,57,315,927,"For making highways safer and ensuring quicker assistance in cases of mishaps, Modi government to start a 24x7 toll-free helpline, 1033, to report road accidents and lodge complaints on National Highways.pic.twitter.com/B2geSKqeQl",,,,958213789614092288,https://twitter.com/BJP4India/status/958213789614092288
2018-01-30 05:15:44,AmitShah,,183,529,3626,"Wishing a very happy birthday to Shri @PrakashJavdekar ji. May you be blessed with a long life, filled with good health.",,@PrakashJavdekar,,958207077096173568,https://twitter.com/AmitShah/status/958207077096173568
2018-01-30 05:01:14,ArvindKejriwal,,435,857,3137,"I will visit various markets and meet the traders affected by sealing.",,,,958203426726268928,https://twitter.com/ArvindKejriwal/status/958203426726268928
2018-01-30 04:39:24,JM_Scindia,,166,671,2367,"मध्यप्रदेश की लचर आर्थिक नीति का परिणाम - 8वीं पास की न्यूनतम शैक्षणिक योग्यता वाले 738 पदों के लिए 2.81 लाख आवेदन, जिसमें से हज़ारों इंजीनियरिंग, वकालत और एमबीए की डिग्री धारक है। क्या ऐसे संवारेगी मप्र सरकार हमारे प्रतिभावान, पढ़े-लिखे युवाओं का भविष्य?https://www.jansatta.com/job/law-graduates-engineers-and-mbas-among-candidates-who-applied-for-738-peon-posts-in-madhya-pradesh/562609/ …",,,,958197932699746304,https://twitter.com/JM_Scindia/status/958197932699746304
2018-01-30 04:37:19,ArvindKejriwal,rupashreenanda,282,1032,1909,"I made a sincere request to our BJP friends to sit down, discuss and together find a soln to sealing. However, they just walked out. I am disappointed. Solns can be found only thro discussions in democracy.https://twitter.com/rupashreenanda/status/958192499197030405 …",,,,958197411196710912,https://twitter.com/ArvindKejriwal/status/958197411196710912
2018-01-30 04:34:50,INCIndia,,152,839,2054,"यूँ ही नहीं कहते 'सूट-बूट की सरकार'! #SuitBootKiSarkarhttps://www.navjivanindia.com/news/big-corporates-in-country-are-giving-maximum-political-donations-to-bjp-says-adr-report …",,,#SuitBootKiSarkarhttps,958196782395215873,https://twitter.com/INCIndia/status/958196782395215873
2018-01-30 04:12:31,JM_Scindia,,112,656,3329,"भारत की आज़ादी के तपस्वी नायक, विश्व को अहिंसा का मार्ग दिखाने वाले राष्ट्रपिता महात्मा गांधी के बलिदान दिवस पर कृतज्ञ राष्ट्र का नमन! #बापू के सिद्धांत और मूल्य आज के माहौल में हमारे लिए और भी ज़्यादा प्रासंगिक हैं।",,,#ब,958191166293393408,https://twitter.com/JM_Scindia/status/958191166293393408
2018-01-30 03:52:14,SachinPilot,,144,606,2385,"सत्य, अहिंसा के पुजारी राष्ट्रपिता महात्मा गांधी जी की पुण्यतिथि ""शहीद दिवस"" पर विनम्र श्रद्धांजलि व सादर नमन। #MahatmaGandhipic.twitter.com/b0kJE0AARg",,,#MahatmaGandhipic,958186063503093761,https://twitter.com/SachinPilot/status/958186063503093761
2018-01-30 03:26:00,RajaBrar_INC,,25,235,661,"“ क्रोध और असहिष्णुता सही समझ के दुश्मन हैं...” #MahatmaGandhi जी को उनकी पुण्यतिथि पर शत्-शत् नमन..pic.twitter.com/2PnBtu70jj",,,#MahatmaGandhi,958179463308615680,https://twitter.com/RajaBrar_INC/status/958179463308615680
2018-01-30 03:00:01,BJP4India,,131,363,1875,"राष्ट्रपिता महात्मा गांधी की पुण्यतिथि पर शत्-शत् नमन।pic.twitter.com/6fEMUcPup0",,,,958172924950777856,https://twitter.com/BJP4India/status/958172924950777856
2018-01-30 02:45:16,MamataOfficial,,42,113,976,"Today is World Leprosy Day. Let’s vow for an end to untouchability, and act more towards the end of the disease",,,,958169209120309249,https://twitter.com/MamataOfficial/status/958169209120309249
2018-01-30 02:44:44,MamataOfficial,,45,190,1536,"Today is the day of martyrdom of the Father of the Nation, Mahatma Gandhi. Let us solemnly remember, and abide by, the ideals he stood for",,,,958169078803283968,https://twitter.com/MamataOfficial/status/958169078803283968
2018-01-30 02:30:16,INCIndia,,26,437,873,"Congress President Rahul Gandhi hits the campaign trail with a two day visit to #Meghalaya #OneMeghalayapic.twitter.com/koZjsIe0zU",,,#Meghalaya #OneMeghalayapic,958165436708872192,https://twitter.com/INCIndia/status/958165436708872192
2018-01-30 02:29:07,arunjaitley,,79,160,1644,"Best wishes to Shri Prakash Javadekar, my colleague in the Union Cabinet on his birthday. May God bless him with good health, long life & a successful year ahead. @PrakashJavdekar",,@PrakashJavdekar,,958165147838640128,https://twitter.com/arunjaitley/status/958165147838640128
2018-01-30 02:26:12,arunjaitley,,121,252,2458,"Respectful tribute to Mahatma Gandhi, Father of the Nation, on his Punya Tithi. Truth and non-violence always guided the political thought of Mahatma Gandhi. We remember his life, works and ideals on his Punya Tithi and follow the path shown by him.",,,,958164414334562304,https://twitter.com/arunjaitley/status/958164414334562304
2018-01-30 02:21:26,PMOIndia,,440,1302,9350,"Anguished by the bus accident in West Bengal’s Murshidabad. My thoughts and prayers are with those who lost their loved ones: PM @narendramodi",,@narendramodi,,958163214877052928,https://twitter.com/PMOIndia/status/958163214877052928
2018-01-30 02:18:04,INCIndia,,104,226,484,"In Iceland, it is now illegal to pay men more than women and companies are required to obtain an equal pay certification by the Govt. Do you think India is equipped enough to implement such a law? #IndiaSpeaks",,,#IndiaSpeaks,958162364234309632,https://twitter.com/INCIndia/status/958162364234309632
2018-01-30 02:17:40,AmitShah,,461,975,6812,"राष्ट्रपिता महात्मा गांधी जी की पुण्यतिथि पर उन्हें विनम्र श्रद्धांजलि।pic.twitter.com/rqWXwyQe6a",,,,958162265189924864,https://twitter.com/AmitShah/status/958162265189924864
2018-01-30 02:16:36,ArvindKejriwal,,796,1543,7137,"बापू को शत शत नमन। अहिंसा और भाईचारे के बापू के संदेश की आज भारत को सबसे अधिक ज़रूरत है।",,,,958161998654550016,https://twitter.com/ArvindKejriwal/status/958161998654550016
2018-01-30 02:12:41,narendramodi,,414,1417,8532,"Warm birthday wishes to my colleague Shri @PrakashJavdekar. May Almighty bless him with a long and healthy life.",,@PrakashJavdekar,,958161011063783425,https://twitter.com/narendramodi/status/958161011063783425
2018-01-30 02:10:21,narendramodi,,513,3122,16572,"We bow to all those martyrs who have sacrificed themselves in service of our nation. We will always remember their courage as well as dedication towards the nation.",,,,958160423961939969,https://twitter.com/narendramodi/status/958160423961939969
2018-01-30 02:08:46,narendramodi,,1421,3424,23079,"पूज्य बापू की पुण्यतिथि पर उन्हें श्रद्धांजलि. Remembering Bapu on his Punya Tithi.",,,,958160026190991360,https://twitter.com/narendramodi/status/958160026190991360
