date,username,to,replies,retweets,favorites,text,geo,mentions,hashtags,id,permalink
2018-01-23 05:15:05,INCIndia,,141,541,1122,"PM Modi's incompetence continues to show. After allowing the situation in Kashmir to spiral out of control. Modi Govt shows that it is incapable of containing Pakistan.http://indianexpress.com/article/india/jk-january-likely-to-record-most-violations-of-ceasefire-on-the-loc-since-2003-5035380/ …",,,,955670197570097152,https://twitter.com/INCIndia/status/955670197570097152
2018-01-23 05:10:10,BJP4India,,153,468,2159,"प्रधानमंत्री कौशल विकास योजना से युवाओं को मिल रहे हैं रोज़गार के नए अवसर।pic.twitter.com/x1p6SdjSZS",,,,955668960174784512,https://twitter.com/BJP4India/status/955668960174784512
2018-01-23 04:55:52,ncbn,,72,1001,2798,"One need not be a politician to be a great leader and lead the society towards a better tomorrow. Congratulations @iamsrk on being awarded @wef's 24th crystal award. Your dedicated efforts for Women’s and Children’s rights are commendable.",,@iamsrk @wef,,955665364511178752,https://twitter.com/ncbn/status/955665364511178752
2018-01-23 04:55:44,ncbn,,12,50,427,"“We need collaborative efforts. No nation, no person, no stakeholder group alone can address the complex global agenda in a constructive way."" What an inspiring launch of #WEF18 by Klaus Schwab. #APatDavos @wef",,@wef,#WEF18 #APatDavos,955665329987842048,https://twitter.com/ncbn/status/955665329987842048
2018-01-23 04:33:29,INCIndia,,38,721,1470,"The EC has reaffirmed the idea that holding an Office of Profit will lead to disqualification. It is time that MLAs in Chattisgarh be similarly disqualified.https://www.hindustantimes.com/india-news/citing-aap-case-congress-seeks-disqualification-of-11-bjp-mlas-in-chhattisgarh/story-5gIpjwfagLB2URF3o7nEnO.html …",,,,955659728335638528,https://twitter.com/INCIndia/status/955659728335638528
2018-01-23 04:17:53,ncbn,,446,291,2639,"Blessings and wishes to Telugu youth icon and charismatic leader, Nara Lokesh, on his birthday. May you be blessed with greater strength and determination to serve the citizens of Andhra Pradesh.",,,,955655805205757952,https://twitter.com/ncbn/status/955655805205757952
2018-01-23 04:17:21,ncbn,,17,104,815,"Remembering the fearless nationalist, Netaji Subhash Chandra Bose on his birth anniversary.",,,,955655670354788353,https://twitter.com/ncbn/status/955655670354788353
2018-01-23 03:40:13,MamataOfficial,,141,186,1571,"Remembering Netaji Subhas Chandra Bose on his birth anniversary. Jai Hindpic.twitter.com/LxvrSZIjDd",,,,955646324736540673,https://twitter.com/MamataOfficial/status/955646324736540673
2018-01-23 03:33:25,PMOIndia,,652,2651,12991,"Today, 3:45 PM onwards the Opening Plenary of the @wef commences. PM @narendramodi will address the plenary. You can watch the address live here. http://narendramodi.in/watch-live #IndiaMeansBusiness",,@wef @narendramodi,#IndiaMeansBusiness,955644613024538624,https://twitter.com/PMOIndia/status/955644613024538624
2018-01-23 03:08:03,INCIndia,,306,474,906,"The Karni Sena has announced a Bharat Bandh on January 25th and threatens to burn multiplexes that screen the movie Padmaavat. Will you watch the Movie in a theater? #IndiaSpeaks",,,#IndiaSpeaks,955638228576382976,https://twitter.com/INCIndia/status/955638228576382976
2018-01-23 03:00:52,arunjaitley,,169,526,5252,"नेताजी सुभाष चन्द्र बोस की जयंती पर शत् शत् नमन। #SubhashChandraBose",,,#SubhashChandraBose,955636421078827008,https://twitter.com/arunjaitley/status/955636421078827008
2018-01-23 02:45:02,BJP4India,,267,1097,4865,"जातिवाद, परिवारवाद, धोखा देना, सत्ता लोलुपता... ये हिंदुस्तान की राजनीति का कल्चर बन गए हैं और इसकी मुख्यधार कांग्रेस रही है। जब मैं 'कांग्रेस मुक्त' कहता हूं तो इस कल्चर से मुक्ति की बात कहता हूं। इस कल्चर से देश को बचाना होगा और खुद कांग्रेस को भी कांग्रेस मुक्त होना होगा: पीएमpic.twitter.com/9wk8mkejYq",,,,955632438675365888,https://twitter.com/BJP4India/status/955632438675365888
2018-01-23 02:44:05,AmitShah,,289,1283,7708,"प्रखर राष्ट्रवादी व जनप्रिय नेता आदरणीय बालासाहेब ठाकरे जी की जयंती पर उन्हें शत् - शत् नमन।pic.twitter.com/DYivwbXgqI",,,,955632199910543362,https://twitter.com/AmitShah/status/955632199910543362
2018-01-23 02:40:11,PMOIndia,,274,1357,6163,"In Davos, PM @narendramodi interacted with top CEOs. He spoke about India’s economic development and the investment opportunities in the nation. #IndiaMeansBusinesspic.twitter.com/LmRR28k9xL",,@narendramodi,#IndiaMeansBusinesspic,955631218074247168,https://twitter.com/PMOIndia/status/955631218074247168
2018-01-23 02:37:27,INCIndia,,253,923,2833,"Lovingly called as #Netaji, India's patriot #SubhashChandraBose was a leader of the Indian National Congress and served as the Congress President in 1938 and 1939.pic.twitter.com/EVQb6dy8Nq",,,#Netaji #SubhashChandraBose,955630527146422278,https://twitter.com/INCIndia/status/955630527146422278
2018-01-23 02:24:49,narendramodi,,971,5831,31656,"Remembering Balasaheb Thackeray on his birth anniversary. He will always be remembered as a brave leader who worked tirelessly towards fulfilling the aspirations of people.",,,,955627349667647488,https://twitter.com/narendramodi/status/955627349667647488
2018-01-23 02:24:46,BJP4India,,90,378,1599,"Salute to one of the most dynamic and patriotic leaders of India’s struggle of Independence Netaji Subash Chandra Bose on his birth anniversary.pic.twitter.com/dD3B22u4ek",,,,955627337374105601,https://twitter.com/BJP4India/status/955627337374105601
2018-01-23 02:17:00,AmitShah,,162,888,3836,"I bow to the legendary Netaji Subhash Chandra Bose on his birth anniversary. Netaji's patriotism, courage and bravery were exceptional. His charismatic leadership had inspired millions of youth to participate in India's Independence struggle.pic.twitter.com/891MUx3BH6",,,,955625383977783297,https://twitter.com/AmitShah/status/955625383977783297
2018-01-23 02:14:00,INCIndia,INCIndia,22,207,427,"The Noes have it. #IndiaSpeakshttps://twitter.com/INCIndia/status/955263598720270336 …",,,#IndiaSpeakshttps,955624627572584448,https://twitter.com/INCIndia/status/955624627572584448
2018-01-23 02:13:00,INCIndia,,15,123,260,"The Noes have it. #IndiaSpeaks",,,#IndiaSpeaks,955624376522674176,https://twitter.com/INCIndia/status/955624376522674176
2018-01-23 02:05:39,narendramodi,,1306,6909,26741,"The valour of Netaji Subhas Chandra Bose makes every Indian proud. We bow to this great personality on his Jayanti.pic.twitter.com/Qrao1dnmQZ",,,,955622526734032897,https://twitter.com/narendramodi/status/955622526734032897
2018-01-23 02:00:29,INCIndia,,54,239,557,"Karnataka recently became the first state in India to roll out Universal Health Care by assuring healthcare services for its population of over 6 crore. Which of the following Govt. schemes assured this? #WhatTheFact",,,#WhatTheFact,955621224805105664,https://twitter.com/INCIndia/status/955621224805105664
2018-01-23 01:59:00,INCIndia,INCIndia,20,251,542,"Dr Manmohan Singh is the correct answer. In 2007, the University of Cambridge instituted a scholarship in his name which aids students from India pursuing doctoral studies at St John's College, Cambridge. #WhatTheFacthttps://twitter.com/INCIndia/status/955289117109108736 …",,,#WhatTheFacthttps,955620852149534720,https://twitter.com/INCIndia/status/955620852149534720
2018-01-23 01:58:00,INCIndia,,18,190,464,"Dr Manmohan Singh is the correct answer. In 2007, the University of Cambridge instituted a scholarship in his name which aids students from India pursuing doctoral studies at St John's College, Cambridge. #WhatTheFact",,,#WhatTheFact,955620601342734336,https://twitter.com/INCIndia/status/955620601342734336
2018-01-23 01:31:00,MamataOfficial,,195,183,1908,"Remembering Bal Thackeray on his birth anniversary",,,,955613806092107776,https://twitter.com/MamataOfficial/status/955613806092107776
2018-01-23 01:30:01,MamataOfficial,,12,31,572,"Wishing film director Ramesh Sippy a very happy birthday",,,,955613556900233217,https://twitter.com/MamataOfficial/status/955613556900233217
2018-01-22 23:21:50,ArvindKejriwal,OxfamIndia,384,1472,3025,"Such huge inequality is undesirable for any country. It is due to faulty economic policies n crony capitalism. It existed during UPA and has further widened during NDA rule.https://twitter.com/oxfamindia/status/955312636798763008 …",,,,955581300341055488,https://twitter.com/ArvindKejriwal/status/955581300341055488
2018-01-22 18:41:46,narendramodi,,769,3138,17084,"On reaching Davos, held talks with the President of the Swiss Confederation, Mr. @alain_berset. We reviewed the scope of our bilateral cooperation and discussed ways to deepen it even further.pic.twitter.com/aPOXnHrajt",,@alain_berset,,955510820498063360,https://twitter.com/narendramodi/status/955510820498063360
2018-01-22 18:32:07,JM_Scindia,,47,283,1441,"आज चन्देरी में हमारे देश के सुप्रसिद्ध ध्रुपद गायक बैजू बावरा की पुण्यतिथि के अवसर पर उनके समाधि स्थल पर आयोजित बैजू बावरा ध्रुपद उत्सव में सम्मलित होने का सौभाग्य प्राप्त हुआ।pic.twitter.com/2lKn3FSxjr",,,,955508391098531840,https://twitter.com/JM_Scindia/status/955508391098531840
2018-01-22 18:09:56,ncbn,,76,115,980,"LoI for the development of a Partnership between the Government of AP, India and the Government of the Canton of Zurich, Switzerland, has been signed today. It will strengthen relations in the areas of ICT, environmental technologies & urban and regional development. #APatDavospic.twitter.com/JejlfecCGv",,,#APatDavospic,955502806076604416,https://twitter.com/ncbn/status/955502806076604416
2018-01-22 15:05:30,BJP4India,,140,659,2289,"Big diplomatic success for Modi government, India moves one step closer to becoming NSG (Nuclear Suppliers Group) member as it joins coveted ‘Australia group’.pic.twitter.com/vLbtAigBn5",,,,955456392697020417,https://twitter.com/BJP4India/status/955456392697020417
2018-01-22 15:00:06,INCIndia,,446,1340,3275,"PM Modi's mismanagement of the economy is leading to an increasing number of loans going bad. #ModiWrecksEcononypic.twitter.com/1cfzjYyhY7",,,#ModiWrecksEcononypic,955455035743203328,https://twitter.com/INCIndia/status/955455035743203328
2018-01-22 14:52:33,RahulGandhi,,702,3650,11884,"Met Senator Penny Wong, the Australian Leader of the Opposition in the Senate and the Australian High Commissioner, Ms. Harinder Sidhu for a wide-ranging exchange of views. Sen. Wong has the distinction of being the first person of Asian origin in the Australian cabinet.pic.twitter.com/5PXLsKlFRi",,,,955453136914628608,https://twitter.com/RahulGandhi/status/955453136914628608
2018-01-22 14:48:14,MamataOfficial,,109,157,1478,"নেতাজী সুভাষচন্দ্র বসুর জন্মদিবসে শ্রদ্ধার্ঘ্যpic.twitter.com/m3LTPXBFVv",,,,955452048593502208,https://twitter.com/MamataOfficial/status/955452048593502208
2018-01-22 14:30:31,INCIndia,,53,531,1090,"The Modi Govt has systematically eroded pollution and environment norms to favour businesses over citizens. #SuitBootKiSarkarhttps://www.inc.in/en/in-focus/the-narendra-modi-govts-war-on-environment …",,,#SuitBootKiSarkarhttps,955447589805191169,https://twitter.com/INCIndia/status/955447589805191169
2018-01-22 14:18:35,INCIndia,,16,236,539,"AICC Press briefing by @DrAMSinghvi on fuel price risehttps://www.youtube.com/watch?v=9a0HGgbBcvY&feature=youtu.be …",,@DrAMSinghvi,,955444586712674304,https://twitter.com/INCIndia/status/955444586712674304
2018-01-22 13:14:04,BJP4India,,103,492,2225,"The intention behind ‘Congress-free country’ is not only limited to defeating them electorally but to free the country of the culture of political ills it has come to manifest : PM @narendramodi #PMModiSpeaksToTimesNowpic.twitter.com/pVZUDxTzTD",,@narendramodi,#PMModiSpeaksToTimesNowpic,955428349102477312,https://twitter.com/BJP4India/status/955428349102477312
2018-01-22 13:00:38,INCIndia,,65,420,867,"Healthcare should be accessible to all sections of society. This is the guiding principle of our Govt in Karnataka #NavaKarnatakaNirmanapic.twitter.com/NXsoytjtjT",,,#NavaKarnatakaNirmanapic,955424968652787712,https://twitter.com/INCIndia/status/955424968652787712
2018-01-22 12:32:37,PMOIndia,,574,1394,10284,"PM @narendramodi reached Switzerland, where he will take part in the @wef.pic.twitter.com/ASA0qamQfS",,@narendramodi @wef,,955417918287654913,https://twitter.com/PMOIndia/status/955417918287654913
2018-01-22 12:30:26,INCIndia,,169,609,1618,"बीजेपी सरकार गरीबी हटाने से ज्यादा गरीबी को ढंकने में यक़ीन रखती है #JanKiBaatpic.twitter.com/BkCIU72Zy2",,,#JanKiBaatpic,955417371354845184,https://twitter.com/INCIndia/status/955417371354845184
2018-01-22 11:57:20,RahulGandhi,,2577,5610,15895,"खुद को बताते हैं जो बहुत ‘आम’ ‘खास’ को ही गले लगाना उनका काम मोदीजी, ऐसी भी क्या मजबूरी गले लगाने वालों में किसान मजदूर और जवान का होना भी है ज़रूरीhttps://khabar.ndtv.com/news/india/pm-modi-on-hugging-global-leaders-i-am-a-common-man-and-do-not-protocol-1802417/amp/1?akamai-rum=off …",,,,955409039134932992,https://twitter.com/RahulGandhi/status/955409039134932992
2018-01-22 11:25:02,BJP4India,,71,460,1856,"PM @narendramodi busts the propaganda on lack of jobs with irrefutable figures. Only in ‘formal sector’ comprising 10% of jobs, more than 70 lakh new EPF accounts for employees aged between 18-25 years prove increased employability in the country.pic.twitter.com/nFgUnHA8Eg",,@narendramodi,,955400913144881153,https://twitter.com/BJP4India/status/955400913144881153
2018-01-22 11:15:10,INCIndia,,53,424,868,"Tackling malnutrition, increasing school enrolment, and reducing dropout rates. With Ksheera Bhagya, our government in Karnataka has ensured that children are not deprived of education and nutrition. #NavaKarnatakaNirmanapic.twitter.com/421gt5CZHY",,,#NavaKarnatakaNirmanapic,955398430037348352,https://twitter.com/INCIndia/status/955398430037348352
2018-01-22 11:01:02,laluprasadrjd,,1970,1903,13427,"रौंदोगे तो हिमाला बनूँगा विष दोगे तो शिवाला बनूँगा उधेड़ोगे तो दूशाला बनूँगा जलाओगे तो उजाला बनूँगा दफ़नाओगे तो निवाला बनूँगा लालू लाल है बिहार का जन्म-जन्मांतर तक इस मिट्टी का रखवाला बनूँगा।",,,,955394873401556993,https://twitter.com/laluprasadrjd/status/955394873401556993
2018-01-22 10:35:06,INCIndia,,138,793,1994,"""पिछले साल भारत में जितनी संपत्ति का निर्माण हुआ, उसका 73 प्रतिशत हिस्सा देश के 1 प्रतिशत अमीरों ने लिया""https://navbharattimes.indiatimes.com/business/business-news/indias-richest-1-corner-73-of-wealth-generation-survey/articleshow/62601351.cms …",,,,955388343990341632,https://twitter.com/INCIndia/status/955388343990341632
2018-01-22 10:25:18,BJP4India,,36,232,956,"GST in the current form has evolved as a collective and unanimous decision taken by the parliament, all states & UTs. So using unpalatable expressions for it in public is not only political hypocrisy but also an insult to the democratic tenets and institutions of the country: PMpic.twitter.com/vAdfu146HC",,,,955385878964199424,https://twitter.com/BJP4India/status/955385878964199424
2018-01-22 10:12:52,PMOIndia,,460,1539,8733,"PM @narendramodi speaks about rapid progress in various Government schemes and how the Central government not only believes in good ideas but also speedy implementation.pic.twitter.com/pkZ69dsy8d",,@narendramodi,,955382748931387392,https://twitter.com/PMOIndia/status/955382748931387392
2018-01-22 10:10:13,PMOIndia,,172,610,3280,"Our ultimate goal is ‘ease of living.’pic.twitter.com/FlGSBDsEP3",,,,955382082829737984,https://twitter.com/PMOIndia/status/955382082829737984
2018-01-22 10:08:47,PMOIndia,,126,585,2906,"Important to rise beyond votebank politics and think about empowerment of women.pic.twitter.com/RysdRuqjS2",,,,955381723491168256,https://twitter.com/PMOIndia/status/955381723491168256
2018-01-22 10:06:50,PMOIndia,,69,471,2051,"We are unwavering in our efforts towards strengthening the agriculture sector and committed towards doubling of income of farmers.pic.twitter.com/hXWVvyTyqd",,,,955381232732463104,https://twitter.com/PMOIndia/status/955381232732463104
2018-01-22 10:06:22,BJP4India,,69,418,1908,"India has improved its ranking on ‘ease of doing business’ at the back of many structural reforms but the ultimate goal of my government is to improve ‘ease of living’ for every Indian : PM @narendramodi #PMModiSpeaksToTimesNowpic.twitter.com/tODpy59OLA",,@narendramodi,#PMModiSpeaksToTimesNowpic,955381115170123777,https://twitter.com/BJP4India/status/955381115170123777
2018-01-22 10:04:25,PMOIndia,,115,555,2412,"The world is suffering due to the menace of terrorism and is strongly uniting against those who support it.pic.twitter.com/7aIxhkpHjp",,,,955380624696717312,https://twitter.com/PMOIndia/status/955380624696717312
2018-01-22 08:40:42,JM_Scindia,,47,250,951,"शमशाबाद में आज भगवान द्वारकाधीश जी के नवीन मंदिर के स्थापना समारोह में सम्मलित होकर भगवान द्वारकाधीश जी के दर्शन लाभ का सौभाग्य प्राप्त किया।pic.twitter.com/uEvGR0TalC",,,,955359557571641345,https://twitter.com/JM_Scindia/status/955359557571641345
2018-01-22 08:33:01,JM_Scindia,,13,158,573,"मध्यप्रदेश में दिन प्रतिदिन महिलाओं को प्रताड़ित किया जा रहा है, लेकिन निकृष्ट सरकार सहारा बनने के बजाय उन्हें और तड़पा रही है।",,,,955357620235218944,https://twitter.com/JM_Scindia/status/955357620235218944
2018-01-22 08:33:00,JM_Scindia,,58,358,1143,"मप्र सरकार की असंवेदनशीलता की पराकाष्ठा - सरकार से इंसाफ़ के लिए गुहार कर रही रेप पीड़िता निराशा में ज़हर खाकर आज अस्पताल में ज़िंदगी और मौत के बीच जूझ रही है।https://hindi.oneindia.com/news/india/bhopal-rape-victim-who-consumed-poison-in-front-of-chief-minister-house-in-mp-shivraj-singh-chouhan-441230.html …",,,,955357617898995712,https://twitter.com/JM_Scindia/status/955357617898995712
2018-01-22 08:31:12,mkstalin,,178,292,1721,"சென்னை, அண்ணா அறிவாலயத்தில் உள்ள கலைஞர் அரங்கில், வருகிற பிப்ரவரி 1ம் தேதியில் இருந்து மாவட்ட வாரியாக கழகத்தின் ஊராட்சி செயலாளர் முதல் மாவட்ட செயலாளர் வரை உள்ள நிர்வாகிகள் அனைவரையும் நேரில் சந்தித்து ஆய்வு நடத்தவிருக்கிறேன்.pic.twitter.com/w37Fsk3h99",,,,955357166428332033,https://twitter.com/mkstalin/status/955357166428332033
2018-01-22 08:09:31,BJP4India,,57,295,1090,"Here is how Modi Government is ensuring ‘Ease of Living’ for every Indian. #ImprovedEaseOfLivingpic.twitter.com/UjaKfEPuW1",,,#ImprovedEaseOfLivingpic,955351707759927296,https://twitter.com/BJP4India/status/955351707759927296
2018-01-22 07:10:50,ncbn,,63,128,1046,"Landed in Zurich. Will participate in the World Economic Forum, at Davos, today. Hopeful for fruitful interactions with world renowned innovators and investors. #APatDavos #WEF2018 @wef",,@wef,#APatDavos #WEF2018,955336939158163457,https://twitter.com/ncbn/status/955336939158163457
2018-01-22 07:10:09,ncbn,,81,152,1428,"'అమ్మ' నిరాదరణకు గురవుతోన్న నేటి ఆధునిక సమాజంలో విద్యార్థి దశలోనే తల్లి విలువను తెలియజేసి, మెరుగైన, నైతిక విద్యా ప్రమాణాలు అందించాలనే లక్ష్యంతో వసంతపంచమి సందర్భంగా ప్రభుత్వం ‘అమ్మకు వందనం’ కార్యక్రమానికి శ్రీకారం చుట్టింది. దీనిని విజయవంతం చేస్తారని ఆశిస్తున్నాను.",,,,955336767346950144,https://twitter.com/ncbn/status/955336767346950144
2018-01-22 07:00:27,INCIndia,,206,575,1595,"वैसे भी, देश में हर वर्ग भाजपा सरकार की जनविरोधी और मनमानी नीतियों से दु:खी ही है।https://khabar.ndtv.com/news/india/pm-narendra-modis-sign-will-not-be-happy-to-everyone-the-upcoming-union-budget-1802939?google_editors_picks=true …",,,,955334327470100480,https://twitter.com/INCIndia/status/955334327470100480
2018-01-22 06:16:41,PMOIndia,,129,448,1938,"Narendra Modi interview: PM says under NDA, turnaround for India is from part of ‘fragile 5’ to being a ‘bright spot’ http://www.financialexpress.com/india-news/narendra-modi-interview-pm-says-common-man-has-lot-of-expectations-from-me-we-have-passed-with-distinction/1024300/ … via NMApppic.twitter.com/sKCGzD4iao",,,,955323314972626944,https://twitter.com/PMOIndia/status/955323314972626944
2018-01-22 06:16:12,PMOIndia,,280,787,4162,"India's global rankings, improved image, result of good governance: PM @narendramodi. http://www.ddinews.gov.in/national/prime-minister-narendra-modi-interview-times-now … via NMApppic.twitter.com/WZwVi8RkvH",,@narendramodi,,955323191248990208,https://twitter.com/PMOIndia/status/955323191248990208
2018-01-22 05:58:04,ArvindKejriwal,msisodia,622,1878,4124,"An open letter by Manish Sisodia to the people of Delhi. Pl do read and share...https://twitter.com/msisodia/status/955308675043872773 …",,,,955318625962872833,https://twitter.com/ArvindKejriwal/status/955318625962872833
2018-01-22 05:50:06,INCIndia,,307,1164,2567,"Why is BJP/RSS so obsessed with changing the #Constitution?pic.twitter.com/xNV0e0Q6eM",,,#Constitution,955316623132434432,https://twitter.com/INCIndia/status/955316623132434432
2018-01-22 05:49:52,JM_Scindia,,140,455,2641,"समस्त देशवासियों को बसंत पंचमी की हार्दिक शुभकामनाएं। माँ सरस्वती आप सभी के जीवन में सुख शांति और समृद्धि लेकर आए। #BasantPanchami",,,#BasantPanchami,955316564823130112,https://twitter.com/JM_Scindia/status/955316564823130112
2018-01-22 05:30:08,INCIndia,,106,671,1598,"सरकार का काम लोगों को न्याय दिलाना होता है, न कि अन्याय में शामिल लोगों की मदद करना।https://www.navjivanindia.com/india/yogi-government-look-for-options-to-withdraw-muzaffarnagar-riot-cases-against-bjp-leaders …",,,,955311600025600000,https://twitter.com/INCIndia/status/955311600025600000
2018-01-22 04:58:12,SachinPilot,,160,548,2476,"सभी देशवासियों को ऋतुराज बसन्त के आगमन व माँ सरस्वती जी के पूजन दिवस ""बसंत पंचमी"" की हार्दिक शुभकामनाएँ। #BasantPanchami",,,#BasantPanchami,955303561411227649,https://twitter.com/SachinPilot/status/955303561411227649
